text,id,subreddit,meta,time,author,ups,downs,authorlinkkarma,authorkarma,authorisgold
i recently installed 5 new mods to an existing save  dual sheath redux  fnis  netimmerse override  realistic ragdolls amp  force  and xpmse  i m 99  sure i installed these mods correctly  but i m new to modding so i could ve made a mistake i never had  this   http  imgurcomaany0t  problem before installing these mods i m not quite sure which mod is causing this so i could use some advice    my mods     a quality world map and solstheim map  with roads   http  wwwnexusmodscomskyrimmods4929     amazing follower tweaks   http  wwwnexusmodscomskyrimmods15524     auto unequip ammo   http  wwwnexusmodscomskyrimmods10753    bethesda performance textures   animals and creatures   http  wwwnexusmodscomskyrimmods43921   and  armor  clothes  and weapons   http  wwwnexusmodscomskyrimmods42360     character creation overhaul  races  birthsigns  classes  skills  specializations  attributes   http  wwwnexusmodscomskyrimmods21587     complete custom race stats   http  wwwnexusmodscomskyrimmods12202     convenient horses   http  wwwnexusmodscomskyrimmods14950     deadpool follower   http  wwwnexusmodscomskyrimmods36958     immersive animations   http  wwwnexusmodscomskyrimmods34950     immersive hud  ihud   http  wwwnexusmodscomskyrimmods3222     no menu and loading smoke   http  wwwnexusmodscomskyrimmods7901     skyrim community uncapper   http  wwwnexusmodscomskyrimmods1175     skyui   http  wwwnexusmodscomskyrimmods3863    sounds of skyrim   civilization   http  wwwnexusmodscomskyrimmods20193         the dungeons   http  wwwnexusmodscomskyrimmods8601        and  the wilds   http  wwwnexusmodscomskyrimmods10886     static mesh improvement mod  smim   http  wwwnexusmodscomskyrimmods8655     stones of barenziah quest markers   http  wwwnexusmodscomskyrimmods9385     unofficial skyrim legendary edition patch   http  wwwnexusmodscomskyrimmods71214     violens  a killmove mod   http  wwwnexusmodscomskyrimmods56980     dual sheath redux   http  wwwnexusmodscomskyrimmods34155         fores new idles in skyrim  fnis   http  wwwnexusmodscomskyrimmods11811  tab  1amp  navtag  http  3a  2f  2fwwwnexusmodscom  2fskyrim  2fajax  2fmoddescription  2f  3fid  3d11811  26preview  3damp  pup  1        netimmerse override   http  wwwnexusmodscomskyrimmods37481         realistic ragdolls amp  force   http  wwwnexusmodscomskyrimmods601        and  xp32 maximum skeleton extended  xpmse   http  wwwnexusmodscomskyrimmods68000  ,464tae,skyrim,gaming,1455659525,szd0817,3,0,1182,393,0.0
i m at nearly 2700 hours and do nt have all the achievements yet ,d00jhxc,skyrim,gaming,1455534942,Drox_the_Blue,2,0,694,205,0.0
odahviing  he literally vows to serve you as he served alduin ,d01x29j,skyrim,gaming,1455634433,EJR77,3,0,111,4930,0.0
modlist  http  wwwmodwatchucore_ten,d02pjnc,skyrim,gaming,1455675445,Core_ten,2,0,2994,317,1.0
i have coin  does your cat have wares ,d02gq02,skyrim,gaming,1455661930,agurcsik,112,0,550,29256,0.0
i love it my cats have maxed out their sneak and have very high speech and illusion they constantly fool my wife and i into thinking they need more food we also believe that in a couple of months  they will probably have their fourhanded in the 80s urg ,d02jl54,skyrim,gaming,1455666224,ccbbb23,26,0,1156,4683,0.0
thanks for the response everyone just a little backstory  we found her as a kitten scavenging for food at my girlfriend s work we picked her up and named her khajiit because she likes to sneak up on our 2 dogs and we were playing skyrim at the time  ,d02lm3v,skyrim,gaming,1455669443,startamovement,15,0,2266,29,0.0
keep your paws to yourself  sneak thief ,d02l67q,skyrim,gaming,1455668788,Islanduniverse,10,0,19,29645,0.0
cute alfiq  3,d02oaye,skyrim,gaming,1455673548,YouCantTakeThisName,3,0,1,400,0.0
i thought the title said  my cat s leg  and my immediate thought was  nooo there is nt an arrow in its knee is there    the blip of pink in the thumbnail did nt ease my mind much  i have to read topics slower  the emotional roller coaster is too much ,d02rf5j,skyrim,gaming,1455678388,Ryshenron,3,0,5,1213,0.0
awesome  we named our cat dovahkitty  ,d02snr7,skyrim,gaming,1455680436,Zaraki42,3,0,20829,6306,0.0
panthony ,d02m0so,skyrim,gaming,1455670055,iimpact,2,0,4909,464,0.0
may her road lead her to warm sands ,d02tz1p,skyrim,gaming,1455682701,dreamer_dw,2,0,8425,16909,0.0
skooma  catnip  will fix that right up,d02u27b,skyrim,gaming,1455682854,XxTreeFiddyxX,2,0,1,3129,0.0
not sneaking anywhere with that bell on ,d02uw01,skyrim,gaming,1455684357,Mastuh,2,0,3687,10478,0.0
you re gon na find a mouse on your bed someday and you cat is gon na be sitting there all  khajit has wares  if you have the coin ,d02mr78,skyrim,gaming,1455671211,Musclecar123,4,0,22207,6850,0.0
looks like your cat needs the uncapper ,d02w3gr,skyrim,gaming,1455686704,yerbaceo,1,0,1,163,0.0
does your cat have kitten mittens ,d02w4ha,skyrim,gaming,1455686765,xIoBEASToIx,1,0,2535,3302,0.0
since my game used to ctd every 15 minutes i have a habit of saving every 34 minutes  so when this issue happens its no biggie i do suggest wheb playing modded  that you make a save after every quest you do or dungeon you complete ,d01q4kj,skyrim,gaming,1455613281,LittleGitten,1,0,169,547,0.0
so pretty much i m trying to get skyrim legendary to run on mac i specifically want legendary edition so does anyone know how i would be able to run it  i m really not looking to have to buy windows and run it off of there  but i would if its the only way i would be able to play the legendary edition i have already bought it on steam  thanks ,463mwv,skyrim,gaming,1455645088,SkyrimSavage0,3,0,1,3,0.0
use wineskin  http  wineskinurgesoftwarecomtikiindexphp,d024c15,skyrim,gaming,1455645286,waffle247,3,0,1,6161,0.0
the only two answers that i  and most likely others  will have are  1  buybuild a pc with windows  2  run whatever windows emulation you want on your mac to simulate it running windows ,d024epp,skyrim,gaming,1455645386,Tamoketh,2,0,117,2447,0.0
i ll just share what worked for me  way back when i first played on an imac  bootcamp your mac and play in windows i never successfully got it working in wineskin  not saying it wo nt  and would nt dream of trying it in an emulator  skyrim and gaming in general pushed me out of the mac universe and i m glad it did  ,d026k5k,skyrim,gaming,1455648305,arcline111,1,0,1652,3006,0.0
bootcamp your mac that s what i did to get skyrim running on mine it ll take several hours but it ll get it working ,d02b7yg,skyrim,gaming,1455654545,Crazylittleloon,1,0,1391,54344,0.0
use bootcamp so it will run on native hardware specs i believe using something like wineskin or a windows virtual machine like parallels will hinder performance ,d02dynn,skyrim,gaming,1455658174,NSA_GOV,1,0,3525,3199,0.0
what are we looking at,d02v8z5,skyrim,gaming,1455685033,quarantine22,1,0,18,37,0.0
what mods do you use  specifically the armor  and the water please ,d013ga2,skyrim,gaming,1455571219,Duckman1337,1,0,478,7743,0.0
wander ,d0233bf,skyrim,gaming,1455643588,SauronGamgee,1,0,842,14589,0.0
collar bell of ringing  sneak maxes at 10 ,d02utqg,skyrim,gaming,1455684239,Luxurypoop,1,0,1,100,0.0
all of the vigilants that i ve encountered in skyrim have been limited to the use of a mace and spells from the restoration and alteration schools of magic  it begs the question  could they use  or more importantly why are they prevented from using   swords  bows  shields  sneaking  conjuration magic  bound weaponssummons   destruction magic  i have a reason for asking  role playing and fan fiction creation i m thinking of a former soldier  spellswordscout  recently becoming a devotee of stendarr he s on a pilgrimage to the hall of the vigilant in skyrim which is his first experience as a vigilant since he has knowledge and experience of all the things above  i m wondering if there is some deeply religious reason why he should nt be using them i can see the limitation on the conjuration tree  but i ca nt see the limits imposed on the others ,45x38a,skyrim,gaming,1455551815,p4ck3tl055,16,0,39,436,0.0
conjuration is daedric magic and is therefore banned  think of the to be more like dnd clerics  heavy armor  maces to crush skeleton bones  healing and protection magic ,d00qf0z,skyrim,gaming,1455552182,LosGrak,23,0,546,1609,0.0
generally  they have the standard paladin feel heavy armor  mace  and protective and restorative spells if you run into them  they ll heal you of any diseases also  a few individuals  like the one in markarth  wear higher level robes and use other weaponsspells my guess is the standard macerestoalto set up is learned at vigilant boot camp and as members progress in ranks they ll learn more advanced skills  they re main goal is destroying daedraundead  so they ve got a skill set for that ,d00scks,skyrim,gaming,1455555192,MightyDebo,6,0,426,34436,0.0
i think it s just the  crusader  theme more than anything  actually that reminds me  there was a crusader class in the older games  http  elderscrollswikiacomwikicrusader  if you look at the major skills  that s basically everything the vigilants use for the most part ,d017kmh,skyrim,gaming,1455577399,MrManicMarty,2,0,2491,141720,0.0
good question  you should bring this up to rteslore,d01e7oq,skyrim,gaming,1455587971,c_megalodon,2,0,15445,18614,0.0
my cat is named jskar  she s a rare house khajiit ,d02kaac,skyrim,gaming,1455667406,Arklelinuke,3,0,105,3835,0.0
press a to pet,d02sgey,skyrim,gaming,1455680089,WappyTrees,3,0,893,4301,0.0
every armor mod i find is too wariorish it s all combat style armor like ebony armor and iron armor type of armor  i am looking for something that looks casual nothing to edgy something like this for example  http  wwwnexusmodscomfallout4mods9690  except that mod is for fallout 4   does anyone know a mod that adds that type of armor to skyrim  anything casual  every casual clothing is usually perverted and exposed something casual like the fallout 4 mod would be nice  if you know anything of the sorts please link it to me  d,465ffb,skyrim,gaming,1455667605,Fedowa,1,0,1,3,1.0
so clothing  i personally use the  rogue sorceress outfit   http  wwwnexusmodscomskyrimmods57124    which has cloth and light armor versions,d02llmo,skyrim,gaming,1455669422,noughtofswords,2,0,1,793,0.0
i have played skyrim when it first came out and i really enjoyed it i recently bought the legendary edition with the intention to replay the game can you guys give me recommendations to mods that make your game visually look better  mods the make the game more immersive  and mods that make the game feel more alive ,4650wo,skyrim,gaming,1455662142,eran1000,1,0,399,854,0.0
if your gpu is good enough  project enb  climates of tamriel  enhanced lights and fx if you want more immersive mods visit the skyrim nexus and just use the search bar to look for immersive it s literally the most overused tagline when it comes to naming mods next to overhaul  and redux ,d02gx8f,skyrim,gaming,1455662219,JustJoshingAround,2,0,506,618,0.0
this has links to mods  and more   ignore the parts after the mod links if you wish  https  wwwredditcomrskyrimcomments3z1f8tpsa_for_modders_on_this_sub_seeking_help,d02ln1l,skyrim,gaming,1455669481,arcline111,1,0,1652,3006,0.0
hello its me  ur dragonbrother,d02bnyg,skyrim,gaming,1455655116,Jhrek,1,0,349,5663,0.0
sweet moon sugar ,d02hqsi,skyrim,gaming,1455663405,DemonicSquid,10,0,344,7138,0.0
what mod corrupted them may i ask  just for future warning for myself  plus the gentleman and ladies of reddit ,d02b3n4,skyrim,gaming,1455654389,TheGamblingAddict,12,0,1474,2446,0.0
i really recommend sounds of skyrim  it adds a lot of sounds to the game which makes the environment more alive,d02kakq,skyrim,gaming,1455667419,Krippaify,1,0,1,42,0.0
i played this game for so long and never thought of doing it,d01ct0s,skyrim,gaming,1455585762,Vitorfg,4,0,8,12269,0.0
good luck with selling all the gems  its nearly impossible,d011vk5,skyrim,gaming,1455568958,SlukMCprasKCZ,0,0,155,73,0.0
you get to start all over again nostalgic  maybe ,d02gofr,skyrim,gaming,1455661868,iuseleinterwebz,1,0,5271,11331,0.0
i am usually extracareful with savegames  have like 10 hard copies  cycling through them regularly   backups etc  but yeah bad things happen i suppose  never too careful  ,d02jf3u,skyrim,gaming,1455665966,Omiad,1,0,1,1,0.0
so  is this not okay  https  wwwredditcomrskyrimcomments3uhoj2saw_this_driving_around_on_black_friday i personally approve of content like this  which  i know  counts for diddly squat but i personally would like to keep content like this in the sub ,cxf3vzd,skyrim,gaming,1448661970,I_am_very_attractive,23,0,2095,7261,0.0
also if you have legendary edition make sure to play dawngaurd and dragonborn they are both loads of fun ,d02sz9c,skyrim,gaming,1455680965,SkyrimSavage0,2,0,1,3,0.0
honestly  about time the no unrelated material  rule is getting enforcedbut there is some fairly good content  cosplays require a lot of effort  for example  and are nt lazy   that would fall under some of your criteria how about letting that stuff go through as a text post   if it is nt already ,cx7y1er,skyrim,gaming,1448113244,risvyre,36,0,179,6979,0.0
gt  mods reserve the right to remove posts and ban users at their discretion  see rule 2  only thing i ve ever disagreed with in any sort of moderation policy getting your content removed or banned because someone with power has a problem with you is just stupid ,cy3cd6p,skyrim,gaming,1450444228,Kastoli,5,0,249,27575,0.0
i sometimes do instructional image sets which seem to violate the superimposed text rule allowed or not  for example   angi s camp   https  reddit2t9965   bromjunaar sanctuary   https  reddit2tkn0o ,cxmoufs,skyrim,gaming,1449211463,GaryOster,9,0,6774,20626,0.0
installed skyrim after really enjoying fallout 4 to level 67 any words of advice on transitioning ,4661e0,skyrim,gaming,1455676214,CloisteredOyster,3,0,192,3558,0.0
i am subbed to a lot of game subbreddits and  to be honest  this one is one of the most toxic free environments i ve encountered so if its the nature of the fan base or the moderators  well done rskyrim,cy0wlri,skyrim,gaming,1450266553,boom_townTANK,9,0,258,2094,0.0
for some reason gfycat has completely botched the quality  youtube to the rescue  https  youtubeslkal6kvmbe,czzwinr,skyrim,gaming,1455482975,UKDarkJedi,11,0,381,6603,0.0
modlist please i beg of you ,d006b5n,skyrim,gaming,1455500448,Austin4606,3,0,188,672,0.0
so i ve been playing through hearthfire  and i ve got the falkreath house  currently building it up i have the main hall and the small house and the cellar i noticed while using loot that the hearthfiresesm master file needed cleaning  so i went into tes5edit and fixed the problem however  i am now unable to buy wood from any of the lumber mills  as they do nt have the dialogue option available in addition  i ca nt hire a steward i ve brough adelaisa vendicci to my house but there is no dialogue option to add her as steward i ca nt find solutions anywhere else on the internet  and i m calling on you to help reddit  update  i am able to buy lumber on a previous save  some two hours before i cleaned using tes edit this does nt add up because i have already removed the files that had been cleaned and replaced them with backups  not to mention reinstalled all three dlcs numerous times ,463fpd,skyrim,gaming,1455642774,FenrirForgefire,5,0,1,46,0.0
op  ask rskyrimmods they should have an answer ,d028x4c,skyrim,gaming,1455651484,heinykin,1,0,1,16,0.0
i m at 1830 hours and have 57 of the 75 achievements ,d00ff0q,skyrim,gaming,1455519522,Corpsehatch,13,0,50,518,0.0
probably better of on rskyrimmods,d0147n0,skyrim,gaming,1455572341,Rogue_freeman,3,0,13802,4165,1.0
cannabis skyrim gives you the possibility for people to ask you to buy weed when you smoke it i use it on my current character  half nord half redguard bard who recently arrived in skyrim to join the bards college  ,d01vntt,skyrim,gaming,1455631707,SunshineBlind,1,0,4128,26029,0.0
i m at 1830 hours and have 57 of the 75 achievements ,d00ff0q,skyrim,gaming,1455519522,Corpsehatch,13,0,50,518,0.0
i m at nearly 2700 hours and do nt have all the achievements yet ,d00jhxc,skyrim,gaming,1455534942,Drox_the_Blue,2,0,694,205,0.0
the vampwolf perks will be boring for me  i have save files before i get cured so i can go back and grind when the time comes,d00xki8,skyrim,gaming,1455562769,SergioSource,1,0,992,4048,0.0
i need the werewolfvampire perks  daedric items  three houses  and the dragon tamer one  650 hours in  oops ,d00lx6s,skyrim,gaming,1455543320,purefabulousity,1,0,3376,24563,0.0
ilinalta s deep has a good creepy vibe not quite up there with frostflow  but it s good ,d019r8t,skyrim,gaming,1455580864,captain_gordino,3,0,186,4850,0.0
i m still missing vampire mastered  werewolf mastered  master architect and dragonrider i ca nt ever get myself to play as a vampire or werewolf and dragon riding sucks ,d00lvfv,skyrim,gaming,1455543193,o0-0o,2,0,471,11442,0.0
remember  in addition to burial urns  large urns  chests  and lockboxes  you ll also find extra loot on dragur mummies in dungeons  the ones that do nt rise up and attack usually in a nook in the wall  naked or wrapped in linens  ,d010rhj,skyrim,gaming,1455567362,SomeguyBCS,19,0,102,2494,0.0
what mod corrupted them may i ask  just for future warning for myself  plus the gentleman and ladies of reddit ,d02b3n4,skyrim,gaming,1455654389,TheGamblingAddict,12,0,1474,2446,0.0
i have 1595 hours and i m still missing five achievements   hail sithis  was nt given to me the first time i completed the quest  i forgot to try and get master criminal  i did nt try to get oblivion walker  i hardly played as a vampire master  forgot to ride five dragons  i even had a 100  save that i built over months  except i killed the dark brotherhood  and now i lost it ,d0198w3,skyrim,gaming,1455580053,ThunderCrash,1,0,470,2287,0.0
fus roh is a weaker version of fus roh dah so i would nt recommend using it with human women ,d01az14,skyrim,gaming,1455582835,Baturinsky,4,0,2199,6362,0.0
a            m                                              d                                    r                            e                   p                                   p                             e                                      n                     g                                           t                         o                                                  u                             l                        t                       e                         r                                                       v                        i                               o                l                                    e                                      n                       t                                               c                   e                  t                                y                                              ,d00jqhy,skyrim,gaming,1455535931,H8-Bit,-4,0,152,5051,0.0
the lesson here is to never help anyone in skyrim ever this is why most dragons hate humans and why the dragonborn will eventually slaughter everyone  p,czzsdzj,skyrim,gaming,1455475832,conativejj,11,0,80,18745,0.0
you mean you submitted and went with the guard  sounds like you took an arrow to the knee ,d00gu81,skyrim,gaming,1455524036,dumblonde301,1,0,1,-3,0.0
skyrim flora overhaul would be the one slowing down your game ,d02objp,skyrim,gaming,1455673573,Kesvyn,1,0,1,367,0.0
spot on  i love skyrim and i ca nt wait for bethesda to make a new version hopefully the new version does not feel like a dlc,czzovlr,skyrim,gaming,1455469900,0bsolete,1,0,1,42,0.0
this is the opposite of the story behind why a chicken is the national bird of portugal,czzsbj8,skyrim,gaming,1455475717,snatchinyosigns,3,0,2,436,0.0
http  wwwnexusmodscomskyrimmods32096  all master spells are 1 handed  and you can move while casting ,d01ak54,skyrim,gaming,1455582169,enzo34,1,0,4,6810,0.0
pc by far it s a great game on console it might be the best game ever on pc,d02k17g,skyrim,gaming,1455667011,brianfantana32,5,0,2788,87503,0.0
good luck with selling all the gems  its nearly impossible,d011vk5,skyrim,gaming,1455568958,SlukMCprasKCZ,0,0,155,73,0.0
so is it a crime if i cut my own chickens head off  i mean i know the epa and aspca are old  but come on  pre ice age times should give some lenience on eating to survive ,czzs9jp,skyrim,gaming,1455475622,Kiyoko504,1,0,345,5086,0.0
he s taking a dirt nap ,d021rll,skyrim,gaming,1455641723,Pittfiend,0,0,1,6000,0.0
what we all did nt know is the chickens swore allegiance to alduin a long time ago ,d002bih,skyrim,gaming,1455492960,xarthos,1,0,834,572,0.0
please insert your tmt scorecard ,d02645p,skyrim,gaming,1455647704,besyuziki,0,0,1506,11549,0.0
suddenly horse ass ,d0263h1,skyrim,gaming,1455647678,Asilidae000,1,0,493,2164,0.0
when i accidentally kill a chicken i just kill everyone in for a penny in for a pound ,czzyvlj,skyrim,gaming,1455486978,mecrosis,1,0,14,46711,0.0
it s a crime because life is shit in the cold north and people need chicken to eat,d0025fw,skyrim,gaming,1455492649,alekzander01,1,0,17387,165959,0.0
a stealth archer or dualwield warrior are the two most common styles  but you can switch anytime before level twentyish and be fine ,d02hegk,skyrim,gaming,1455662906,Mrraptee,1,0,12,123,0.0
i recommend levelling other magic styles conjuration is alot of fun  summoning spells are great bound weapons are handy as they count them as physical damage  handy for getting through wards  and level up weapon attacks bound weapons have perks to fill soul gems too soul trap will fill the soul gems you need for enchanting items  to level up enchanting  disenchant a bunch of things you do nt use when you have alot of enchantments  get items and enchant the shit out of everything soul gems are very expensive so this is where your conjuration spells become useful  smithing can be levelled up by making stuff buy or collect loads of leather and ore for ingots then just keep making things  for alchemy just keep making potions if you are impatient for levelling by doing the things  you can also just pay for lessons ghorza in markarth  eorland greymane in whiterun and riften s blacksmith are good for lessons in smithing ,d025940,skyrim,gaming,1455646541,jarris123,1,0,3423,1610,0.0
while crafting and leveling your enchanting  alchemy and smithing  the experience gained is based on finished product s value ,d02a06p,skyrim,gaming,1455652926,justcomment,1,0,1,4700,0.0
for enchanting  get a bunch of soul gems  empty ones   you ll find them constantly just keep saving them  as soon as you find an item with soul trap  disenchant it at an enchanting station  then acquire the best bow  unenchanted  that you can find  and a decentsized soul gem  greater should be fine  though lesser can work too  go to an enchanting station with the bow and a soul gem  select the bow  select  soul trap  from the enchant list and slide the slider all the way to the left  it should say  when the target dies in 1 second  fill a soul gem   name it something original like  soul trap bow  and then craft it  the reason you do the  1 second  thing is because it maximizes the number of charges on it now just roam around and shoot stuff with empty soul gems in your inventory  and you ll fill them up quickly  also  be sure to always check the disenchant menu before selling magic items  you only need to disenchant something once to unlock it  so it s typically better to do that than sell it  there are the  gloves of the pugilist  in the ratways of riften  these are the only source of  fortify unarmed  in the whole game  be sure to disenchant these  if you want to make the game more fun  and are playing on pc  get some mods that make the game mor erealistic i like  traps kill    realistic lightning    improved enemy ai   requires skse    skyui   better menus   a lighting improvement mod that makes everything far darker  you should not be able to see when the moon is not out and it s 12 am  or in the dark parts of a dungeon where there are no torches   even on legendary  though  when you get to be high enoug hlevel with good equipment  the game is still sorta easy  i can 1shot normal dragons with my bow if i crit them   ,d02dym0,skyrim,gaming,1455658172,armahillo,2,0,544,7459,0.0
i think at this point i ve tried out almost every viable build in the game  the most overpowered and funnest class i played in skyrim is easily shield and 1h  sword for me   it really only starts to get rolling after you get pretty high shield perks  but you can cheese your block up pretty easily by blocking something that hits hard  giants on low difficulty   and healing it up  this levels your restoration and your block and also easily transfers into leveling heavy armor your 1h skill perks do nt matter that much except for damage early if you really want to min max you have to do smithing and enchanting as well alchemy can be helpful too but its not needed to shield bash dragons into outer space  for how to level each of the skills that is up to you if you want to use a guide on the most efficient ways of doing so  but they re mostly pretty obvious ,d02gje2,skyrim,gaming,1455661673,vexxer209,1,0,1,11578,0.0
lightning i also like fire imo ice would be great but the amount of enemies in skyrim that have a huge resist to it makes it horrible  like drougr and nords who you are fighting a lot of the time in skyrim ,d02od55,skyrim,gaming,1455673641,SkyrimSavage0,1,0,1,3,0.0
i would suggest gameplay mods they make the game more strategic every class has unique abilities and there will be spells and counter spells ,d02gtvb,skyrim,gaming,1455662083,TheSunIsTheLimit,1,0,173,2207,0.0
