text,id,subreddit,meta,time,author,ups,downs,authorlinkkarma,authorkarma,authorisgold
had someone request a load order  so i will paste it here in its full clusterfucked glory apologies for the text wall  0 0 skyrimesm 1 1 updateesm 2 2 dawnguardesm 3 3 hearthfiresesm 4 4 dragonbornesm 5 5 unofficial skyrim legendary edition patchesp 6 6 skyrim project optimization  full versionesm 7 7 lanterns of skyrim  all in one  mainesm 8 8 campfireesm 9 9 omegared99compilationesm 10 a jswordsesm 11 b magicduelrebornesm 12 c notice boardesp 13 d highrestexturepack01esp 14 e highrestexturepack02esp 15 f highrestexturepack03esp 16 10 unofficial high resolution patchesp 17 11 cutting room flooresp 18 12 skyuiesp 19 13 appropriately attired jarls reduxesp 20 14 dd  realistic ragdoll force  realisticesp 21 15 dd_dawnguard additionsesp 22 16 dd_dragonborn additionsesp 23 17 ihudesp 24 18 chesko_lorebasedloadingscreensesp 25 19 footprintsesp 26 1a lanterns of skyrim  all in one  1_5x brighteresp 27 1b moss rocks  legendaryesp 28 1c dialoguetweaksesp 29 1d enhancedlightsandfxesp 30 1e relightingskyrim_legendaryesp 31 1f dark fantasy overhaulesp 32 20 elfx  exteriorsesp 33 21 realisticroomrentalesp 34 22 ele_legendary_liteesp betterquestobjectivesesp 35 23 wetandcoldesp 36 24 book covers skyrimesp 37 25 skyfalls  skymills  dg  dbesp 38 26 birdshfcleanesp 39 27 farmhousechimneysesp 40 28 realisticwatertwoesp 41 29 aosesp 42 2a 3dnpcesp 43 2b immersive citizens  ai overhaulesp 44 2c guard dialogue overhaulesp 45 2d weapons amp  armor fixes_remadeesp 46 2e weapons amp  armor_trueorcishamp  daedricweaponsesp 47 2f prometheus_no_snow_under_the_roofesp 48 30 clothing amp  clutter fixesesp 49 31 rebirth monsteresp 50 32 collegeofwinterholdimmersiveesp 51 33 skyrim immersive creaturesesp 52 34 obisesp weapons amp  armor_trueweaponslvllistsesp 53 35 amidianborn_contentaddonesp 54 36 complete crafting overhaul_remadeesp 55 37 realshelteresp 56 38 elfxenhanceresp 57 39 skyrimcoinreplacerreduxesp 58 3a skyrim immersive creatures  dlc2esp 59 3b hidden hideouts of skyrim  merged  no map markersesp 60 3c elfx  weathersesp 61 3d skyre_encounterzonesesp 62 3e inns and tavernsesp 63 3f hothtrooper44_armorcompilationesp 64 40 hearthfireextendedesp 65 41 corneroftheskyrimesp 66 42 83willows_101bugs_v4_highresesp 67 43 beardsesp 68 44 browsesp 69 45 ormarvakesp 70 46 dark dungeons for enbesp complete crafting_trueweaponslvllistsesp 71 47 amb glass variants loreesp 72 48 differently ebonyesp 73 49 elemental stavesesp gqj_dg_vampireamuletfixesp 74 4a potionsesp potions  requiem17esp 75 4b fco  follower commentary overhaulesp 76 4c immersive weaponsesp 77 4d skyre_enemyscalingesp 78 4e sptconsistentolderpeopleesp 79 4f tradebarteresp 80 50 realisticneedsanddiseasesesp 81 51 disease descriptions_rnd compatibileesp 82 52 noanimalsreportcrimesdgdbesp 83 53 bfseffectsesp 84 54 dawnguardruneweaponsfxsreplaceresp 85 55 deadlyspellimpactsesp 86 56 immersive sounds  compendiumesp 87 57 dd  enhanced blood mainesp dddgdbimmersive creatures ebt patchesp 88 58 ddlarger splatter sizeesp 89 59 the dance of death  ultimate editionesp 90 5a fnisesp 91 5b animationsesp 92 5c soul gems differesp 93 5d ihssesp 94 5e better stealth ai for followersesp 95 5f convenient horsesesp 96 60 dserarcherygameplayoverhaulesp 97 61 dual wield parrying_skseesp 98 62 krev the skinner s mantle by hothtrooper44esp 99 63 notsofastmainquestesp 100 64 wetandcold  ashesesp 101 65 ttym  think to yourself messagesesp 102 66 hothtrooper44_armor_ecksstraesp 103 67 immersive npc in the darkesp 104 68 improved combat sounds v22esp 105 69 iscompendium enhanced blood patchesp 106 6a immersivespellsesp 107 6b lpbardsesp 108 6c deadlycombat_giantsaifixesp 109 6d blackhorsecourieresp 110 6e action combatesp betterdgentranceesp 111 6f oblivion gates v3  skyrim  dawnguard dlcesp 112 70 oblivion gates v3 without markers  skyrim  dawnguard dlcesp 113 71 thechoiceisyoursesp 114 72 realisticwatertwo  legendaryesp 115 73 the honored deadesp 116 74 inigoesp 117 75 cloaksesp 118 76 ufo  ultimate follower overhaulesp 119 77 sfo  dragonbornesp 120 78 rnd_dawnguardpatchesp 121 79 rnd_dragonbornpatchesp 122 7a obisdbesp 123 7b 1nivwiccloaksesp 124 7c uniquebordergatesallesp 125 7d rrr_3dnpcpatchesp 126 7e bring out your dead  legendary editionesp 127 7f jswordsdistributionbalancepluginesp 128 80 immersive patrols iiesp 129 81 mage outfit texture overhaulesp 130 82 amidianborn_skyforge_weaponsesp 131 83 windfull skyrimesp 132 84 skyrimimprovedpuddlesdghfdbesp 133 85 companionvalfaresp 134 86 skyre_standingstonesesp 135 87 rabbitsplusesp 136 88 frostfallesp 137 89 rnd_hearthfirespatchesp skyre_enemyaiesp 138 8a skyrim flora overhaulesp 139 8b timingiseverythingesp uniquebordergatesallbetterdgentranceesp 140 8c hunterbornesp 141 8d pilgrimsdelightesp 142 8e the paarthurnax dilemmaesp holdborderbannersesp 143 8f immersive music templesesp 144 90 immersive musicesp 145 91 hhos subterranean hot spring nmmesp imaginator  visual control for skyrimesp 146 92 brevi_moonlighttalesesp 147 93 blocksparklesesp 148 94 gildergreen regrownesp 149 95 equipping overhaulesp 150 96 perkusmaximus_masteresp 151 97 perma expansion 1  wintermystesp 152 98 perkusmaximus_mageesp 153 99 perkusmaximus_thiefesp 154 9a animated weapon enchantsesp 155 9b paralyzeesp 156 9c isc perma compatibility patchesp 157 9d imp_helm_legendesp 158 9e deadlydragonsesp 159 9f perkusmaximus_warrioresp 160 a0 deadlycombatesp 161 a1 attack commitment movement speed fluid 3esp 162 a2 potions  perma patchesp 163 a3 amatteroftimeesp 164 a4 lbackpackallesp 165 a5 magebackpack_bytumbajambaesp 166 a6 hunterarmoresp 167 a7 nordicrangerarmoresp 168 a8 omegared99weaponsetsesp 169 a9 sabrefurbagesp 170 aa troll hunter armor by hothtrooper44esp 171 ab wandererarmoresp 172 ac dr_bandolieresp 173 ad dr_bandolierdgesp 174 ae bandolierfornpcmasterfileesp 175 af bandolierfornpcswic_v2esp 176 b0 1nivwicskycloakspatchesp 177 b1 omegared99galleryofarmoresp 178 b2 bandolierfornpcscheaperbandoliers_balancedweight_dawnguardesp 179 b3 brug hild  nordic short sword skyrimesp 180 b4 third era  dwemeresp 181 b5 the bastardesp 182 b6 the gaddhjalt skyrimesp 183 b7 the kingmaker skyrimesp 184 b8 the thegnesp 185 b9 the vassal skyrimesp 186 ba cloaks  dawnguardesp 187 bb pipesmokingesp 188 bc redguard_unique_swordsesp 189 bd redguard_shieldsesp 190 be redguard_bowesp 191 bf tkdodgeesp 192 c0 wizdynamicthingsesp 193 c1 headtrackingesp 194 c2 bounty goldesp 195 c3 followerascompanionesp 196 c4 rspatchesp 197 c5 jswords_load_screensesp 198 c6 smoking candlesesp 199 c7 xcesesp 200 c8 dual sheath reduxesp 201 c9 dwemer beardsesp 202 ca clamsdroppearlsesp 203 cb sit anywhereesp 204 cc unique uniquesesp 205 cd apex werewolfesp 206 ce mintylightningmodesp 207 cf truestormsesp 208 d0 smdroplittorchesp 209 d1 nbscarsesp 210 d2 wondersofweatheresp 211 d3 chainmail robesesp 212 d4 thundering shoutsesp 213 d5 thieves guild requirementsesp dk_armor_by_hothtrooper44esp 214 d6 sleeping innkeepersesp 215 d7 the stamfordesp vhvpesp betterquestobjectivesambskyforgepatchesp betterquestobjectivescrfpatchesp 216 d8 nonessentialchildrenesp betterquestobjectivesnecpatchesp betterquestobjectivespermapatchesp 217 d9 fnis_pcea2esp 218 da sleeptightesp 219 db wsco  occifemalevnlesp 220 dc wsco  occimalevnlesp 221 dd vimmersivebedsesp 222 de lessintrusivehudesp 223 df realistichumanoidmovementspeedesp 224 e0 simplyknockesp 225 e1 perkusmaximus_simplyknockesp 226 e2 invisibility eyes fixesp 227 e3 dragon soul relinquishmentesp 228 e4 fnisspellsesp 229 e5 riverwood smelteresp 230 e6 notice board  dragonborn patchesp 231 e7 bordersenseesp 232 e8 dovahkiinrelaxesp 233 e9 rnd_animallootesp 234 ea skaalheavyarmoresp 235 eb hunterborn_rndpatchesp 236 ec theeyesofbeautyesp 237 ed tamriel compendium  skill booksesp 238 ee tamriel compendiumesp 239 ef lohsesp 240 f0 the huntsmanesp betterquestobjectivespaardilemmapatchesp 241 f1 wsco  better npcsesp 242 f2 palistovspinningarrowsesp 243 f3 chesko_wearablelanternesp 244 f4 hunterborn_wearablelanternpatchesp 245 f5 step combined pluginhfesp 246 f6 alternate start  live another lifeesp betterquestobjectivesalternatestartpatchesp 247 f7 dual sheath redux patchesp 248 f8 deadlycombat_asis_patchesp 249 f9 iactivateesp 250 fa bashed patch  0esp 251 fb patchusmaximusesp,d01sa8q,skyrim,gaming,1455622113,FadedinInk,1,0,1423,530,0.0
you said  if i play the game without mods the fps is an okay 30  and mods impact your performance  honestly  what the heck did you expect  texture mods impact performance some more than others  fact of life  if your vanilla game runs at 30 fps you do nt have a system capable of handling a modded game  unless those mods are very few and very very light ,d02vsgv,skyrim,gaming,1455686088,arcline111,1,0,1652,3006,0.0
https  wwwredditcomrskyrimcomments44si0kpsa_for_pc_players_seeking_help_with_game,d02vtw4,skyrim,gaming,1455686167,arcline111,1,0,1652,3006,0.0
before mods i was running ultra high graphics at about 3040 fps  now it s at 11 here s my list of mods  skse bethesda performance textures  animals and creaturesarmor clothes weapons skyrim performance plus  all 4  apachiishyhair skyrim flora overhaul xenius character enhancement showracemenu precashe killer unoffficial skyrim legenday patch a quality world map and solstheim map skyui fps counter,465lza,skyrim,gaming,1455670267,chrislee256,0,0,11,32,0.0
title pretty much explains it when i use the regular skyrim it works perfectly but with skse it doesnt even recognize it i have 360 controller enabled under settings but doesnt help any suggestions  f310 game controller btw,460wda,skyrim,gaming,1455598712,flyer3110,0,0,1,1,0.0
fly you fool ,d01pnb6,skyrim,gaming,1455611477,Julzerinos,1,0,10,148,0.0
do nt mind the bloody blue hell of unloaded sections ,d01kkeb,skyrim,gaming,1455598342,Mythological__,1,0,123,769,0.0
have you tried using  optimizer textures   http  wwwnexusmodscomskyrimmods12801   ,d02rj24,skyrim,gaming,1455678565,cody712,1,0,37,30,0.0
some of those achievements you have to try to get like the master criminal one  where you need 1000 bounty in all nine holds a master criminal wouldnt get a bounty,d00fu7r,skyrim,gaming,1455520805,I_Speak_For_The_Ents,46,0,279,11228,0.0
wow  only 224 hours  i got it at around 500 hour mark  but to be honest those 500 hours felt like 2 minutes ,d00fjs7,skyrim,gaming,1455519920,Rogue_freeman,9,0,13802,4165,1.0
after 901 hours  i have 36 achievements ,d00kbfx,skyrim,gaming,1455538226,RobotSnake,1,0,108,4260,0.0
damn i m at 310 and i m still not there,d00mwmh,skyrim,gaming,1455545709,Mr_Biscuits_532,1,0,3,620,0.0
im 600 hours and still did nt get all of them  only 57  but it s worth it  i got a save with all the shouts  dragon masksunique weapons and armorsspecial weapos and armorsdaedrc relicsand almost everything ,d00oneh,skyrim,gaming,1455549192,Ahmed-kabbary2015,1,0,6075,1965,0.0
clearly you were on a  get all the achievements  path kudos for the completion i ve got more than 2000 hours on you and still have 5 left solely due to disinterest recently picked up a couple i d neglected do nt know if i ll ever pick up my last five  ,d00v673,skyrim,gaming,1455559337,arcline111,1,0,1652,3006,0.0
grats  477 hours for me  but i really was nt focused on all 75 until this past week without a doubt  oblivion walker was the main pita because 3 of the required quests let you shoot yourself in the foot i spent an entire day with console commands trying to repeat the failed quests but alas no luck fortunately i had a save before the dead ends  took about 5 hours to rerun about 10 of the daedric quests but it worked ,d01ccfs,skyrim,gaming,1455585047,Riitoken,1,0,1,-71,0.0
kudos  i m nowhere near  ,d01cont,skyrim,gaming,1455585570,yerbaceo,1,0,1,163,0.0
120 hours lvl 62 and 52 achievements so far ,d00qh2z,skyrim,gaming,1455552274,AceofJoker,0,0,2688,10536,0.0
the only good thing about xbox skyrim is kinect dragon shout and that gets old pretty fast ,d02tl6w,skyrim,gaming,1455682022,eob3257,2,0,1,1134,0.0
you wear circlets because there is no reason you ca nt be both tough and fabulous anyone that says differently will have to answer to your swordmaceaxe ,d01wivb,skyrim,gaming,1455633440,LosGrak,7,0,546,1609,0.0
pc mods  basically  if a game has mods  then the pc version will always be superior unless  of course  there is no pc version which is basically for games like mario kart 8 and the like  but in that case  they are nt really mods but hacks  i have a natural affinity for text walls ,d02ss0s,skyrim,gaming,1455680634,Dagger300,2,0,1,309,0.0
i m trying to have another go at skyrim  but my  new  computer is having a problem with mouse lag  which has apparently been a common problem since the game launched i tried disabling vsync and adding ipresentinverval  0 to skyrimprefsini  but no luck has a definitive fix for it ever been found ,4652j3,skyrim,gaming,1455662704,CrazyEddie041,1,0,815,55403,0.0
have you tried turning off antialiasing ,d02iuao,skyrim,gaming,1455665075,Kathartrix,2,0,1,627,0.0
being a sneaky archer is far more fun on pc it s so much easier to snipe from a distance with keyboard and mouse you can clear whole areas from cover i was nowhere near as accurate  or  more accurately  accurate and  quick   with a controller  edit  also  the other reasons people have said  graphics and mods ,d02kt1x,skyrim,gaming,1455668222,KeetoNet,1,0,1,14332,0.0
elder scrolls wikia has quotes not sure if they re complete  and they re not a transcript because the player s dialogue is missing http  elderscrollswikiacomwikisheogorath  quotes,d01rzfv,skyrim,gaming,1455620909,cactoidjane,2,0,2,105,0.0
ah  the power of alchemy ,d02me41,skyrim,gaming,1455670631,bosmerrule,1,0,1,1415,0.0
it is better on pc in literally every way ,d02kkin,skyrim,gaming,1455667854,hells_gullet,3,0,71,1264,0.0
i always thought you got a bounty for killing chickens because of property damage not because you assaulted some poultry,czzsdg6,skyrim,gaming,1455475807,ThandiGhandi,38,0,69,7710,0.0
 hurts chicken    kill everyone   https  wwwyoutubecomwatch  v  f21aifx0lzy  ,czznpbh,skyrim,gaming,1455467822,Rogue_freeman,22,0,13802,4165,1.0
this is fantastic i love how serious it is drawn ,czzrwc7,skyrim,gaming,1455475003,Vinven,3,0,16080,17339,0.0
he must be broke from renovating him home  otherwise he could just pay the fine ,czzq1jf,skyrim,gaming,1455471916,Valen_the_Dovahkiin,1,0,1,6729,0.0
before mods i was running ultra high graphics at about 3040 fps  now it s at 11 here s my list of mods  skse bethesda performance textures  animals and creaturesarmor clothes weapons skyrim performance plus  all 4  apachiishyhair skyrim flora overhaul xenius character enhancement showracemenu precashe killer unoffficial skyrim legenday patch a quality world map and solstheim map skyui fps counter,465lza,skyrim,gaming,1455670267,chrislee256,0,0,11,32,0.0
are you playing on pc  you could try making him essential using console commands also try telling your follower to wait outside and just beat him with your fists you might be doing too much damage to him too fast to trigger his diolouge ,d02psll,skyrim,gaming,1455675830,Wyatt1313,1,0,29521,151181,1.0
i have been dying to try this out   night of the living mannequins   http  wwwnexusmodscomskyrimmods55956    i m terrified of them and this mod makes them come to life and slighter everyone warning  you will have massive casualties it s just for giggles  so keep a save in handy  p,d00jkgn,skyrim,gaming,1455535240,rcam95,3,0,3176,3045,0.0
hey so i love the magic in skyrim  i know it s a major bug bear for a lot of people  but since morrowind i ve played a spellsword even though a mixed class in morrowind was as smooth and intuitive as switching from 5th to reverse in a car with a missing gear lever  my bug bear is that the master level spells like dragonhide  fire storm  bane of the undead take far too long to cast in a pinch  especially at level 60  are there any mods that simply reduce the cast cost  i m using the dlc s and nothing else and i d like to keep it that way with the exception of a faster cast on the master spells mod  on the vampire lord part harkon refers to you as a half breed at the end which confuses me  are nt you a pure blood vampire when harkon or serana makes you a vampire ,45yrl8,skyrim,gaming,1455570574,DKHaku,3,0,67,25,0.0
am i the only one who does nt find pictures like these amazing  likethe mountain is cool and all the design of the game is great but the whole point of a view like that is to see beauty for miles i see beauty for about a mile  followed by blurry textures and weird looking water mod screenshots have spoiled me ,d02a3kl,skyrim,gaming,1455653052,superbozo,3,0,6,3853,0.0
i cleared the original ones within 100 hours hardest one is to get the legendary dragon to spawn  which required a certain level the dlc ones were pretty easy of course  i was actively hunting achivements ,d00sz15,skyrim,gaming,1455556128,mishugashu,3,0,4130,103314,0.0
1200 hours and i ll never get all of them  but i am annoyed that hail sithis and one with the shadows have nt registered as i did nt really want to do either of those quests again ,d00xqic,skyrim,gaming,1455563004,StoneheartedLady,1,0,235,11647,0.0
pshah  next round  soon you ll have enough gems to buy everyone in skryim enough mead to die of alcohol poisoning ,d01xybe,skyrim,gaming,1455635986,conativejj,1,0,80,18745,0.0
armor  weapons  potions  scrolls  magic  and shouts  the normal skyui menu does this  except shouts  spells  and scrolls are mixed in with each other any mod that makes those 3 sorted ,465ajw,skyrim,gaming,1455665645,Duckman1337,2,0,478,7743,0.0
yes   categorized favorites menu   http  wwwnexusmodscomskyrimmods4862  ,d02krrm,skyrim,gaming,1455668166,Gubbit,3,0,144,4291,0.0
one of the dragon priest masks  krosis i believe  grants a 20  boost to alchemy he s northeast of windhelm  in front of the throw voice word wall  i do nt believe there s any kind of fortify enchanting enchantment to apply to gear the only way to boost that is thru alchemy ,d019toh,skyrim,gaming,1455580973,SomeguyBCS,1,0,102,2494,0.0
this case calls for jury nullification the dragonborn deserves it,czzxym1,skyrim,gaming,1455485388,TiesFall,1,0,1,205,0.0
you do nt need to worry too much if you do nt like a play style  just switch to whatever you want amp  start levelling that up instead keep your character as  unless you are playing on legendary difficulty  skyrim is quite forgiving if you switch styles ,d01yhuk,skyrim,gaming,1455636869,waffle247,80,0,1,6161,0.0
oh man  i ll give you the run down on how to level quick and make a lot of gold in the process you ll need to delve into dungeons to get started as well as keep this going  so you should nt get too bored  first and foremost  some rules  1  whenever you see any weapon or armor or ring that is enchanted  pocket it and disenchant it at an altar so you can enchant other weapons with its effects  2  grab all soul gems you see  3  any iron  silver or gold oreingot pocket it as well 4  do nt buy anything except ingots and ores they are sold at blacksmiths whiterun is ideal because there are 3 people you can buy from  first  you ll want to go north of whiterun to halted stream camp there is a ton of iron mines there  and an awesome spell called transmute this take iron ore and turns it into silvergold ore this makes your smithing increase more than iron would do  buy as much iron ingot and ore and make iron daggers and jewelry and then sell them off  a huge thing here that will change both your money and leveling drastically is to find a weapon that has soul trap on it  disenchant it and then use a soul gem to enchant a bowcrossbow with soul trap  since you likely are low level you ll only encounter petty and lesser soul gems fill these by walking around the whiterun plains and killing deer  mudcrabs  etc with your bow  now that you have a lot of filled soul gems  go make some daggers and jewelry  and then enchant them all with whatever enchantment and then sell them this will get you quite a bit of money  all while leveling enchanting and smithing you can now afford even more iron ingot to make more daggers to rinse and repeat  if you have the dawn guard expansion  the soul cairn is full of soul gems ripe for the taking if you are running low on them just go and restock  after you ve leveled your smithing a bit you ll want to unlock the dwarven smithing dwarven ingot is by far the most common and easy to stockpile in the game they are all found in dwarven ruins  and dwarven ingot can be smelted from many dwarven scrap metal you find lying around there  make dwarven bows  enchant  sell  some other tips  you can level conjuration easily by finding a mud crab and just recasting a summon spell like  conjure sword   it levels very fast the reason being is that you must be in combat to level conjuration  and the summon sword spell wo nt kill the mudcrab as long as you do nt attack it  also  you do nt need to specialize in skyrim  you can really do anything g with any character you want to focus on health and magic for your character  i d say your stamina should never go above 200 points unless you are very high level  the solitude blacksmith also has a ton of iron  steel  and silver ingot for you to loot just do nt get caught ,d023j98,skyrim,gaming,1455644191,hks9,11,0,94,17344,0.0
you have to mod it until it breaksor until it works because gt  it just works but just do nt listen to anyone and play itmake mistakes they will be a part of the whole experience,d024rx6,skyrim,gaming,1455645887,DigitalSundial,2,0,12,0,0.0
leveling up enchanting  alchemy and smithing is something that happens  very gradually  over the course of your playthrough unless you spend all your time mining and getting the money to buy soul gems  you ll be around level 40 before you can smith ebony  if you want to speed up enchanting  use conjuration and focus on using bound weapons  as i believe a perk allows bound weapons to put a soul into an empty soul gem  you do nt  need  anything to play on a higher difficulty  i m personally on a level 93 legendary run   just the willpower not to turn it down use restoration to keep your health up  dodge more  etc ,d020lck,skyrim,gaming,1455640056,shit-I-justfuckedup,1,0,2110,2624,0.0
you level up enchanting  alchemy  and smithing by enchanting stuff  brewing potions  and making weaponsarmor one of the best things about skyrim in my opinion is that skills level up as you use them so if you want to make stupidly powerful potions  you ll start with relatively weak potions  and gradually get stronger as you obtain perks and skill levels  alternatively  you can just find trainers for the skills pretty sure there s an enchanting trainer in the college of winterhold ,d0235p6,skyrim,gaming,1455643679,illkillyouwitharake,1,0,255,2696,0.0
1  do not start a new character just shift gears  2  mages have weaker dps than the physdmg builds  3  even with cheating you will find it hard to make a hi dps mage 4  see the uesp pages for great leveling advice  5  do not play higher than adept difficulty until you learn everything you need to know  6  always follow the fun  ie let your personality do what it wants  7  see my recent post  about mage builds  and read the 4 physdmg builds and go for the one that best suits your personality if you like dps then any of those 4 builds will make you very happy you wanted a ranged dps mage so might i suggest that you immediately shift gears to sneaksniper  which is the single best ranged dps in the game  hope this helps ,d027fzq,skyrim,gaming,1455649494,Riitoken,1,0,1,-71,0.0
play as an archerit s my favourite,d029sxj,skyrim,gaming,1455652659,Vitorfg,1,0,8,12269,0.0
i d say that playing mage only is probably the most boring combat style to begin with  go with magicka and one handed or blockone handed level up alchemy and enchanting as much as you can  those will prove usefull ,d029ykn,skyrim,gaming,1455652866,Rogue_freeman,1,0,13802,4165,1.0
for mage style playthrough i recommend forgotten magic redone mod this mod offers new spells that get improved upon use and nicely complements lack of levelingscaling of vanilla magic system ,d02u0a7,skyrim,gaming,1455682759,eob3257,1,0,1,1134,0.0
google  skyrim alchemyenchantingsmithing loop  ,d01y4nc,skyrim,gaming,1455636272,arcline111,-6,0,1652,3006,0.0
the reason for this is apparently the animals themselves count as npcs for the purposes of being injured and reporting crimes so a crime is reported even if you just generate a bunch of animals in the middle of nowhere and hurt one the only fix is a mod that changes it so animals do nt report crimes ,czzueus,skyrim,gaming,1455479305,Ordeiberon,16,0,36,437,1.0
now he is known as dovakhonvict ,d003hqq,skyrim,gaming,1455495139,Hq3473,7,0,11434,70616,1.0
for the magic part  what i usually do is play a sneak mage and when i want to cast a master level spell  i sneak and cast invisibility the invisibility stays until the effects of the spell are released meaning  you can cast it and remain invisible  in reference to harkon  maybe it s because pure vampires can only come directly from being raped by molag bal maybe harkon just wanted to insult you ,d01392d,skyrim,gaming,1455570928,TheParagon_MarvelUni,4,0,5,6330,1.0
that arrow  it seems like his adventuring days are over ,d01490a,skyrim,gaming,1455572396,DerpHerpDerpston,5,0,5747,8234,0.0
i remember playing side by side with my friend when skyrim first came out when he got to riverwood he decided to kill a chicken for whatever reason  maybe on accident it was hilarious watching him struggle for the next two hours trying to get arrested but none of the guards would do it  instead they just tried to kill him he eventually had to restart ,d0095id,skyrim,gaming,1455505571,xGENERALxMiLLZx,2,0,230,6915,0.0
