text,id,subreddit,meta,time,author,ups,downs,authorlinkkarma,authorkarma,authorisgold
so my problem is that when i fast travel somewhere where enemies are near  the first enemy i encounter can not be ressurrected by spellthe spell just hits the dead bodythe second enemy i hit can be ressurrected normallyi never heard anyone have this bug the only mods i have are live another life and usleep and skyui pls help  ,45yo53,skyrim,gaming,1455569597,Melkoroth,2,0,2,3,0.0
downvote cause the video took forever to load and buffered like hell also  ads just use youtube damnit ,d026fu6,skyrim,gaming,1455648146,lildutchboy7,3,0,27058,9610,0.0
downvote  because if the site makes me watch an ad for a clip like this  i do nt wan na see it,d01xdn6,skyrim,gaming,1455634994,maco-x,3,0,1,56,0.0
armor ,d01aa9y,skyrim,gaming,1455581726,andrewjackson5,1,0,130378,134167,0.0
if you install the personalised music mod then you can pick a track to play during fights either of your own or the default music ,d01qll6,skyrim,gaming,1455615141,waffle247,2,0,1,6161,0.0
what you are experiencing is actually normal to the game are you thinking that it is broken  it always cycles through a number of musical pieces when fighting a dragon ,d01nei5,skyrim,gaming,1455604592,LosGrak,0,0,546,1609,0.0
work  on your  semantics ,d01mtjc,skyrim,gaming,1455603159,catsunnyspence,-1,0,1,31,0.0
oblivion dark brotherhood is lightyears better i guess that is why i was so disappointed in skyrim but these are good reasons too ,d02ftzc,skyrim,gaming,1455660684,Hproff25,5,0,165,6978,0.0
when i was retiring my sneak archer  i was picking out some normal clothes for him to wear  but just before i could put him away for good one of my daughters  lucia or sofie ca nt remember who it was  gave me a green robe  so i decided that that s what i ll wear ,d01xvbj,skyrim,gaming,1455635847,eskaolin,1,0,511,9181,0.0
the elder scrolls  dominion  takes place in the entire aldmeri dominion main plots would involve the build up for the next great war and the imperial attempts to sabotage the military build up may take place concurrently or shortly after skyrim  with only vague references to the  troubles in skyrim  importantly the goals and ideologies of the members of the dominion would be presented in a positive light  with emphasis on how everybody is actually pretty happy  and the economy seems to be booming of course there will be drawbacks  like some racism and maybe the occasional secret police raids  but most common citizens will feel that it s worth it of course the imperial agents  maybe some of them blades or penitus oculatus  will be shown as cutthroat  paranoid agents who will sacrifice anything to achieve their goals  there would be a quest line to combat the imperials or to help sabotage the dominion  though you may be able to do both  the thieves guild may be based in elsweyr  the fighters guild could be a mercenary group that is taking care of policing while the army prepares for war  the mages guild could be a research lab for the war effort  or just a regular college  the assassins guild could be made up of some surviving dark brotherhood members  maybe even some that were presumed dead by cicero  important mechanics would be in game consequences for your actions oh  you helped imperial agents destroy the mill  now the khajit that ran the place is in the street begging for money because he ca nt afford the repairs oh  killed the spy that was bothering that shopkeeper  now she ll happily sell you better goods at lower prices  or maybe offer an alternative solution to a tricky quest oh  you did nt kill the thief that you caught while on patrol with the mercenaries  every bandit hideout now has an extra enemy for a few days oh  you  did  kill that thief  now the thieves guild thinks they ve been crossed and wants you to find out who s betraying them  in this game you have to think about who your actions will affect in the whole world and question whether this is really what you want ,d01h753,skyrim,gaming,1455592656,RedDemocracy,10,0,1,1986,0.0
panthony ,d02m0so,skyrim,gaming,1455670055,iimpact,2,0,4909,464,0.0
skooma  catnip  will fix that right up,d02u27b,skyrim,gaming,1455682854,XxTreeFiddyxX,2,0,1,3129,0.0
1we shall use another engine 2we shall make 2040 npc responses   yeah   what   move along  is not acceptable 3quality over quantity will be our main motto  4we shall not rely on modders or other people to fix or tweak our mistakes  5if a memory leak arisewe will not wait until the third dlc to fix it  6we will make npc feel like they are in the zonesituationpredicament and not hire 40 voice actors to read 20 line of dialog for 600 npc s 7we will take care of the texture popinsdistance render and resolve the flying meshes underground that serve no purpose but degrade performance a lot  8will make it so everyone can die and quest failingcompletion will make an impact on the world in some meaningful way  9will make more body typesraces scale accordingly and more than 5 presets for each of the sexes  10we will not be named bethesda anymore but inovedawe wont stangnada and we wo nt rushedawe wo nt profitmax anymore and careforourfansmorebe ready for us in 2060 this is going to be epic ,d025wzt,skyrim,gaming,1455647438,DigitalSundial,2,0,12,0,0.0
looks like your cat needs the uncapper ,d02w3gr,skyrim,gaming,1455686704,yerbaceo,1,0,1,163,0.0
well i havent seen any personal attacks or threats on this sub  always felt like home to me so good job mods ,cx86hi9,skyrim,gaming,1448130920,Real_Cicero,24,0,1698,1440,0.0
just to be clear  what exactly is direct cosplay   is there such a thing as indirect cosplay ,cx93d5f,skyrim,gaming,1448210256,the_gerund,10,0,2286,21925,0.0
would the  4th top post of all time   http  imgurcoma6zl7k  on this subreddit not be allowed by your no meme rules ,cxm7hb5,skyrim,gaming,1449182216,chocolatecheeese1,8,0,944,12744,1.0
found a troll who is insulting france and he pming me and another guy  c  nt  we ve outtrolled him he s all yours now skyrimforthenord edit  he also insulted france  homosexuals 90  of the elder scrolls community  adopted people  the inventor of the calculator and a british politician,czu562q,skyrim,gaming,1455064155,Mr_Biscuits_532,2,0,3,620,0.0
are u a lemon lol jk plz do nt ban me        ,cyifhoa,skyrim,gaming,1451671489,thegr8rambino13,1,0,5070,7424,0.0
feel free to ban me  p s gt  anything that is nt a screenshot of skyrim  art someone made of skyrim  or direct cosplay  including crafts  from skyrim  you may want to reconsider this  maybe have art friday metathread or something cosplays and art can really add to the community it seems odd to stifle that,czwmh0c,skyrim,gaming,1455232173,ilivetofly,1,0,89,12609,0.0
a lot of the time we remove posts from this subreddit  we the mods are often met with various behaviors that normal people would find unacceptable  despite our rules being clearly labeled on our side bar so instead  i m making this post to clarify a couple things and highlight our rules  which are as follows  1   please read the  skyrim faq   https  wwwredditcomrskyrimwikiindex  before you post    this is a good way to start the faq outlines several commonly asked questions and also highlights certain threads that contain good information  such as  what mods should i get   and system info  among other things  2   slurs and personal attacks will be met with an immediate ban    anything that can be construed as a personal attack or slur  even in jest  is not allowed in skyrim  in the last hour  i ve banned 10 people   http  iimgurcomvoxjgoepng  for varying degrees of personal attacks  and it s easy for me  because all i have to do it press a button and then read someone telling me to go fuck myself we have 4 pages of bans  and i do nt mind adding to it  so behave yourselves and if you see someone telling someone else to kill themselves or something similar  report it  3   mods reserve the right to remove posts and ban users at their discretion    see rule 2  4   no memes  no rage comics  no unrelated material    the first two are self explanatory instead  i will be explaining what constitutes unrelated material   pictures of real life that remind you of skyrim   hand prints   anything that is nt a screenshot of skyrim  art someone made of skyrim  or direct cosplay  including crafts  from skyrim   sweetrolls   screenshots or images with memelike text or captions   piracy  where to pirate the game  etc   begging for someone to gift you the game go fuck off   etc   on the topic of reposts    get over it there are 316379 subscribed users on rskyrim  and if rpics  user count of 9942242 subscribers is any indication of how many people are registered on this site  that means that only 318  of all of reddit normally sees posts on rskyrim  and i highly doubt that all 316379 of you see every single post made here  if anyone has questions or wants to get banned  please say so ,3tlzza,skyrim,gaming,1448051903,MaxLemon,230,0,3002,26049,0.0
is this in response to that weird downvote party that came out of nowhere yesterday ,cx7bmph,skyrim,gaming,1448054149,Freezer_Slave,48,0,8090,88771,0.0
lmao you seem so entitled by your unlimited modpower  if anyone has questions or wants to get banned  please say so   in the last hour  i ve banned 10 people   sheeet son   i never had a problem with anyone on this subreddit and never felt the need to write smth negative except now because of some sassy af mod get overyourself dude  ,cy1j3us,skyrim,gaming,1450304209,DovahkiinHero,26,0,156,897,0.0
car je vous aime   i love it why am i not playing skyrim in french ,d02mgpo,skyrim,gaming,1455670745,bosmerrule,1,0,1,1415,0.0
i love it my cats have maxed out their sneak and have very high speech and illusion they constantly fool my wife and i into thinking they need more food we also believe that in a couple of months  they will probably have their fourhanded in the 80s urg ,d02jl54,skyrim,gaming,1455666224,ccbbb23,26,0,1156,4683,0.0
how is this modded to to shit  you just used sweet fx instead of enbchromatic aberration is pretty obvioussome cloaksnothing that stands out and yet it still stutters to shitlearn to mod get to 800 modsget a stablestutter free experience with 4560 fps and then try this again ,d025bwc,skyrim,gaming,1455646643,DigitalSundial,0,0,12,0,0.0
awesome  we named our cat dovahkitty  ,d02snr7,skyrim,gaming,1455680436,Zaraki42,3,0,20829,6306,0.0
not sneaking anywhere with that bell on ,d02uw01,skyrim,gaming,1455684357,Mastuh,2,0,3687,10478,0.0
frame rate above 60 ,d00qk3k,skyrim,gaming,1455552411,LosGrak,3,0,546,1609,0.0
on a similar note  has anybody else that uses mods had the problem at the start where lokir immediately dies  the black title screen barely fades away when i hear a loud    aauhgh    and he falls through the carriage after that ralof quickly cycles through all of his lines by himself and then it s just a long awkward silence until we get to helgen the game proceeds just fine and it does nt break anything except my immersion but yeah  i have like 200 mods but i ve always assumed it was attached to alternate start ,d00tjks,skyrim,gaming,1455556978,clov3,3,0,8956,1125,0.0
uhiphopopotamus5782 gave you the best way to avoid this the cart physics thing is a well known issue not everyone gets it but it s common the alt start mod eliminates this issue ,d01kpch,skyrim,gaming,1455598614,arcline111,2,0,1652,3006,0.0
yeah  either frame rate  as physics wigs out gt  60fps  or you have sos installed   there is a fix  or you need to do a clean install  failing that you can download a blank save that contains the first autosave as you get off the cart  you can find one on the nexus ,d00rdi4,skyrim,gaming,1455553693,praxis22,2,0,1,116,0.0
so cinematic ,d00qwq9,skyrim,gaming,1455552966,HuffMar,1,0,131,4584,0.0
dang this is pretty awesome  this could make playing an aggressive combat archer a lot more viable and interesting  or at the very least make sneak archers have a few more tools available to them ,d01ar48,skyrim,gaming,1455582480,JCsquared2,1,0,1,176,0.0
never ever use that wikia site uesp for everything ,d02gbtx,skyrim,gaming,1455661375,CassiusTheDog,17,0,110,10854,0.0
wow ,d02g8ta,skyrim,gaming,1455661260,cryophelia,1,0,739,11186,0.0
so i was casually playing  and i decided to manually save  but the save button was gray  i am unable to use it any ways to fix it  i am level 55 i dont want to start over ,462xfp,skyrim,gaming,1455636758,swuc3,25,0,1,3,0.0
do you have the inventory open  it wo nt let you save if that s open far as i remember if not then reload your last save amp  see if that lets you save ,d01yzx0,skyrim,gaming,1455637672,waffle247,1,0,1,6161,0.0
you do nt have more than one save ,d015rvm,skyrim,gaming,1455574660,Mightyprawn,20,0,300,1610,0.0
my thoughts are with you  ,d01glzz,skyrim,gaming,1455591729,Chrisco91,1,0,129,259,0.0
no matter the level  or time played  for every character  there is always 2 saves saved my ass more than once i d adopt this method even go to three if you re that unsure ,d0193m6,skyrim,gaming,1455579814,montchie,4,0,4708,14668,0.0
ye i always hated the npc behaviour when it comes to fighting or encountering dangerous situations,d02nlsk,skyrim,gaming,1455672496,DovahkiinHero,1,0,156,897,0.0
i remember having a fistfight to get uthgerd as a companion and i kept blasting mikael in the face while running around the campfire very frustrating  that 2011 skyrim ai ,d02nt9n,skyrim,gaming,1455672807,brenop111,1,0,1,515,0.0
great story  told well and a truly epic fail in the best of ways   kudos for taking on the nodie game it s not for the faint of heart i m in the middle of one now level 43 love the nodie game  i just went through a huge battle against a master vampire in whiterun  immersive creaturesmaster difficultymaster vampire    the entire populace of whiterun was attacking this vampire and doing virtually no damage the vampire would periodically  respawn  and totally heal up i m an archer and of course i want to help problem with that is the vampire is surrounded by good guys in trying to put arrows into this guy  i inevitably hit a citizen i got arrested and hauled off to jail twice during the battle it took at least a half hour to finish this demon off i thought it was pretty funny the guard and the commander of the guards no less  would break off from the battle to haul my sorry self to jail lol half the population of whiterun is now dead and all anybody will talk about is how their wifehusbandgirlfriend died  ,d02vd2a,skyrim,gaming,1455685246,arcline111,1,0,1652,3006,0.0
hodilton on youtube is my favorite channel for showcasing enb mods because his camera skills are excellent he recently has started to upload in 4k  but unfortunately youtube just rips video quality to shreds it s definitely something you need to experience for yourself how beautiful this game can be  https  wwwyoutubecomplaylist  list  plbjrt3lrsq0lzwarh6llxub3wrn0c9pr5,d02u82o,skyrim,gaming,1455683141,DrewReaLee,1,0,66,5855,0.0
i m trying to have another go at skyrim  but my  new  computer is having a problem with mouse lag  which has apparently been a common problem since the game launched i tried disabling vsync and adding ipresentinverval  0 to skyrimprefsini  but no luck has a definitive fix for it ever been found ,4652j3,skyrim,gaming,1455662704,CrazyEddie041,1,0,815,55403,0.0
have you tried turning off antialiasing ,d02iuao,skyrim,gaming,1455665075,Kathartrix,2,0,1,627,0.0
i have a mod that added a bunch of little sneaky hidey holes  but i m not sure the storage is set up to not respawn is there a way to check through the dev console ,466aaj,skyrim,gaming,1455679576,Atari_5200,1,0,111439,26963,1.0
hidden hideouts of skyrim  i am pretty sure that nearly all of the containers are permanent in that mod  but i do not know if there is a direct way you can tell ,d02t5gs,skyrim,gaming,1455681258,LosGrak,2,0,546,1609,0.0
i do nt get it ,d00sl30,skyrim,gaming,1455555539,Rogue_freeman,3,0,13802,4165,1.0
modlist  http  wwwmodwatchucore_ten,d02pjnc,skyrim,gaming,1455675445,Core_ten,2,0,2994,317,1.0
you mean you have nt heard of  skywind   https  wwwyoutubecomusertesrskywindofficial  ,d02pjr7,skyrim,gaming,1455675449,JingleJangleJin,1,0,367,14214,0.0
 p fus roh dah ,d01fg38,skyrim,gaming,1455589899,cooley_04,2,0,1,9,0.0
the hell is up with the sound ,d0235uf,skyrim,gaming,1455643685,SauronGamgee,1,0,842,14589,0.0
i love skyrim and i love skyrim and i love skyrim and i love this community  d happy aftervalentine sday everybody ,d01qss5,skyrim,gaming,1455615960,jh1157,1,0,1,-18,0.0
i hope this gets finished there is this little part inside me that is worried this will be one of those projects that never get completed ,d02toz0,skyrim,gaming,1455682207,splkennedy,1,0,1,4276,0.0
i have been a huge elder scrolls fan since about the time oblivion came out since then i have played morrowind and skyrim lately i have been enjoying skyrim with many amazing mods  huge kudos to you guys   playing these mods have got me wondering  would it be possible to create a total conversion mod for skyrim that could make it into a modern morrowind  use the same setting and story lines  but skyrim s graphics and combat system  and ability for khajit to wear armour  but also morrow wind items what do you guys think  could there be legal issues  what would the development issues be ,465yzx,skyrim,gaming,1455675306,Kirk_Ernaga,1,0,27,244,0.0
i ve started playing again after some time off  decided to switch from my usual glass hammer approach and play a magic based character  i ve started playing with enchanting and alchemy  are there any pieces of gear that improve enchanting  i ve found alchemy ones and then enchanting potions but not gear  can i also get magika use down to 0   or can i get resists upto 100   or would i have to spread the stats across multi pieces of gear ,45ye9z,skyrim,gaming,1455566612,thebluemonkey,2,0,1556,63055,0.0
  magic resistance   is capped at 85   elemental resistance is also capped at 85   but it is calculated separately from magic resistance  so you can stack  say  fire resistance on top of magic resistance however  in this case  elemental resistance is calculated as percentage of the damage not blocked by the magic resistance for instance  if i have 80  magic resistance and 20  fire resistance  that does nt mean i resist 100  of fire damage it means i resist 80  of fire damage  plus 20  of the remaining 20  that is nt taken care of by my magic resistance so stacking a 20  fire resistance item or potion on top of 80  magic resistance only yields an extra 4  resistance to fire  for 84  total on the other hand  you can stack capped elemental resistance on top of capped magic resistance  so that you resist 9775  of each spell  85  magic resistance  and 85  of the remaining 15      spell cost   can be reduced to zero with sufficiently high enchanting skill but you can only do this for two magic schools  since the most you can get on a single item is a 25  cost reduction  and you can only put two enchantments on each item also note that the fortify lt  spell schoolgt  effect you get from enchanting is different from the fortify lt  spell schoolgt  effect you get from potions having  say  an amulet with 20  fortify destruction reduces your spell cost by 20   but a potion that grants 20  fortify destruction increases your spell damage by 20   there are nt gear pieces that improve your enchanting  because there is no fortify enchanting enchantment  only fortify enchanting potions but this can still be used for   maximizing enchantment power    check out  this brief guide   http  wwwuespnetwikiskyrim  enchanting  maximizing_enchantment_power  on the wiki the basic idea is to get a kind of feedback loop going between fortify enchanting potions and fortify alchemy enchantments  brief a fortify enchanting potion  then make a fortify alchemy enchantment while under that potion s effects  which you can use to make an even more powerful fortify enchanting potion  and so on however  the most powerful fortify enchanting potion you re going to be able to make no matter what is somewhere between 40  50   depending on what patches you re using ,d012h14,skyrim,gaming,1455569797,Grundlage,2,0,27,1317,0.0
what are we looking at,d02v8z5,skyrim,gaming,1455685033,quarantine22,1,0,18,37,0.0
i do nt man  if it keeps those loud ass bears at bay then i m cool,d012gjv,skyrim,gaming,1455569778,andrewjackson5,1,0,130378,134167,0.0
gt  illusion magic _ ftfy i do agree with you during my mage playthrough  i experimented with all types of magic i noted how boring it was ,d01c5e2,skyrim,gaming,1455584745,Mythological__,0,0,123,769,0.0
the only real reason to get illusion up is for the quiet casting perk  in my opinion ,d00xik4,skyrim,gaming,1455562694,ChaosWolf1982,1,0,3883,44072,0.0
perkus maximus ,d0110ls,skyrim,gaming,1455567725,Crackborn,1,0,9,2580,0.0
the concept of an illusion mage really speaks to me  however bethesda could ve done so much more with it then what they did  it s basically 4 basic spells that get stronger from novice to master and then master spells that are also the same except they get an area of effect and then you also get muffle and invisibility  so in my opinion you really only get 6 spells which  after a while  is very boring to play with  is there any mod that revamps the illusion spells ,45xzwc,skyrim,gaming,1455562255,Virark,2,0,160,508,0.0
 force push smooch   that sound either rapey or violent ,d014lq7,skyrim,gaming,1455572908,Siethron,11,0,1836,63510,0.0
so i went back to solstheim to make another batch of spiders for such a small island  i always get sucked into doing something there and staying a lot longer than i d planned i estimate that i must have been there for a week ingame  came back to lakeview manor to tend the garden and my daughter is outside she gives me red robes i am excited because this is pretty out of the ordinary i think i usually get nondlc items from them before this  i did nt even know red robes existed i put them on i love the way they look she stares at me and seems happy that i like it and then she goes to sit down in the yard  little moments like these make me think that beth did something really quite different with skyrim ,460blm,skyrim,gaming,1455590225,bosmerrule,9,0,1,1415,0.0
if you want to take screenshots with cinematic angles and no hud and stuff  you could try typing tfc 1 into the console to freeze time and allow you to move the camera freely  and type tm into the console to hide the hud ,d0237if,skyrim,gaming,1455643750,illkillyouwitharake,2,0,255,2696,0.0
what mods do you use  specifically the armor  and the water please ,d013ga2,skyrim,gaming,1455571219,Duckman1337,1,0,478,7743,0.0
conjuration is daedric magic and is therefore banned  think of the to be more like dnd clerics  heavy armor  maces to crush skeleton bones  healing and protection magic ,d00qf0z,skyrim,gaming,1455552182,LosGrak,23,0,546,1609,0.0
i think it s just the  crusader  theme more than anything  actually that reminds me  there was a crusader class in the older games  http  elderscrollswikiacomwikicrusader  if you look at the major skills  that s basically everything the vigilants use for the most part ,d017kmh,skyrim,gaming,1455577399,MrManicMarty,2,0,2491,141720,0.0
