text,id,subreddit,meta,time,author,ups,downs,authorlinkkarma,authorkarma,authorisgold
do nt try and roleplay if that s what s killing it for you start with a character that is just yourself what would  you  do in this situation  what side do  you  think is in the right  which weapons and armor would  you  use  by putting yourself in the game you can get into the adventure that you want to have ,d019de7,skyrim,gaming,1455580249,RedDemocracy,11,0,1,1986,0.0
i think the best thing is to take ideas from people that you watch creating a unique character based on something either in the elder scrolls universe or something from a tv show or movie is a lot of fun  you can also skip through a lot of dialogue and still get the main idea of something  hope this helps ,d01770z,skyrim,gaming,1455576816,TheOnionBoyLP,3,0,14,27,0.0
you do nt have to roleplay  i tend not to just set a goal for yourself and go for it  like collecting unique items or beating all questlines hell  even just building your character to fit a certain archetype can be fun ,d019c92,skyrim,gaming,1455580200,Freezer_Slave,2,0,8090,88771,0.0
 i am so immersed right now ,d01mhg0,skyrim,gaming,1455602374,Careless_Con,58,0,2044,231949,1.0
well  it s unp  that s for sure beyond that i do nt know but maybe that will help a bit ,d01krb9,skyrim,gaming,1455598720,LosGrak,6,0,546,1609,0.0
you could try asking over on rskyrimmods the user base there might be more helpful and friendly than this one ,d02bhn6,skyrim,gaming,1455654885,itza-pizza,3,0,1,2,0.0
dang  only four results on google image search three of them have are just unhelpful galleries  but one of them was a japanese forum post that looked promising but turned out to be some other guy asking what mod it is  you can produce a similar look with northgirl pants and something from lingerie shop  or maybe sexy vests they do nt use the same body replacer but there s a cbbe conversion for northgirl ,d0244gb,skyrim,gaming,1455645002,Lacey_Rosehips,2,0,1866,503,0.0
just go google some porn wtf,d022mbu,skyrim,gaming,1455642932,I_Speak_For_The_Ents,6,0,279,11228,0.0
looks like the bathing babes luxury suite not like i know what it looks like or what that is or anything ,d01pkue,skyrim,gaming,1455611230,reaperer,2,0,1,512,0.0
maybe try and set yourself some roleplaying rules to hamg unto give the character some backstory  read into tes lore so basically learnote about the world your in and try to make a character that matters to you ,d018mgn,skyrim,gaming,1455579058,RexUmbr4e,1,0,1,445,0.0
have you tried typing sw 15e  which sets the weather to default  in the console  on pc   have you also tried using clear skies andor storm call ,d01s4ns,skyrim,gaming,1455621486,RK0019K,1,0,967,1484,0.0
go to skaal village or the temple you ll start the quest to find the first black book,d01k5d5,skyrim,gaming,1455597556,andrewjackson5,5,0,130378,134167,0.0
lightning i also like fire imo ice would be great but the amount of enemies in skyrim that have a huge resist to it makes it horrible  like drougr and nords who you are fighting a lot of the time in skyrim ,d02od55,skyrim,gaming,1455673641,SkyrimSavage0,1,0,1,3,0.0
any plans to post a screenshot of daytime ,d00wrub,skyrim,gaming,1455561640,blackhawk905,4,0,69,3649,0.0
got weed ,d0189zn,skyrim,gaming,1455578506,irefusetolisten,2,0,1,1445,0.0
there is a variety of things you can try to improve your magic flailing madman in the fantastic land of skyrim  as you said you have gone through everything there is to be the wonderful wizard of skyrim so let s get a good look at the various schools of magic and see what might fit you  1   alteration   a class for a magician who just wants to feelwell magical  this school as you may know is based around defenses and miscellaneous utilities essentially your  buff  school being a mage is a squishy life unlike the heavy plated beserking monstrosity that are mighty orc  the wall  warrior builds  mages tend to be as well defended as a wet napkin this can be offset later on with enchanting which i will talk about later but that s the bitch way son spells like stoneflesh and dragonskin put some hair on your pale wizard chest and get you ready to rumble in the cold harsh world however alteration shines the greatest when its just doing utility jobs with its tools such as candlelight  transmute  detect life  telekinesis  and paralysis  alteration can work with any school but is more or less a passive school  2   conjuration   imagine this a dragon swoops down and starts causing a ruckus on your hometown of  insert home here  but you just ca nt be bothered to get your soft magic hands dirty well then conjuration is the class for you  this school of magic lets you summon your wageless demonic slaves or undead minions to combat problems for you even awaken your inner goodguymagicman and banish the creatures of oblivion back to the shadow realm from whence they came but if you re the sort of person who s day is nt complete without killing it yourself well then conjuration allows you to summon weapons and bows as well  a pro at this school can have their own undead army or personal daedric escort to help you and your merry magical adventures across the land of skyrim hell you can even steal the souls of the living to use in your horrible  or purely academic  mad experiments by trapping them in soul gems with soul trap as long as you can kill them before the spell ends depending on how you play  this school can be either very hands on or very laid back whether you d decide to get up and personal with hell itself or just let your army of the damn deal with it on your behalf it is a very fun school that can work very well with alteration if you refuse to dawn even the most fragile of armors and restoration if you find yourself getting more than a scratch  3   destruction   now here s a fucking school of magic if you want to be a master of the element  s  that throws balls of explosive fire  bone chilling spikes of ice  or motherfucking sith lightning  then this is the school for you you can either focus into a specific element or branch out and enjoy what destruction has to offer now by endgame  with the proper perks invested such as impact  overpowered  you can essentially have enemies constantly stagger as you launch volley after volley of whatever flamingfrozenshocking projectile you can fling at them until they are nothing but smears on the floor each branch of destruction has their benefits and drawbacks fire works mostly with overtime damage and directly focuses on taking down an enemies health but is somewhat weaker  frost is excellent at slowing an enemy to a crawl and preventing power attacks but can be fairly wonky to work with and does the least damage of the 3 shock does the most damage and is the magician s natural predator as it will beat that magicka bar like it caught it cheating but it takes a ton of magicka to use their spells and cost the most of the 3 each one is a different playstyle and ultimately falls under player preference this school works exceptionally well with restoration as you may be the more offensive kinda guy and it is an offensive kinda school  4   illusion   you ever feel like you want to be a sneaky manipulative piece of shit but ca nt be bothered to do any actual fighting  welcome to the palpatine school of being a manipulative asshole illusion works great if you want to be stealthy and out of the way spells like pacify  fear  frenzy  can make sure you do nt ever have to worry about an enemy again because they either ran away  killed each other  or simply lost the will to be bothered other spells like rally do the opposite and make your allies  better  faster  and stronger which makes this work really well with conjuration if you are simply too shy to deal with people at all then muffle and invisibility are the introverted wizard s best friend  this school is a very supportsecondary school you use on top of your combat or lack thereof as it takes full advantage of a situation given you have the proper training because of this  it can be a school that works well outside of the sphere of the mage that warriors  thiefs  assassins and shifty pedophiles take complete advantage of the possibilities are endless  5   restoration   this is possibly the most essential school that a mage could invest in you can have your fireballs  your invisibility  your bark skin  but nothing really matches being able to heal yourself from damage if you plan on getting hit then restoration is your good friend more or less your  holy builds  have this as a secondary school because of its ability to fuck up zombies spells like turn undead can have the ability to not only make the spirits of the damned run away peeing their pants but also sets them on fire because fuck it that s what good guys do it also has a proper magic defense system as well in the form of wards even a low level steadfast ward spell can have total protection against dragon breath  if you need something to complement your  main  school you can never go wrong with restoration it is a perfectly valid school of magic  6   enchanting  special    probably the most potentially broken  magic school   this basically makes the game easier than your mom on prom night making full suits of daedric armor overflowing with health and magicka and making spells have zero cost speaks for itself you probably wo nt need to bother with builds at this point  now  these can be used in any combination of ways such as destructive conjurer  holy gandalf build batman   alterationrestorationconjuration   manipulative priest  illusionrestoration   pure conjurer  conjuration   pure destruction mage  destruction   sneak archer etc etc  in the end there is nt really any particular way to play a mage if none of the many combinations suit you or you simply are not having fun then magic might not be for you ,d01krkg,skyrim,gaming,1455598735,Loremaster_Wuyo,6,0,3965,20668,0.0
no she  didnt   https  wwwgoogledesearch  tbs  sbi  amhzzivircvyzvj4kjo9dn2zhdcvb5tbjuuiemrl6d815wexqj2mhnuiwesqee05h0vpqbalq3_1fy9kxjwqz1qvuxy_12zpwsorjeyzlpjpgeposjkhvyops3z937kpahey7yqnbxipduzauveddr6dkdobbeb2oz_1l_1k1dpd4w_12bdpyy9l7toqoccidxtjob8rd4waywygoovyydmmwenkfce1tl4quo_1qwggjsydhozlwxzfa8p7scuge6hoyykleku_1nnhns5vbdlyakdkad6lfpg8pm3y9w7jxe76nwbgozsiutjaig5n48cyb5v2flkg6rmr0r04dki1bmfpan90pcuwdcdw4mbxciiywsjz4o6yaeupcdelbleb5rqr_1druov7d7wubygapqrgomulo6i6mtpzqidr48nlzqa7qay8rb3_19nwm0nbatt8ahhz4unth8qtl8wmde6wswrs1nkutgldr53xvvb3gtvelocmjcbl4dutd9sf_15zerejspdo6am8pdunse_1mllwglltxncll65ujmoyly5kdmwahfdo_1e7xaxhdxf3hzq1srvmte66uefnvusqjexsxem1qgioglkmxbmzi5upz4ocae2d065fy4oi3kscubvb3fme2n1xtd7y7u4s5jgxjrfst6iby2kblggcqn98p3geoiwnh9imxa60uscynrfdlmpv75thd024q1xudkupsc_1roex8jkhgxcajc_1urzqno2n04v7qxmzqo_1ncvpgqdplwunrgkuuiqgehbyo2eqmawwy9ma4ltrs4gcndadyzkpt3qlynwvnjxbswquf3yeay62wtawxq4ora42yug3gdiqaaz6f8kdoxjzfe2a0cmsgvssjjbf1k5rr0zqlttx62rehp7twkoud3edk7rqxscer_1wjyqos6vutb_1hbx4l7izpjyefr9zcimmpxo2bpkpy4tx2qbwj8jb1_1qnuxzgm2ginuhhbzrnhipzvcgjuhslsahl1ravhb1ax4cmulsp0qfrqlgnxamgdgetezlvlgtw4h7entajm2n4m7iqrhxhivbl1lko1gtkv3jfj5d09rmdd51vy03y4hnv1ijeiq4mbm6l4ugou59km9l7rhqw8bbic18fyd0alk56k8qhuftyhwt543xvt_1iy2nsecnakiw_1djwn1xwebfjgrkxx3drg1mnpvpim   remove this cheap attempt of an repost ,d01rywz,skyrim,gaming,1455620849,DovahkiinHero,9,0,156,897,0.0
loneliness made this ,d02cxtf,skyrim,gaming,1455656811,Blizzow13,2,0,936,1377,0.0
1 word  coop,d01t6p3,skyrim,gaming,1455625332,Bowmance,0,0,959,3014,0.0
easiest way to start roleplaying in skyrim  and similar games  is to roll play yourself in that situation once you are comfortable that then start giving your character a background and stick to their choices ,d01uxib,skyrim,gaming,1455630082,Calvin1976,1,0,1,2,0.0
you ca nt move  if it isnt a mod issue  might be stupid but i had a similar problem and turns out it was because the xbox 360 controller was enabled and overriding anything i tried to do  including opening up the escape menu     if you ca nt get into the menu via escape try using your controller and go to optionsgt  gameplaygt  uncheck xbox360 controller  if you do nt have a controller try going to  userprofile   documents  my games  skyrim in your file browser and open skyrimprefsini in notepad and set bgamepadenable  1 to bgamepadenable  0,d021ozf,skyrim,gaming,1455641621,Waswat,5,0,4321,9459,0.0
sounds like mod issue install loot amp  it will automatically sort out your mod load order ,d0211k7,skyrim,gaming,1455640703,waffle247,1,0,1,6161,0.0
no she  didnt   https  wwwgoogledesearch  tbs  sbi  amhzzivircvyzvj4kjo9dn2zhdcvb5tbjuuiemrl6d815wexqj2mhnuiwesqee05h0vpqbalq3_1fy9kxjwqz1qvuxy_12zpwsorjeyzlpjpgeposjkhvyops3z937kpahey7yqnbxipduzauveddr6dkdobbeb2oz_1l_1k1dpd4w_12bdpyy9l7toqoccidxtjob8rd4waywygoovyydmmwenkfce1tl4quo_1qwggjsydhozlwxzfa8p7scuge6hoyykleku_1nnhns5vbdlyakdkad6lfpg8pm3y9w7jxe76nwbgozsiutjaig5n48cyb5v2flkg6rmr0r04dki1bmfpan90pcuwdcdw4mbxciiywsjz4o6yaeupcdelbleb5rqr_1druov7d7wubygapqrgomulo6i6mtpzqidr48nlzqa7qay8rb3_19nwm0nbatt8ahhz4unth8qtl8wmde6wswrs1nkutgldr53xvvb3gtvelocmjcbl4dutd9sf_15zerejspdo6am8pdunse_1mllwglltxncll65ujmoyly5kdmwahfdo_1e7xaxhdxf3hzq1srvmte66uefnvusqjexsxem1qgioglkmxbmzi5upz4ocae2d065fy4oi3kscubvb3fme2n1xtd7y7u4s5jgxjrfst6iby2kblggcqn98p3geoiwnh9imxa60uscynrfdlmpv75thd024q1xudkupsc_1roex8jkhgxcajc_1urzqno2n04v7qxmzqo_1ncvpgqdplwunrgkuuiqgehbyo2eqmawwy9ma4ltrs4gcndadyzkpt3qlynwvnjxbswquf3yeay62wtawxq4ora42yug3gdiqaaz6f8kdoxjzfe2a0cmsgvssjjbf1k5rr0zqlttx62rehp7twkoud3edk7rqxscer_1wjyqos6vutb_1hbx4l7izpjyefr9zcimmpxo2bpkpy4tx2qbwj8jb1_1qnuxzgm2ginuhhbzrnhipzvcgjuhslsahl1ravhb1ax4cmulsp0qfrqlgnxamgdgetezlvlgtw4h7entajm2n4m7iqrhxhivbl1lko1gtkv3jfj5d09rmdd51vy03y4hnv1ijeiq4mbm6l4ugou59km9l7rhqw8bbic18fyd0alk56k8qhuftyhwt543xvt_1iy2nsecnakiw_1djwn1xwebfjgrkxx3drg1mnpvpim   remove this cheap attempt of an repost ,d01rywz,skyrim,gaming,1455620849,DovahkiinHero,9,0,156,897,0.0
this is the sort of thing i can get behind ,d00tzd6,skyrim,gaming,1455557622,Fus_Ro_Dadjokes,4,0,1,36,0.0
 dammit marie  ,d01rbsy,skyrim,gaming,1455618175,park-drive,1,0,399,463,0.0
have you been playing with the ini file  check it has the same resolution set as your desktop  fixes many ctd issues  ,d0259o4,skyrim,gaming,1455646561,waffle247,1,0,1,6161,0.0
i have coin  does your cat have wares ,d02gq02,skyrim,gaming,1455661930,agurcsik,112,0,550,29256,0.0
these are the mods i have installed in order  what can i do to fix this  http  prntscrcoma423tw http  prntscrcoma424wi edit  i disabled the usp because an ingame message told me to  so i installed the uslp,4638dj,skyrim,gaming,1455640443,OhShitARedditor,10,0,1940,1190,0.0
trollsfoot ,d009cag,skyrim,gaming,1455505920,GandolfShitler,5,0,901,15456,1.0
the dwemer are really advanced,czzqdai,skyrim,gaming,1455472472,SauronGamgee,2,0,842,14589,0.0
apart from the fact muffle must be my all time most used spell  i agree with you ,d01xhpf,skyrim,gaming,1455635192,daerse,1,0,1,352,0.0
ha  i was thinking about this last night  when i played the game on xbox i got all the achievements in probably 100 or so hours  just for the completion then went on to play it for another 400 hours  now i ve got it on pc with another 222 hours and ive only got 5175 itl probably be a very long time until i ve got them all ,d00jrfz,skyrim,gaming,1455536034,321232,2,0,797,12973,0.0
395 hours here and i did nt even finish the main quest yet  p,d00gh3y,skyrim,gaming,1455522835,ShiniShy,6,0,14,313,0.0
reminds me of mario kart ,czzlm3y,skyrim,gaming,1455463880,heretoplay,2,0,3969,41671,0.0
your quest markers disturb me  that aside  amusing  ,d00hz03,skyrim,gaming,1455528361,LordSyyn,9,0,1,23028,0.0
it s one of the riddler s banners from markarthham asylum ,czzpeny,skyrim,gaming,1455470822,kshump,9,0,3263,6867,0.0
yolo you only lollygag once ,czzom8p,skyrim,gaming,1455469445,OrickJagstone,13,0,3290,2920,0.0
i think it s etac is causing that i have the same effect in my game ,czzkkuq,skyrim,gaming,1455461636,Sjeft,1,0,39,160,0.0
i ve had a lot of fun playing as an illusionconjuration mage as well as just a straight up assassin archer when i make a new character to level up smithing and enchanting i usually make jewelry then enchant it and sell it  or i go into dwemer ruins get the scrap metal  melt it and then make it into armorweapons and sell it  also make sure to search as many minescaves as you can find and extract all the ore and make armor out of that ,d023wdl,skyrim,gaming,1455644695,SkyrimSavage0,1,0,1,3,0.0
i ve been playing skyrim for about  20 hours  yet i still have never have possessed over 2000 septims at one time next game  which i m starting tonight   i d really like to have the money for a home   or i could build one  since i have hearthfire installed   how can i make enough money to get a house ,45ymlo,skyrim,gaming,1455569169,Little-miss-hetalia,5,0,1,75,0.0
find and create weapons use weapons and armor you find to complete quests save all gold i only buy health potions and supplies if i need them i have around 30000 septims on me and probly about 100000 in jewelry and loot at my house in white run  i just created lakeview manor and havme maybe 50000 in gold their if you save gold long enough your biggest problem will be trying to sell it and get rid of it selina  i think her name is  at ft dawnguard imo is the best merchant she has 5000 gold on her and she buys everything also using a companion as a pack mule makes things easier editi have around 100 hours,d013y0d,skyrim,gaming,1455571946,Packpinchdipnspit,2,0,11,341,0.0
just pick up everything of value whenever you know you re going into town  smith whatever you can  then sell on the way from helgan to whiterun i usually have over 3000 gold  while only doing the dragon stone quest ,d018lbn,skyrim,gaming,1455579009,irefusetolisten,2,0,1,1445,0.0
  from looting    gold bags  jewellery  high value potions  scrolls  the best weapon tier available  and i believe chest or helmet for armour  gt  ingots are excellent too  for improving smithing and the value of weapons to sell   crafting     alchemy   all ingredients you can buy from the vendors  look up valuable potions you can make  and make them sell them back speech bonuses help  esp the 5001000 gold perks   smithing   grab heaps of ingots  and collect pelts for leather where possible  mine too   make the best value items you can per ingot weapons  warhammergsword   armour  chesthelm  etc   temper and sell   enchanting   collect all jewellery and unenchanted crap armour collect soul gems from lootingbuying if necessary look up best enchants per piece  banishwepsneaketc ,d01a6tk,skyrim,gaming,1455581569,LordSyyn,2,0,1,23028,0.0
if you join the thieves guild  you get access to tonilia  who is a fence and has 1000 gold available as you progress through the quests  you get more fences  one in each major city  and they all increase the amount of gold they have  up to 4000 great for selling stuff to ,d01s5vs,skyrim,gaming,1455621623,RK0019K,2,0,967,1484,0.0
do favor quests early to gain easy money  go to morthal by carriage  find falion north  north west  near a circular shrine after 1am ask him what he s doing and then extort some money to keep his secret  go to the jarl s house and speak to idgrod deliver idgrod s note to danica purespring in whiterun now go to dragonsreach and speak to farengar  ask him if he s the only wizard in whiterun  deliver farengar s frost salts to arcadia for some free potions and be able to take some items from her shop  speak to carlotta in whiterun marketplace  tell her you ll deal with mikael  give a coin to the town beggar and head into the bannered mare to persuade mikael then talk to carlotta again  get a carriage to riften  before you go inside  turn around and go into each of the three guard towers to pick the locks  no crime committed  and empty the chests sell the items in riften marketplace  get a carriage to markarth  before you head inside  speak to banning the dog trainer and ask him about his dogs  dont buy one   say you ll deliver his spiced beef to voada  when you enter markarth  draw your sword and kill weylin find a woman in blue  named margret  talk to her to receive a valuable necklace  before going to understone keep to deliver the dog food  head into the hag s cure and ask bothela about the store s unusual name  then agree to deliver the potion to the steward  go to understone keep  deliver the potion to the jarl s steward and the dog meat to voada in the kitchen for a reward  then get a carriage to windhelm  wait until 2pm and head into candlehearth hall  go upstairs to find adonato leotelli writing talk to him and agree to deliver his book  take a carriage to solitude head inside and watch the ceremony go inside radiant raiments and wait until taarie comes back inside  and it s between 8am and 8pm   speak to her to ask her what s wrong with what you re wearing and tell her you re heading to the blue palace accept her quest and head to the bards college to deliver the book  put on taarie s clothes  go into the blue palace  go upstairs and wait for the discussion to finish  ask jarl elisif if she likes your outfit go back to taarie to receive your reward  get a carriage to falkreath find thadgeir  wearing leather armor  sometimes chopping wood   in or near dead man s drink and accept his quest to deliver berit s ashes to runil runil is either in the graveyard to the west or inside the tavern  congratulations you should have over 3000 gold at level 45 ,d01cu42,skyrim,gaming,1455585811,raggamuffinoO,3,0,11,1628,0.0
any plans to post a screenshot of daytime ,d00wrub,skyrim,gaming,1455561640,blackhawk905,4,0,69,3649,0.0
go looting in the random dungeons and camps you ll eventually get more than enough gold from septims and loot ,d0131wx,skyrim,gaming,1455570640,nomedable,3,0,1,1371,0.0
if you do the assassins guild questline they give you like 50000 septims to build a sanctuary  but fuck those guys they re fucking creepy and their armor does nt look half as cool as nightingale armor  also  the correct way to play the game is  stealth archer sell everything buy nothing with money  only buy stuff with what you can sell pick up everything based on sell value vs weight ,d0125c1,skyrim,gaming,1455569337,Tianoccio,10,0,944,30589,0.0
always loot gems and sell them to merchants ,d01k4nb,skyrim,gaming,1455597518,djiboutigregg,2,0,39,4720,0.0
do quests and never buy equipments  craft them or loot ,d01866n,skyrim,gaming,1455578337,Themrchester,6,0,1437,5143,0.0
1 try to pick items what have a 10  1 goldweight ratio 2 innkeepers often hand out  kill a banditbeastgiant  quest with gold reward 3 do nt buy anything you could craft yourself  3 alchemy and enchanting are easy ways to make gold  4 the dark brotherhood offers one of the best gold rewards in the game ,d014vw6,skyrim,gaming,1455573317,Juan-San,2,0,318,1699,0.0
the torture chamber is a lot of fun i used the console to set the torture victims as essential so i could torture them indefinitely ,d02n9jj,skyrim,gaming,1455671989,CIRNO9000,1,0,2449,6974,0.0
i saved the dark brotherhood storyline up for a long time  since people seemed to think it was the best so i m a bit late to this party  but here i am  head of my shiny new sanctuary  and frankly  i m feeling a bit let down when old delvin offered me a torture chamber  i thought it might be an edgy bit of decoration and coughed up  but here i am with all these poor sods hanging from my walls begging for mercy  oh gods  what have i done  i ve done some bad things in my time  but i joined the db to deal in quick  clean death  not to be a sadist bollocks  and on top of that  the night mother keeps sending jobs our way  but can i get anyone to carry them out  nooooo  they all just hang around the cosy sanctuary and it s muggins here who has to go out and take care of business the new recruits are as much in awe of me as i was of astrid in the beginning  but will they get out there and practice their trade  will they bunnies all i want to do now is hang up my armour and lounge around the place ordering people about and plotting things on my big map  and instead i ve got a cave full of torture victims i ca nt release  and toadies who wo nt lift a bloody finger  lydia was right i m going back to whiterun ,464fn7,skyrim,gaming,1455654827,s_nut_zipper,29,0,3806,1970,0.0
always pick loot based on valueweight ratio lower ratio gets tossed away first  invest some points in stamina to carry more loot  play with a follower and always fills yours and their inventory  practice alchemy make every ingredient count  look for recipes online  and craft paralysis  damage magicka regenration  invisibility  slow  fortify carry weight  and regenerate health  magicka  stamina they are the more valuable  but in general potions have a very good sell value  before selling anything in a city look for a beggar  and give them a septim  this grants you the gift of charity  which increases your speech which gives you better prices  get some perks on the speech tree  left branch merchant is particularly useful  get married  wear an amulet of zenithar or dibella when selling  andor activate their shrine  join the thieves guild they give you enchanted items for better prices and you get acces to fences to be able to sell stolen items  the dark brotherhood questline gives a lot of money  play as an imperial they find 10  more gold  dwemer ruins are usually rich in soulgems  from automatons collect them all and use a weapon with soul trap  or the spell soul trap to fill them and practice enchanting you can craft iron daggers or leather bracers  and enchant them  for a lot of profit and leveling  edit  also  always carry enough lockpicks buy them from khajit caravans they usually have 30 never leave a chest unopened  or room unopened  you get very valuableuseful items ,d02v51m,skyrim,gaming,1455684828,mistselkie,1,0,444,335,0.0
