text,id,subreddit,meta,time,author,ups,downs,authorlinkkarma,authorkarma,authorisgold
  practice courtesy upvoting   courtesy upvoting is when you upvote someone who replies to your comment or post it just makes sense to me to show my appreciation for their time replying and reading my post it just feels appropriate ,d01ur0w,adviceanimals,humor,1455629655.0,marineturndlegofiend,5.0,0.0,50205,140277,1.0
you spelled downvote  wrong,d01z85z,adviceanimals,humor,1455638018.0,Mox_au,2.0,0.0,5466,24327,0.0
nah that s when you look at other comments  take best parts from them as well and rephrase to sound it better enjoy karma ,d01y9bw,adviceanimals,humor,1455636484.0,myndzha,1.0,0.0,8963,50167,0.0
but you ca nt use an upvote bigger than your thumb ,d01zueq,adviceanimals,humor,1455638955.0,acerebral,1.0,0.0,217,20167,1.0
no thanks  i shall blather my opinion and seek to engage in competitive voting  it s like reposting  but requires a little more writing ,d01zuhc,adviceanimals,humor,1455638958.0,sonicmasonic,1.0,0.0,1,1984,0.0
who the fuck cares ,d020p8q,adviceanimals,humor,1455640212.0,furtivepigmyso,1.0,0.0,1,15500,0.0
i downvote them for posting my witty hilarious comment faster than me ,d020rgl,adviceanimals,humor,1455640301.0,Neutronova,1.0,0.0,29,19777,0.0
and who s thumb are we ruling by ,d021ewx,adviceanimals,humor,1455641227.0,cjh57,1.0,0.0,7,7773,0.0
wait  rule of thumb  in the early 1900s it was legal for men to beat their wives  as long as they used a stick no wider than their thumb ,d0222uv,adviceanimals,humor,1455642169.0,dtUnaM,1.0,0.0,1,191,0.0
and then you get people saying that upvotes do nt mean anything because they are fuzzed and people upvote on a whim  or they delete  edit their comment and suddenly your vote means nothing ,d022g31,adviceanimals,humor,1455642690.0,NotInVan,1.0,0.0,1,855,0.0
fuck them  i want the karma,d0235g3,adviceanimals,humor,1455643670.0,Tabnam,1.0,0.0,193,6080,0.0
as someone who sorts by  new  andor  controversial   is hard to see who said what ,d025pvm,adviceanimals,humor,1455647173.0,I_AM_ALWAYS_ANGRY,1.0,0.0,894,13598,0.0
i ve got two more from the same ex  of whom i have two children with   1 after we separated  but not divorced   she drove halfway across the country to bone my  then  best friend  was her friend too   needless to say  that tipped the scales as to the direction of our relationship  with me and her and me and my best friend   2 about a year ago  i got served court paperwork in which she was asking the court for full physical custody of my kids  we have 12 legal and 12 physical now  and to move the kids across the country to follow her new military husband at his new duty station oh  and she wanted child support  we ended custody  change request  case about a month ago the court granted me full physical custody of my kids and ordered her to pay child support ,d028mfb,adviceanimals,humor,1455651090.0,socalnonsage,144.0,0.0,21260,25412,0.0
long story short  i had to pay my ex  1000 a month in child support  she did nt use it for anything but partying and drugs while my kids suffered and went hungry one time i was between jobs and she said i was  dead beat dad  one payment eventually my lawyer convinced the judge that the kids were in a bad environment  ie the new husband was a drug addict and 3 time convicted felon lol and i got the kids 100  of the time having gone through horrible child support issues i lessened her child support to  50 a month guess how much in child support i ve gotten from this dirty whore in 4 years  guessand the courts have done nothing  not that i give a shit i have my kids ,d02fure,adviceanimals,humor,1455660713.0,ixholla,19.0,0.0,726,1669,0.0
she sounds like a lot of people i know,d02s6f8,adviceanimals,humor,1455679629.0,SteroidSandwich,1.0,0.0,12900,145231,0.0
gt   says my kids want to spend more time at her house so i let them gt   in court  she says i do nt spend all of my allotted time with my kids showing i do nt care about them    these   captions   are nt   guaranteed   to   be   correct ,d02jib0,adviceanimals,humor,1455666102.0,CaptionBot,1.0,0.0,12594,448583,1.0
he s probably hoping you ll learn to do it yourselves some day,d01yw4z,adviceanimals,humor,1455637507.0,mattreyu,8.0,0.0,2686,222967,1.0
there s something wrong here  i do nt know what it is tho ,d01yvpa,adviceanimals,humor,1455637488.0,Aaabea,6.0,0.0,30218,15511,0.0
the only problem arises when you have to wait to wash your hands  and there are multiple other sinks you could use  if only you were allowed to leave the bathroom without washing your hands ,d02dyzj,adviceanimals,humor,1455658187.0,greenbanana17,6.0,0.0,1,170,0.0
alex is gon na crush that with zero effort,d01izih,adviceanimals,humor,1455595552.0,You_Will_Be_Angry,219.0,0.0,4,9096,0.0
every single fucking time ,d02ffqz,adviceanimals,humor,1455660131.0,McCyanide,2.0,0.0,132571,302625,0.0
and why would nt you be able to bring home chocolate covered strawberries otherwise  am i missing something ,d02n67t,adviceanimals,humor,1455671852.0,Xadnem,7.0,0.0,19,5482,0.0
maybe not you but the system deserves it and that includes a lot of workers sure you have power but child welfare is a force for childhood trauma by itself here s just a quick note  when trained or educated  what is the equal amount of trauma caused by a parent that equals the amount generally done by removal of a child ,d02t890,adviceanimals,humor,1455681391.0,HIPPAviolationGo,-1.0,0.0,1,23,0.0
 i agree ,d01z14s,adviceanimals,humor,1455637723.0,suckfail,1.0,0.0,9394,2108,0.0
people who think upvotes are required in specific situations on reddit are the worst kind of reddit users ,d021xu4,adviceanimals,humor,1455641967.0,xMoody,1.0,0.0,508,2431,0.0
you know how when a cat brings you a mouse it is not really a gift but because the cat thinks you are to stupid to survive ,d02rf4v,adviceanimals,humor,1455678387.0,nhjuyt,1.0,0.0,11064,33004,0.0
you ca nt tell me what to do,d01yeii,adviceanimals,humor,1455636716.0,westondeboer,18.0,0.0,33991,2035,1.0
this is nt advice just more duck lecturing ,d0244a7,adviceanimals,humor,1455644996.0,RP-on-AF1,3.0,0.0,250,11767,0.0
more like downvote out of spite for stealing my precious karma ,d025dfi,adviceanimals,humor,1455646701.0,tartay745,2.0,0.0,4985,96348,0.0
lol yea right like i m gon na let that prick steal my thunder ,d01zgqd,adviceanimals,humor,1455638382.0,-MURS-,1.0,0.0,2129,34726,0.0
  who has summoned me   ,d01z6v6,adviceanimals,humor,1455637963.0,Ruleofthumb,2.0,0.0,141,4564,0.0
orpost it anyway and downvote the other person  multiple times the unidan way,d0250oa,adviceanimals,humor,1455646224.0,johndoev2,1.0,0.0,477,16489,0.0
perhaps you mean the rule of wrist  https  youtubej0bjpuhpg9g,d01xl6y,adviceanimals,humor,1455635362.0,Soren_Aabye,4.0,0.0,79,5085,0.0
i often ctrl  f to search for comments containing my would be comment before commenting ,d01znxz,adviceanimals,humor,1455638686.0,mindymcmillan,4.0,0.0,1155,3580,0.0
i felt guilty and had to go buy a  2000 snowblower because although i enjoy shoveling snow my neighbors kept insisting on helping me  am canadian,d020t6v,adviceanimals,humor,1455640371.0,Frozen-assets,16.0,0.0,107,32066,1.0
 no  this is the rule of thumb   http  meme4funcomimagesdownvotingromanjpg ,d020afs,adviceanimals,humor,1455639616.0,pcd84,4.0,0.0,5421,26504,0.0
rule of duh ,d022e5e,adviceanimals,humor,1455642617.0,Ghitit,1.0,0.0,14,18309,0.0
why no batman slap  is that not a meme  unpopular opinion puffin i can understand ,cvbe8qq,adviceanimals,humor,1443020592.0,dangeroustiger,2.0,0.0,1,536,0.0
do nt tell me what to do ,d0270yr,adviceanimals,humor,1455648933.0,takes_joke_literally,1.0,0.0,5345,23002,0.0
dissgusting  here  take your damn upvote ,d02dxnw,adviceanimals,humor,1455658138.0,ArcticTreeHerder,3.0,0.0,124,157,0.0
his new album sucks,d0263r0,adviceanimals,humor,1455647688.0,Roman420,2.0,0.0,51,3690,0.0
you know what actually i d like to see a 90  tax rate play out seeing as if taxes were anywhere near that high the government would have to be taking incredible care and provide a high quality of life for it s citizens to not revolt ,d02rguy,adviceanimals,humor,1455678463.0,PopWhatMagnitude,-2.0,0.0,12371,88164,0.0
low energy slug,d02thxm,adviceanimals,humor,1455681862.0,TRUMP_SIMULATOR,-2.0,0.0,1,171,0.0
easy to explain remember what happen to uranus last night  bingo spaceporn,d02t2us,adviceanimals,humor,1455681133.0,WienerNuggetLog,0.0,0.0,10,5484,0.0
 why are you confused  you showed that to me  throw it back in his face,d02tecd,adviceanimals,humor,1455681689.0,Honk_If_Top_Comment,0.0,0.0,7,244717,1.0
 actual photo   http  assetsrollingstonecomassetsimagesmovie_reviewbernie20120426rectanglejpg ,d02bw8c,adviceanimals,humor,1455655413.0,BumbleTummy,88.0,0.0,297,36868,0.0
the world needs more big brothers ,d02fba4,adviceanimals,humor,1455659956.0,cjh57,5.0,0.0,7,7773,0.0
my nana is 85  is on oxygen  and is dying of 3 different things right now she s still living alone and has neighbors who check on her everyday it s so sweet when i go visit her  there s constant waving out of the window  and people peek their heads in to see if she needs anything or to watch gunsmoke with her your brother is amazing ,d02oxjy,adviceanimals,humor,1455674504.0,FauxDarling,3.0,0.0,1,389,0.0
for a second there i thought this was going to be just a tenant ,d02noi6,adviceanimals,humor,1455672608.0,Deluxe_Flame,1.0,0.0,46,41031,0.0
i supervise a restaurant kitchen  i once had a customer come in with three other people and ask the hostess if we used peanuts anywhere in our facility i told them that we do nt personally prep anything with peanuts  but we put a peanut allergy on our desserts because they are prepared in a kitchen that handles nuts the customer threw his hands up and responds  sorry  i have a peanut allergy and i do nt dine in any restaurants that handle peanuts  he turned around and walked out i saw the looks on his company s faces go from slightly hopeful to blank in an instant man  just do nt go out  or pack your own meal  but do nt drag everyone else into your extreme accommodations ,d023bod,adviceanimals,humor,1455643910.0,Skykittens69,1694.0,0.0,8034,4534,1.0
find out what food he likes and tell hr you are allergic to it to get it banned too,d02a0rf,adviceanimals,humor,1455652947.0,GeronimoHey,448.0,0.0,294,954,0.0
https  youtubeweb5ai0kyg,d026bc1,adviceanimals,humor,1455647978.0,Kendermassacre,48.0,0.0,3966,101620,1.0
no nut having bitch,d025c66,adviceanimals,humor,1455646652.0,WienerNuggetLog,12.0,0.0,10,5484,0.0
i say they need to build up a tolerance  or die  like nature intended ,d02bjuc,adviceanimals,humor,1455654965.0,BumbleTummy,45.0,0.0,297,36868,0.0
well rule of thumb really meant that you could nt beat you wife with a switch thicker than your thumb but let s not trouble ourselves with that  this rule of thumb is a lot nicer  ,d01vi64,adviceanimals,humor,1455631373.0,Shadow1752,27.0,0.0,25,450,0.0
but i can just read the titles of the articles posted in rpolitics,d02uks8,adviceanimals,humor,1455683774.0,spartangrad007,1.0,0.0,12215,42119,0.0
so if you had a bad night and wanted to blow off some steam  you should automatically break up  you should go visit rrelationships  you d fit in well there ,d01cwb1,adviceanimals,humor,1455585912.0,Graphitetshirt,481.0,0.0,328,313176,1.0
i did   d,d01lf4g,adviceanimals,humor,1455600048.0,Whiteywhiteboy,4.0,0.0,12282,2035,0.0
if you have a significant other that cares that much about valentine s day i feel like that s a little red flag  but i might be a dick ,d01jnc5,adviceanimals,humor,1455596665.0,Superflypirate,1.0,0.0,51,143740,1.0
dude all my gf did was fuck up our restaurant reservation  this is way to0 harsh  you a fucken savage damn bruh,d01mqmh,adviceanimals,humor,1455602968.0,interwebbed,1.0,0.0,6902,12503,0.0
there was a significant increase of scumbag stacy  but very few scumbag steve s the last few days ,d01rh2n,adviceanimals,humor,1455618795.0,Philanthropiss,1.0,0.0,6,44177,0.0
people who do nt use reddit are using the internet on training wheels,d02rpe0,adviceanimals,humor,1455678855.0,CLE_BROWNS_32,0.0,0.0,95,-9,0.0
i do that here with stuff i ve seen on facebook ,d01xh2k,adviceanimals,humor,1455635161.0,Last_Gigolo,2.0,0.0,5931,32678,0.0
my mother works at a court and had a guy try and give the judge a good impression by taking off both of his ex wife s wing mirrors immediately before the trial for custody of their child some peoples stupidity amazes me sometimes ,d02ojun,adviceanimals,humor,1455673924.0,Gandalf_the_Cray_,7.0,0.0,4505,1599,0.0
people love to complain at bakeries about the fact that that what they sell might be contaminated with peanuts  either because the bakery has nuts or the products were manufactured in a place that also handles nuts the bakery i worked at had signs all over the place saying we could nt guarantee a product had nt come into contact with peanuts yet parents of elementary students got all up in arms because the cupcakescookies might have touched peanuts it took every faculty i had to not say  do nt like it  do nt buy it  i get that you might die from exposure and i m glad you re proactive about preserving your health  but please stop being a special snowflake,d02d1y0,adviceanimals,humor,1455656963.0,sammers092,138.0,0.0,3427,3270,0.0
i have a bee sting allergy so i ca nt go outside at all in the summer because of the slight risk that i might get stung by a honeybee  yea  fuck that  i go out every day in the summer and often spend weeks camping and kayaking many miles from the nearest road enjoying life is more important to me than living in constant fear of what could potentially happen  also  you wo nt see me go to a beekeeping farm and complain that i m allergic  it would be just as stupid as a vegan going to 9999  of restaurants or supermarkets ,d02ixtd,adviceanimals,humor,1455665228.0,MeEvilBob,17.0,0.0,2801,71053,0.0
this dad screws,d02s6j9,adviceanimals,humor,1455679634.0,WienerNuggetLog,3.0,0.0,10,5484,0.0
if i ever had a moment of absolute self control i would use it in that moment to unscrew the screw ,d02t8b3,adviceanimals,humor,1455681394.0,Honk_If_Top_Comment,1.0,0.0,7,244717,1.0
or else he would ve been screwed ,d02tqpp,adviceanimals,humor,1455682290.0,ILL_Show_Myself_Out,1.0,0.0,6902,957531,1.0
nope take the bit out of drill and leave it in your arm on the way to the hospital keeps you from bleeding you pull that out and you have a hole with a lot of blood coming out leave it in and that hole s got a cork ,d02tjzk,adviceanimals,humor,1455681962.0,punkdoctor1000,1.0,0.0,1280,43354,0.0
serious question  never have shaved my balls before  how do i do it ,d02n97a,adviceanimals,humor,1455671975.0,SplashDrag0n,4.0,0.0,1,20,0.0
 sorry  op   http  lupchanorgmsrc1369499276996gif    source   https  wwwtopatococommerchantmvc  screen  prodamp  product_code  qwastro  ,d02vh8w,adviceanimals,humor,1455685472.0,DonOntario,1.0,0.0,11623,142581,0.0
difficult  how  food porn  earth porn  car porn are all very common so just compare it to that ,d02rgfu,adviceanimals,humor,1455678445.0,vbran1,7.0,0.0,45,4280,0.0
was offered a cake to take home to daughter my daughter is allergic to walnuts and the cake had walnuts in it simply said  no thank you   explained why i could not take it and it was eaten in the office instead no harm  no foul  the person who offered did nt know ,d028qis,adviceanimals,humor,1455651239.0,Caramel412,350.0,0.0,1,383,0.0
yeah  knocking the wrinkles out ,d02uf9g,adviceanimals,humor,1455683498.0,Masaphotog,1.0,0.0,69,1393,0.0
what a lovely guy  the world needs more caring people like that ,d02k4ez,adviceanimals,humor,1455667156.0,bethl12,2.0,0.0,322,971,0.0
he s working his way into some wills smart man ,d02ph6l,adviceanimals,humor,1455675340.0,Kurtronic,1.0,0.0,103,16426,0.0
i downvoted anyone who posted any kind of  shitty girlfriend  for valentine s ,d01m1nv,adviceanimals,humor,1455601371.0,Arqideus,1.0,0.0,3,18494,1.0
and revaluate your life decisions,d01p1fv,adviceanimals,humor,1455609389.0,just_beachy,1.0,0.0,4691,1174,0.0
mind boggling how people can grow up with this ideology  i rent something for a fixed price but because i did nt use some part of it i should pay less  by that logic i should nt pay for an entire roll of toilet paper because i do nt use all of it during first use ,d01tyzq,adviceanimals,humor,1455627654.0,XFX_Samsung,6.0,0.0,39297,48113,0.0
i think you and my last landlord could commiserate i lived there for about 4 years  he had 2 units  and in my time i think he went through 3 people in the other unit the last one was a girl who lived there for about 2 years  had friends living with her  smoked  did drugs hell  she even had a guy die in her apartment from a heroin overdose the last day before she was being evicted they had every window open  smoke was coming out the windows enough that you might have thought they were burning more than just smokes they put tons of holes in the drywall the guy before here just skipped town one night and left almost a dozen bags of garbage in the apartment  some of which was food garbage i felt really bad when my time came to move out he was a great landlord as far as i know all he really asked was that you paid on time and did nt trash the place i think in the 4yrs i was there he may have come up to my apartment twice just to see how i was doing ,d01w95w,adviceanimals,humor,1455632918.0,Zooshooter,3.0,0.0,854,17233,0.0
just include utilities in the rent  problem solved ,d01xicz,adviceanimals,humor,1455635224.0,Jessie_James,2.0,0.0,4590,67131,0.0
quarterth ,d01v5l3,adviceanimals,humor,1455630605.0,Quattrocket,1.0,0.0,322,9119,0.0
or maybe they could talk about their problems with their so like an adult  even if they were just blowing off steam also valentine s day can be stressful for some  and some might have high expectations for valentine s day while the other does not ,d01ftkn,adviceanimals,humor,1455590488.0,myleskilo1,20.0,0.0,1,128,0.0
this is why i never follow redditor s relationship advice relationships will have their ups and downs  no relationship is perfect 100  of the time holidays especially put increased pressure and strain on relationships and some of them may not always turn out as expected a successful relationship requires commitment and work  get over yourself life is nt a disney princess movie ,d01kfc1,adviceanimals,humor,1455598076.0,Armypharmacist,190.0,0.0,671,1855,1.0
totally if this meme was accurately used  you got ta reevaluate your relationship or at least aspects that are strongly negative and if its inaccurately used stop being a whiny bitch and tell your partner you re hurt by their actions ai nt that hard ,d01izl2,adviceanimals,humor,1455595555.0,steveryans2,3.0,0.0,375,28609,0.0
man that was a good show,d02u3om,adviceanimals,humor,1455682925.0,FifteenPancakes,2.0,0.0,232,6548,0.0
to be fair  i m sure plenty of people that did that do nt actually have an so ,d01orb0,adviceanimals,humor,1455608483.0,CarpeCookie,2.0,0.0,1,2315,0.0
good guy marco  he knows ted has a nostalgic longing for home  apologize ,d02s30t,adviceanimals,humor,1455679474.0,TRUMP_SIMULATOR,3.0,0.0,1,171,0.0
disregard females  acquire currency ,d01wke6,adviceanimals,humor,1455633519.0,Xvexe,1.0,0.0,1,655,0.0
it s shit like this i swear it  i will never have another roommate again ,d01oiqt,adviceanimals,humor,1455607742.0,SpokeyDokey_,4.0,0.0,3754,5169,0.0
cats are better than humans  plus you ca nt make meowing noises at fellow professionals,d02f3dr,adviceanimals,humor,1455659659.0,madster-the-great,1.0,0.0,8718,35809,1.0
fom,d02rda0,adviceanimals,humor,1455678302.0,BullyBullz,1.0,0.0,1,124,0.0
and why would nt you be able to bring home chocolate covered strawberries otherwise  am i missing something ,d02n67t,adviceanimals,humor,1455671852.0,Xadnem,7.0,0.0,19,5482,0.0
this meme made me genuinely feel sad,d02pv9j,adviceanimals,humor,1455675947.0,KingBooScaresYou,3.0,0.0,27,10089,0.0
just like the women that stop in the doorway of a store to fish their keys out of their purse ,d02euqm,adviceanimals,humor,1455659348.0,sp1kline,8.0,0.0,134,1684,0.0
a terminal mistake ,d02h7h9,adviceanimals,humor,1455662632.0,ILL_Show_Myself_Out,6.0,0.0,6902,957531,1.0
yea  and the bitches have the nerve to get mad at you and say  well  learn to say excuse me   nah bitch   how about you learn to not fuckin block the entire walkway    real story  her husband  who i assume was nt giving her any lately  apologized twice ,d02f1fo,adviceanimals,humor,1455659587.0,ritz-chipz,4.0,0.0,25,1458,0.0
the worst is when a family or group of people will get to the end of a hall or doorway  and decide that s a perfect place to stop and hang out  seriously people  imagine people are liquid  if you re a cork in the bottle  you re doing it wrong ,d02go3c,adviceanimals,humor,1455661856.0,darth_hotdog,4.0,0.0,2269,14420,0.0
op is right if you pay attention you ll see that shit happen everywhere my personal favorite is the door way chatters  here s a doorway everybody needs to use lets have a conversation right in the middle of it  ,d02hyiy,adviceanimals,humor,1455663724.0,riconoir28,2.0,0.0,365,8001,1.0
 get the fuck out of the way  would help,d02nuam,adviceanimals,humor,1455672851.0,BillyTalentfan,2.0,0.0,475,17338,0.0
i also love when people are talking on their phone and amble erratically into me  even if i m walking straight ahead they re wandering into my path  so fun ,d02qkna,adviceanimals,humor,1455677041.0,pappylepew,1.0,0.0,2,87,0.0
it s this shit show every day on the sidewalks near times square ,d02ul68,adviceanimals,humor,1455683794.0,Yieldway17,1.0,0.0,86,2980,0.0
here is what the linked meme says in case it is blocked at your schoolwork or is unavailable for any reason      mad advice mallard    gt     post title      every time i am at the airport today some lady had her suitcase open in the middle of the aisle going through her stuff  gt     top      do nt fucking stop in the middle of a busy walkway to check you phone  have a conversation  or blankly stare off into space  gt     bottom      move your shit to the side  have some awareness of what is going on around you   original link  1   http  imgurcomiq0vaur    meme template  2   http  imgurcommemegencreateiq0vaur ,d02ec2b,adviceanimals,humor,1455658671.0,imgurtranscriber,0.0,0.0,7,88923,1.0
tell her that you find pigs attractive and that s why you used it as a comparison then explain in detail how you used to fornicate with pigs i promise her reaction will be better than what you just started ,d02u62v,adviceanimals,humor,1455683044.0,spartangrad007,3.0,0.0,12215,42119,0.0
your ,d01u32t,adviceanimals,humor,1455627970.0,Black-Kirito,49.0,0.0,18541,38563,1.0
no excuse for this kids need glasses to see and learn in school ,d027dep,adviceanimals,humor,1455649396.0,redshoewearer,16.0,0.0,1,17021,1.0
all of the lack of grammar,d02adyd,adviceanimals,humor,1455653440.0,z14ever,6.0,0.0,581,146,0.0
i m more of a tonka truck guy myself,d02aqiu,adviceanimals,humor,1455653913.0,blueberrypie8,1.0,0.0,4727,3668,0.0
  scumbag parents   gt   mother is a nurse  step father works for the utility company gt   we don  t have the money to buy you the glasses that you need  but we are going to the casino  and look at my new ring  is nt it pretty ,d01u21r,adviceanimals,humor,1455627891.0,CaptionBot,1.0,0.0,12594,448583,1.0
i think a call to cps is in order she needs glasses and they re being neglectful in those needs ,d02iakx,adviceanimals,humor,1455664229.0,SilentJoe1986,1.0,0.0,26806,29133,0.0
they both sound like decent hardworking people  though  how much are the glasses she needs  did they just spend 10 grand in other stuff she  needed  before this came up  i heard she had a boyfriend now can he help out  seeing as they are practically engaged  do they blow a lot of money at the casino  or is it like a  100 occasional night out for them  it is nice to get presents from your husband  especially for a big anniversary or other special occasion does the daughter have any jewellery that was given to her by her boyfriend  i m sort of playing devil s advocate here  but maybe they are heartless  selfish parents  and maybe they are nt you may know  but we do nt ,d01wgdu,adviceanimals,humor,1455633305.0,64vintage,-5.0,0.0,8,52810,0.0
if the kid is nt naked on the street begging for change i d say she s doing fine get a job  go to walmart  buy glasses what is the issue ,d01wmci,adviceanimals,humor,1455633621.0,missprecocious,-13.0,0.0,22673,10404,0.0
i m lucky my apt is basically sound proof except for the windows so you can hear my system from the parking lot but not other units my first apartment you could hear a cricket fart in the next unit ,d02gwsr,adviceanimals,humor,1455662201.0,Bearmageddong,2.0,0.0,405,718,0.0
somethings broken  call landlord cause i do nt live in a fucking house  shovel snow  landscaping  garbage  landlords job cause i do nt live in a fucking house  want to move just move because do nt own a fucking house,d01vn91,adviceanimals,humor,1455631673.0,load231,-3.0,0.0,11786,27309,1.0
congrats,d02a8eg,adviceanimals,humor,1455653237.0,GeronimoHey,1.0,0.0,294,954,0.0
here is what the linked meme says in case it is blocked at your schoolwork or is unavailable for any reason      success kid    gt     post title      home owner since a year ago next month   gt     top      hear music through the walls  gt     bottom      know it s something i left on in another room because i do nt live in a fucking apartment building anymore   original link  1   http  imgurcom0kjg7sv    meme template  2   http  imgurcommemegencreate0kjg7sv ,d01ojab,adviceanimals,humor,1455607787.0,imgurtranscriber,1.0,0.0,7,88923,1.0
