text,id,subreddit,meta,time,author,ups,downs,authorlinkkarma,authorkarma,authorisgold
that s okay  they probably like you more as well,d02jluo,adviceanimals,humor,1455666254.0,WienerNuggetLog,3.0,0.0,10,5484,0.0
fom,d02rda0,adviceanimals,humor,1455678302.0,BullyBullz,1.0,0.0,1,124,0.0
probs baked,d02uwb8,adviceanimals,humor,1455684375.0,Connors116,1.0,0.0,441,1699,0.0
do nt know what kind of work you do  but if they do  random  drug tests and that is the office gossip  i would put an end to their joke if there was a chance it would not come back clean  very sorry about your dad  op ,d02siic,adviceanimals,humor,1455680188.0,CharistineE,2.0,0.0,6659,7189,0.0
if you ca nt trust her  do nt fucking date her or maybe the problem is with you op  have you ever been a cheater before  if so  you may have a cheater s mentality  seeing your behavior mirrored in the actions of others ,d02odml,adviceanimals,humor,1455673662.0,riflebutt,2.0,0.0,1403,7149,0.0
threesome   ,d02oj3i,adviceanimals,humor,1455673891.0,nmbrcrnchr,3.0,0.0,299,33548,0.0
so she already cheats on you when shes drunk ,d02oy0e,adviceanimals,humor,1455674524.0,Ragequit4Life,1.0,0.0,1,28,0.0
i hope he at least called the authorities and tell them where he left the body ,d02r0oc,adviceanimals,humor,1455677739.0,Philanthropiss,2.0,0.0,6,44177,0.0
i find this all the time with the postal service inevitably  i ll get put on hold until they close  at which point i m immediately connected and told the office is closed i once sat on hold for an hour and 45 minutes before getting disconnected  fuck usps ,d02107k,adviceanimals,humor,1455640650.0,Starsy,52.0,0.0,181667,229739,1.0
upvoted for smooth balls just do nt knick yourself been there  done that  bled like a bastard ,d02a57e,adviceanimals,humor,1455653112.0,nmbrcrnchr,7.0,0.0,299,33548,0.0
thats why i just trim now its to much work lol,d02ihxd,adviceanimals,humor,1455664542.0,OverPot,0.0,0.0,1787,9146,0.0
kanye west say very arrogant individual it s disgusting that people in america look up to him all he does is lie i ve never seen a bigger liar in the world than kanye west ,d02mvoy,adviceanimals,humor,1455671403.0,TRUMP_SIMULATOR,-8.0,0.0,1,171,0.0
not downloading his music or partaking in his brand of slop is way worse he gets none of my time or attention ,d02rl7b,adviceanimals,humor,1455678661.0,chambertlo,0.0,0.0,96,45530,0.0
here is what the linked meme says in case it is blocked at your schoolwork or is unavailable for any reason      uncomfortable situation seal    gt     post title      in retrospect he looked pretty exhausted but man was that a weird experience  gt     top      during an exam the doctor dangled the stethoscope in front of my face while i answered his questions and bonked me in the nose repeatedly with it  gt     bottom      the nurse eventually says amp  quot  what the hell are you doing  amp  quot  he pauses and goes amp  quot  i have no ideaamp  quot  before proceeding with the exam   image link  1   http  memedadcommeme815546 ,d02bl6g,adviceanimals,humor,1455655013.0,memedad-transcriber,1.0,0.0,1,4362,0.0
they did nt force you to do anything grow the fuck up ,d029n9x,adviceanimals,humor,1455652451.0,BradyBunch12,-20.0,0.0,81,1819,0.0
just like the women that stop in the doorway of a store to fish their keys out of their purse ,d02euqm,adviceanimals,humor,1455659348.0,sp1kline,8.0,0.0,134,1684,0.0
a terminal mistake ,d02h7h9,adviceanimals,humor,1455662632.0,ILL_Show_Myself_Out,6.0,0.0,6902,957531,1.0
the worst is when a family or group of people will get to the end of a hall or doorway  and decide that s a perfect place to stop and hang out  seriously people  imagine people are liquid  if you re a cork in the bottle  you re doing it wrong ,d02go3c,adviceanimals,humor,1455661856.0,darth_hotdog,4.0,0.0,2269,14420,0.0
went to see deadpool opening night  2nd showing arrived about 15 mins before start time  which is later than i usually would like to show up  and the ticket line is pretty long no worries  i had already purchase reserved seats five minutes later we get to the front and pick up our tickets and move on to the concession stand three lines  and we go to the shortest guy at the register walks away  i assume he s grabbing a customer s food or what not a few minutes pass  and the guys not back 7 minutes later he walks back and puts a  closed  sign in front of his register ,d02fybr,adviceanimals,humor,1455660850.0,specialproject,14.0,0.0,33,14954,0.0
or you call the automated phoneline so you can pay a bill  and they say that they ca nt service you because it s after hours ,d02g1yf,adviceanimals,humor,1455660993.0,Kataphractoi,1.0,0.0,111,9006,0.0
i ca nt remember what company or service this was  but i remember the situation and handled it so 5 years ago  i got surprised by something and needed some form of support from my company i was doing business with and called their 1800 number 45 minutes till their posted close time on friday ended up like 20 something in cue  so i put my phone in speaker mode and wait sit down in front of a muted television being patient all the while listening to some really distorted recording of some of the most god awful elevator music so i did nt miss their representative  with every 2 minutes a voice would interrupt  your call is important  please stay on the line   and then another voice would inform you of your cue position  i m waiting and waiting  the cue number goes down like 5 numbers before it hits their closing time literately like 4 seconds after the clock rolls over to their  closed time  the static laden and distorted music stopped and a message  sorry you have called after we have closed  please call back between the hours of x and y  i nearly broke threw the phone through a window after that ,d02n3v1,adviceanimals,humor,1455671754.0,DongleNocker,4.0,0.0,122,49608,0.0
what tip percentage do you typically expect for delivery  genuinely curious as someone who rarely orders delivery  and would think that 15  is an adequate amount ,d02dmz8,adviceanimals,humor,1455657740.0,Wolfgang985,3.0,0.0,448,3733,0.0
op is right if you pay attention you ll see that shit happen everywhere my personal favorite is the door way chatters  here s a doorway everybody needs to use lets have a conversation right in the middle of it  ,d02hyiy,adviceanimals,humor,1455663724.0,riconoir28,2.0,0.0,365,8001,1.0
i also love when people are talking on their phone and amble erratically into me  even if i m walking straight ahead they re wandering into my path  so fun ,d02qkna,adviceanimals,humor,1455677041.0,pappylepew,1.0,0.0,2,87,0.0
talk to strangers so it does nt matter what they think ,d02q3q3,adviceanimals,humor,1455676314.0,Watsonmom,3.0,0.0,215,4316,0.0
to grow your business let a few friends have some sample products to wear out and about free advertising ,d02qbhn,adviceanimals,humor,1455676652.0,Kage_G5,2.0,0.0,5,561,0.0
here is what the linked meme says in case it is blocked at your schoolwork or is unavailable for any reason      confession bear    gt     post title      my biggest downfall  gt     top      i am trying to sell my designs  gt     bottom      but i m too afraid of people disliking me that i wo nt tell people about it   original link  1   http  imgurcombsaoaio    meme template  2   http  imgurcommemegencreatebsaoaio ,d02q3o1,adviceanimals,humor,1455676312.0,imgurtranscriber,1.0,0.0,7,88923,1.0
why make the effort ,d02o71x,adviceanimals,humor,1455673386.0,MadokaAndBulletClub,13.0,0.0,1,2568,0.0
here is what the linked meme says in case it is blocked at your schoolwork or is unavailable for any reason      evil plotting raccoon    gt     post title      people will still comment saying they found it  gt     top      i ll take a normal picture  gt     bottom      and add  when you see it    original link  1   http  imgurcomy0yg8bu    meme template  2   http  imgurcommemegencreatey0yg8bu ,d02jwdp,adviceanimals,humor,1455666799.0,imgurtranscriber,1.0,0.0,7,88923,1.0
no excuse for this kids need glasses to see and learn in school ,d027dep,adviceanimals,humor,1455649396.0,redshoewearer,16.0,0.0,1,17021,1.0
they both sound like decent hardworking people  though  how much are the glasses she needs  did they just spend 10 grand in other stuff she  needed  before this came up  i heard she had a boyfriend now can he help out  seeing as they are practically engaged  do they blow a lot of money at the casino  or is it like a  100 occasional night out for them  it is nice to get presents from your husband  especially for a big anniversary or other special occasion does the daughter have any jewellery that was given to her by her boyfriend  i m sort of playing devil s advocate here  but maybe they are heartless  selfish parents  and maybe they are nt you may know  but we do nt ,d01wgdu,adviceanimals,humor,1455633305.0,64vintage,-5.0,0.0,8,52810,0.0
if you pirate it without ever intending to purchase the album did it really hurt his profit ,d02shx4,adviceanimals,humor,1455680162.0,goldstayer,2.0,0.0,56,1533,0.0
as a gay guy i can say that i pretty much only swallow if we are on decent trust terms however  if it hits the air for more than five seconds its not gunna get in my mouth the taste changes quick straight from the cock though  i savor and really enjoy it it kinda gets me horny high  some of my favorite bj times were when i lived with a life long girl friend and her straight brother the whole two years we lived together i would suck his dick under the desk while he watched his straight porn  once he d bust id just take the load in my mouth to my room and furiously beat off the fact that we did nt talk about the act or make it a big deal made it even hotter  sadly we do nt live together anymore  but i occasionally swap car repairs for bj s with him now ,d02ads7,adviceanimals,humor,1455653434.0,Phoenix197,34.0,0.0,40,1619,0.0
it s not a big deal she s actually pretty lucky many men have an aversion to tasting themselves my take  how can you expect someone to gobble you down  if you do nt know how it tastes  ,d0200a3,adviceanimals,humor,1455639199.0,stacksobabies,6.0,0.0,2955,15607,0.0
not so much the taste  for me  as shooting it directly on my gag reflex and the smell i do nt really taste it  but goddamnit if it hits the back of my throat  and i smell it i m gon na puke sucks really  cuz the idea of it turns me on so much and also what ueatinchicken said about it coating everything it just does nt dissipate like it should  edit  formatting  sorry on my phone ,d02ieu8,adviceanimals,humor,1455664406.0,pm_me_your_HPtrivia,4.0,0.0,2531,121,0.0
if the kid is nt naked on the street begging for change i d say she s doing fine get a job  go to walmart  buy glasses what is the issue ,d01wmci,adviceanimals,humor,1455633621.0,missprecocious,-13.0,0.0,22673,10404,0.0
all of the lack of grammar,d02adyd,adviceanimals,humor,1455653440.0,z14ever,6.0,0.0,581,146,0.0
i think a call to cps is in order she needs glasses and they re being neglectful in those needs ,d02iakx,adviceanimals,humor,1455664229.0,SilentJoe1986,1.0,0.0,26806,29133,0.0
  confession bear   gt   my ex that broke my heart got dumped on valentine s day for someone else gt   even though i still have feelings for her  she deserved it more than anyone else and i m kind of happy it happened,d02rf8e,adviceanimals,humor,1455678391.0,CaptionBot,1.0,0.0,12594,448583,1.0
burglars and sites that tell you to disable adblockers have one big commonality  they love to open windows ,d02jevx,adviceanimals,humor,1455665957.0,pm_me_my_own_comment,3.0,0.0,1,13988,1.0
  maury determined that was a lie   gt   you said that if i disable adblock you promise never to serve any intrusive ads gt   the two new windows that immediately opened determined that was a lie,d02hs48,adviceanimals,humor,1455663461.0,CaptionBot,1.0,0.0,12594,448583,1.0
sorry sir i m with the meme police and i m going to have to issue you a ticket ,d023mev,adviceanimals,humor,1455644315.0,imnotlikeanyofyou,184.0,0.0,1,13081,1.0
is he saying there s two sides to each story  no way ,d02g7rp,adviceanimals,humor,1455661220.0,cjh57,1.0,0.0,7,7773,0.0
hm  is nt op s meme just as stupid for blanket assuming every instance is onesided nonsense  i mean  he s basically giving us the  a sith does not deal in absolutes  hypocrite nonsense ,d02m7wf,adviceanimals,humor,1455670361.0,losian,1.0,0.0,349,87109,1.0
people who say things like that have never been in a relationship ,d02qn7j,adviceanimals,humor,1455677152.0,ButtsexEurope,1.0,0.0,1948,153749,0.0
one of my top comments is about my gf teasing me and getting me aroused most of the comments are people saying i should leave her because of that i love my gf a little annoyance is nt going to make me leave her ,d02rkvk,adviceanimals,humor,1455678644.0,SteroidSandwich,1.0,0.0,12900,145231,0.0
this is why as a dude i hate it when my friends say  bitch was crazy  after a breakup ,d02tegi,adviceanimals,humor,1455681694.0,WadeWilsonforPope,1.0,0.0,675,286907,1.0
here is what the linked meme says in case it is blocked at your schoolwork or is unavailable for any reason      confession bear    gt     post title      sorry for using it incorrectly  but this also has to be said  gt     top      if you advise people to break off a relationship based on a short onesided story  gt     bottom      then i think you are an idiot   original link  1   http  imgurcomas7pg5m    meme template  2   http  imgurcommemegencreateas7pg5m ,d022wa6,adviceanimals,humor,1455643321.0,imgurtranscriber,1.0,0.0,7,88923,1.0
stop believing the liberal media,d025aqn,adviceanimals,humor,1455646600.0,TRUMP_SIMULATOR,-6.0,0.0,1,171,0.0
same goes for people who walk when their pedestrian sign says do not walk ugh ,d02798c,adviceanimals,humor,1455649234.0,redshoewearer,2.0,0.0,1,17021,1.0
while we re at it  northeaster us  stop driving like assholes when the roads are icy i m talking to you massachusetts ,d02v3f3,adviceanimals,humor,1455684742.0,tronalddumpLOL,1.0,0.0,20,145,0.0
how about just  do not jaywalk  ,d01x8tw,adviceanimals,humor,1455634755.0,shifty_coder,-5.0,0.0,407,70576,0.0
monster  this guy is a fucking morningtime terrorist ,d02pq3w,adviceanimals,humor,1455675723.0,DoobaDoobaDooba,3.0,0.0,1088,2326,1.0
here is what the linked meme says in case it is blocked at your schoolwork or is unavailable for any reason      scumbag steve    gt     post title      i  too  work with a monster  gt     top      takes the last cup of coffee at 9am and walks away  gt     bottom       someone else will make more    original link  1   http  imgurcomgeueabf    meme template  2   http  imgurcommemegencreategeueabf ,d02p6m5,adviceanimals,humor,1455674883.0,imgurtranscriber,2.0,0.0,7,88923,1.0
and we re reminded of the perilous and backwards undertaking of having to make coffee before you ve had coffee ,d02pkbm,adviceanimals,humor,1455675474.0,aznednacni,2.0,0.0,6938,20814,0.0
may the coffeeshits strike hard and be bubbly ,d02ppuw,adviceanimals,humor,1455675712.0,WienerNuggetLog,1.0,0.0,10,5484,0.0
you are now banned from rrelationships,d02rri2,adviceanimals,humor,1455678949.0,jokersleuth,1.0,0.0,3626,23193,0.0
you should always be in control of your car regardless of road conditions slow down,d02pxso,adviceanimals,humor,1455676059.0,ianmac47,0.0,0.0,590,8672,0.0
your puffin is showing ,d02mf8u,adviceanimals,humor,1455670681.0,JoshSidekick,1.0,0.0,2545,141172,1.0
my friends girlfriend said she would break up with him if he did nt let her shove a dildo in his asshole i told him to break up with her i think that you are wrong op ,d02i5g7,adviceanimals,humor,1455664018.0,IWorkAtWal-Mart,1.0,0.0,1,2179,0.0
this reminds me of when i was apartment hunting last year it d been a long  frustrating day  as those things go we get to a place for a viewing  with the realtor  who has the keys and everything  and as we re walking up the front steps  some lady on the sidewalk goes  can i help you  and we re like  no we re good  turns out she owned the building  and then we liked the apartment so we had to go back and sheepishly ingratiate ourselves ,d02p4tz,adviceanimals,humor,1455674811.0,aznednacni,1.0,0.0,6938,20814,0.0
ummm  they are both wrong i hate buying condoms and let us just say i have been around the block i always have to buy something with them it can not be something odd to buy with condoms too i hate when people are behind me or in front of me if someone is looking at nasal spray next to them i wait until they leave if a child walks by i have a panic attack it is all irrational and not something i try to justify  it just happens  as far as it having something to do with maturity  it looks like some 20 year old is full of themselves and standing on their soapbox of minuscule life experience in judgement of all ,d02t2r9,adviceanimals,humor,1455681128.0,savemejebus0,3.0,0.0,65385,119089,0.0
question  is the nsfw necessary for language  such as the  f  word  ,cul5x3z,adviceanimals,humor,1440971708.0,mysoulishome,2.0,0.0,10178,4931,0.0
this does nt say anything about the puffin  we re free ,ct4joji,adviceanimals,humor,1436991518.0,BlastedInTheFace,-11.0,0.0,4862,28493,0.0
you say no cake day posts the fact that there are dozens a day determine this to be a lie ,ctimt7c,adviceanimals,humor,1438056777.0,Magic-for-Sale,8.0,0.0,1284,729,0.0
whether embarrassed or not buy condoms but seriously if you want to have some fun  wink at the cashier when heshe scans them ,d02vayp,adviceanimals,humor,1455685135.0,ThatIowanGuy,1.0,0.0,107,18403,0.0
 you got my upvote  op now i want your storytime   http  iimgurcomiekyifypng ,d02ggk1,adviceanimals,humor,1455661560.0,agentsirus,3.0,0.0,33706,41651,1.0
the only reason i turn the faucet on at home is because my wife will chastise me for not washing my hands  i do nt wash my hands ,d02h9ml,adviceanimals,humor,1455662718.0,tinspoons,0.0,0.0,1559,366,0.0
could be worse  clapses and smashes head  forgets hes working morning shift comes in hour late forced to resign or get fired  so thats how my weeks been going   too much stress going on in my life at the moment ,d020alb,adviceanimals,humor,1455639622.0,nickncs,1.0,0.0,204,1622,0.0
that s the way the toilet flushes     _    _ ,d02ge5p,adviceanimals,humor,1455661466.0,Yokuo,2.0,0.0,19523,56050,1.0
that s nothing  where i work there are giant signs on the wall reminding everyone to flush the damn toilet when they are done it never occured to me that such a sign would be necessary at a place of work ,d02g5rp,adviceanimals,humor,1455661142.0,Butterbuddha,5.0,0.0,1989,12292,0.0
do they not have cabs or uber in that city ,d02o4yt,adviceanimals,humor,1455673299.0,Margravos,0.0,0.0,5034,19297,0.0
if he over exaggerates things like me then it was actually one mile and tomorrow it will be five  and he s on track to have pushed the woman from california to virginia by the end of the month ,d02bqaa,adviceanimals,humor,1455655201.0,Bigfourth,54.0,0.0,3,4567,0.0
this meme made me genuinely feel sad,d02pv9j,adviceanimals,humor,1455675947.0,KingBooScaresYou,3.0,0.0,27,10089,0.0
im going to download it then delete itjust to shore up the numbers on his failure  ,d02qri5,adviceanimals,humor,1455677332.0,D-Evolve,-5.0,0.0,234,29260,0.0
actually  the real question is y u no use imgur   ,d02s7fo,adviceanimals,humor,1455679674.0,mrbonk71,2.0,0.0,1456,631,0.0
 get the fuck out of the way  would help,d02nuam,adviceanimals,humor,1455672851.0,BillyTalentfan,2.0,0.0,475,17338,0.0
i sensed you would say that ,d02jqao,adviceanimals,humor,1455666486.0,FancySack,3.0,0.0,8737,207803,1.0
middle aged man here you ll spend the first 20 years of your life wanting to shave your face and the rest of your life wishing you never grew one single hair there ,d02kimx,adviceanimals,humor,1455667775.0,manolid,7.0,0.0,955,5327,0.0
its 5am here  ive been up since about 8am yesterday  and i have a job interview today at 11 ive had about 56 job interviews in my life  and i have never slept before any of them hope you have a great day man ,d01r29k,adviceanimals,humor,1455617053.0,TheMacGoesRiiing,4.0,0.0,4180,10704,0.0
i did nt know there was so many people not washing their hands  now i ll forever be weirded out shaking hands o_o,d02lnbo,adviceanimals,humor,1455669493.0,Aldwyn,2.0,0.0,632,2703,0.0
who irons anymore ,d01w8xo,adviceanimals,humor,1455632905.0,coolshifts,88.0,0.0,184,23409,0.0
pro tip for office working bachelors  if you want to look sharp and successful  always iron and starch your work clothes  even if they re not wrinkled there s a noticeable difference between a wrinkle free shirt and a well ironed shirt there s nothing wrong with the former  but the latter projects a better image  also  pay extra attention to the cuffs and collar both should be nicely starched  always from the inside rather than the outside to avoid flaking or shine  and just a little bit stiff ,d023fod,adviceanimals,humor,1455644056.0,joec_95123,14.0,0.0,13555,159116,0.0
well  no one really sees my underwear  since i also wear pants from time to time   so no one out and about in public or wherever will care if i have nt changed them in a few days ,d0291vg,adviceanimals,humor,1455651662.0,bojiggidy,2.0,0.0,67,11528,0.0
this is nt foul bachelor behavior  it s common sense ,d02g4qo,adviceanimals,humor,1455661103.0,Kataphractoi,2.0,0.0,111,9006,0.0
this was me yesterday button up shirt wrinkly af ,d022hq4,adviceanimals,humor,1455642756.0,ganooosh,1.0,0.0,245,16420,0.0
lpt frog,d02c51t,adviceanimals,humor,1455655731.0,audiate,1.0,0.0,7995,8362,0.0
this is foul  to you  op  you must be one of those savages that drink your remaining milk straight from the cereal bowl as well truly disgusting ,d02fci3,adviceanimals,humor,1455660004.0,bannana,1.0,0.0,2815,105157,0.0
amateur  real bachelor frogs wear buttondown collars no ironing ,d02m62h,adviceanimals,humor,1455670283.0,cavehobbit,1.0,0.0,380608,43282,0.0
after 13 years  he s resorted to dialing every possible phone number combination on a quest to find his balls ,d02hwag,adviceanimals,humor,1455663634.0,AnotherKriegerClone,25.0,0.0,60,21149,0.0
probably not his first accidental incident that involved you ,d02iyk7,adviceanimals,humor,1455665260.0,WienerNuggetLog,37.0,0.0,10,5484,0.0
or maybe he was calling to apologize but chickened out ,d02ppzn,adviceanimals,humor,1455675718.0,UNPER50N,3.0,0.0,3866,17213,0.0
something similar happened to me  only it was a relative who looked me up online  i m named after my father   it was a super awkward phone call ,d02pnu1,adviceanimals,humor,1455675625.0,pappylepew,2.0,0.0,2,87,0.0
it would be really cool if the studies actually found something significant life would be much more fun if you could just learn telekinesis ,d02jfw4,adviceanimals,humor,1455665999.0,Wyatt1313,3.0,0.0,29521,151181,1.0
likely related to the guy i worked with that pulled out everyone else s print jobs and throws them in the recycling to get to his ,d020nm8,adviceanimals,humor,1455640146.0,Starsy,8.0,0.0,181667,229739,1.0
loading paper for other people is socialism ,d02ckwc,adviceanimals,humor,1455656321.0,Team_Braniel,1.0,0.0,5006,119527,1.0
what a dick whenever i would get up to go get supplies i d ask the folks around me if they needed anything ,d029zed,adviceanimals,humor,1455652896.0,Mtlguy,1.0,0.0,8,9784,0.0
well that is really convenient until he finds out someone already used the paper,d02p6hk,adviceanimals,humor,1455674877.0,SteroidSandwich,1.0,0.0,12900,145231,0.0
that s me i only do it after regularly discovering my print job stalled because somebody else ran the printer dry and never noticed  because they forgot they sent it in the first place  if i get to the printer and there is anything else there besides my job  i throw it out into the locked shred bin unless  of course  it has personal information like social security numbers  health insurance data  or salary information  in which case it goes into my pearl harbor file ,d02vlqi,adviceanimals,humor,1455685713.0,Spinolio,1.0,0.0,1394,25824,0.0
he s the same guy who leaves the toilet seat up ,d026a0l,adviceanimals,humor,1455647927.0,cjh57,-5.0,0.0,7,7773,0.0
how like a woman to whine about the efficient man finishing his load,d020str,adviceanimals,humor,1455640356.0,WienerNuggetLog,-12.0,0.0,10,5484,0.0
maaan thats not foul  that is smart as fuck,d02nwog,adviceanimals,humor,1455672951.0,SuckMyVickNoRomo,1.0,0.0,1,1510,0.0
the sad thing is  you are still friends with this person what does that say about you ,d02st5a,adviceanimals,humor,1455680686.0,chambertlo,2.0,0.0,96,45530,0.0
selfish would do ,d026d49,adviceanimals,humor,1455648045.0,cjh57,1.0,0.0,7,7773,0.0
i m guessing she could nt afford the  2000 bike  either ,d02s8x5,adviceanimals,humor,1455679742.0,almostagolfer,1.0,0.0,7,20524,0.0
these are the people you should not be friends with ,d028jpj,adviceanimals,humor,1455650986.0,skillsxr600,1.0,0.0,139,4224,0.0
agreed often i only shave my ankles ,d020k15,adviceanimals,humor,1455640004.0,DiscoLicker,8.0,0.0,1,6,0.0
do what i do throw that shirt in with a wet sock right before you leave and bam  barely wrinkly ,d02731l,adviceanimals,humor,1455649009.0,Cerdeira_man_now,3.0,0.0,37,3409,0.0
invest in a couple  dickeys   https  enwikipediaorgwikidickey_  garment   you ll look fully dressed  but wo nt overheat under that sweater ,d028hyt,adviceanimals,humor,1455650922.0,ConundrumExplained,3.0,0.0,146,27788,0.0
timely i never wear a sweater  but i did this today ,d023u9q,adviceanimals,humor,1455644616.0,DrunkenGolfer,1.0,0.0,792,7977,1.0
that s what the dryer is for  you motivated bastard ,d02bf8u,adviceanimals,humor,1455654799.0,pjt77,1.0,0.0,393,609,0.0
dude you do nt have a dad ,d02ryyi,adviceanimals,humor,1455679290.0,HardKase,1.0,0.0,66,41421,0.0
when i was fat i would wear button downs that were too small under sweaters i would only button the top few buttons kinda similar ,d02fopm,adviceanimals,humor,1455660478.0,bgeorger,1.0,0.0,40,73,0.0
