text,id,subreddit,meta,time,author,ups,downs,authorlinkkarma,authorkarma,authorisgold
dogmeat has found something ,d02js7y,adviceanimals,humor,1455666592.0,JoshuaBayard,7.0,0.0,7,153,0.0
i do nt hate kanye i mean  his personality has some flaws but he s a really good producer if anything i just hate his decision to put his album only on tidal that was stupid of him ,d02hb4i,adviceanimals,humor,1455662777.0,raubana,9.0,0.0,7620,12880,0.0
this is the only time i break down ,d02sf7t,adviceanimals,humor,1455680035.0,infinitefoamies,1.0,0.0,1765,3083,0.0
that was nt a wrong number it was a cry for help and he does nt know how to reconcile when he wants to he was weak enough to leave you  strong enough to find your number  and weak enough to break when he heard your voice  one option ,d02tw3d,adviceanimals,humor,1455682552.0,Plushooks,2.0,0.0,1064,4214,0.0
lol  that was me too earlier today in seattle ,d02v6m8,adviceanimals,humor,1455684908.0,hamsumwich,1.0,0.0,1854,430,0.0
i usually throw the shirt in the drier while i shower  comes our wrinkle free and warm bonus  convenience factor  my laundry is done in my garage,d02sdau,adviceanimals,humor,1455679942.0,Thetman38,1.0,0.0,28,5493,0.0
 shrug  ok     source  canadian ,d02r4vl,adviceanimals,humor,1455677928.0,Lifebehindadesk,2.0,0.0,1253,6916,0.0
as much as i hate kanye west and how people conflate their enjoyment of his music with their enjoyment of his douchebag personality  i honestly would nt be surprised if he was in debt the recording industry is notorious for fucking over artists  using them like geese that lay golden eggs and then butchering them for meat at christmas time  only to move on to the next goose when spring comes ,d02tyh3,adviceanimals,humor,1455682672.0,blaghart,1.0,0.0,4114,190251,1.0
i have nt talked to my old man in almost 9 years and at year 2 he butt dialed me and when i answered all i heard shuffling for a bit and then  oh shit  and he hung up  fuck him  and he wonders why i stopped talking to him ,d02nkmk,adviceanimals,humor,1455672447.0,lkaos,71.0,0.0,465,3187,0.0
the stephen avery story,d02ke19,adviceanimals,humor,1455667568.0,kitthekat,2.0,0.0,132,28233,0.0
whats the link to the story ,d02pvjx,adviceanimals,humor,1455675962.0,ajm0031,1.0,0.0,9843,164,0.0
gt  kidney failure maybe do nt give dog foods to foxes ,d02r1c1,adviceanimals,humor,1455677768.0,breadislive,0.0,0.0,31,6963,0.0
so me being a 20 year old male getting a little rosy cheeked over buying condoms means i ca nt have sex anymore  who the fuck do you think you are  ,d02cc73,adviceanimals,humor,1455655996.0,Kraigery,15.0,0.0,12138,5798,0.0
social anxiety and maturity have nothing to do with each other ,d02hh33,adviceanimals,humor,1455663014.0,AOEUD,5.0,0.0,4286,102792,0.0
nah  that s just a very small minded view there try exploring other people s cultures and upbringings a little before saying idiotic shit ,d02d6w7,adviceanimals,humor,1455657145.0,parachutepantsman,9.0,0.0,1,613,0.0
had this talk with my little brothers years back i m 10 and 13 years older than them  and one of them was asking me to buy him condoms because it was embarrassing to him  i straight up told him if he s not adult enough to purchase the means for safe sex  he s not ready for the sex itself ,d029wfy,adviceanimals,humor,1455652788.0,Dalzeil,4.0,0.0,19,11212,0.0
there s a difference between being mature and wanting other people to know you re sexually active ,d02r7o7,adviceanimals,humor,1455678054.0,necromundus,1.0,0.0,21452,84327,0.0
girls you buy the big goddamn box so you do nt constantly run out and they re cheaper that way then when you have around 10 left  you go buy another big goddamn box of them why is this a problem  this is too simple to still be a thing ,d02vh82,adviceanimals,humor,1455685470.0,B4UGOTHERE,1.0,0.0,6,6228,0.0
am i the only one who is fucking proud buying condoms  i do nt even do the self checkout  even if it s the only thing i m buying i make sure to bring them to the oldest  most innocent looking old lady cashier  and then when she asks   did you find everything ok   i say   one moment  and i go and grab another box of condoms ,d020ix9,adviceanimals,humor,1455639960.0,Obie_Trice_Kenobi,-2.0,0.0,338,83418,1.0
enforce rule 3 on those fucky terrible twist tigers ,cut1hgz,adviceanimals,humor,1441590786.0,dam072000,2.0,0.0,108,56317,0.0
it drives my wife bat shit crazy sometimes  but i always get out of the right lane at stop lights when i m going straight  unless i need to take a quick right after the light ,d02k58n,adviceanimals,humor,1455667189.0,squid06,3.0,0.0,1341,7749,0.0
i have button ups i only wear with sweaters dry clean once and never again ,d02te65,adviceanimals,humor,1455681681.0,Violentopinion,1.0,0.0,166,2040,0.0
pro bachelor tip  no iron needed throw it in the dryer with a wet washcloth by the time you re done getting ready  about 1015 minutes   your shirt looks like it was just ironed the water on the washcloth makes it just steamy enough to unwrinkle the shirt ,d0228cd,adviceanimals,humor,1455642387.0,mtgcracker,20.0,0.0,1,1213,0.0
what tip percentage do you typically expect for delivery  genuinely curious as someone who rarely orders delivery  and would think that 15  is an adequate amount ,d02dmz8,adviceanimals,humor,1455657740.0,Wolfgang985,3.0,0.0,448,3733,0.0
get a laser pointer it works with more than just cats ,d02ubm2,adviceanimals,humor,1455683317.0,spartangrad007,2.0,0.0,12215,42119,0.0
have a friend that you trust do it for you give them a percentage  make it a business proposition ,d02q8xb,adviceanimals,humor,1455676537.0,Melmab,2.0,0.0,1,10312,0.0
we can blame op but a couple thousand people upvoted this ,d01zjfn,adviceanimals,humor,1455638495.0,Spartan2x,631.0,0.0,55,2189,0.0
  princess bride   gt   you keep using that phrase  worth it  gt   i do not think it means what you think it means    these     cations     are nt     guaranteed     to     be     correct ,d01x2jn,adviceanimals,humor,1455634446.0,CationBot,890.0,0.0,32755,809644,1.0
that was the only wet willy she got that night,d01w0ni,adviceanimals,humor,1455632439.0,messimanziel,125.0,0.0,11335,5654,0.0
 oh the insanity seriously  can we reserve this meme for when people do actual gobsmackingly bold shit  giving your wife a wet willie in bed is a little risky  giving your wife a wet willie in bed and saying  come on  your sister liked it   now that s insanity wolf worthy ,d01xkix,adviceanimals,humor,1455635329.0,gynoceros,1805.0,0.0,63498,168034,1.0
wow this is nt even deserving of a insanity puppy ,d01zg3n,adviceanimals,humor,1455638355.0,strallweat,31.0,0.0,422614,390968,1.0
how did you ever manage to get out of the friendzone ,d0201nc,adviceanimals,humor,1455639253.0,lifewontwait86,15.0,0.0,12034,17221,0.0
given the meme you ve chosen  i assume your wife is a serial murderer who s captured you and will be flaying the skin off your finger for this offense  a this a carefully disguised cry for help  blink twice for yes ,d01zc3p,adviceanimals,humor,1455638188.0,eukomos,8.0,0.0,189,34655,0.0
awesome penguin followed by awkward by no means insanity wolf ,d01wlib,adviceanimals,humor,1455633578.0,MrWinklestein,86.0,0.0,1029,9217,0.0
you and i have very different definitions of insanity ,d01ychv,adviceanimals,humor,1455636626.0,IBiteMyThumbAtYou,15.0,0.0,11,8454,0.0
are you five ,d024tjj,adviceanimals,humor,1455645947.0,phrozen_one,6.0,0.0,53,4631,0.0
this is nt insanity wolf  this is stupidity wolf ,d027nhl,adviceanimals,humor,1455649780.0,soapergem1,5.0,0.0,387,739,0.0
my husband would have done the exact same thing you keep pulling shit like that  your wife wo nt try to do anything sexy anymore ,d01xf8g,adviceanimals,humor,1455635070.0,Gogo_McSprinkles,21.0,0.0,2133,10267,0.0
i m waiting for your wifes  scumbag meme reply ,d01uul3,adviceanimals,humor,1455629889.0,Undoppable,24.0,0.0,107,3590,0.0
idiot ,d01x2wd,adviceanimals,humor,1455634462.0,DrWhoSays,11.0,0.0,12599,9188,0.0
one time my gf sucked on my finger and asked why it was waxy and i told her i did nt know  later that day i just casually brought up that that when she asked why it taste that way it was because i forgot i had just picked my ear  so she s never done it again since  it s been a few years ,d0255ig,adviceanimals,humor,1455646403.0,SawBo,5.0,0.0,794,6756,0.0
that s one way of not getting your willy wet ,d025ogx,adviceanimals,humor,1455647119.0,Games_sans_frontiers,4.0,0.0,1,14186,0.0
 that s a meh meme hey maybe the comments will be funny at least    looks   oh wait everyone is just bitching about meme usage classic ,d0217hg,adviceanimals,humor,1455640937.0,agamemnon364,5.0,0.0,334,2243,0.0
happily married insanity wolf,d0255t7,adviceanimals,humor,1455646415.0,nocahomadc,4.0,0.0,70,425,0.0
yeah this is more like the puppy wolf is more  tried to finger her  was on her period  smeared it on my face as war paint and rode her like a native american chasing away the white man  just in terms of how the meme should be used,d023nv7,adviceanimals,humor,1455644372.0,PM_ME_BIGGER_BOOBS,2.0,0.0,340,11634,0.0
https  iimgurcomspdv2smjpg can we just change the name of the wolf to  average sunday night wolf  ,d024mgh,adviceanimals,humor,1455645680.0,serosis,2.0,0.0,475,37989,0.0
incorrect use of this meme ,d026mqi,adviceanimals,humor,1455648403.0,FinasCupil,2.0,0.0,20,2004,0.0
was insanity wolf neutered ,d0276xw,adviceanimals,humor,1455649150.0,smokinJoeCalculus,2.0,0.0,3289,38858,1.0
gee golly op  well that s just gosh darn goofy ,d027b0o,adviceanimals,humor,1455649304.0,jonny_wonny,2.0,0.0,20,2720,0.0
you must be a natural with the ladies ,d01zxvv,adviceanimals,humor,1455639103.0,mattthefro,2.0,0.0,647,11,0.0
so  is she seeing anyone ,d020jsp,adviceanimals,humor,1455639994.0,1Arky,2.0,0.0,794,20427,0.0
at least you did nt have kids  to bring you closer together   i ve seen sooo many couple try that one as a solution to their problems  ,d020zcv,adviceanimals,humor,1455640617.0,Garrwolfdog,8.0,0.0,1,1055,0.0
my mother works at a court and had a guy try and give the judge a good impression by taking off both of his ex wife s wing mirrors immediately before the trial for custody of their child some peoples stupidity amazes me sometimes ,d02ojun,adviceanimals,humor,1455673924.0,Gandalf_the_Cray_,7.0,0.0,4505,1599,0.0
gt  if you think that was your first mistake,d02pvat,adviceanimals,humor,1455675949.0,Honk_If_Top_Comment,3.0,0.0,7,244717,1.0
maybe not you but the system deserves it and that includes a lot of workers sure you have power but child welfare is a force for childhood trauma by itself here s just a quick note  when trained or educated  what is the equal amount of trauma caused by a parent that equals the amount generally done by removal of a child ,d02t890,adviceanimals,humor,1455681391.0,HIPPAviolationGo,-1.0,0.0,1,23,0.0
i think doing nothing at all hurts him more  dude ,d02mfz6,adviceanimals,humor,1455670712.0,Mutoid,48.0,0.0,10965,217405,1.0
fugitive fox,d02pvem,adviceanimals,humor,1455675954.0,Ktlyn41,1.0,0.0,52,2023,0.0
said it before and i will say it again if you go to places asking for relationship advice  they are either 1  looking for support in their decision  2  making sure they are nt crazy  or something they need to be talked into or out of  the understanding if someone comes in and says   i love everything about this girl  but have only been dating for 6 months  is it too early to propose   they are looking to be talked out of it  or to make sure they are nt doing something crazy the other case being  my boyfriend hit me and i am thinking that after the 12th time this has happened  i want to leave thoughts   they know they should leave  but want everyone to back them up  which is why every thread unanimously agrees usually it s painfully obvious in what the person should do ,d02nfa3,adviceanimals,humor,1455672227.0,Snowfox2ne1,1.0,0.0,1,17252,0.0
chaos reigns,d02oqlx,adviceanimals,humor,1455674208.0,Flavahbeast,5.0,0.0,1330,83499,1.0
hi  i have worked in wildlife rehab and can likely shed some light on this topic for those who do nt know one of the most common problems rehab facilities face is the process of imprinting an animal onto humans  or a lesser version of that where the animal just thinks that all humans are providers of food imagine releasing an imprinted bear  the bear thinks that he belongs with humans and will go try to find other humans to hang out with or score food from this is how  nuisance animals  are made  and you better believe people will call anybody to get this big fucking bear off their property  around me it is usually the dnr and in most cases it is putting the bear down this is why you see rehabers wearing costumes or masks when working with wildlife to be released so that animal does nt know what the big thing with the food is here is an example of people working with cranes  https  media2wnycorgi1200627c80photologueimages4bop_mig_crane_costumejpg people are nt perfect and there is a cute affectionate fox to be taken care of  and it s easier than you might imagine to imprint an animal onto people  especially when said animal is very young what most likely happened is that the workers spent too much time trying to play or cuddle with the little guy ,d02m9lk,adviceanimals,humor,1455670436.0,Bringer_of_Bears,111.0,0.0,96,799,0.0
not true buying them implies you intend to use them  meaning you ve thought through the possible effects of sex and are taking necessary precautions  yeah  it s awkward the first few times  but so are most things  especially those related to sex ,d02i9kr,adviceanimals,humor,1455664188.0,Hey-its-that-asshole,3.0,0.0,1,21555,0.0
brafuckingvo ,d02qo70,adviceanimals,humor,1455677193.0,Slappycake,1.0,0.0,146,45,0.0
or maybe he does nt want the word to get out that he does nt wear magnums not everyone is as pleased with their penis size as we are op ,d0212ra,adviceanimals,humor,1455640749.0,beeshepherd,10.0,0.0,204,1057,0.0
my wife refuses to let me buy her tampons seriously  she had her mother bring her some the other day because she was too embarrassed to add them to my grocery list  i do nt see the big deal  but whatever ,d01yiqv,adviceanimals,humor,1455636909.0,Ezra611,19.0,0.0,398,7735,0.0
it s all part of the long con as we speak  he s tunneling into your warehouse ,d02pgel,adviceanimals,humor,1455675307.0,ElagabalusRex,1.0,0.0,86303,91639,0.0
lol you re hurting him so badly by giving him more publicity,d02t1lz,adviceanimals,humor,1455681074.0,KennyB95,3.0,0.0,352,9615,0.0
sorry to say guys seems canada has traded marked this for canadian use only something about them being already to nice or something ,d02pvq6,adviceanimals,humor,1455675970.0,eagles_an_shit,1.0,0.0,310,8,0.0
i m tired of my tax dollars going to support these welfare vixens ,d02dv5u,adviceanimals,humor,1455658045.0,Warhawk137,12.0,0.0,7298,102647,1.0
please no  i do nt want you to think i m an idiot  anything but that ,d02bzjg,adviceanimals,humor,1455655531.0,Snoino,7.0,0.0,3555,14187,0.0
that s like saying  if you re uncomfortable talking to new girls maybe you re too immature for a girlfriend  fuck off  not everyone is comfortable with everything  as long as you re safe  you re mature enough ,d02g3uj,adviceanimals,humor,1455661068.0,hugs4thugs,66.0,0.0,1991,12227,0.0
i lost interest after college dropout he seemed to lose the flair that made him unique and grew big headed ca nt stand the guy now  what kind of asshole hijacks someone else s moment at the music awards ,d02ooum,adviceanimals,humor,1455674134.0,Gandalf_the_Cray_,-2.0,0.0,4505,1599,0.0
i bought one of those online it s too small for my door frames ,d01slfk,adviceanimals,humor,1455623294.0,CanadianSherlock,3.0,0.0,2994,4482,0.0
is it a cave  do you live in a cave ,d02bczf,adviceanimals,humor,1455654721.0,BumbleTummy,3.0,0.0,297,36868,0.0
as a former maintenance man  i ve always hated those things cuz they always split the door frame apart and pull off the top moulding ,d01xlna,adviceanimals,humor,1455635383.0,Spastic_pinkie,1.0,0.0,708,10814,0.0
i got one of those too  my new house  which i just bought  has  one  door with enough space on either side to fit the pullup bar  and it s in my basement  what ,d01wsrl,adviceanimals,humor,1455633952.0,Antoros,1.0,0.0,845,10383,0.0
better than me  pulls up on the wrong side  smacks head into top of door,d020dju,adviceanimals,humor,1455639741.0,holysocks,1.0,0.0,26579,112930,0.0
how do the doors stay in place,d029ygq,adviceanimals,humor,1455652862.0,GeronimoHey,1.0,0.0,294,954,0.0
above your door behind the drywall is something called a header it s a larger piece of wood that holds the weight of the roof over the open span that is the doorway you could screw a 2x4 to the header and hook onto that you could probably use a 2x2 as well to drop the height of the bar down if needed ,d01v4i0,adviceanimals,humor,1455630535.0,Shrimpkin,0.0,0.0,1097,5103,0.0
it s probably not up to code ,d01v54g,adviceanimals,humor,1455630576.0,stampadhesive,0.0,0.0,13,4594,0.0
how d he figure out it was you  how d that conversation go ,d02grnw,adviceanimals,humor,1455661995.0,Dirty_Liberal_Hippie,102.0,0.0,2110,45844,1.0
i ve said goodnight to a girlfriend before and then browsed reddit on my phone  it happens i told her about it and she was nt mad then several months later we got into an argument  broke up  and now i have two 75 minute classes with her a week and each time i feel a little more miserable   not gon na drop the class though  then she d win ,d00t6df,adviceanimals,humor,1455556435.0,Nextmastermind,643.0,0.0,3518,20265,0.0
i d fucking kill for someone to text me just because they re thinking about me do nt take that shit for granted,d01cpkj,adviceanimals,humor,1455585609.0,_Username_Required_,4.0,0.0,14811,1266,0.0
hey guys  i did a real life insanity wolf the other daycomparable to op s  i farted  and it smelled bad  yeah  totally it was grosstastic  insane  well  maybe not as insane as op because he did a wet willy ,d01xvsy,adviceanimals,humor,1455635869.0,doohicker,215.0,0.0,788,14714,0.0
is nt it easier to just get them done for a dollar a piece at a dry cleaners  was always jealous of lower prices for men s clothing,d02adsh,adviceanimals,humor,1455653434.0,revengemaker,1.0,0.0,1652,6183,0.0
so insane ,d028jkh,adviceanimals,humor,1455650981.0,NoItNone,2.0,0.0,1,6531,0.0
canadian here with a pro tip on how to walk on ice waddle like a penguin,d02qrkp,adviceanimals,humor,1455677336.0,uncreativeusername31,1.0,0.0,2188,1135,0.0
kanye makes some really good music just that some of his opinions are unusual ,d02uerg,adviceanimals,humor,1455683475.0,Ultra_light_beams,7.0,0.0,1,6,0.0
it s the same ideas as idiots who pull out in front of big rigs and then stop i always tell people the same thing there s a good chance that i wo nt be able to stop if i want too and you still have nt figured out whether i do  in fact  want to  yet ,d02jfad,adviceanimals,humor,1455665974.0,UniverseGuyD,0.0,0.0,13945,9203,0.0
i ve got a funny feeling that will be the last time she sucks anything of yours  ever ,d0290rp,adviceanimals,humor,1455651619.0,runninron69,2.0,0.0,1,2509,0.0
that s not a reason to stay with her in fact  it s more cruel to her you should let her go so she can find someone who will like her for her and not for her family if you break it off right  you might be able to remain friends with her family and maybe even her  too ,d02jp0z,adviceanimals,humor,1455666414.0,NearHi,6.0,0.0,3484,7638,0.0
last week the police asked if i could dig up some video for an accident that occurred outside one of our business locations girl was crossing the street  was struck by a speeding car  and she died it was snowing a bit but the car was speeding still i do nt understand how she did nt see or hear him coming i do nt think she was paying attention and i know the driver was nt  long story short you got ta lookout for yourself do nt count on the drivers to stop for you ,d02ae90,adviceanimals,humor,1455653451.0,satisfried,6.0,0.0,1236,18600,0.0
because he s worried that when he steals your food out of the fridge  it s gon na have nuts in it now he knows that everyone s food is fair game ,d02lj7w,adviceanimals,humor,1455669323.0,ronerychiver,4.0,0.0,2982,2944,0.0
in massachusetts  people have this habit of driving out into your lane right in front of you just so they can turn you d think these people would nt do that in a snowstorm darwinism at work ,d02f58k,adviceanimals,humor,1455659729.0,pjr032,3.0,0.0,2,6292,1.0
perfect timing  https  wwwredditcomrbodyweightfitnesscomments462bvwtrapeze_rigging_freestanding_portable_pullup_bar,d01x2rn,adviceanimals,humor,1455634456.0,nebulight,2.0,0.0,16534,10403,0.0
he probably just pussied out last moment and said it was fake number ,d02uc9t,adviceanimals,humor,1455683350.0,fullM3TALturban,1.0,0.0,58,6374,0.0
a piece of 2x4 and some screws problem solved ,d026tjl,adviceanimals,humor,1455648656.0,dark04templar,1.0,0.0,100,454,0.0
that is my fucking boyfriend all the time ,d025cuy,adviceanimals,humor,1455646679.0,marigoround,2.0,0.0,4,165,0.0
he should visit her on the home from time to time  i m sure she d love it ,d02kfi9,adviceanimals,humor,1455667633.0,mkizys,1.0,0.0,3102,14839,0.0
i made this same mistake a few years back opened the box and walked around my house looking for a doorframe turns out all the doorways in my house are flush with the ceiling ,d01uu68,adviceanimals,humor,1455629862.0,Bigworm410,4.0,0.0,403,743,0.0
the streets get plowed  the sidewalks do not ,d02pa01,adviceanimals,humor,1455675032.0,Tfg1,3.0,0.0,3432,2872,0.0
you could probably use a 2x2 as well to drop the height of the doorways in my house looking for a doorframe ,d01vubr,adviceanimals,humor,1455632081.0,gurjuz_sam,0.0,0.0,1,52,0.0
my gf always texts me asking if i m playing games i play video games like 25 hours a week  but those 25 piss her off ,d013e9f,adviceanimals,humor,1455571136.0,Biffmcgee,33.0,0.0,20005,26783,0.0
 ahh yeah i slept for 15 hours ,d00vrxw,adviceanimals,humor,1455560206.0,soberactivities,1269.0,0.0,104,7063,0.0
see  i m worried i ll just end up fucking up the door in my apartment it has trim and all  and i do nt weigh much  150 lbs   but i do nt know how well built this place is ,d028ukn,adviceanimals,humor,1455651391.0,messy_eater,1.0,0.0,46,32798,0.0
i say goodnight way before i go to sleep simply to get my gf to go the fuck to sleep she has a hard time functioning when she does nt get enough sleep and if im up she wants to stay up too,d010l20,adviceanimals,humor,1455567101.0,swaggman75,573.0,0.0,36,7377,0.0
now you can call him pretending like you dialed the wrong number  bonus  everyday roll a random number on randomorg from 1 to 100 and call him when ever you roll a 1 ,d02rlut,adviceanimals,humor,1455678691.0,The_Eerie_Red_Light,-1.0,0.0,73,1688,0.0
gf  why are you so tired today  did nt you go to sleep at 10  me  oh yeah definitely not at 3  36am  five and a half hours after i said good night ,d013bvo,adviceanimals,humor,1455571042.0,Kos-ensues,300.0,0.0,209,351,0.0
this happened to me when i got a really nice bouncer for my daughter   the only door that had a frame that stuck out was the bathroom,d01y6p6,adviceanimals,humor,1455636365.0,SillyRabit91,1.0,0.0,955,2338,0.0
when i was in the marines i roomed with a guy who was engaged to his hs sweetheart she texted him a lot an insane amount it never stopped one day he says  i m gon na tell her i m gon na take a nap for an hour so i can play some halo  so he does then he puts his phone on vibrate and we play fast forward exactly an hour he goes back to his phone and she had called 109 times in that hour 109 times he married this girl ,d018f5w,adviceanimals,humor,1455578733.0,PartypantsPete,5.0,0.0,2,8373,0.0
so i m currently in a spot where my dad who i have nt spoken to in almost 20 years wants to suddenly walk back into my life and get together i really do nt know what to do ,d02s90c,adviceanimals,humor,1455679746.0,The_Endling,3.0,0.0,1,24,0.0
i do nt think you understand what  in lieu of  means ,d012a13,adviceanimals,humor,1455569522.0,suzepie,889.0,0.0,19236,73332,0.0
my son got one of those for christmas  and i was shocked at how few options i had for placement i live in a fairly large 2story house  but almost none of the doorways in my whole place will accommodate the stupid doorframe bar ,d01v4j2,adviceanimals,humor,1455630537.0,phrankygee,1.0,0.0,1993,17747,0.0
i would just average the utilities out for the year and include it in the rent advertise free utilities ,d01yu0s,adviceanimals,humor,1455637413.0,LoudMusic,1.0,0.0,3509,86111,0.0
well said  bravo,d02fo69,adviceanimals,humor,1455660456.0,toastinbread,0.0,0.0,156,5,0.0
so return it ,d02uhrx,adviceanimals,humor,1455683623.0,PurpleCHEEZMint,1.0,0.0,343,1932,0.0
at work i only put in enough for me  but to be fair i have to use about five different colors of paper ,d025t6p,adviceanimals,humor,1455647296.0,queencuntpunt,1.0,0.0,26818,8228,0.0
did you know you can just buy lab coats ,d02vi1f,adviceanimals,humor,1455685513.0,Traveleravi,1.0,0.0,13057,4734,0.0
do you even want contact with him ,d02o8gy,adviceanimals,humor,1455673446.0,woram,11.0,0.0,2,383,0.0
  success kid   gt   checked my automatic student loan payments gt   principal portion greater than the interest,d021m6m,adviceanimals,humor,1455641510.0,CaptionBot,1.0,0.0,12594,448583,1.0
plot twist  he needed 500 pages for his print job ,d028yvl,adviceanimals,humor,1455651549.0,AlamarAtReddit,5.0,0.0,2390,29060,0.0
i do this because every time i print something that s collated  someone immediately prints something  grabs the entire print job  carelessly shuffles through it searching for their copy  which they inexplicably assume is buried in my work  instead of being on top  which it always is  and thereby forcing me to manually collate every fucking thing i print  every  fucking  time so fuck you if you do this shit ,d02du0q,adviceanimals,humor,1455658005.0,lazlounderhill,3.0,0.0,4381,32970,0.0
