text,id,subreddit,meta,time,author,ups,downs,authorlinkkarma,authorkarma,authorisgold
yes and no my buddy was a customer service guy for tivo and he did not give a fuck about that job he would hang up on people daily regardless of how nice they were if he did nt feel like dealing with the issue they had  he would nt he got fired  but still ,d0262tj,adviceanimals,humor,1455647654.0,Kraigery,1.0,0.0,12138,5798,0.0
i work in tech support being kind and polite is only part of it here s a list  if you do all of these things  i will do absolutely 100  everything in my power to give you the best support i can   be on a phone that works no bluetooth  no speaker  and be in a quiet room   have relevant information ready account numbers  part numbers etc  do nt call when driving or going to the bathroom  please   i did nt design or build what you think is broken and 95  of the time you ca nt get it working is because of something you did  so do nt be mad at me   if you want it fixed  do what i say when i say it you re calling me for help  i know how to fix it help me help you   i enjoy a little bit of small talk  but i do nt need to hear your life story i have other people waiting on the line behind you ,d0274n6,adviceanimals,humor,1455649066.0,Neltech,1.0,0.0,6144,50452,0.0
i ve found this is more true with online customer chat anytime i ve done that  with a few different companies  they end up going out of their way to refund me  fix the trouble  give me extra money  etc and i always thank them and let them know they are amazing ,d028nxk,adviceanimals,humor,1455651146.0,nexxusoftheuniverse,1.0,0.0,11267,6611,0.0
  actual advice mallard   gt   if you are kind and polite to the customer support rep on the phone gt   they will go out of their way to help you,d01gz1v,adviceanimals,humor,1455592303.0,CaptionBot,-1.0,0.0,12594,448583,1.0
people itt are talking about phone reps for major corporations  but this advice applies to any kind of service industry i m a guest service rep  front desk  at a hotel  and i do have the ability to reduce the nightly rate  increase it over our bestavailable rate  or give a compupgrade  up to  150 value sometimes  depending on your attitude over the phone you would nt believe the kinds of shit people say to get a discount on their room just last week   are you going to give me a discount because you re almost full    no  story time  just last night  my room has no view    it looks like you reserved a k size with a partial view   this false advertising  i m looking at a parking lot    sir  if you wanted the view room  you should have reserved the room with a view the partial view has a partial view of the ocean   well i m fucking pissed off now  we re checking out   what s your room number  we ll get you going right away   you figure it out    ok  what s your last name   this is fucking bullshit  blahblahblahblahblahblah   i go to the reservation bucket  with all the hotel guests  names  flipping through them slowly  making direct eyecontact  what s your last name   sonofabitchson   not really his last name   alright  i ve gone ahead and checked you out just so you know  you will be charged for the room due to our 24hr cancellation policy stated during the reservation   says some more bullshit  5minutes later when he has to tell his wife he threw a tantrum  he calls down to my coworker   ok  we ve decided to stay can you tell the guy that i apologize  what a valentines day ,d01mz28,adviceanimals,humor,1455603527.0,cannagetsomelove,-1.0,0.0,416,1632,0.0
this is very true i work in the hospitality industry and me and my co workers were just talking about this if someone calls super irate and yelling at my acting like i personally did something to them on purpose or like it s my fault  i m more than likely going to say   sorry sirmaam i m unable to help you  but i can transfer you to my manager   90 percent of the time i m able to help some what  whether it be a small refund  or a discount or just an explanation to what they want sometimes what they want is just to know that their refund had already been applied but the bank can take a few days to clear things i will take time out to look up an old receipt or email them or whatevr i can if they are nice  when i end up transferring them to a manager  it is hit or miss if they are able going to get back to  or get what they want  whether it s a restaurant or a hotel  i m always nice to the people i know that that it s usually not the persons fault who i am talking to the people behind the counter are nice somewhat because they have to  belt also because they want the respect from the customers ,d01qe9h,adviceanimals,humor,1455614325.0,whitak3r,-1.0,0.0,5035,1673,0.0
your problem is nt lending games it s needing better friends ,d0172un,adviceanimals,humor,1455576640.0,adamf1983,3.0,0.0,268,6438,0.0
since the dawn of time  this has happened this is the time when you learn that  and hopefully do nt make the same mistake again ,d01gwal,adviceanimals,humor,1455592177.0,Chester_the_cat,1.0,0.0,6875,4102,0.0
or you could tell the guy go away ,d02p6qf,adviceanimals,humor,1455674888.0,Rhysieroni,1.0,0.0,1,4189,0.0
of course he can afford a replacement do you know how much a healthy finger goes for these days ,d01ihci,adviceanimals,humor,1455594714.0,Thriven,1.0,0.0,4607,30940,0.0
story time  a few years ago i broke up with a gf of  3 years before we broke up she had been playing skyrim on my xbox she texted me some odd weeks after the breakup and asked if she could finish her game of skyrim i told her that the game and its save data were on the xbox  so i could nt do that she   insisted   that i should let her take my xbox  which at the time i was playing on regularly  so that she could finish the game  and threw a temper tantrum about it  i guess the good thing that came out of it was when my friends saw the texts she sent me  they were nt buying her shit she told them about me anymore ,d01j3g2,adviceanimals,humor,1455595733.0,frallet,3.0,0.0,1525,16739,0.0
he did nt let his colleague borrow it think about it why would he just part with it  that s not his personality greed and dishonesty is a big part of who  scumbag steve  is he has your game still  he just wants you to think it s in someone else s hands he s probably playing it at this very moment ,d01ir17,adviceanimals,humor,1455595157.0,Wolfgang7990,3.0,0.0,50,6474,0.0
lol its more than likely a pdf version from the company that was purchased then uploaded ,d02on2p,adviceanimals,humor,1455674059.0,eHawleywood,15.0,0.0,334,9004,0.0
did you at least blow him ,d02ronq,adviceanimals,humor,1455678820.0,now_its_a_dick_joke,0.0,0.0,17,14526,0.0
the unsung heroes of the internet who ul all our movies  music  and textbooks will never be celebrated  but we all admire their courage and public service  what a fucking racket  2015 tax book costs  300  2016 tax book costs  300  same shit just some edits and revisions here and there go back to the bookstore and they pay you  50 for the  old   ie one semester old  book in the back of your minds  they can not get away with this forever all things like this have a breaking point  and the college system is in serious peril once the veil is pierced and we all see the racket that it is  if you have nt already   a toast to the unsung heroes of the internet that selflessly upload for the public good ,d02vogy,adviceanimals,humor,1455685866.0,footlong24seven,1.0,0.0,3684,1090,0.0
but then you realized you have to pay a hundred bucks to just submit homework on pearson fuck pearson fuck you pearson ,d02rjf0,adviceanimals,humor,1455678581.0,okaychanged,25.0,0.0,2863,6837,0.0
if you are kind to people they will be kind to you  except for the ones that wo nt be kind to you anyway ,d01tfw2,adviceanimals,humor,1455626120.0,AtrociouSs,5.0,0.0,516,2184,0.0
used to work for a credit card terminal support helpdesk the people that called in and were assholes right off the bat because they need their machine fixed usually caused me to turn off instantly i get that you need your machine up and going  i get that you lose money if its not up  but let me point out something to you  you are calling me for help your issue was caused by your stupidity 34 of the time  and i know how to fix that on the machine  i could have gotten you up and going within 10 minutes of calling in but because you re a jackass to me  we ll go ahead and make it last 30 because that s when my 15 minute break is and i do nt want to deal with more calls right now ,d01p14b,adviceanimals,humor,1455609357.0,citrus_monkeybutts,2.0,0.0,30,3878,0.0
i m always nice to customer support people because generally speaking i m not a dick ,d01y2wi,adviceanimals,humor,1455636194.0,ErrorRon,1.0,0.0,624,2989,0.0
while this has worked for me  i can say for certain that most of the time it has not ,d01ufur,adviceanimals,humor,1455628905.0,kquach91,1.0,0.0,3688,5365,0.0
they may be more likely to  but this is nt an absolute ,d01s3i7,adviceanimals,humor,1455621360.0,xubax,297.0,0.0,1849,52701,0.0
no they wo nt  source  i work at my university s it helpdesk being nice does nt make you any less stupid ,d02hg5g,adviceanimals,humor,1455662974.0,Dawglester,2.0,0.0,1,1260,0.0
 he stuck a gun in my face and threatened to shoot me  advice   you should really seek couples counseling i think you can salvage this relationship ,d02c6i1,adviceanimals,humor,1455655785.0,xubax,25.0,0.0,1849,52701,0.0
sometimes be kind anyway  because why be an asshole  most of them are just wage slaves doing a shitty job ,d01u5fa,adviceanimals,humor,1455628154.0,Saiboogu,3.0,0.0,1761,3471,0.0
i do nt believe a running club is really a thing op is being silly ,d01a5ed,adviceanimals,humor,1455581504.0,SkywayTraffic,11.0,0.0,2076,26824,0.0
you must not live in the sticks  or the south ,d01hhr7,adviceanimals,humor,1455593121.0,Jokkerb,1.0,0.0,17887,26870,0.0
how do i find the running club,d01hotl,adviceanimals,humor,1455593441.0,DoctorWaluigiTime,1.0,0.0,60,132982,0.0
this may vary depending on company  policy  and person but while i worked for xbox support call and chat i would do everything and some to make sure you were good if you acted like a decent person once i got a rude  brat or something if i was nt able to get you to calm down and act human i proceeded to not care and gave shitty help and worry about the other customers i had i just do nt want to deal with you  i do nt sympathize with you  i really just do nt care   i love my games and crap but i wo nt take it out on some stranger because it s just a game   like i play games a lot i know the need to be able to play still no reason to be an ass ,d01tiut,adviceanimals,humor,1455626368.0,MunkiiJunkii,1.0,0.0,8,273,0.0
there needs to be some sort of stipulationbecause they are only going to do what is within their power which is nt a whole lot  i think we all understand that the person on the other end of the phone is nt the cause  but it does nt change the fact that i m the customerclient  i mean if you are paying someone close to minimum wage  how much  power  do they really have  i get it  it does nt matter how high in the food chain you are  unless you are at the top you do nt necessarily have all the power  this is nt a put down of anyone that works in a call center  but if they ca nt solve my problem and continue to escalate my call to their supervisor who also ca nt solve my problemit s frustrating and annoying  my biggest problem is when the person on the other end tells me or implies that something is nt their job you do nt have to tell me this  tell me anything other than this  it just is nt something that flies and it s not something i ve ever told a clientcustomer i ve thought it plenty of times  but it s just unprofessional ,d01j40l,adviceanimals,humor,1455595758.0,ProfLiar,8.0,0.0,17,29996,0.0
generally speaking  i m an asshole that being said  i am profoundly nice to customer service reps whenever i have to call a call center for anything  my primary objective is to get them to have an actual conversation with me the reason i called is secondary  it ll be handled anyway ,d01si9j,adviceanimals,humor,1455622971.0,OnionSquire,5.0,0.0,4064,7211,0.0
i know i do go out of my way i mean ,d01snun,adviceanimals,humor,1455623531.0,minkshaman,1.0,0.0,1,333,0.0
they will do everything in their power to help  unless they are under pressure not to  sadly  being nice gets you most of the way  but the squeaky wheel gets the oil  one example  had a screaming customer at my kinkos store  and i could not help him he was belligerent over customs tax that was charged to an international shipment he would nt even let me speak he just wanted me to give him 70ish dollars from my register told him to call 800   he did  then they talked to me i told them that he signed the shipping label  indicating he would accept charges he yelled at the lady and yelled at me continuously  they issued him a full refund of his original charge  and a check for the tax  i quit retail ,d01spaj,adviceanimals,humor,1455623673.0,brosephiroth,7.0,0.0,1397,6581,0.0
this is far from always being the case ,d01zhh8,adviceanimals,humor,1455638413.0,Ikari_Shinji_kun_01,1.0,0.0,5818,24215,0.0
go take alex out to dinner before she does ,d01e7xt,adviceanimals,humor,1455587982.0,FancySack,1875.0,0.0,8737,207803,1.0
op  post the letter put your karma where your mouth is and bite down hard ,d01spnw,adviceanimals,humor,1455623710.0,Chance4e,15.0,0.0,3261,54937,0.0
 dodged   https  uncommongeekfileswordpresscom201404thematrixbullettimegifgif ,d01jz7x,adviceanimals,humor,1455597243.0,coupland,20.0,0.0,21385,12973,0.0
i still do nt believe this happened,d01kmxi,adviceanimals,humor,1455598481.0,ShureYnaut,64.0,0.0,12405,29097,0.0
enjoy having a pair of balls sounds like you ve misplaced them for a while,d01me96,adviceanimals,humor,1455602169.0,redditandpoop,6.0,0.0,13,3593,0.0
they want that 55 survey rating ,d01wvjx,adviceanimals,humor,1455634095.0,prodromic,1.0,0.0,31825,15794,0.0
clearly you ve never called comcast ,d02eq3i,adviceanimals,humor,1455659179.0,athomas17,1.0,0.0,520,5181,0.0
speaking as someone who did tech support over the phones in the past  the converse is also true if you are a mean asshole to me before i ve even said anything  i will deliberately do things to fuck with you  like force restart your router  reset your wifi password to the convoluted alphanumeric string that can only be found on the sticker on the bottom of the router  and other annoying things as part of my  fix   sometimes  these things are required for an actual fix  but not always  and if you make my life hell for no good reason  i ll return the favor ,d01vido,adviceanimals,humor,1455631385.0,iyaerP,2.0,0.0,156,10399,0.0
not even close to universally true maybe there are some companies that encourage this  or individuals with a chip on their shoulder working in call centers who will do this  but i am never  ever rude on the phone and a vast majority of customer service reps stick to their script and toe the company line until i hang up it is only when i get audibly annoyed and ask for someone s boss that they start to think for themselves and try to actually help me out this advice mallard should just be  be kind and polite to everyone   not because it might inspire someone to actually do their fucking job  but because its the nice thing to do ,d01yovp,adviceanimals,humor,1455637183.0,sam_hammich,1.0,0.0,219,33970,0.0
i have to disagree with this in some cases this may be true  but in the places i ve worked  the general philosophy was that nice and patient people got shoved to the bottom of the priority list while angry douchebags more or less got whatever they were asking for  i wish this was nt the case but i think most managers would rather avoid getting a complaint letter than reward kindness ,d01qzh7,adviceanimals,humor,1455616730.0,homerghost,121.0,0.0,976,2294,0.0
ive found going off on the first rep works really well they record it in the notes then the second rep will be extra cautious trying to please you did this with comcast  had no choice but to cuss out one of their worker bees to get a manager that fixed the problem  while the worker bee refused to help me saved me  40 a month on bills ,d0258pu,adviceanimals,humor,1455646526.0,safesthaven,1.0,0.0,373,1856,0.0
i was a csr for years  can confirm csrs i talk to now  as a customer  usually tell me they wish all customers were as polite as i am  when i tell them it s because i worked the job for years  they always thank mefeels good man,d01zyec,adviceanimals,humor,1455639123.0,redditeando,1.0,0.0,9491,5420,0.0
i can confirm can be applied to people working front desk at hotels,d020d88,adviceanimals,humor,1455639729.0,joeyrpugh,1.0,0.0,4845,2452,0.0
i like how in this thread you have angry customers of largely cable companies saying   this is not true fuck you fuck customer service   and then you have people who actually work in customer service largely saying   100  true i will always help the person who is nice to me  maybe your experience with bad cs was because you re calling a shitty company  and you have a bad attitude already  maybe  you know the saying   if you run into an asshole in the morning  he s an asshole if you run into assholes all day  maybe you re the asshole ,d01w258,adviceanimals,humor,1455632523.0,Antoros,2.0,0.0,845,10383,0.0
this is nt true at all it depends on what kind of customer service you need i ve been on lines where i was as nice as i could be and the person is a nasty fuck  other times they would go out of their way to even give me a bunch of free things  talking to you blizzard  when i was somewhat upset over something and needed customer support help ,d02ah78,adviceanimals,humor,1455653565.0,Sybre,1.0,0.0,3060,11665,0.0
one of my good friends hit me up that her and her boyfriend were having a rough time and all of our other girlfriends were just saying cut it off not knowing the guy i gave her actual advise on what she could maybe do to mend the problem i was the only one to say to try to work it out if he was worth it everyone told her to call it off and they are back to being happy ,d02d2sn,adviceanimals,humor,1455656994.0,Jaci_D,4.0,0.0,3536,5942,0.0
he lost it or broke it  i guarantee it,d010z6d,adviceanimals,humor,1455567670.0,oosqu,228.0,0.0,1,637,0.0
local running club  what,d01k86p,adviceanimals,humor,1455597701.0,Tsobaphomet,4.0,0.0,1482,2841,0.0
if you live in a smaller townneighborhood  contact the post office mail carriers know all of the dogs on their route and will recognize one that is nt where it belongs ,d01cxu9,adviceanimals,humor,1455585980.0,JesperIsHere,396.0,0.0,5939,15418,0.0
so you told him to shove it and left anyway right ,d02mtys,adviceanimals,humor,1455671330.0,Wyatt1313,3.0,0.0,29521,151181,1.0
so when they need to surgically remove your foot from his ass  will you be allowed time off work ,d02qmyi,adviceanimals,humor,1455677142.0,D-Evolve,3.0,0.0,234,29260,0.0
sorry  but my town is so small we do nt have a running club not even a gun  strip or old mans club ,d01g4im,adviceanimals,humor,1455590964.0,mreatsum,1.0,0.0,945,31141,0.0
how do you know we re not thinking the op is a dipshit and we re conspiring to do their significant other a favor ,d02miv3,adviceanimals,humor,1455670840.0,Saneless,1.0,0.0,1,1297,0.0
you should definitely break up with us then,d02jol4,adviceanimals,humor,1455666391.0,DoesntWearEnoughHats,1.0,0.0,88,14399,0.0
also the best people to ask to find the best beer in town running clubs know how to drink ,d01arf0,adviceanimals,humor,1455582494.0,gkunkle,38.0,0.0,107,5723,0.0
there s also a running group called the hash house harriers they often run places where your average running club will not there are clubs all over the world many cities have multiple clubs they re a bunch of halfminds  but they would gladly keep an eye out for a missing animal ,d01cu4x,adviceanimals,humor,1455585812.0,itstevens,23.0,0.0,2008,17857,0.0
ummare you sure you two are dating  does she know ,d01vyyk,adviceanimals,humor,1455632344.0,ritz-chipz,4.0,0.0,25,1458,0.0
if someone takes life changing advice from a random person on the internet then i think they are the idiot ,d02fbnw,adviceanimals,humor,1455659971.0,Link442,4.0,0.0,18,568,0.0
where i live the local hunting club would be a better bet  just not sure you will like the condition of your pet  jk they re actually really upstanding chaps ,d01c67w,adviceanimals,humor,1455584782.0,Malphael,14.0,0.0,16939,104086,0.0
op  is it me or does it kind of seem like op might have overinflated this relationship in his own mind  just maybe ,d01t8zs,adviceanimals,humor,1455625530.0,SpeakerPaulRyan,29.0,0.0,1,3785,0.0
honestly  i recommend plastering your dog s info all over social media the dog loving community where i live is pretty incredible  they share your posts like wild fire that s how i got my little fur dude back and my neighbor s dog as well ,d01fjms,adviceanimals,humor,1455590054.0,bluegirlinaredstate,4.0,0.0,10,222,0.0
i m glad you found your duck ,d01w92d,adviceanimals,humor,1455632913.0,zweezy3,2.0,0.0,1,258,0.0
and where do i find that number ,d01ff3t,adviceanimals,humor,1455589855.0,stringabellz,1.0,0.0,1,47,0.0
what kind of white suburbia gated community do you live in ,d01aue4,adviceanimals,humor,1455582627.0,WhiskeyAndDickPics,117.0,0.0,5,3799,0.0
maybe tone it down a bit for the next girl ,d01troq,adviceanimals,humor,1455627083.0,Mcnasby,7.0,0.0,2665,2657,0.0
wrote five page love letter made a bed of rose petals purchased chocolate tipped my fedora quoted richard dawkins to her called her mlady  what went wrong  nice guys never get anywhere ,d01teb9,adviceanimals,humor,1455625988.0,kristianstupid,12.0,0.0,27,7734,0.0
i live near philadelphia i ve never heard of anyone getting a ticket for jaywalking everybody crosses where they want  when they want  a coworker was sent to san diego for a week when he came back he tried to submit 5 jaywalking tickets in his expense report which were all turned down he got 5 jaywalking tickets in just under a week he said he could nt help it by the time he realized he was crossing illegally he was already halfway across the street and the cops were coming for him ,d02lw60,adviceanimals,humor,1455669860.0,Luzer606,2.0,0.0,26,3785,0.0
the best part is i m fairly confident you were never dating this girl you may have thought so  but she did nt ,d01uyhv,adviceanimals,humor,1455630147.0,Iwritewordsformoney,11.0,0.0,1,14797,1.0
i just lost my pet  this is no time for exercise ,d01h733,adviceanimals,humor,1455592654.0,FreedomStamps,3.0,0.0,1,273,0.0
i run a support department and this is our stated policy if you re nice and patient we will help you as much as we can  up to and including hounding the developers to get them to fix a bug ,d01y6ay,adviceanimals,humor,1455636347.0,TheIcelander,1.0,0.0,9686,183526,0.0
straight guys keep posting these it makes me glad i m gay   ,d02s0n0,adviceanimals,humor,1455679366.0,AnitaTT,3.0,0.0,9290,3876,1.0
once while running i saw a chicken on the road  i presume it was someone s pethome egg layer on one side of the road was houses and the other was the river  i ran that route pretty often and never saw the chicken again i hope it fulfilled it s life s purpose ,d01c5ot,adviceanimals,humor,1455584759.0,letsburn00,6.0,0.0,8634,17370,0.0
i m in the same situation broke up with my boyfriend the day after valentine s day too we were together for almost a year and i paid for everything i went out of my way for the guy and i planned an amazing valentine s day scavenger hunt  plus i bought dinner  paid for the cab  got him a wallet he has been asking for and i also arranged for a pizza to be delivered with one of the scavenger hunt clues written on the inside of the box he made me a card while he was on break at work and i feel like i m being too materialistic  that s what he is telling me anyway   i just want to be with someone who will give me their all like i d give them my all  is that too much ,d01lvhk,adviceanimals,humor,1455600996.0,megalin,10.0,0.0,1401,42,0.0
kanye west will try his kanye best to get out of this kanye mess ,d01gzkh,adviceanimals,humor,1455592328.0,YouWantALime,964.0,0.0,1862,59436,0.0
he ll just pull some money out of his arse more likely his wife s actually ,d01jgk6,adviceanimals,humor,1455596354.0,PoglaTheGrate,24.0,0.0,4828,54680,0.0
 assets,d01oi48,adviceanimals,humor,1455607690.0,Letpigeonsfly,3.0,0.0,536,983,0.0
we ll see whether kim really meant til death do us part  ,d01purb,adviceanimals,humor,1455612246.0,ThisVersionOfMyself,2.0,0.0,25486,78080,0.0
ca nt his wife just write him a check  53 million is chump change to them ,d01vw8n,adviceanimals,humor,1455632189.0,pooponagoose,1.0,0.0,19051,26586,0.0
how is the first part socially awesome ,d02ina0,adviceanimals,humor,1455664773.0,pepsi4ever,3.0,0.0,5,7824,0.0
i advise everyone to break up with their boyfriend or girlfriend who cares  do it just for a laugh go find another one what does it matter ,d02mulp,adviceanimals,humor,1455671356.0,toilet_bowler,1.0,0.0,19,22635,0.0
national grid does this too i stayed on hold with them for almost an hour before they came on and said their call center was closed  fuck national grid ,d02mf98,adviceanimals,humor,1455670681.0,pjr032,2.0,0.0,2,6292,1.0
so not true i am nice to them and usually get nothing however i know people who chew them out and get whatever they want ,d01tret,adviceanimals,humor,1455627060.0,Mastaking,1.0,0.0,2706,2313,0.0
the quick answer is to stop watching tv ,d02umud,adviceanimals,humor,1455683883.0,ciberjedi,1.0,0.0,1,702,0.0
didnt he then tweet that he s personally rich and that any rich person knows not to spend their money  but instead spend some other rich persons money ,d01q2v0,adviceanimals,humor,1455613102.0,northfall,2.0,0.0,2,1577,0.0
