text,id,subreddit,meta,time,author,ups,downs,authorlinkkarma,authorkarma,authorisgold
this is the best tl  dr i could make   original   http  wwwdwcomenukrainepmarsenyyatsenyuksurvivesnoconfidencevotea19052526  reduced by 72    i m a bot       gt  arseniy yatsenyuk maintained his position as ukraineamp   039  s prime minister after ukraineamp   039  s parliament  the verkhovna rada  rejected a noconfidence vote against him  gt  earlier on tuesday  president petro poroshenko asked yatsenyuk to step down  suggesting a amp  quot  total reformattingamp  quot  of the cabinet and saying his government had lost public support and committed amp  quot  more mistakes than achievementsamp  quot  poroshenko  who heads ukraineamp   039  s largest party  has joined hands with yatsenyukamp   039  s party to form a coalition government in the center  gt  yatsenyuk became prime minister in 2014  shortly after protests in ukraine succeeded in ousting former president viktor yanukovych          extended summary     http  npredditcomrautotldrcomments465ex2ukraine_pm_yatsenyuk_survives_noconfidence_vote    faq   http  npredditcomrautotldrcomments31b9fmfaq_autotldr_bot  version 16   37006 tl  drs so far     theory   http  npredditcomrautotldrcomments31bfhttheory_autotldr_concept    feedback   http  npredditcommessagecompose  to   23autotldr  pms and comment replies are read by the bot admin  constructive feedback is welcome     top   keywords     ukraine     1   yatsenyuk     2   president     3   poroshenko     4   reforms     5,d02kaw4,worldnews,news,1455667433.0,autotldr,1.0,0.0,18.0,106620.0,0.0
i m impressed that two men can assemble a thousand tractors in a year ,d00ws6q,worldnews,news,1455561654.0,intensely_human,12.0,0.0,132.0,136785.0,1.0
so could george bush ,d01pc8q,worldnews,news,1455610395.0,munster62,0.0,0.0,13.0,6765.0,0.0
there s a browser extension to stop that   ghostery   https  wwwghosterycomoursolutionsghosterybrowserextention ,d01exgp,worldnews,news,1455589083.0,clupean,31.0,0.0,419.0,3145.0,0.0
belgium did this a while ago and actually won the court case ,d01774m,worldnews,news,1455576820.0,shrekinator,94.0,0.0,1.0,23244.0,0.0
how tragic hope they remember how to herd sheep ,d02s7vw,worldnews,news,1455679695.0,italianfatman,1.0,0.0,22.0,83.0,0.0
do they even know what ppk is  what they do ,d022l8c,worldnews,news,1455642889.0,unal991,0.0,0.0,1767.0,1941.0,0.0
it would not surprise me if facebook had more political power than france ,d015k07,worldnews,news,1455574322.0,Honk_If_Top_Comment,13.0,0.0,7.0,244676.0,1.0
this makes me super super sad ,d02jk63,worldnews,news,1455666182.0,Jakesteeed,3.0,0.0,8.0,20380.0,0.0
google  privacy badger  if you re at all concerned about being tracked by the various like and share buttons that are everywhere now ,d01roix,worldnews,news,1455619645.0,right_there,2.0,0.0,23.0,505.0,0.0
gt  turkey calls gobble  gobble  gobble  ,d02jmm1,worldnews,news,1455666286.0,BlueMonkOne,1.0,0.0,1.0,1909.0,0.0
i do nt think it s really contested anymore shit s china s they are developing it they got missiles on it now ,d02svy3,worldnews,news,1455680813.0,DecoysLoisDecoys,1.0,0.0,5498.0,7313.0,0.0
are they on youtube ,d02n69c,worldnews,news,1455671854.0,Gequinn,1.0,0.0,54.0,13637.0,0.0
gt  for decades  the royal family has used the kingdom  s immense oil wealth to lavish benefits on its people  including free education and medical care  generous energy subsidies and wellpaid  and often undemanding  government jobs no one paid taxes  and if political rights were not part of the equation  that was fine with most people  how terrible now that they re no longer getting spoiled  they ll have to work harder like the rest of the world ,d02qhu0,worldnews,news,1455676921.0,SunsetChaos,19.0,0.0,4.0,377.0,0.0
great name  sad to see him go ,d02tn7w,worldnews,news,1455682123.0,Victor_Zsasz,1.0,0.0,1.0,15868.0,0.0
it s not metal  but made me think of  this   http  wwwthelonelyislandcomvideoiransofar   not really relevant anymore since m night ahmadenijad left though ,d02rpr0,worldnews,news,1455678872.0,Bon_Qui_Qui,1.0,0.0,1.0,201.0,0.0
there is no such thing as promised land  ,d02buis,worldnews,news,1455655350.0,thinkaboutit43,-2.0,0.0,1.0,-100.0,0.0
taiwan numbah one ,d02rctf,worldnews,news,1455678281.0,2weeke,1.0,0.0,1.0,111.0,0.0
i have a v8 jeep that  can  run on regular gasoline  i ve been feeding her nothing but premium lately  partly because i support bla bla bla bla bla  but mostly i want to see the world burn before i die ,d02iol8,worldnews,news,1455664830.0,Themosthumble,0.0,0.0,1.0,60749.0,0.0
want to know who was a major campaign funder for sarkozy  col gaddafi with 50 million euros  http  wwwtheguardiancomworld2012mar12gaddaficontributedsarkozy2007election who spearheaded the nato intervention in libya  france did under sarkozy ,d02hnar,worldnews,news,1455663265.0,jihad_dildo,18.0,0.0,5629.0,25483.0,0.0
gt  as they face the expectation that they will have to actually work  unlike their parents  ftfy ,d02u0fx,worldnews,news,1455682767.0,richmomz,1.0,0.0,8716.0,139976.0,0.0
good damn sand roaches ,d02s0jq,worldnews,news,1455679362.0,Graceful_Ballsack,1.0,0.0,547.0,6859.0,0.0
in soviet russia  the  thrift paradoxes   https  enwikipediaorgwikiparadox_of_thrift  you ,d029i05,worldnews,news,1455652256.0,Continuity_organizer,8.0,0.0,506.0,9093.0,0.0
saudis work ,d02rqow,worldnews,news,1455678914.0,KeavesSharpi,1.0,0.0,1020.0,45474.0,0.0
its not like half of  younger saudis  are secondclass citizen hostage of islamism with no true legal right to work  fuck the other half younger saudi this country never deserved its money  edit  am i the only one to see the irony one of the biggest oil producers will not be able to switch back to desert rurale society because of global warming they produced ,d02u6d5,worldnews,news,1455683059.0,Fennec_Murder,1.0,0.0,2.0,922.0,0.0
good  someone needs to pay for that game ruining my family s christmas because someone just had to keep playing the really sexual and really racist cards ,d01m1ou,worldnews,news,1455601373.0,TitusVandronicus,1.0,0.0,5.0,28001.0,0.0
beheading sand metal ,d02p0mv,worldnews,news,1455674632.0,malan4reddit,1.0,0.0,1.0,53.0,0.0
insane troll logic they need to be exterminated with extreme prejudice ,d02cn03,worldnews,news,1455656403.0,Kamaria,1.0,0.0,8072.0,36536.0,0.0
i did nt know that card game was looking for an accountant,d01z3ha,worldnews,news,1455637823.0,captainmavro,1.0,0.0,178.0,8260.0,1.0
greeks violate turkish airspace in the same way except that they do nt have enough money to do it as often these days ,d01nsmb,worldnews,news,1455605643.0,doneredditall,88.0,0.0,1.0,148.0,0.0
no money no rocket,d01t6lx,worldnews,news,1455625326.0,Owlseeingeverything,-3.0,0.0,1.0,6.0,0.0
gt  5 hospitals and 2 schools war crime  no ,d01cv1k,worldnews,news,1455585854.0,Beejsterb,84.0,0.0,16649.0,7836.0,0.0
fuck that over ,d02ayqq,worldnews,news,1455654215.0,canihaveahint,3.0,0.0,245.0,2669.0,0.0
how many licks does it take to get to the meth center of a tootsie pop  the world may never know ,d01br6q,worldnews,news,1455584108.0,SharonJone,36.0,0.0,29.0,49.0,0.0
so what  this shits been going on since decades and both sides do it ,d01rpyq,worldnews,news,1455619817.0,badfysh,44.0,0.0,259.0,1404.0,0.0
it s ironic that syria is crying to the un about turkey  and in the meantime  is slaughtering civilians through it s hired military muscle ,d01npk0,worldnews,news,1455605410.0,GalaxyQuesting,1.0,0.0,1.0,29.0,0.0
by the way  he s proeveryonegun and a trump supporter  and those isis scum were nt gunning for them  they were gunning for anyone most likely those at the football stadium  the singer ran immediately from the stage so not much of what happened is really their story it s more about the victims and a tragedy that happened in france ,d02opcv,worldnews,news,1455674155.0,Zodiac13,-18.0,0.0,265.0,4072.0,0.0
allow kurds to come and talks can begin what s the big deal  just carve kurds some space from iraq and syria like it was done for the jews in the 40 s and everyone will be happy ,d02j1yk,worldnews,news,1455665405.0,you_have_been,4.0,0.0,1.0,212.0,0.0
what do they taste like  a trailer park ,d0239sg,worldnews,news,1455643836.0,witchsbrew,1.0,0.0,196301.0,50334.0,1.0
 one should never link the military facilities with efforts to militarize the south china sea  common china  you can lie better than that you did nt even try ,d02qb7l,worldnews,news,1455676639.0,SpermWhale,11.0,0.0,2286.0,144992.0,0.0
welcome to the rest of the world ,d02q0xz,worldnews,news,1455676194.0,Deranged_Kitsune,6.0,0.0,115.0,6172.0,0.0
i would have expected this to be bigger news  i guess for most people here he was sort of before their time ,d02iqvh,worldnews,news,1455664928.0,Loki-L,3.0,0.0,47573.0,243727.0,1.0
til these stupid fucking morons are still around,d020g8k,worldnews,news,1455639851.0,Nosam88,5.0,0.0,48129.0,9148.0,0.0
this is the best tl  dr i could make   original   https  wwwrtcomnews332682unscturkeyfirekurds  reduced by 76    i m a bot       gt  the un security council received a letter from the syrian government in which damascus condemned turkeyamp   039  s attacks in the north of syria  ramirez explained  noting that the entire council expressed amp  quot  concernamp  quot  about these violations  gt  when asked if the unsc discussed the shelling of the hospitals and schools in northern syria on monday which left close to 50 people dead  ramirez said the council indeed discussed the issue  but reached amp  quot  no agreementamp  quot  or amp  quot  consensusamp  quot  because of amp  quot  different sourcesamp  quot  of information on the incidents  gt  amp  quot  we have urged the ypg to avoid moves that will heighten tensions with turkey but at the same time we have also urged turkey to cease any artillery its artillery fire across the border          extended summary     http  npredditcomrautotldrcomments46598run_security_council_urges_turkey_to_stop_shelling    faq   http  npredditcomrautotldrcomments31b9fmfaq_autotldr_bot  version 16   36997 tl  drs so far     theory   http  npredditcomrautotldrcomments31bfhttheory_autotldr_concept    feedback   http  npredditcommessagecompose  to   23autotldr  pms and comment replies are read by the bot admin  constructive feedback is welcome     top   keywords     turkey     1   syria     2   ramirez     3   council     4   unsc     5,d02iw4y,worldnews,news,1455665155.0,autotldr,2.0,0.0,18.0,106620.0,0.0
i m gon na make a wild guess that they re blueraspberry flavored ,d01m2vb,worldnews,news,1455601448.0,ArseGriddle,3.0,0.0,1.0,6076.0,0.0
putin get your little dick out of syria s ass ,d01khku,worldnews,news,1455598195.0,Pitchfork_Peasant,-1.0,0.0,4948.0,4886.0,0.0
why is he accountable for cards against humanity ,d01mkwv,worldnews,news,1455602600.0,dagmd,1.0,0.0,1.0,305.0,0.0
 could  be  wtf is nt it obvious already ,d01bbp5,worldnews,news,1455583411.0,Classicpass,154.0,0.0,380.0,5556.0,0.0
00063 angolan kwanza  1 us dollar because i had to check to see if kwanza was a real currency ,d02mrhv,worldnews,news,1455671222.0,CommonCentsEh,3.0,0.0,2159.0,336.0,0.0
pedophile politicians in the uk government making laws about pornography what a joke,d02r6iz,worldnews,news,1455678004.0,Chillypill,2.0,0.0,20.0,3643.0,0.0
finally some sanity about iran the media in the us has been acting like iran is totally fine ever since the negotiations and subsequent deal ,d02s6v0,worldnews,news,1455679648.0,Fredfredbug4,1.0,0.0,1514.0,96289.0,1.0
guess desert will be covered in the mexican prisons for the next few months should work well all around ,d02ceaa,worldnews,news,1455656076.0,diggernaught,0.0,0.0,2258.0,7158.0,0.0
suddenly  north korea realizes the error of its ways and becomes the utopia it has always bragged to be ,d01mdft,worldnews,news,1455602117.0,ClearlyDoesntGetIt,1.0,0.0,2092.0,36524.0,0.0
russia also rejects being in crimea or shooting down civilian airliners the world knows better by now ,d01uts5,worldnews,news,1455629836.0,GalaxyQuesting,33.0,0.0,1.0,29.0,0.0
no one believes a word the russian government says anymore so this statement does nt mean anything ,d01uikp,worldnews,news,1455629089.0,doneredditall,4.0,0.0,1.0,148.0,0.0
putin is lying  http  imageshutterstockcomzstockphotoportraitofashockedyoungmancoveringhismouthwithhands230627524jpg,d02c4fi,worldnews,news,1455655709.0,adam3k3,2.0,0.0,1.0,39.0,0.0
that s a fun way to get around war crimes hitler could have learned a few things from the soviets ,d02pn3u,worldnews,news,1455675595.0,PM_Me_Labia_Pics,1.0,0.0,1475.0,6579.0,0.0
russians dont care  and wont care even if these reports will show 1 mln casualties unless the source isnt something like wwwdefensegov or registered military correspondents of cnnbbc on site  or photos from military satellites with timestamps and correlation with actual bombing schedules that isis coalition have access to  that s how all that news about hospital attacks look like  http  cs5pikaburupost_imgbig2015100771444218895_2079245877jpg,d01vj56,worldnews,news,1455631430.0,popelyshev,1.0,0.0,51.0,201.0,0.0
the us is upset that russia and syria are winning the war this is why turkey and saudi arabia are threatening to invade this is why the western media has gone into hysterics ,d027i4z,worldnews,news,1455649574.0,ZorgLives,0.0,0.0,39.0,2207.0,0.0
makes sense bombing hospitals is more like the us mo any us planes unaccounted for  during that time ,d02cm25,worldnews,news,1455656365.0,jaywalker32,-1.0,0.0,1137.0,19203.0,0.0
everybody jumps on russia when they do something bad usa did it first and the russians do nt give a fuck ,d023s7h,worldnews,news,1455644539.0,modelo666,-11.0,0.0,1.0,2928.0,0.0
it ai nt easy being a strongman dictator in one of the world s most impoverished states give the man some slack on this rights of humans thing ,d01n2j9,worldnews,news,1455603761.0,nsad01,2.0,0.0,1.0,-12.0,0.0
isis doesnot makesense ,d02u3wc,worldnews,news,1455682936.0,slowcooked,1.0,0.0,1.0,47.0,0.0
i could  jump over the moon,d01qgez,worldnews,news,1455614563.0,Shooter_-_McGavin,1.0,0.0,9.0,2594.0,0.0
on the next edition of  fantastic mr fox news ,d02suss,worldnews,news,1455680762.0,jiggatron69,1.0,0.0,1.0,16430.0,0.0
oh fox news ,d02hleo,worldnews,news,1455663188.0,you_have_been,-3.0,0.0,1.0,212.0,0.0
do nt know anything about china s media but i do know fox ,d02omec,worldnews,news,1455674032.0,you_have_been,-1.0,0.0,1.0,212.0,0.0
someone blows those pieces of shit up already,d02rq8e,worldnews,news,1455678894.0,DaphWingDuck89,1.0,0.0,1.0,107.0,0.0
yeah like that ll happen ,d01l6sc,worldnews,news,1455599576.0,sushipusha,1.0,0.0,475.0,8472.0,0.0
the headline is misleadingmore accurately  it should read   kim jong un could be  charged with crimes against humanity    held accountable  implies the un can or will follow through with meaningful action  which is highly unlikely ,d021aag,worldnews,news,1455641046.0,Gfrisse1,1.0,0.0,1.0,55606.0,0.0
this honestly gives me so much hope for the future thank you sisi ,d02qamy,worldnews,news,1455676613.0,TinfoilKeffiyeh,18.0,0.0,726.0,646.0,0.0
who has the balls to do it ,d01qx1b,worldnews,news,1455616446.0,iFart_69,1.0,0.0,7.0,618.0,0.0
assholes why ca nt islam have the same thing as  christcore  ,d02gw2j,worldnews,news,1455662172.0,situation_unknown,1.0,0.0,1.0,2644.0,0.0
muslims are in control,d02g5e0,worldnews,news,1455661127.0,extex001,6.0,0.0,1.0,158.0,0.0
what happens when those sites get hacked an all the personally identifiable information gets out  they are trying to turn us into south korea or china  the only way to have a safe net for children and adult is a separate net of sorts their are ways to achieve this technically without destroying the internet ,d02cbro,worldnews,news,1455655980.0,fluxThyristor,2.0,0.0,1.0,411.0,0.0
seems like if you lived there you would know most of the rules by now ,d02ty3e,worldnews,news,1455682653.0,bigghimself,1.0,0.0,3.0,80.0,0.0
and the dalai lama says we need to give these fuckers respect what a sad state the world is in right now  http  mobilewndcom201512dalailamacallsonworldtogiveisisrespect,d026jwa,worldnews,news,1455648296.0,Chemspiration,-1.0,0.0,479.0,16698.0,1.0
 for too long  we have been a passively tolerant society  saying to our citizens as long as you obey the law  we will leave you alone    said david cameron ,d029gqw,worldnews,news,1455652211.0,I_FUCK_YOUR_FACE,283.0,0.0,351.0,6884.0,1.0
some dea agent is pissed right now,d023um1,worldnews,news,1455644629.0,modelo666,1.0,0.0,1.0,2928.0,0.0
oppose us industries  get embargoes that cripple your economy for 50 years  open the gates  the embargoes vanish and us companies come in overnight ,d00qr03,worldnews,news,1455552712.0,thelazyreader2015,21.0,0.0,12701.0,7754.0,0.0
allah  muhammad  god  jesus  can suck about 800000 dicks and get shit on by about 14000000 eroding assholes fuck your gods ,d02ivk7,worldnews,news,1455665131.0,heady_potter,2.0,0.0,21.0,1257.0,0.0
 would you kindly  ,d01jx08,worldnews,news,1455597138.0,fullonrantmode,269.0,0.0,148.0,18683.0,0.0
what is it with the uk government being so prude lately ,d02nmi8,worldnews,news,1455672525.0,Roma_Victrix,2.0,0.0,8626.0,33336.0,0.0
i do nt think the unhrc could be a bigger joke even if they tried ,d01nztg,worldnews,news,1455606204.0,DonaldBlake,1.0,0.0,3407.0,14667.0,0.0
from what i have seen  to exploit this bug requires root level to the device in question ,d02on8t,worldnews,news,1455674067.0,justscottaustin,1.0,0.0,2908.0,101670.0,0.0
it s also a worrying pattern that these criticisms are rarely directed at the west  international institutions  including the icc  seem to deliberately target developing countries  icc has basically been an africa focused court   the african union s decision to withdraw is testament to the frustration felt by the continent these institutions would happily target an african president whilst turning a blind eye to an undemocratic and brutal us ally  most notably saudi arabia  i wonder how a chinese call for the immediate and unconditional release of guantanamo bay inmates in the bush era would have been received  i would presume the us would have been highly unimpressedoffended double standards abound ,d02hb7e,worldnews,news,1455662780.0,tinker_tailor17,4.0,0.0,1.0,4430.0,0.0
 brutal  ,d02ufnh,worldnews,news,1455683518.0,flappy_cat,1.0,0.0,349.0,1393.0,0.0
in a sense  it is kind of flattering that people can blame the us for every single thing that happens on the planet  on the other hand  it is laughably ironic the same people that say the us is nt doing enough and is weak  are the same people blaming the us for every person that dies around the globe ,d01p67n,worldnews,news,1455609833.0,GoHuskies858,4.0,0.0,1024.0,12700.0,1.0
the logic of religion ,d02d28v,worldnews,news,1455656974.0,AtreidesMedia,1.0,0.0,2.0,5577.0,0.0
it s almost like the system wants us to rent  not own,d02r90u,worldnews,news,1455678112.0,dermotBlancmonge,1.0,0.0,5.0,36159.0,0.0
why does reddit close threads about stupid rap music downloading  yet leave threads open that help you find a database with the personal information of 70 million turks  eli5 ,d02dk3b,worldnews,news,1455657635.0,fskoti,11.0,0.0,1.0,1254.0,0.0
cool story islam,d02h4c0,worldnews,news,1455662507.0,TheClevelandHockey,12.0,0.0,856.0,3117.0,0.0
i ca nt wait to make these men proud european citizens,d028rea,worldnews,news,1455651270.0,johnson-p-daily,3.0,0.0,1.0,9.0,0.0
that makes b9oooooooo sense ,d02tz3b,worldnews,news,1455682704.0,Narfquadfecta,1.0,0.0,1.0,1045.0,0.0
terrorists using it as a base  weapons hidden in the basement you know how it goes ,d01khtj,worldnews,news,1455598208.0,L1terally_jabotinsky,-3.0,0.0,19.0,31.0,0.0
russia again ,d01eui7,worldnews,news,1455588952.0,bracciofortebraccio,2.0,0.0,1.0,17107.0,0.0
ah  abrahamic religions  stoning rape victims since 1000 bc ,d0250xp,worldnews,news,1455646233.0,YouMad,2.0,0.0,5396.0,41047.0,0.0
why does this news title sound like a headline from the news reporters on the show metalocalypse ,d02ez26,worldnews,news,1455659502.0,dvariables,2.0,0.0,105.0,1166.0,0.0
has this gone to trial ,d02b1na,worldnews,news,1455654318.0,BlondFaith,1.0,0.0,1.0,-100.0,0.0
people freak out about japan when norway  iceland and natives harvest far more whales then the japanese ever do ,d01up9g,worldnews,news,1455629538.0,ah_go_on_ya_will,16.0,0.0,71.0,5003.0,0.0
i want ti see someone actually have the balls and try and prosecute him,d01rv4g,worldnews,news,1455620414.0,pepperooni,1.0,0.0,1.0,259.0,0.0
the will send a couple of officers to arrest him ,d01ttfh,worldnews,news,1455627220.0,Burkabob,1.0,0.0,1.0,8264.0,1.0
any chance we can get bieber  tayswift or kanye in on this ,d02sdxv,worldnews,news,1455679974.0,Xtulu,1.0,0.0,177.0,8494.0,0.0
i m so glad that we gave such a westernized  stable  tolerant  and peaceful country billions of dollars and access to nuclear material ,d02oole,worldnews,news,1455674124.0,Fredfredbug4,3.0,0.0,1514.0,96289.0,1.0
i m surrounded by lakes of fresh water  yall can lick my balls,d01l5ui,worldnews,news,1455599522.0,Sumbodygonegethertz,113.0,0.0,1.0,2863.0,0.0
business has been dying to privatize water in canada but we re on to them  if they had their way  we would die of thirst in the middle of a wetland ,d01pds4,worldnews,news,1455610540.0,munster62,24.0,0.0,13.0,6765.0,0.0
this is the best tl  dr i could make   original   http  wwwhuffingtonpostcomentrywaterscarcitystudy_us_56c1ebc5e4b0b40245c72f5e  reduced by 97    i m a bot       gt  a dried up section of the new melones lake reservoir is seen which is now at less than 20 percent capacity as a severe drought continues to affect california on may 26  2015  gt  the american flag flies beside an almost dry section of the new melones lake reservoir which is now at less than 20 percent capacity as a severe drought continues to affect california on may 26  2015  gt  a dead tree is seen on a dried section of the new melones lake reservoir which is now at less than 20 percent capacity as a severe drought continues to affect california on may 24  2015          extended summary     http  npredditcomrautotldrcomments460s1iglobal_water_shortage_worse_than_predicted    faq   http  npredditcomrautotldrcomments31b9fmfaq_autotldr_bot  version 16   36723 tl  drs so far     theory   http  npredditcomrautotldrcomments31bfhttheory_autotldr_concept    feedback   http  npredditcommessagecompose  to   23autotldr  pms and comment replies are read by the bot admin  constructive feedback is welcome     top   keywords     california     1   drought     2   lake     3   june     4   water     5,d01jrc0,worldnews,news,1455596860.0,autotldr,3.0,0.0,18.0,106620.0,0.0
poor choice of title ,d01uet5,worldnews,news,1455628831.0,objectivedesigning,2.0,0.0,69.0,1013.0,0.0
only a fucking moron would believe this shit ,d02mynu,worldnews,news,1455671530.0,YetAnotherWTFMoment,1.0,0.0,86.0,719.0,0.0
one word desalination so what they are energy intensive  does that mean we should rather die of thirst ,d01spe7,worldnews,news,1455623682.0,_Perfectionist,0.0,0.0,198312.0,32708.0,0.0
its only 70  of the surface of the planet ,d02d6o7,worldnews,news,1455657137.0,Moleculartony,0.0,0.0,1.0,5003.0,0.0
lol  k,d01n8h0,worldnews,news,1455604166.0,crapper7,-2.0,0.0,1.0,265.0,0.0
haha  live around the five lakes one day we ll be selling water to all of you suckers for  100 a barrel,d01zx0s,worldnews,news,1455639066.0,phakov,-1.0,0.0,304.0,5524.0,0.0
few other countries are not in favor of monitoring the visitors behavior also not only facebook many others big portal do the same without knowing others google is also on of them ,d01lz9o,worldnews,news,1455601224.0,haydeneed,1.0,0.0,1.0,0.0,0.0
welcome to the millennial generation  young saudis ,d02tzrh,worldnews,news,1455682736.0,safety_jam,1.0,0.0,10193.0,28765.0,0.0
you almost made it edd gould ,d01sc5j,worldnews,news,1455622326.0,ZeDitto,3.0,0.0,139.0,5409.0,0.0
too bad they do nt have a retirement plan to slash ,d02di4q,worldnews,news,1455657562.0,NullMarker,0.0,0.0,2202.0,26834.0,1.0
at least he solved the obesity epidemic in his country ,d01sxl5,worldnews,news,1455624497.0,sirisaacneuton,1.0,0.0,56.0,651.0,0.0
i m so glad this article was posted typically when i see articles posted about cancer treatments on reddit it involves mixing some plant with alien cum and butt fucked into you or some other out of this world treatment that is nt really being discussed in the oncology community  car tcell therapy however  is definitely under a lot of discussion seattle seems to be leading the way but i m aware of at least two other facilities participating in car tcell trials at the moment  nih and baylor a lot of the physicians i work with see this as the next evolution in cancer therapy  hopefully one day replacing transplant this looks like an article written by those involved about the role of b cells in this process http  mbloodjournalorgcontent114244919fullpdf we may finally have a way to get the graft vs tumor effect provided by tcells without having gvhd associated with it ,d01yup5,worldnews,news,1455637444.0,gooch3803,2.0,0.0,1922.0,3764.0,0.0
cheeky feckers,d01k0ap,worldnews,news,1455597293.0,BradleyX,2.0,0.0,746.0,1932.0,0.0
west claim without any photos or video evidence,d01tdae,worldnews,news,1455625900.0,nicotoma,-10.0,0.0,1.0,-2.0,0.0
please reject this deal  iran ,d02sfgz,worldnews,news,1455680046.0,EnemyOfAllMankind,1.0,0.0,1.0,671.0,0.0
