text,id,subreddit,meta,time,author,ups,downs,authorlinkkarma,authorkarma,authorisgold
gt   more mistakes than achievements  if that was a criteria for getting booted out of office i think most politicians would be out after their first year ,d02k5wp,worldnews,news,1455667216.0,bob_marley98,1.0,0.0,254.0,14415.0,0.0
i am certain the guardian will issue a retractionbrawhawhaw  i amuse myself ,d02s7uf,worldnews,news,1455679693.0,Imapopulistnow,1.0,0.0,413.0,30756.0,0.0
gt  when the fishing gets tough  penguins simply pick up and move  i do nt wish to brag but i was right   https  wwwredditcomrworldnewscomments45jaoe150000_penguins_killed_after_giant_icebergczydzhv,d02g2rx,worldnews,news,1455661025.0,_The-Big-Giant-Head_,2.0,0.0,17485.0,9456.0,1.0
i m doing my part to keep those hard working vodkateers in business ,d02odz1,worldnews,news,1455673677.0,CaramelApplesRock,1.0,0.0,6.0,1347.0,0.0
give them a few years and they ll be back to being sand dwellers guns wo nt do them any good when the funds go dry ,d02p0h2,worldnews,news,1455674625.0,stellaraturd,1.0,0.0,1.0,36.0,0.0
we ve been activated   unzips ,d02snxo,worldnews,news,1455680445.0,littlebear_blackfoot,1.0,0.0,966.0,968.0,0.0
it s true all of it  middle earth the ring everything ,d01nvkf,worldnews,news,1455605865.0,sorren_uogl,390.0,0.0,25.0,1743.0,0.0
ca nt help thinking there s a wonderful scifi story waiting to be written here  about people who live on an island in a world where true giants  compared to them  exist on other islands around them  and where they have elephants  or similar  living with them  it s been a few years  i ca nt believe noone has done it yet ,d01kqvj,worldnews,news,1455598698.0,someguysaid,27.0,0.0,363.0,104732.0,0.0
not only is this likely going to be a successful deal for the company  it s going to help out cuban workers and farmers nice all around ,d00qa6g,worldnews,news,1455551966.0,letdogsvote,62.0,0.0,8979.0,410804.0,1.0
for comparison s sake  here s  a photo of a tractor driving through a town in cuba   http  iimgurcomudbznnbjpg  that i took in march 2011  i m glad to hear that this is happening but also concerned about the possible exploitation of cuban workers who  as has been pointed out  make an average of  20 usdmonth  as cuba transitions to a more capitalist economy  i hope we do nt end up with wealthy north american businesses turning cuba into another source of cheap labour like chinavietnametc but just a lot closer to mainland north america  i d much rather see cuba become a thriving mixed economy  retaining elements of their current socialist state  free education  healthcare  low infant mortality  etc  but with the various goods amp  services that increased capitalismreduced embargo will bring for example  when we visit as canadians  many cubans say they prefer if tourists bring gifts since they often can not use cash tips to buy items that are simply not available  everything from school supplies to medicine to food ,d00x666,worldnews,news,1455562201.0,headtale,19.0,0.0,1382.0,1547.0,1.0
no shit  a cuban man wearing an alabama crimson tide hoodie just walked into my job i asked him if he d ever been back after 38 years and he said   no  but maybe someday  when i told him about the factory being opened he looked like he wanted to cry he was so shocked and happy it kind made me tear up myself ,d011xuw,worldnews,news,1455569049.0,lardlad95,19.0,0.0,113.0,6474.0,0.0
my question is  how is the average jos  going to afford the  10000  the following solution  from the article does nt seem that it would be an option for the majority of private farmers   the men believe they can sell hundreds of the tractors a year to cuban farmers with financing from relatives outside the country and to nongovernment organizations seeking to help improve cuban agriculture  ,d00tb9r,worldnews,news,1455556638.0,Islandplans,23.0,0.0,1.0,1748.0,0.0
as a republican  this is something we really should give obama credit for so many presidents have come and gone with no progress this is a good thing ,d010kwd,worldnews,news,1455567095.0,DougSR01,28.0,0.0,3560.0,7987.0,0.0
united fruit company ,d00xytb,worldnews,news,1455563330.0,wile_E_coyote_genius,20.0,0.0,6.0,5336.0,0.0
yay more outsourcing ,d01ctzu,worldnews,news,1455585805.0,aceman1126,10.0,0.0,753.0,1403.0,0.0
congratulations srilanka  india had a real chance at this project it s the telecom big brothers who petitioned against it as there was a lot at stake for them in milking people from their need for internet ,d02ufh8,worldnews,news,1455683510.0,simtron,1.0,0.0,6.0,2893.0,0.0
me love low oil prices  me love azerbaijan ,d02ox3y,worldnews,news,1455674485.0,stellaraturd,2.0,0.0,1.0,36.0,0.0
this is the best tl  dr i could make   original   http  wwwnaturecomnewsthechipsaredownformooreslaw119338  wtmc_id  sfb_nnews_1508_rhbox  reduced by 97    i m a bot       gt  a rule of thumb that has come to dominate computing  mooreamp   039  s law states that the number of transistors on a microprocessor chip will double every two years or so  which has generally meant that the chipamp   039  s performance will  too  gt  at every stage  software developers came up with applications that strained the capabilities of existing chips  consumers asked more of their devices  and manufacturers rushed to meet that demand with nextgeneration chips  gt  second  to keep the chips moving along the mooreamp   039  s law performance curve despite the speed limit  they redesigned the internal circuitry so that each chip contained not one processor  or amp   039  coreamp   039   but two  four or more          extended summary     http  npredditcomrautotldrcomments465x7hthe_semiconductor_industry_will_soon_abandon_its    faq   http  npredditcomrautotldrcomments31b9fmfaq_autotldr_bot  version 16   37025 tl  drs so far     theory   http  npredditcomrautotldrcomments31bfhttheory_autotldr_concept    feedback   http  npredditcommessagecompose  to   23autotldr  pms and comment replies are read by the bot admin  constructive feedback is welcome     top   keywords     chip     1   moore     2   more     3   law     4   compute     5,d02p0x9,worldnews,news,1455674645.0,autotldr,3.0,0.0,18.0,106620.0,0.0
i really wish that they will bring the desmarais up vive le qu  bec libre ,d02oqjh,worldnews,news,1455674205.0,stellaraturd,1.0,0.0,1.0,36.0,0.0
this is the best tl  dr i could make   original   http  wwwindependentcouknewsukpoliticsttiptaxavoidancecorporationssuegovernmentstaxevasionisdsa6875061html  reduced by 79    i m a bot       gt  a controversial new trade deal between the eu and the united states could make it more difficult to fight tax avoidance  a new report has warned  gt  amp  quot  nick dearden  the director of global justice now said  amp  quot  despite the enormous public outcry over companies like google and amazon paying ridiculously small amounts of tax in the uk  the government is trying to sign us up to a trade deal that could effectively prevent us from bringing about laws that could address tax injustice  gt  tax justice campaigners including friends of the earth  the tax justice network  and global justice now have written to david cameron to draw his attention to the new evidence          extended summary     http  npredditcomrautotldrcomments4644zmttip_could_block_governments_from_cracking_down    faq   http  npredditcomrautotldrcomments31b9fmfaq_autotldr_bot  version 16   36930 tl  drs so far     theory   http  npredditcomrautotldrcomments31bfhttheory_autotldr_concept    feedback   http  npredditcommessagecompose  to   23autotldr  pms and comment replies are read by the bot admin  constructive feedback is welcome     top   keywords     tax     1   trade     2   deal     3   justice     4   government     5,d028pdu,worldnews,news,1455651197.0,autotldr,2.0,0.0,18.0,106620.0,0.0
how does the cpu core  scale so far  what are we up to  8 cores in personal computers ,d02p7ty,worldnews,news,1455674937.0,4daptor,2.0,0.0,694.0,3261.0,0.0
 campaign finance is a balancing act anywhere   http  iimgurcomo1n5jgif ,d02lt73,worldnews,news,1455669735.0,boston_shua,2.0,0.0,18224.0,27776.0,0.0
gt  second time in the same week that a hospital working with doctors without borders was targeted in an attack  the syrians and russians are sending dwbmsf a message  they have no patients  pardon the pun  for a group like msf treating their enemies in their own backyard ,d02nao5,worldnews,news,1455672036.0,lapalomablanca,2.0,0.0,445.0,-13.0,0.0
yeah  i m just going to go donate more money to dwb  russia and syria so you can both suck a fuck ,d02pa4f,worldnews,news,1455675038.0,I_DONT_READ_RESPONSE,1.0,0.0,1.0,3747.0,0.0
so is bombing dwb the norm now ,d02abav,worldnews,news,1455653344.0,GreenScreenOfDeath,1.0,0.0,30.0,1283.0,0.0
the report is about new taxes  not tax avoidance the point of a trade deal is to agree on how imports and exports will be taxed so yes this limits the type of taxes a member country can implement ,d02ipui,worldnews,news,1455664884.0,potatojoe88,1.0,0.0,260.0,2252.0,0.0
i think china figured out  probably accurately  too  that sternly worded letters and calls for stability are nt going to stop a massive buildup on that island i guess we re heading toward an inevitable shootdown of a us p8 plane  which will probably result in a diplomatic incident and then the us and allies backing off so as not to start a war  and a collapse of markets there  ,d02touo,worldnews,news,1455682202.0,hodyoaten,1.0,0.0,14671.0,188967.0,1.0
lol vietnam is about to get runned over by her big neighbor to the north ,d02s3dh,worldnews,news,1455679491.0,aulnet,1.0,0.0,1.0,1761.0,0.0
freudian slip ,d02dhxw,worldnews,news,1455657556.0,hoinurd,1.0,0.0,137.0,2814.0,0.0
so that makes it the second pentagon the saudis have destroyed   ,d02o2pg,worldnews,news,1455673205.0,xxxsultanxxxx,1.0,0.0,433.0,6311.0,0.0
my understanding is turkey and saudi arabia are supporting the groups  affiliated  with isis which are the resistant groups against assad the us media does nt want you to know because the us is an ally with saudi arabia ,d02ktib,worldnews,news,1455668241.0,AnitaTT,2.0,0.0,9290.0,3876.0,1.0
saudi arabia took part in airstrikes   did this coincide with the hospital that was bombed ,d02leam,worldnews,news,1455669123.0,IAmCowGodMoo,5.0,0.0,7444.0,2791.0,0.0
 they  the saudis  did participate in strikes over the weekend   said peter cook  a pentagon spokesman  in a tuesday news briefing he did not say specifically what the saudi actions were  or where title makes it sound as if they hit isis version of the pentagon but i think it means the info came from our pentagon ,d02cuyc,worldnews,news,1455656703.0,NewBroPewPew,4.0,0.0,774.0,6697.0,0.0
shame he seemed like a very nice person https  wwwyoutubecomwatch  v  c5p9j1wcgnm,d02scdb,worldnews,news,1455679900.0,mrupvot3s,1.0,0.0,91.0,4604.0,0.0
one of those  middle period  heads of an organization learning by doing how to bring nations together behind agreed upon principles a thankless task  necessarily working behind the scenes rather than generating memorable milestones  yet he was well respected  my one specific memory of his stewardship occurred on one of his birthdays  when letterman announced that everyone at the un had gotten together to get him another boutros  ,d02lcjo,worldnews,news,1455669050.0,91995,4.0,0.0,1.0,67.0,0.0
oh no oh no ,d02hshx,worldnews,news,1455663477.0,maschine01,1.0,0.0,1.0,83749.0,0.0
this is the best tl  dr i could make   original   http  wwwreuterscomarticleglobaloiliduskcn0vo2i2  reduced by 72    i m a bot       gt  new york brent oil fell almost 4 percent on tuesday  erasing early gains after top producers russia and saudi arabia dashed expectations of an outright supply cut by agreeing only to freeze output if other big exporters joined them  gt  benchmark brent prices jumped briefly through  35 a barrel after russia and saudi arabia agreed to keep output at january levels  in what could be the first joint opec and nonopec deal in 15 years  gt  qatari energy minister mohammad bin saleh alsada said the step would help to stabilise the oil market  which has experienced price declines not seen since the early 2000s because of a supply glut          extended summary     http  npredditcomrautotldrcomments464s00oil_loses_nearly_4_percent_as_hopes_over_saudi    faq   http  npredditcomrautotldrcomments31b9fmfaq_autotldr_bot  version 16   36974 tl  drs so far     theory   http  npredditcomrautotldrcomments31bfhttheory_autotldr_concept    feedback   http  npredditcommessagecompose  to   23autotldr  pms and comment replies are read by the bot admin  constructive feedback is welcome     top   keywords     price     1   output     2   early     3   supply     4   us     5,d02en04,worldnews,news,1455659069.0,autotldr,1.0,0.0,18.0,106620.0,0.0
who thinks that iraniraqsaudi arabia will be able to overcome their differences to make this happen ,d02ihjm,worldnews,news,1455664525.0,wolverhampton69,3.0,0.0,1597.0,590.0,0.0
that s awesome ,d02iku9,worldnews,news,1455664667.0,4daptor,2.0,0.0,694.0,3261.0,0.0
follow up story  nebraska thanks mexico and the drug trade for reminding people the state still exists ,d01hg4d,worldnews,news,1455593046.0,JonnyTheRobot,28.0,0.0,49.0,32.0,0.0
but how am i supposed to do two loads of laundry at once while at home ,d026jwe,worldnews,news,1455648296.0,tiamdi,3.0,0.0,943.0,76932.0,0.0
this is the best tl  dr i could make   original   http  wwwabcnetaunews20160217janruffohernecomfortwomanwwiijapanesegovernmentapology7174174  reduced by 81    i m a bot       gt  key points  adelaide woman jan ruffoamp   039  herne was a wwii comfort womanshe wants the japanese government to apologise and offer compensation to victimsshe hopes julie bishop will bring the issue up with japanese foreign minister  gt  she is still calling for japanese prime minister shinzo abe to apologise and offer compensation  a campaign that gained new momentum after he did offer words of regret and millions of dollars for a compensation fund in december  but only for the korean survivors  gt  it is a question she hoped might be answered by foreign minister julie bishop  in japan this week for talks  including with japanese foreign minister fumio kishida          extended summary     http  npredditcomrautotldrcomments466k78jan_ruffoherne_93yearold_australian_former    faq   http  npredditcomrautotldrcomments31b9fmfaq_autotldr_bot  version 16   37049 tl  drs so far     theory   http  npredditcomrautotldrcomments31bfhttheory_autotldr_concept    feedback   http  npredditcommessagecompose  to   23autotldr  pms and comment replies are read by the bot admin  constructive feedback is welcome     top   keywords     japanese     1   minister     2   family     3   war     4   rape     5,d02ug3l,worldnews,news,1455683540.0,autotldr,1.0,0.0,18.0,106620.0,0.0
party poopers ,d01xtab,worldnews,news,1455635752.0,AudioPanther,1.0,0.0,2606.0,697.0,0.0
bras and lollipops of meth  shipping pallets of cocaine  just waiting for a bathroom sink of  4 heroin,d01cxcc,worldnews,news,1455585958.0,Mercc96,15.0,0.0,12867.0,9967.0,0.0
first you lick then you scratch scratch ,d01h6a8,worldnews,news,1455592618.0,Sluttybuttersauce,11.0,0.0,1.0,2548.0,0.0
there are going to be a lot of pissed off toddlers going through withdrawal in nebraska ,d01l2c8,worldnews,news,1455599329.0,batkevn,5.0,0.0,494.0,13699.0,0.0
i ll take potential heavy metal band names for 1000  alex ,d022fom,worldnews,news,1455642676.0,emthreeve,1.0,0.0,1.0,681.0,0.0
i guess you could just take sick leave if the pain was getting to you  do nt really get why this is a separate law ,d02od1b,worldnews,news,1455673636.0,JavaX_SWING,1.0,0.0,4280.0,3332.0,0.0
prease reave  you go   https  wwwyoutubecomwatch  v  68rl4lkwizq,d02rtxk,worldnews,news,1455679059.0,wompwompwomp2,1.0,0.0,1.0,2636.0,0.0
it s meth for kids ,d02m7my,worldnews,news,1455670350.0,InfinityTortellino,1.0,0.0,571.0,1382.0,0.0
i remember in another thread talking about candy flavour someone mentioned meth we got a laugh saying it was nt a real flavour turns out this guy was just ahead of the curve,d0247pr,worldnews,news,1455645127.0,wired_warrior,1.0,0.0,22.0,2154.0,0.0
this could get bad,d025mmd,worldnews,news,1455647048.0,Soghain,3.0,0.0,71.0,2547.0,1.0
so now i have to drive all the way to mexico to get my meth lollipops  this nafta thing really sucks ,d02g0ie,worldnews,news,1455660935.0,FluffyBunnyHugs,1.0,0.0,1468.0,108491.0,1.0
but i thought you fought terrorism by shopping ,d027o6f,worldnews,news,1455649807.0,thyusername,2.0,0.0,937.0,13229.0,0.0
well that methpop would just be doubly bad for those poor huskers  teeth ,d01d2ng,worldnews,news,1455586188.0,ttufizzo,-2.0,0.0,419.0,12500.0,0.0
sounds like a hell of a marketing idea ,d01raou,worldnews,news,1455618042.0,shamethebastards,1.0,0.0,1.0,382.0,0.0
stifled laugh at work over the comments ,d026kpz,worldnews,news,1455648327.0,00910,1.0,0.0,1.0,184.0,0.0
save your money so it can be deflated to nothing  are they trying to solve a trade imbalance ,d0279l9,worldnews,news,1455649248.0,fluxtime,1.0,0.0,15.0,2349.0,0.0
that s messed up  but japan always has been hard nosed about apologizing for their atrocities ,d02rb04,worldnews,news,1455678201.0,username_004,1.0,0.0,3.0,21765.0,1.0
good they ll finally have to grow an economy ,d026c1t,worldnews,news,1455648004.0,SneezingTurtle,-1.0,0.0,4438.0,29676.0,0.0
ukrainian politics is a fucking circus  2004  people are poor and generally fucked  yanukovich is a thief and a crony  never accept him for presidency  to barricades comrades  2010  people are still poor and fucked  turns out yushenko was even worse let s vote for yanukovich now  2014  people are still fucked  let s go to barricades again  poroshenko ca nt be any worse than this  right guys  2016  people are more fucked than ever premier is a assigned a scapegoat role  what s next  guys  more barricades  that worked so well for you in the last 10 years ,d021rvm,worldnews,news,1455641734.0,fubarbazqux,31.0,0.0,22.0,1609.0,0.0
i was always under the impression that yatsenyuk is one of the good guys  i thought poroshenko is the one who might be a bit corrupt can anyone from ukraine explain what the general public thinks of this  did he really mess up or is he the fall guy  or is poroshenko just trying to get rid of competition ,d0215nf,worldnews,news,1455640864.0,NoolanD,-2.0,0.0,103.0,2489.0,0.0
maybe he should call victoria nulandshe gave him the job in the first place ,d023v16,worldnews,news,1455644646.0,ZorgLives,17.0,0.0,39.0,2207.0,0.0
canada to go through the motions of pretending the govt s opinion extends beyond where its sovereignty ends ftfy ,d02avpj,worldnews,news,1455654104.0,Mtlguy,2.0,0.0,8.0,9784.0,0.0
we always seem to have money for noncanadians ,d029aht,worldnews,news,1455651978.0,JustinThrewDough,2.0,0.0,1142.0,12023.0,0.0
this is the best tl  dr i could make   original   http  economictimesindiatimescomindustryconsproductsfoodcocacolaindiashuts3plantscitinginadequatedemandarticleshow50953581cms  reduced by 80    i m a bot       gt  the spokesman of hindustan cocacola beverages  cocacolaamp   039  s bottling company  said production at the kaladera plant had been halted because of lack of demand in the region and not due to charges of water depletion  gt  in india  cocacolaamp   039  s plants are split between companyowned and franchisee bottlers  with both operating 24 plants each  gt  activist group irc said it has proof that a cocacola representative told workers that production at kaladera was shut down on january 25  2016  and there is no possibility of resuming in the future  the plant has incurred financial losses  the availability of groundwater and raw materials has become difficult and that the plant will now serve as a storage and distribution centre          extended summary     http  npredditcomrautotldrcomments460ybkcocacola_india_shuts_3_plants_citing_inadequate    faq   http  npredditcomrautotldrcomments31b9fmfaq_autotldr_bot  version 16   36733 tl  drs so far     theory   http  npredditcomrautotldrcomments31bfhttheory_autotldr_concept    feedback   http  npredditcommessagecompose  to   23autotldr  pms and comment replies are read by the bot admin  constructive feedback is welcome     top   keywords     plant     1   kaladera     2   cocacola     3   being     4   water     5,d01l5nu,worldnews,news,1455599512.0,autotldr,3.0,0.0,18.0,106620.0,0.0
they were depleting the poisoned water supply to make poisoned soda ,d02h1t5,worldnews,news,1455662404.0,SoCo_cpp,1.0,0.0,24174.0,83120.0,0.0
rabolish ,d01w3k8,worldnews,news,1455632612.0,DonManuel,4.0,0.0,112118.0,13713.0,0.0
this is the best tl  dr i could make   original   http  wwwbbccomnewsworlduscanada35561449  reduced by 86    i m a bot       gt  one of the headlines to come out of the new budget was a quadrupling of spending on us military preparations to defend allies in europe  gt  the line item in the pentagonamp   039  s budget shows an increase from  789m to  34bn on measures to improve readiness in europe  gt  proposed pentagon budget for 2017  total   5827bn research and development   714bn aviation procurement   453bn submarines   81bn fighting islamic state   75bn cyber budget   7bn european reassurance initiative   34bn munitions   18bn since pledging to boost spending in 2014  several east european nato members have announced increases          extended summary     http  npredditcomrautotldrcomments466k4dus_remains_reluctantly_tied_to_global_security    faq   http  npredditcomrautotldrcomments31b9fmfaq_autotldr_bot  version 16   37047 tl  drs so far     theory   http  npredditcomrautotldrcomments31bfhttheory_autotldr_concept    feedback   http  npredditcommessagecompose  to   23autotldr  pms and comment replies are read by the bot admin  constructive feedback is welcome     top   keywords     budget     1   europe     2   spend     3   defence     4   nato     5,d02ufax,worldnews,news,1455683501.0,autotldr,1.0,0.0,18.0,106620.0,0.0
those fucking liberals  where is the legalized marijuana you promised ,d01yuxm,worldnews,news,1455637455.0,phakov,18.0,0.0,304.0,5524.0,0.0
they must drink coke in pakistan if they drink pepsi in india,d01z00k,worldnews,news,1455637676.0,Sumbodygonegethertz,19.0,0.0,1.0,2863.0,0.0
this is the best tl  dr i could make   original   http  wwwreuterscomarticleuschinarightsunresponseiduskcn0vq003  reduced by 84    i m a bot       gt  china said guiamp   039  s case was complicated and involved all the other booksellers  who were being held for investigation  gt  china said all the cases raised by zeid involved criminal activities and had nothing to do with restricting rights  gt  another case  against a group of labor activists in guangdong province  involved people using overseas funds to intervene in chinese labor disputes  and some accusations of fraud  adultery and embezzlement  china said          extended summary     http  npredditcomrautotldrcomments465x8schina_says_missing_bookseller_doesnt_want_his    faq   http  npredditcomrautotldrcomments31b9fmfaq_autotldr_bot  version 16   37026 tl  drs so far     theory   http  npredditcomrautotldrcomments31bfhttheory_autotldr_concept    feedback   http  npredditcommessagecompose  to   23autotldr  pms and comment replies are read by the bot admin  constructive feedback is welcome     top   keywords     china     1   case     2   involved     3   police     4   lee     5,d02p16q,worldnews,news,1455674657.0,autotldr,1.0,0.0,18.0,106620.0,0.0
coke has been replaced by thums up  ,d01twmy,worldnews,news,1455627472.0,raktha_sindhuram,4.0,0.0,13472.0,8796.0,0.0
er  g washington has a speech saying not to go over seas fighting europes wars for them it only changed right before america got into the first world war it was even a major subject during the elections at the time ,d02t31q,worldnews,news,1455681141.0,Gothicjaysus,1.0,0.0,2.0,1956.0,0.0
it always feels weird when a news article is posted by an op who clearly has an agenda that s a pretty impressive post history ,d02ttkv,worldnews,news,1455682431.0,krejnogawdnab,1.0,0.0,1.0,895.0,0.0
so  it has begun remember this moment people  this is like watching the opening event of a decades long olympics  but the stakes are that all our lives hang perilously in the balance remember this moment this is where it went from tensions to a confrontationconflict ,d02r3i1,worldnews,news,1455677864.0,GrowlingTaco,1.0,0.0,7783.0,3376.0,0.0
