text,id,subreddit,meta,time,author,ups,downs,authorlinkkarma,authorkarma,authorisgold
i like to think that there s some underlying narrative where a group of mps are always getting caught watching porn and they come up with the excuse that it s all research for these  morality  laws  it s been happening for years and now people want results so they reluctantly put it forward and everyone feel forced to support it because they ca nt be seen to be proporn even though they ve likely been watching it since they were kids  dispite everything  there will always be those people who always gets caught watching bootleg porn and the laws will escalate until sex itself becomes illegal and soon after emotions and eventuality individuality  and that is how the terrorists will win ,d02ca6x,worldnews,news,1455655922.0,SloMoMonday,9.0,0.0,1109.0,2373.0,0.0
probable outcome  they wont do shit ,d01uqya,worldnews,news,1455629650.0,DinaDinaDinaBatman,1.0,0.0,2213.0,48064.0,0.0
i think the uk government sites should be blocked because frankly im sick of them fucking us over ,d02le5o,worldnews,news,1455669117.0,brainhack3r,1.0,0.0,4144.0,24922.0,0.0
more refugees please,d02p4p3,worldnews,news,1455674806.0,Eatitmate,2.0,0.0,1.0,433.0,0.0
take a note raustralia  we are heading down this road as well,d02u7wn,worldnews,news,1455683132.0,Mister__S,1.0,0.0,10865.0,10082.0,0.0
ecoterrorists ,d01ohjt,worldnews,news,1455607643.0,Cosmic_Bard,40.0,0.0,1986.0,39940.0,0.0
as someone who works in the social housing sector i honestly see a lot of our clients are better off than the staff they get their rent and bills heavily reduced and they get funding for other areas like furniture seems like this is the way the housing industry is headed ,d02t9ex,worldnews,news,1455681449.0,jaysaber,1.0,0.0,1.0,81.0,0.0
great job fred hutchinson cancer research center in seattle  us  ,d01mive,worldnews,news,1455602465.0,spacelordmofo,10.0,0.0,1.0,3196.0,0.0
am a 27yo  us resident i honestly feel like i have no hope of owning a home renting is supposed to be the  cheaper  alternative and even then the cost is absurd so do nt feel too bad my british ally you re not alone  ,d02qnn3,worldnews,news,1455677170.0,10_Virtues,-1.0,0.0,1.0,2240.0,0.0
there are lots of nations breaching un and international law in front of the worlds witnessing media yet all the un are capable of doing is  sometimes  managing to string a strongly worded condemnation together  what s that ban ki    you re urging restraint by all parties   well that will fix everything wo nt it  feckless and impotent reminds me of this http  youtubeyawagq6llra,d01bfqn,worldnews,news,1455583590.0,EvelcyclopS,3.0,0.0,903.0,1345.0,0.0
 lol  kj un,d01kwg9,worldnews,news,1455599000.0,Big_Test_Icicle,2.0,0.0,34779.0,43181.0,0.0
no way is that guy funny enough to come up with all those cards ,d01tklz,worldnews,news,1455626515.0,Misfitg,1.0,0.0,141.0,5779.0,0.0
i am sure there is a power that he will answer to eventually ,d01sjd5,worldnews,news,1455623085.0,mad-n-fla,1.0,0.0,1.0,15524.0,0.0
that s it  kim  you re under arrest  you broke the law  and are going to jail ,d01mo6n,worldnews,news,1455602808.0,Finaglers,1.0,0.0,3764.0,6231.0,0.0
this article is satire  but it was nt meant to be,d01zugl,worldnews,news,1455638958.0,iolex,1.0,0.0,3.0,7686.0,0.0
well i m deeply surprised and  to be frank  shocked about this unexpected development who could have predicted such an outcome  s guys ,d01lb1b,worldnews,news,1455599818.0,evilbunny_50,12.0,0.0,544.0,1832.0,0.0
i would think that n korea would assume that anyway ,d02u0wk,worldnews,news,1455682790.0,Zodiac13,1.0,0.0,265.0,4072.0,0.0
hey  my mom works for some charity that was involved with this stuff  nice ,d01lvm6,worldnews,news,1455601004.0,assrielmeemurr,5.0,0.0,3475.0,8161.0,0.0
ttip is very questionable and mostly corporations and the hegemony of the usa profit from it ,d02kjt1,worldnews,news,1455667824.0,VishnuX,4.0,0.0,21.0,757.0,0.0
this is the best tl  dr i could make   original   http  wwwindependentcouknewsukpoliticsttiptaxavoidancecorporationssuegovernmentstaxevasionisdsa6875061html  reduced by 79    i m a bot       gt  a controversial new trade deal between the eu and the united states could make it more difficult to fight tax avoidance  a new report has warned  gt  amp  quot  nick dearden  the director of global justice now said  amp  quot  despite the enormous public outcry over companies like google and amazon paying ridiculously small amounts of tax in the uk  the government is trying to sign us up to a trade deal that could effectively prevent us from bringing about laws that could address tax injustice  gt  tax justice campaigners including friends of the earth  the tax justice network  and global justice now have written to david cameron to draw his attention to the new evidence          extended summary     http  npredditcomrautotldrcomments4644zmttip_could_block_governments_from_cracking_down    faq   http  npredditcomrautotldrcomments31b9fmfaq_autotldr_bot  version 16   36930 tl  drs so far     theory   http  npredditcomrautotldrcomments31bfhttheory_autotldr_concept    feedback   http  npredditcommessagecompose  to   23autotldr  pms and comment replies are read by the bot admin  constructive feedback is welcome     top   keywords     tax     1   trade     2   deal     3   justice     4   government     5,d028pdu,worldnews,news,1455651197.0,autotldr,2.0,0.0,18.0,106620.0,0.0
the report is about new taxes  not tax avoidance the point of a trade deal is to agree on how imports and exports will be taxed so yes this limits the type of taxes a member country can implement ,d02ipui,worldnews,news,1455664884.0,potatojoe88,1.0,0.0,260.0,2252.0,0.0
 the supreme court was acting on a petition by environmental activists led by greenpeace  greenpeace  the environmental jerk twin of peta ,d02qig4,worldnews,news,1455676948.0,SpermWhale,6.0,0.0,2286.0,144992.0,0.0
these antigmo conspiracy theorists would kill millions to promote thier ideology  they have lost the battle of science  law and common sense in the first world and now they are focusing in developing countries ,d02q9td,worldnews,news,1455676577.0,adamwho,6.0,0.0,2062.0,46816.0,0.0
this is the best tl  dr i could make   original   http  wwwreuterscomarticlephilippinesgmoidusl3n15w021  reduced by 87    i m a bot       gt  philippine govt agencies scrambling to issue new gmo rules  gt  government agencies are scrambling to set new regulations on gmos by feb 23 after the southeast asian nationamp   039  s top court late last year demanded an overhaul of existing rules  halting gm planting and issuance of new gm import permits until that was done  gt  amp  quot  our framework has served as a model for gmo regulatory policy to other countries like vietnam  indonesia and even some latin american countriesamp  quot  said merle palacpac  chief of the plant quarantine service at the bureau of plant industry          extended summary     http  npredditcomrautotldrcomments465spnasia_watches_as_gmo_legal_challenge_threatens    faq   http  npredditcomrautotldrcomments31b9fmfaq_autotldr_bot  version 16   37021 tl  drs so far     theory   http  npredditcomrautotldrcomments31bfhttheory_autotldr_concept    feedback   http  npredditcommessagecompose  to   23autotldr  pms and comment replies are read by the bot admin  constructive feedback is welcome     top   keywords     gmo     1   rules     2   country     3   philippine     4   corn     5,d02nvf9,worldnews,news,1455672898.0,autotldr,1.0,0.0,18.0,106620.0,0.0
i was wondering if penguins where that stupid ,d02ho0d,worldnews,news,1455663294.0,I_Key_Cars,3.0,0.0,2.0,127117.0,0.0
oh look  a hole ,d02gdzr,worldnews,news,1455661460.0,InformedChoice,2.0,0.0,833.0,4465.0,0.0
common sense vs feelings i predict feelings by a landslide keep feeling bad people ,d02dpg1,worldnews,news,1455657833.0,nvkylebrown,4.0,0.0,49.0,16552.0,0.0
gt  when the fishing gets tough  penguins simply pick up and move  i do nt wish to brag but i was right   https  wwwredditcomrworldnewscomments45jaoe150000_penguins_killed_after_giant_icebergczydzhv,d02g2rx,worldnews,news,1455661025.0,_The-Big-Giant-Head_,2.0,0.0,17485.0,9456.0,1.0
original story highly suspect ,d02fvu1,worldnews,news,1455660755.0,TOMapleLaughs,2.0,0.0,191.0,8589.0,0.0
i am certain the guardian will issue a retractionbrawhawhaw  i amuse myself ,d02s7uf,worldnews,news,1455679693.0,Imapopulistnow,1.0,0.0,413.0,30756.0,0.0
 paris s   veille  means  paris awakens   if anyone is wondering ,d02qo14,worldnews,news,1455677188.0,evilcounsel,16.0,0.0,2271.0,13269.0,0.0
 those guys rocks  i will now escort myself out apologies for the inconvenience ,d02oeis,worldnews,news,1455673700.0,iwillmakeyourgfcum,4.0,0.0,120.0,248.0,0.0
why do some people act like these guys are heroes or something ,d02qmwq,worldnews,news,1455677139.0,SameSexDictator,-10.0,0.0,22.0,48.0,0.0
by the way  he s proeveryonegun and a trump supporter  and those isis scum were nt gunning for them  they were gunning for anyone most likely those at the football stadium  the singer ran immediately from the stage so not much of what happened is really their story it s more about the victims and a tragedy that happened in france ,d02opcv,worldnews,news,1455674155.0,Zodiac13,-18.0,0.0,265.0,4072.0,0.0
gt   more mistakes than achievements  if that was a criteria for getting booted out of office i think most politicians would be out after their first year ,d02k5wp,worldnews,news,1455667216.0,bob_marley98,1.0,0.0,254.0,14415.0,0.0
this is the best tl  dr i could make   original   http  wwwdwcomenukrainepmarsenyyatsenyuksurvivesnoconfidencevotea19052526  reduced by 72    i m a bot       gt  arseniy yatsenyuk maintained his position as ukraineamp   039  s prime minister after ukraineamp   039  s parliament  the verkhovna rada  rejected a noconfidence vote against him  gt  earlier on tuesday  president petro poroshenko asked yatsenyuk to step down  suggesting a amp  quot  total reformattingamp  quot  of the cabinet and saying his government had lost public support and committed amp  quot  more mistakes than achievementsamp  quot  poroshenko  who heads ukraineamp   039  s largest party  has joined hands with yatsenyukamp   039  s party to form a coalition government in the center  gt  yatsenyuk became prime minister in 2014  shortly after protests in ukraine succeeded in ousting former president viktor yanukovych          extended summary     http  npredditcomrautotldrcomments465ex2ukraine_pm_yatsenyuk_survives_noconfidence_vote    faq   http  npredditcomrautotldrcomments31b9fmfaq_autotldr_bot  version 16   37006 tl  drs so far     theory   http  npredditcomrautotldrcomments31bfhttheory_autotldr_concept    feedback   http  npredditcommessagecompose  to   23autotldr  pms and comment replies are read by the bot admin  constructive feedback is welcome     top   keywords     ukraine     1   yatsenyuk     2   president     3   poroshenko     4   reforms     5,d02kaw4,worldnews,news,1455667433.0,autotldr,1.0,0.0,18.0,106620.0,0.0
unecessary comment of the day  every time someone mentions unsc i think they are talking about the united nations space command  not the security counci ,d02ils2,worldnews,news,1455664708.0,DOOM_INTENSIFIES,9.0,0.0,22.0,646.0,0.0
this is the best tl  dr i could make   original   https  wwwrtcomnews332682unscturkeyfirekurds  reduced by 76    i m a bot       gt  the un security council received a letter from the syrian government in which damascus condemned turkeyamp   039  s attacks in the north of syria  ramirez explained  noting that the entire council expressed amp  quot  concernamp  quot  about these violations  gt  when asked if the unsc discussed the shelling of the hospitals and schools in northern syria on monday which left close to 50 people dead  ramirez said the council indeed discussed the issue  but reached amp  quot  no agreementamp  quot  or amp  quot  consensusamp  quot  because of amp  quot  different sourcesamp  quot  of information on the incidents  gt  amp  quot  we have urged the ypg to avoid moves that will heighten tensions with turkey but at the same time we have also urged turkey to cease any artillery its artillery fire across the border          extended summary     http  npredditcomrautotldrcomments46598run_security_council_urges_turkey_to_stop_shelling    faq   http  npredditcomrautotldrcomments31b9fmfaq_autotldr_bot  version 16   36997 tl  drs so far     theory   http  npredditcomrautotldrcomments31bfhttheory_autotldr_concept    feedback   http  npredditcommessagecompose  to   23autotldr  pms and comment replies are read by the bot admin  constructive feedback is welcome     top   keywords     turkey     1   syria     2   ramirez     3   council     4   unsc     5,d02iw4y,worldnews,news,1455665155.0,autotldr,2.0,0.0,18.0,106620.0,0.0
just park the unsc infinity above turkey and call it a day  nobody is going to argue with a 56km long space warship ,d02mwwi,worldnews,news,1455671455.0,intencemuffin,1.0,0.0,76.0,8184.0,0.0
i would have expected this to be bigger news  i guess for most people here he was sort of before their time ,d02iqvh,worldnews,news,1455664928.0,Loki-L,3.0,0.0,47573.0,243727.0,1.0
this makes me super super sad ,d02jk63,worldnews,news,1455666182.0,Jakesteeed,3.0,0.0,8.0,20380.0,0.0
one of those  middle period  heads of an organization learning by doing how to bring nations together behind agreed upon principles a thankless task  necessarily working behind the scenes rather than generating memorable milestones  yet he was well respected  my one specific memory of his stewardship occurred on one of his birthdays  when letterman announced that everyone at the un had gotten together to get him another boutros  ,d02lcjo,worldnews,news,1455669050.0,91995,4.0,0.0,1.0,67.0,0.0
shame he seemed like a very nice person https  wwwyoutubecomwatch  v  c5p9j1wcgnm,d02scdb,worldnews,news,1455679900.0,mrupvot3s,1.0,0.0,91.0,4604.0,0.0
great name  sad to see him go ,d02tn7w,worldnews,news,1455682123.0,Victor_Zsasz,1.0,0.0,1.0,15868.0,0.0
oh no oh no ,d02hshx,worldnews,news,1455663477.0,maschine01,1.0,0.0,1.0,83749.0,0.0
00063 angolan kwanza  1 us dollar because i had to check to see if kwanza was a real currency ,d02mrhv,worldnews,news,1455671222.0,CommonCentsEh,3.0,0.0,2159.0,336.0,0.0
i know the capitol is luanda that is all i got here ,d02mo50,worldnews,news,1455671076.0,PabstyLoudmouth,1.0,0.0,106269.0,128307.0,1.0
grow and consume local would be best way around this,d02ucxp,worldnews,news,1455683384.0,Mister__S,1.0,0.0,10865.0,10082.0,0.0
i have not read this but i assume that the person that made this breakthrough was killed by big farma  and the breakthrough is a diet low in cheese ,d01xur2,worldnews,news,1455635822.0,morgan3000,2.0,0.0,1.0,13.0,0.0
my dad is enrolled in a clinical study using the same method at the city of hope in california he was under the care of some of the best oncologists in america and none of the traditional therapies  chemo  radiation  worked for him since he d have horrible reactions to the treatments his doctors at university of san francisco gave up on him a doctor at md anderson center recommended this study  he has nonhodgkins bcell lymphoma in the 4th stage his tcells were extracted from his blood and the cars have been attached he has not yet had the modified cells given back to his body yet due to some unseen complications so his process is on hold while he s been under a different treatment  what s interesting about his particular study  which may apply to the one in the article but i m not sure  is that hiv is somehow used to help in his study  there is a relatively small likelihood of contracting hiv  but the benefits seem to outweigh the costs upwards of 80  of participants with his condition in this study have gone into remission  it s quite remarkable  here s a link to the study i m talking about  http  clinicaltrialscohorgstudy_displayaspx  pid  15209amp  lan  en and a link to some of this doctor s other studies she s incredible  http  clinicaltrialscohorgspecific_resultaspx  pers  177792 also  since my dad was placed on hold for the car tcell study  he was enrolled in another i do nt know the specifics for this one  but it s one of the ones listed in the link above after his first treatment of the type of  chemo  he s trying  he had a 40  decrease in cancer cells  which is at the cusp of going into remission we re so flippin excited ,d01pl72,worldnews,news,1455611266.0,diverticultis,145.0,0.0,2165.0,1508.0,0.0
cry me a river ,d02ik2y,worldnews,news,1455664635.0,quentim,81.0,0.0,1.0,2062.0,0.0
there was an old saudi royal  i ca nt remember who  who was quoted as saying something of the following   my grandfather rode a camel  my father a toyota  i drive a mercedes  but my son will drive a toyota  and his grandson  a camel ,d02fmlw,worldnews,news,1455660394.0,di11deux,51.0,0.0,314.0,15811.0,0.0
they use fucking slaves ,d02io31,worldnews,news,1455664809.0,jjswibbs,25.0,0.0,1.0,6071.0,0.0
gt  for decades  the royal family has used the kingdom  s immense oil wealth to lavish benefits on its people  including free education and medical care  generous energy subsidies and wellpaid  and often undemanding  government jobs no one paid taxes  and if political rights were not part of the equation  that was fine with most people  how terrible now that they re no longer getting spoiled  they ll have to work harder like the rest of the world ,d02qhu0,worldnews,news,1455676921.0,SunsetChaos,19.0,0.0,4.0,377.0,0.0
welcome to the rest of the world ,d02q0xz,worldnews,news,1455676194.0,Deranged_Kitsune,6.0,0.0,115.0,6172.0,0.0
when i read this article  i thought about our neighbors  particularly brunei  and how since the 1980s they have been trying to diversify away from oil but still ca nt do so because the allure of cheap petro dollars is just too great brunei has since harden it stance on religion  and i think it has less to do with piousness than to have a control over its citizens and potential dissent ,d02s9ot,worldnews,news,1455679778.0,raytoei,1.0,0.0,1.0,386.0,0.0
70  of saudis are under 30 years of age that speaks of a rapidlygrowing population thanks to dual enablers  generous economic subsidies and fundamentalist patriarchial religion  saudi arabia is projected to be wholly dependent on imported wheat and other foods within 12 years  they stopped trying to grow wheat to be selfsufficient about 10 years ago  after realizing their aquifers would soon depleted  oil prices are low due to a worldwide decline in demand they may increase again  but likely will drop again as rising prices choke growth  the youth of saudi arabia will find themselves in a bind similar to what the tunisians  algerians  libyans  egyptians  syrians  etc have gone through ,d02hb84,worldnews,news,1455662781.0,hillsfar,26.0,0.0,92352.0,57270.0,0.0
i wonder if we ll see an outflux of wannabe jihadists  like we have in previous eras when oil prices crashed it was after the oil price crash in 85  which was caused by saudi arabia pumping up oil production to knock iran during the iraniraq war  that the major influx of saudi jihadist volunteers went to afghanistan  and during the 90s many saudis went to bosnia and chechnya and fought in wars there a lot of this was explicitly supported by the saudi ruling elites  seemingly as a way to deal with the domestic problems that low oil prices bring  see  the research by thomas hegghammer  who s done a lot of great academic research on salafijihadism  ,d02r7c5,worldnews,news,1455678039.0,arjun101,5.0,0.0,9966.0,12563.0,1.0
so good to hear this news finally  lazy saudi youth will learn how to work hard like the rest of the world,d02pyzo,worldnews,news,1455676110.0,poker_deewana3,6.0,0.0,52.0,42.0,0.0
 i has the sad face   http  iimgurcomkz9gr0tjpg  1 ,d02q2mu,worldnews,news,1455676267.0,iateeggsandbeans,3.0,0.0,1.0,3.0,0.0
saudis work ,d02rqow,worldnews,news,1455678914.0,KeavesSharpi,1.0,0.0,1020.0,45474.0,0.0
so abdul only gets 5 ferraris and 3 bentleys in 2016 instead of 10 each ,d02p666,worldnews,news,1455674865.0,isonem,6.0,0.0,1.0,7008.0,0.0
splendid  indeed ,d02qbgy,worldnews,news,1455676650.0,Huge_Middle_Finger,3.0,0.0,85.0,48222.0,1.0
gt  the oil shock has meant a lowering of expectations as they face the likelihood that they will have to   work harder than their parents     actually work   ftfy,d02t4mf,worldnews,news,1455681217.0,pussy_seizure,1.0,0.0,853.0,2919.0,0.0
welcome to the party ,d02o8f0,worldnews,news,1455673444.0,whodidthistoyou,4.0,0.0,362.0,3240.0,0.0
good maybe they can start working to fix their shitty society while they re at it ,d02s5eo,worldnews,news,1455679581.0,EnemyOfAllMankind,1.0,0.0,1.0,671.0,0.0
how tragic hope they remember how to herd sheep ,d02s7vw,worldnews,news,1455679695.0,italianfatman,1.0,0.0,22.0,83.0,0.0
unfortunately  this will really only fuel the radicalization of the saudi ,d02szdq,worldnews,news,1455680970.0,DemeaningSarcasm,1.0,0.0,639.0,53081.0,0.0
haa ha ,d02t0p0,worldnews,news,1455681030.0,Nollic13,1.0,0.0,1.0,441.0,0.0
could nt happen to a nicer group of religious authoritarians ,d02thoy,worldnews,news,1455681850.0,dmoore13,1.0,0.0,1.0,12378.0,1.0
its not like half of  younger saudis  are secondclass citizen hostage of islamism with no true legal right to work  fuck the other half younger saudi this country never deserved its money  edit  am i the only one to see the irony one of the biggest oil producers will not be able to switch back to desert rurale society because of global warming they produced ,d02u6d5,worldnews,news,1455683059.0,Fennec_Murder,1.0,0.0,2.0,922.0,0.0
sounds just like canada,d02mlee,worldnews,news,1455670953.0,doingthiswhilepoopin,2.0,0.0,1.0,1138.0,0.0
i guess those towels will come in handy when all those royal heads start falling off ,d02i1i8,worldnews,news,1455663851.0,x-2y,2.0,0.0,14892.0,1735.0,0.0
no different than most people everywhere,d02o35h,worldnews,news,1455673224.0,putin_bot_0023456,2.0,0.0,1.0,184.0,0.0
while they do the same work as foreigners  they earn much more salaries for foreign crew start at  320 a month  while saudis get  1460  part of which is subsidized by the government  discrimination  west does not even protestbecause oil matters the most,d02q7lt,worldnews,news,1455676479.0,poker_deewana3,2.0,0.0,52.0,42.0,0.0
this thread is full of salty racists,d02tqeu,worldnews,news,1455682276.0,moltenmoose,1.0,0.0,2.0,800.0,0.0
same as the rest of generation y  then ,d02fcfp,worldnews,news,1455660001.0,Jarmatus,1.0,0.0,22.0,15159.0,1.0
at least we have something in common now ,d02kf8i,worldnews,news,1455667621.0,BoaconicNoblewomen,1.0,0.0,1.0,295.0,0.0
just like the rest of the world then ,d02txuh,worldnews,news,1455682640.0,7LeagueBoots,1.0,0.0,463.0,24898.0,0.0
welcome to the millennial generation  young saudis ,d02tzrh,worldnews,news,1455682736.0,safety_jam,1.0,0.0,10193.0,28765.0,0.0
gt  as they face the expectation that they will have to actually work  unlike their parents  ftfy ,d02u0fx,worldnews,news,1455682767.0,richmomz,1.0,0.0,8716.0,139976.0,0.0
we know that it was the saudi s who funded 911 and i also happen live in nyc and was here on that very day maybe it s not very spiritual of me but anytime i read bad news about saudi arabia i do nt give a shit so these young saudi s are going to have to work harder than their parents  add that to not being allowed to have a beer or sex do nt care about saudis,d02ufw1,worldnews,news,1455683530.0,rit56,1.0,0.0,126728.0,12774.0,0.0
this is the best tl  dr i could make   original   https  wwwnytimescom20160217worldmiddleeastyoungsaudisseecushyjobsvanishalongwithnationsoilwealthhtml  reduced by 93    i m a bot       gt  the fat years left the economy poorly structured  economists say  90 percent of government revenues are from oil  70 percent of working saudis are employed by the government  and even the private sector remains heavily dependent on government spending  gt  with oil revenues crashing and the numbers of young people reaching the work force growing by the day  those jobs have become harder to get as the government cuts costs and pushes saudis toward the private sector  where job security and salaries are lower on average  gt  in recent years  the government has pushed for greater saudi employment  penalizing companies with few saudi employees          extended summary     http  npredditcomrautotldrcomments46596oyoung_saudis_see_cushy_jobs_vanish_along_with    faq   http  npredditcomrautotldrcomments31b9fmfaq_autotldr_bot  version 16   36995 tl  drs so far     theory   http  npredditcomrautotldrcomments31bfhttheory_autotldr_concept    feedback   http  npredditcommessagecompose  to   23autotldr  pms and comment replies are read by the bot admin  constructive feedback is welcome     top   keywords     saudi     1   job     2   government     3   work     4   oil     5,d02ivl1,worldnews,news,1455665131.0,autotldr,1.0,0.0,18.0,106620.0,0.0
good damn sand roaches ,d02s0jq,worldnews,news,1455679362.0,Graceful_Ballsack,1.0,0.0,547.0,6859.0,0.0
we american millennials sympathize a little ,d02gnak,worldnews,news,1455661824.0,SeeShark,-1.0,0.0,2982.0,142686.0,0.0
 everybody wants to sit at home and get paid   we all need to transistion from ice cars to electric ones as soon as possible ,d02shnk,worldnews,news,1455680149.0,tat3179,1.0,0.0,1.0,6759.0,0.0
i have a v8 jeep that  can  run on regular gasoline  i ve been feeding her nothing but premium lately  partly because i support bla bla bla bla bla  but mostly i want to see the world burn before i die ,d02iol8,worldnews,news,1455664830.0,Themosthumble,0.0,0.0,1.0,60749.0,0.0
sounds like america  except instead of oil  its robots and corporations moving jobs ,d02t4cn,worldnews,news,1455681203.0,VarggYarp,1.0,0.0,1.0,2115.0,0.0
murica always finds a way to share our dreams and freedoms with the middle east you re welcome ,d02rpqk,worldnews,news,1455678871.0,butitdothough,1.0,0.0,1.0,15326.0,1.0
