text,id,subreddit,meta,time,author,ups,downs,authorlinkkarma,authorkarma,authorisgold
gt  kurdish activists claim the isis jihadist group has stoned to death four women in a mass execution for  adultery   without identifying any details about the men involved  gt  the lack of information involved in the case brought before the militants  shariah court in mosul  iraq  has led to speculation that the women were raped by isis fighters themselves  no one knows who did it  let s just make some shit up ,d02u8pz,worldnews,news,1455683173.0,80cents,1.0,0.0,88.0,764.0,1.0
missiles placements on these islands are seen as  defensive  in nature and not  militarization  seeing as how the vietnamese have already done this on disputed islands that it controls once again  the president for missile placements were done by some other party and america did nothing but now that china is doing it this is some sort of action just short of an act of war ,d02t4dl,worldnews,news,1455681205.0,C45,1.0,0.0,1.0,2685.0,0.0
leftwing feminists no where to be found yet again too busy smearing fake period blood on their faces in protest of having a door held open for them or getting paid less than a man because she chose to major in gender studiesart and the man chose stem  its sad that the left is more likely to defend extreme muslims than condemn them,d02e7x7,worldnews,news,1455658522.0,Scullyx,3.0,0.0,1.0,2476.0,0.0
china  nothing to see  nothing to see  he likes being in our custody sojustoh my god what s that   shopkeeper  what shopkeeper  i know of no shopkeeper you must be mistaken,d02q2wp,worldnews,news,1455676279.0,Spaceman-spliff87,1.0,0.0,1.0,207.0,0.0
if found guilty of terrorism  just deport them back to where they are ,d026b6l,worldnews,news,1455647972.0,n0xz,1.0,0.0,2.0,312.0,0.0
f,d02p3n2,worldnews,news,1455674760.0,Kill3rKin3,1.0,0.0,1.0,546.0,0.0
right on the eve of a band being executed for blasphemy  nice job  merkel ,d02fpjd,worldnews,news,1455660511.0,Malkalack,2.0,0.0,1478.0,19264.0,0.0
i suppose iran should recognize the israeli s after they treat the palestinians like humans  is nt that only fair ,d02lw0l,worldnews,news,1455669854.0,punchthateye,-2.0,0.0,1.0,-8.0,0.0
what kind of missiles  nuclear  antiair  antiship  cruise missiles  all of the above ,d02s8vi,worldnews,news,1455679740.0,Fredfredbug4,1.0,0.0,1514.0,96289.0,1.0
merkel making great decisions everywhere but in domestic politics ,d025dd4,worldnews,news,1455646699.0,Carvinale,2.0,0.0,178.0,5579.0,0.0
so never ,d01zx1o,worldnews,news,1455639067.0,TheCosmicSerpent,152.0,0.0,188.0,20032.0,1.0
why would germany put the interests of israel above its own  either there is an advantage to relations with iran or not germany should evaluate this based on their own interest ,d02eqao,worldnews,news,1455659187.0,glioblastoma,2.0,0.0,51.0,4242.0,0.0
if i were iran i d tell them    we ll recognize israel when israel recognizes palestine until then  fuck you  ,d025xfo,worldnews,news,1455647455.0,SchrodingersInsult,-17.0,0.0,31.0,5041.0,0.0
all countries exist philosophical question is whether a country has a right to exist every government should ask themselves this ,d02obxz,worldnews,news,1455673589.0,bamoosee,1.0,0.0,14.0,11152.0,0.0
iranian officials have repeatedly stated that once israel recognizes palestine  coming to a peace deal  then the conditions for recognition of israel will be fulfilled ,d02a5wm,worldnews,news,1455653140.0,flashoverride,2.0,0.0,303.0,420.0,0.0
here s the question  what does it matter really  i doubt that germany will shun iranian oil much in the same way that they do nt shun saudi arabian oil saudi arabia does nt recognize israel either yet both israel and sa seem to get along fine it s still all about selfinterest ,d02ovjt,worldnews,news,1455674419.0,3l33tvariance,1.0,0.0,1.0,682.0,0.0
waiting for some trigger happy dipshit to shoot down an airliner ,d02pcng,worldnews,news,1455675144.0,GatoNanashi,0.0,0.0,1.0,27723.0,0.0
good ,d02u4j2,worldnews,news,1455682967.0,BirdBrother,1.0,0.0,1.0,26.0,0.0
so good to hear this news finally  lazy saudi youth will learn how to work hard like the rest of the world,d02pyzo,worldnews,news,1455676110.0,poker_deewana3,6.0,0.0,52.0,42.0,0.0
splendid  indeed ,d02qbgy,worldnews,news,1455676650.0,Huge_Middle_Finger,3.0,0.0,85.0,48222.0,1.0
while they do the same work as foreigners  they earn much more salaries for foreign crew start at  320 a month  while saudis get  1460  part of which is subsidized by the government  discrimination  west does not even protestbecause oil matters the most,d02q7lt,worldnews,news,1455676479.0,poker_deewana3,2.0,0.0,52.0,42.0,0.0
this is the best tl  dr i could make   original   https  wwwnytimescom20160217worldmiddleeastyoungsaudisseecushyjobsvanishalongwithnationsoilwealthhtml  reduced by 93    i m a bot       gt  the fat years left the economy poorly structured  economists say  90 percent of government revenues are from oil  70 percent of working saudis are employed by the government  and even the private sector remains heavily dependent on government spending  gt  with oil revenues crashing and the numbers of young people reaching the work force growing by the day  those jobs have become harder to get as the government cuts costs and pushes saudis toward the private sector  where job security and salaries are lower on average  gt  in recent years  the government has pushed for greater saudi employment  penalizing companies with few saudi employees          extended summary     http  npredditcomrautotldrcomments46596oyoung_saudis_see_cushy_jobs_vanish_along_with    faq   http  npredditcomrautotldrcomments31b9fmfaq_autotldr_bot  version 16   36995 tl  drs so far     theory   http  npredditcomrautotldrcomments31bfhttheory_autotldr_concept    feedback   http  npredditcommessagecompose  to   23autotldr  pms and comment replies are read by the bot admin  constructive feedback is welcome     top   keywords     saudi     1   job     2   government     3   work     4   oil     5,d02ivl1,worldnews,news,1455665131.0,autotldr,1.0,0.0,18.0,106620.0,0.0
there was an old saudi royal  i ca nt remember who  who was quoted as saying something of the following   my grandfather rode a camel  my father a toyota  i drive a mercedes  but my son will drive a toyota  and his grandson  a camel ,d02fmlw,worldnews,news,1455660394.0,di11deux,51.0,0.0,314.0,15811.0,0.0
 everybody wants to sit at home and get paid   we all need to transistion from ice cars to electric ones as soon as possible ,d02shnk,worldnews,news,1455680149.0,tat3179,1.0,0.0,1.0,6759.0,0.0
70  of saudis are under 30 years of age that speaks of a rapidlygrowing population thanks to dual enablers  generous economic subsidies and fundamentalist patriarchial religion  saudi arabia is projected to be wholly dependent on imported wheat and other foods within 12 years  they stopped trying to grow wheat to be selfsufficient about 10 years ago  after realizing their aquifers would soon depleted  oil prices are low due to a worldwide decline in demand they may increase again  but likely will drop again as rising prices choke growth  the youth of saudi arabia will find themselves in a bind similar to what the tunisians  algerians  libyans  egyptians  syrians  etc have gone through ,d02hb84,worldnews,news,1455662781.0,hillsfar,26.0,0.0,92352.0,57270.0,0.0
i thinks somewhere in the bible it is mentioned that whoever corrupts the young should be tied to a millstone and thrown into the sea  said by jesus himself   btw  does it mean this guy is still a priest ,d01r8qd,worldnews,news,1455617809.0,one4allall4one,1.0,0.0,1.0,133.0,0.0
same as the rest of generation y  then ,d02fcfp,worldnews,news,1455660001.0,Jarmatus,1.0,0.0,22.0,15159.0,1.0
just like the rest of the world then ,d02txuh,worldnews,news,1455682640.0,7LeagueBoots,1.0,0.0,463.0,24898.0,0.0
we american millennials sympathize a little ,d02gnak,worldnews,news,1455661824.0,SeeShark,-1.0,0.0,2982.0,142686.0,0.0
murica always finds a way to share our dreams and freedoms with the middle east you re welcome ,d02rpqk,worldnews,news,1455678871.0,butitdothough,1.0,0.0,1.0,15326.0,1.0
good maybe they can start working to fix their shitty society while they re at it ,d02s5eo,worldnews,news,1455679581.0,EnemyOfAllMankind,1.0,0.0,1.0,671.0,0.0
watched the movie  spotlight   http  wwwimdbcomtitlett1895587  on the weekend it s sad to think that even opening up the whole issue to public scrutiny has not been enough to end this sort of thing ,d01p4gg,worldnews,news,1455609670.0,waveform,2.0,0.0,5335.0,24796.0,0.0
not surprising at all remember  cardinal law   https  enwikipediaorgwikibernard_francis_law   the guy got a promotion and is chilling in vatican right now after covering up a sexual abuse scandal involving close to 100 priests within his archdiocese this is  roman catholic church   https  enwikipediaorgwikicatholic_church_sexual_abuse_cases  we are talking about here ,d02gmae,worldnews,news,1455661784.0,mycuntry,1.0,0.0,489.0,556.0,0.0
gt  in an effort to improve the financial literacy of the population  schools in russia this year started lesson plans for ninth graders on credit  pensions and taxes  this should be mandatory part of school programs anywhere,d025yyj,worldnews,news,1455647510.0,CrazyRusFW,27.0,0.0,6140.0,7596.0,0.0
these idiots are going down they will soon turn the locals against them and their funding at least from oil has dried out if other channels are blocked  they will run out of steam soon  already a large number of european jihadis have been defecting,d01v6fb,worldnews,news,1455630656.0,topgun2016,1.0,0.0,7271.0,866.0,0.0
turkey can fuck right off we should have thrown them out of nato after the cold war after their usefulness had ended ,d023omy,worldnews,news,1455644401.0,Misc_Rodriguez,0.0,0.0,549.0,16667.0,0.0
that just shows the intelligence of these idiots,d02lnhr,worldnews,news,1455669499.0,Summamabitch,1.0,0.0,1.0,2481.0,0.0
just curious if germany has normal diplomatic relations with saudi  uae  qatar and other arab countries that dont recognize israel ,d025huz,worldnews,news,1455646870.0,gerbil_111,65.0,0.0,1.0,4202.0,0.0
justin bieber has never written a song nor has he written music to go with a song  his managers buy wrights to music and tell him to sing it how pathetic is that  could you image curt cobain being told by his manager to sing a song he did not like for money ,d02pfg2,worldnews,news,1455675265.0,spiderwomen,-10.0,0.0,1128.0,6026.0,0.0
is anyone surprised after the fiasco that was euromaidan ,d02b3je,worldnews,news,1455654385.0,Bittersweet-World,6.0,0.0,1.0,3951.0,0.0
mo who ,d02u9he,worldnews,news,1455683211.0,MutthaFuzza,1.0,0.0,3069.0,22403.0,0.0
unfortunately  this will really only fuel the radicalization of the saudi ,d02szdq,worldnews,news,1455680970.0,DemeaningSarcasm,1.0,0.0,639.0,53081.0,0.0
if the us was a true democracy we wouldve told these camel fuckers to piss off years ago,d027xpg,worldnews,news,1455650164.0,Blondexopinkpants,-3.0,0.0,1.0,185.0,0.0
11 jinping not happy with that ,d02rwpi,worldnews,news,1455679186.0,butch123,1.0,0.0,3466.0,15421.0,0.0
absolutely fucking not  no ,d01wmwa,worldnews,news,1455633653.0,sensualcurl,9.0,0.0,1.0,1224.0,0.0
no ,d02n4w8,worldnews,news,1455671796.0,From2112,1.0,0.0,40.0,3121.0,0.0
how does  alnusra   https  enwikipediaorgwikialnusra_front  russian_air_raids_282015e28093present29  stay supplied ,d02lgzv,worldnews,news,1455669234.0,4daptor,1.0,0.0,694.0,3261.0,0.0
5 degrees  getting warmer ,d02icxe,worldnews,news,1455664328.0,username_004,-1.0,0.0,3.0,21765.0,1.0
turkey can go in alone i want the kurds to kick their asses ,d0232ws,worldnews,news,1455643573.0,bax101,0.0,0.0,1442.0,17169.0,0.0
good i do nt get how people can downvote humanitarian assistance ,d02g1rs,worldnews,news,1455660985.0,rikudemyx,5.0,0.0,296.0,31478.0,0.0
 sorry we bombed your hospitals   fingers crossed behind back ,d02tppf,worldnews,news,1455682243.0,Chemspiration,1.0,0.0,479.0,16698.0,1.0
i m a layman when it comes to this  but what s left to sanction ,d02rei5,worldnews,news,1455678358.0,Sanhen,1.0,0.0,16.0,20647.0,0.0
and look  our species is finding a way ,d02o3dp,worldnews,news,1455673233.0,PabstyLoudmouth,1.0,0.0,106269.0,128307.0,1.0
this is the best tl  dr i could make   original   http  wwwabcnetaunews20160217artificialislandsperhapstheonlyoptiontosavekiribati7175688  reduced by 80    i m a bot       gt  kiribati has turned to the united arab emirates to help build artificial islands in an effort to save the lowlying pacific nation from rising sea levels  gt  key points  kiribati president says artificial islands perhaps the only option for nationamp   039  s futureengineers from the uae have been enlisted for technical advicemajority of kiribatiamp   039  s 33 coral atolls are less than six metres above sea level  gt  the australian bureau of meteorologyamp   039  s national tidal centre has reported an average sea level rise of 73 millimetres a year for kiribati since 1992  and the kiribati government has said the rise has already forced some villagers to abandon their homes          extended summary     http  npredditcomrautotldrcomments465x6fkiribati_looks_to_artificial_islands_to_save    faq   http  npredditcomrautotldrcomments31b9fmfaq_autotldr_bot  version 16   37024 tl  drs so far     theory   http  npredditcomrautotldrcomments31bfhttheory_autotldr_concept    feedback   http  npredditcommessagecompose  to   23autotldr  pms and comment replies are read by the bot admin  constructive feedback is welcome     top   keywords     kiribati     1   tong     2   island     3   continue     4   level     5,d02p0nv,worldnews,news,1455674633.0,autotldr,1.0,0.0,18.0,106620.0,0.0
how do you field test a lolipop thinking its meth  i m assuming an inside tip ,d01tpc0,worldnews,news,1455626897.0,FlexualHealing,1.0,0.0,1.0,567.0,0.0
oh now she cares about the jews  after she has forced us all to flee to israel amp  america  she can pretend to care about the jews all she wants  actions speak louder than words  she chose her side ,d0248rv,worldnews,news,1455645166.0,GrimTerra,-13.0,0.0,203.0,4936.0,0.0
gt  kiribati has turned to the united arab emirates  uae  to help build artificial islands in an effort to save the lowlying pacific nation from rising sea levels  a  uae team  headed by dutch engineers and indian workers how funny ,d02q5cr,worldnews,news,1455676383.0,if_it_is_in_a,2.0,0.0,3335.0,1850.0,0.0
disgusting,d01o2x0,worldnews,news,1455606445.0,duckkgoat44,3.0,0.0,1.0,2222.0,1.0
we know that it was the saudi s who funded 911 and i also happen live in nyc and was here on that very day maybe it s not very spiritual of me but anytime i read bad news about saudi arabia i do nt give a shit so these young saudi s are going to have to work harder than their parents  add that to not being allowed to have a beer or sex do nt care about saudis,d02ufw1,worldnews,news,1455683530.0,rit56,1.0,0.0,126728.0,12774.0,0.0
gt  the oil shock has meant a lowering of expectations as they face the likelihood that they will have to   work harder than their parents     actually work   ftfy,d02t4mf,worldnews,news,1455681217.0,pussy_seizure,1.0,0.0,853.0,2919.0,0.0
i wonder if we ll see an outflux of wannabe jihadists  like we have in previous eras when oil prices crashed it was after the oil price crash in 85  which was caused by saudi arabia pumping up oil production to knock iran during the iraniraq war  that the major influx of saudi jihadist volunteers went to afghanistan  and during the 90s many saudis went to bosnia and chechnya and fought in wars there a lot of this was explicitly supported by the saudi ruling elites  seemingly as a way to deal with the domestic problems that low oil prices bring  see  the research by thomas hegghammer  who s done a lot of great academic research on salafijihadism  ,d02r7c5,worldnews,news,1455678039.0,arjun101,5.0,0.0,9966.0,12563.0,1.0
this is what happens when you build houses with oil cans,d026q2z,worldnews,news,1455648529.0,Blondexopinkpants,-3.0,0.0,1.0,185.0,0.0
ok,d01x34l,worldnews,news,1455634474.0,phakov,-18.0,0.0,304.0,5524.0,0.0
this is the best tl  dr i could make   original   http  wwwibtimescouktommyrobinsonexedlleaderhospitalisedafterattackoutsideessexnightclub1543925  reduced by 82    i m a bot       gt  a worker for the club  who wished to remain anonymous  told ibtimes uk there had been an altercation between robinsonamp   039  s group of friends and other clubbers on the night  something robinsonamp   039  s representatives denied  gt  the attack comes a week after robinson  real name stephen yaxleylennon  helped lead a amp  quot  silent marchamp  quot  in birmingham as part of a demonstration by antiislam group pegida uk the group  an offshoot of the pegida movement which started in germany  is calling for a halt to what it calls the amp  quot  islamisation of europeamp  quot   gt  robinson insists pegida uk is not racist or amp  quot  antimuslimamp  quot   instead saying the group is fighting the amp  quot  fascistamp  quot  ideology of islam          extended summary     http  npredditcomrautotldrcomments46456otommy_robinson_exedl_leader_in_hospital_after    faq   http  npredditcomrautotldrcomments31b9fmfaq_autotldr_bot  version 16   36936 tl  drs so far     theory   http  npredditcomrautotldrcomments31bfhttheory_autotldr_concept    feedback   http  npredditcommessagecompose  to   23autotldr  pms and comment replies are read by the bot admin  constructive feedback is welcome     top   keywords     robinson     1   group     2   club     3   head     4   pegida     5,d028qw9,worldnews,news,1455651253.0,autotldr,3.0,0.0,18.0,106620.0,0.0
europe s  future   today,d02c7v7,worldnews,news,1455655836.0,cyberspyder,12.0,0.0,1300.0,6462.0,1.0
this is the best tl  dr i could make   original   http  timesofindiaindiatimescomindiamissionimpossibleindiastargettoimportgmofreecornarticleshow51014990cms  reduced by 85    i m a bot       gt  south koreaamp   039  s daewoo international won the tender to ship 250000 tonnes of nongm corn to india from ukraine  but two international traders in singapore and an exporter in kiev said ukraine could at best guarantee 991 per cent nongm corn  gt  amp  quot  india must reject cargoes from suppliers who promise to provide corn that is only 991 per cent free of gm organismsamp  quot  said devinder sharma  an independent food and trade policy analyst based in chandigarh  highlighting a risk of contamination  gt  pec received 15 bids from global traders including daewoo  noble  cargill and agro corp to supply corn mainly to be used as animal feed for indiaamp   039  s poultry industry          extended summary     http  npredditcomrautotldrcomments4666htas_india_prepares_to_import_corn_for_the_first    faq   http  npredditcomrautotldrcomments31b9fmfaq_autotldr_bot  version 16   37038 tl  drs so far     theory   http  npredditcomrautotldrcomments31bfhttheory_autotldr_concept    feedback   http  npredditcommessagecompose  to   23autotldr  pms and comment replies are read by the bot admin  constructive feedback is welcome     top   keywords     corn     1   india     2   trade     3   seed     4   cent     5,d02r9wf,worldnews,news,1455678152.0,autotldr,1.0,0.0,18.0,106620.0,0.0
this is the best tl  dr i could make   original   http  bigstoryaporgarticlea8164cddd6fa434da1bdb37281514a08southkoreasleaderwarnsnorthkoreacollapse  reduced by 77    i m a bot       gt  osan air base  south korea  four us f22 stealth fighters flew over south korea on wednesday in a clear show of power against north korea  a day after south koreaamp   039  s president warned of the northamp   039  s collapse amid a festering standoff over its nuclear and missile ambitions  gt  pyongyang will likely view the arrival of the planes as a threat as they are an apparent display of us airpower aimed at showing what the united states can do to defend its ally south korea from potential aggression from north korea  gt  south koreaamp   039  s president on tuesday warned north korea faces collapse if it doesnamp   039  t abandon its nuclear bomb program  an unusually strong broadside that is certain to infuriate pyongyang          extended summary     http  npredditcomrautotldrcomments466k10us_stealth_jets_flying_over_s_korea_amid_n_korea    faq   http  npredditcomrautotldrcomments31b9fmfaq_autotldr_bot  version 16   37046 tl  drs so far     theory   http  npredditcomrautotldrcomments31bfhttheory_autotldr_concept    feedback   http  npredditcommessagecompose  to   23autotldr  pms and comment replies are read by the bot admin  constructive feedback is welcome     top   keywords     korea     1   north     2   south     3   us     4   pyongyang     5,d02ueau,worldnews,news,1455683453.0,autotldr,1.0,0.0,18.0,106620.0,0.0
gt  four us f22 stealth fighters flew over south korea on wednesday well  it s  not the first time   http  theaviationistcom20130331raptorkorea  f22s have been in south korea ,d02th6n,worldnews,news,1455681827.0,hodyoaten,1.0,0.0,14671.0,188967.0,1.0
what a surprise,d01r6i3,worldnews,news,1455617549.0,TheUniverseIsALie,10.0,0.0,42.0,104.0,0.0
what the hell would metal even sound like in arabic ,d02u6xb,worldnews,news,1455683086.0,ThePopesFace,1.0,0.0,1216.0,8513.0,0.0
this is the best tl  dr i could make   original   http  wwwjapantimescojpnews20160215nationalseashepherdsayscantfindjapanswhalingfleet  vskmy_irliv  reduced by 75    i m a bot       gt  amp  quot  sea shepherd was expecting that australia or new zealand would uphold their obligations as responsible members of the international whaling commission  to send a ship to intercept the japanese whaling fleetamp  quot  watson said  gt  he called on canberra to provide sea shepherd with the exact coordinates of the whaling fleet amp  quot  so that sea shepherd can do the job that australia and new zealand refuse to do  gt  amp  quot  australia is committed to the protection of whales and we will continue to work with the international community to promote whale conservation and uphold the global moratorium on commercial whaling          extended summary     http  npredditcomrautotldrcomments460hwisea_shepherd_says_it_cant_find_japans_whaling    faq   http  npredditcomrautotldrcomments31b9fmfaq_autotldr_bot  version 16   36712 tl  drs so far     theory   http  npredditcomrautotldrcomments31bfhttheory_autotldr_concept    feedback   http  npredditcommessagecompose  to   23autotldr  pms and comment replies are read by the bot admin  constructive feedback is welcome     top   keywords     whale     1   sea     2   shepherd     3   australia     4   hunt     5,d01h93q,worldnews,news,1455592741.0,autotldr,89.0,0.0,18.0,106620.0,0.0
a firmly worded letter is going to just change his little mind right on the spot  he ll cry and beg forgiveness  then laugh  wipe his ass with it and have a walking skeleton with a sheet draped over it deliver his  response  to the dmz  then have a sniper kill the poor bastard for trying to escape ,d0186bz,worldnews,news,1455578343.0,username_004,452.0,0.0,3.0,21765.0,1.0
no shit ,d018qcf,worldnews,news,1455579233.0,MartinShkreliIsACunt,6.0,0.0,15.0,4539.0,0.0
lol saudi arabia is head of the un human rights department the un have no credibility ,d01xxpq,worldnews,news,1455635958.0,aulnet,2.0,0.0,1.0,1761.0,0.0
and all it d take is a bloody and protracted conflict that generates millions of refugees to arrest him and bring him to trial  assuming  of course  that he d allow himself to be captured alive  ,d02489f,worldnews,news,1455645148.0,dethb0y,2.0,0.0,52817.0,169798.0,0.0
 un  and  held accountable  do nt belong in one sentence ,d01jyqg,worldnews,news,1455597220.0,CaramelApplesRock,3.0,0.0,6.0,1347.0,0.0
nice work ,d0219fh,worldnews,news,1455641013.0,Protonoia,8.0,0.0,1.0,10058.0,0.0
lol backwards fools,d02qu1s,worldnews,news,1455677442.0,The_DashPanda,-6.0,0.0,1.0,370.0,0.0
they found a knife and called it thwarting a terrorist attack the numbers of terrorist attacks thwarted at soccer games must be tremendous ,d01v6ts,worldnews,news,1455630681.0,zwiebelhans,-41.0,0.0,1.0,4617.0,0.0
so progressive  we need to mass immigrate in millions of men from that culture every year or we re racist islamophobes ,d02hkz5,worldnews,news,1455663170.0,Rescuedbeta,3.0,0.0,1.0,190.0,0.0
barbarians,d02i2g8,worldnews,news,1455663893.0,Yokaren,1.0,0.0,200.0,8814.0,0.0
seems like india should be investing in its own people  but who am i to recognize the severe poverty of that country ,d02tney,worldnews,news,1455682131.0,Chemspiration,1.0,0.0,479.0,16698.0,1.0
12 people with signs are not a protest ,d02tmah,worldnews,news,1455682076.0,IDontPostOnRedditXI,1.0,0.0,3.0,122.0,0.0
oh look  a hole ,d02gdzr,worldnews,news,1455661460.0,InformedChoice,2.0,0.0,833.0,4465.0,0.0
