text,id,subreddit,meta,time,author,ups,downs,authorlinkkarma,authorkarma,authorisgold
i do nt think the sorting hat puts you in the house you re best suited to but rather what you aspire to be on your points  1  on potter more about the sorting hat it says that peter pettigrew narrowly escaped slytherin when the hat was in him so maybe he asked to be put in gryffindor  not unlike harry  i would argue though that despite being cowardly which led him to betraying james and lily i do think he had some courage he stayed with voldemort for a year he could ve easily abandoned himchopped off his right handkill 13 muggles in the middle of the street and risked getting caught but managed to escapei mean sure they were motivated by cowardice but i would say fear makes you do courageous things and that was what pettigrew did other traits of gryffindor was being courageous and recklessnot just bravery so again despite being pushed by cowardice and self serving  slytherin traits  he still did pretty reckless things  i do know that he is definitely not a hufflepuffnot with his actions of treacheryhufflepuffs are nt the leftover house you got ta be loyal unfortunately peter wasnt  2  i agree with this percy was ambitious enough to get in good with the ministryalthough i do wonder in ootp did percy believe the ministry s lies or did he know it was all fake but did nt care because he wanted to stay in their good books  what do you think   at the end of the deathly hallows he ran away from the ministry to join and fight with his family that could be said to be brave and i think so because he was a pureblood at the time he was protected by his status at the ministry and be still went back to his family but at the same time i do nt think it was brave because i think percy was forced to kish away because they would ve been after him to ask about his family and any sane wizard or witch at the time could realize the ministry was at its all time lowvoldemort low not fudge and umbridge low   3  dumbledore is a tricky one i always thought that with his master chess game he was playing he would ve been the perfect slytherinlol i think dumbledore is wayyyyyy more cunning than voldemort or even slughorn although like in point one i made about pettigrewthe same could be said for dumbledore despite slythering his way through the war he took pretty big risks that relied heavily on chance that s pretty gryffindor to me i think if there was nt a war going on ravenclaw would be his best fit he was a wise old man after all  4  conclusion  i like that the characters were not clean cut caricatures of their houses they re human  the world is nt split into black and white every character in the series could be argued to demonstrate qualities of each of the houses it gives them depth  5  bonus  i think voldemort would ve made a good gryffindor  his actions were even more daring than dumbledore both while he was at school  chamber of secrets fiasco  and when he became the official dark lord ps  its spelled grindelwald,d01iat1,harrypotter,entertainment,1455594420,Mrsphysics,8,0,1,170,0.0
i agree with everything you posted i would also add crabbe and goyle in slytherin  they did nt really show ambition at all and they just did what malfoy told them to do  however  i do nt think they fit into any of the houses also zacharias smith has no hufflepuff traits that are shown in the books i think he would ve been better suited for any other house ,d01ht7c,harrypotter,entertainment,1455593639,RavenclawINTJ,7,0,1,78,0.0
gt  peter was the least gryffindor person ever he s basically the biggest coward in the series i do nt know what house he could belong to  but definitely not gryffindor  ucavelioness posted this excellent post to why peter in gryffindor was the right choice   he was courageous plenty of times he just did nt have any pride  that is  he did nt mind crying and blubbering and pleading for his life so his words were never courageous  but his actions were almost always physically brave i do nt have the super big list  but here are some of his actions that could be considered brave  stayed friends with remus after he found out he was a werewolf worked to become an animagus without adult guidance the animagus transformation can go horribly  nightmarishly wrong as a rat  ran with three larger animals who could easily have trampled him month after month not to mention there s a shitload of owls around hogwarts  being a rat outside would be very risky  i d say  he was a spy for voldemort for over a year yeah  it s treacherous  but it took some nerve especially once dumbledore suspected a spy do nt forget snape did the same thing the opposite way and for that  harry called snape the bravest man he ever knew  thought fast and ruthlessly and efficiently framed sirius after godric s hollow cut off his own finger without a whimper and coldly massmurdered 12 people  seized his opportunity to escape after the shrieking shack  even though he d been informed that he would be killed if he tried to transform he waited for the right moment and took a gamble with his life  and it paid off  he argues with voldemort when he does nt agree with a plan  and the plan in gof was pretty convoluted and bloated  he speaks up even though he s afraid only gryffindor death eater  only death eater we see do this coincidence  the man cuts off his own hand voldemort was nt forcing him  he was already in the cauldron peter does this alone and of his own violation  he reminds voldemort of his promise after voldemort was reborn  he did nt really need peter any more and could have killed him  and peter knows this  but he still manages a reproachful  you promised   seriously  no one else treats the dark lord anything like this ,d01snpb,harrypotter,entertainment,1455623519,roothyman2,6,0,2283,1396,0.0
the two that stick out to me are dumbledore and hagrid  jk does have a tendency especially in the earlier books to put all the good guys in gryffindor  the bad guys in slytherin  and filler characters in the other houses she tries to redeem this later in the series with characters like luna and tonks but she ca nt change what she had already published  dumbledore and hagrid serve as two sides of the  fatherfigure  for harry at hogwarts  so it would make sense that they were in the the same house as him we also find out their house affiliations in the first two books  where the gryffindorslytherin dichotomy is at its most obvious  both have many gryffindor traits hagrid shows his bravery in situations of crisis like when he s arrested in cos and fights off the ministry officials in ootp but i ve always thought that hagrid would make an excellent hufflepuff he s unassuming and loyal to a fault to the people in his life  especially harry and dumbledore   he s a hard worker  seeing as he has been groundskeeper forever and takes on a teaching position on top of that he has an affinity for magical creatures and the outdoors like many hufflepuffs  although his cooking skills are nt quite up to helga s standards   yes there are moments when he is unpuff  like showing harry the dragons   importantly hufflepuff corresponds with the earth element  and you wo nt find an earthier guy than hagrid he s kind to a fault to students  unless they re mean to him   and often has students to his hut when they re lonely or down  dumbledore has gotten way more discussion in this thread  so i ll say less about him he could ve been a great slytherin or ravenclaw since a lot of people have made the slytherin argument  i ll make the ravenclaw one he s one of the most brilliant wizards to ever come out of hogwarts they talk about him wowing professors with theory when he is a student and it looks like he does a fair bit of independent research while at school he s also a total oddball and those types thrive in ravenclaw he has an insatiable desire for knowledge as well,d02chhy,harrypotter,entertainment,1455656196,pinkducktape8,4,0,66,1336,0.0
maybe peter pettigrew would have embraced his inner bravery if he was nt hanging out with james  sirius and remus maybe those 3 looking after him and protecting him all the time  actually made him a bigger coward than he was  because he never got the opportunity to stand up for himself he got so used to them being for him each and every time that he never realized that is not how life is supposed to work this naturally makes him think of saving his own skin than his friends  and makes succumb to voldemort s power who knows  if neville had hung out with the golden trio all the damn time  then he might have never stood up for himself either a little independence will go a long way in building one s courage ,d01xzhb,harrypotter,entertainment,1455636037,Dont_get_too_close,3,0,1,97,0.0
the sorting hat tries to put you where you can find your equals  the hat also knows all the students of each house  so it might take this in consideration harry disliked malfoy from the start  the hat probably saw this  it also knew that sirius and james had already met in the hogwarts train and so on you think voldemort would have turned out good and kind just because he was put in hufflepuff  no  but the slytherin house were the one in which he found his equals  people of ambition and that shared his ideals  so there is no solid answer  sometimes it puts you in a house to balance your traits  hermione was very clever  but gryffindor balanced her somewhat  she certainly did things that she would not have done in ravenclaw malfoy was put into slytherin because he wanted to  he had the traits and etc  if the hat wanted to simply  balance  his personality  then it should have put him in gryffindor for example neville wanted to go to hufflepuff  but the hat insisted and chose gryffindor instead ,d01sc90,harrypotter,entertainment,1455622335,JuniorAL,1,0,1,101,0.0
dumbledore being in slytherin would be a great twist and excellent way of saying  see  there are good people in slytherin  ,d027w5a,harrypotter,entertainment,1455650107,Narsil098,1,0,1,38,0.0
i think that when it comes to where the sorting hat places you  it ultimately comes down to who you are aspiring to be in that moment think about when harry was sorted if it had been completely up to the sorting hat  harry would have been placed in slytherin just as harry told his son at the end of book 7  the hat goes with your choice above all other aspects it weighs in so whoever your 11yearold self believes he or she is or should be  that is where the hat sorts you another good example is the sorting hat s placement of malfoy i love how it is demonstrated in the movie  the hat barely touches malfoy s head and he is immediately sent to slytherin this is because he has been raised by a family bursting with pureblood and slytherin pride  and this is who he aspires to be as well  i hope this make sense  but in the end  i really believe that the sorting hat does nt choose the house for you  you choose the house for you ,d02g2d1,harrypotter,entertainment,1455661009,camicobbs,1,0,1,1,0.0
seems like the sorting hat has a pretty clear algorithm  1  you a dick  yes  slytherin  no  2  you brave  yes  gryffindor  no  3  you smart  yes  ravenclaw  no  hufflepuff  case studies  malfoy dick  yup does nt matter that he s smart  he fixed the vanishing cabinet  props for that   hermione dick  nope brave  yup does nt matter that she s brilliant  she gets gryffindor   harry dick  apparently enough to confuse the hat  but borderline brave  alright  gryffindor  counterpoints  cedric seems not a dick  brave and smart  which would put him in gryffindor  so to answer your question  cedric obvious algorithm malfunction ,d01iu9y,harrypotter,entertainment,1455595308,donthequail,1,0,4,1374,0.0
it looks so real ,d01cn03,harrypotter,entertainment,1455585499,ravenclaw1991,2,0,1103,17144,0.0
buzzfeed article  here   http  wwwbuzzfeedcomshayanroymadamhoochapproves  ci3obbgxol ,d01eodj,harrypotter,entertainment,1455588680,just-a-tv-nerd,2,0,46,2639,0.0
it looks like so much fun ,d01eur3,harrypotter,entertainment,1455588962,Angus_Mac,2,0,1,1238,0.0
the photographer is a friend of mine and these pictures were shot at  kalap trust   http  wwwkalaptrustorg   india featuring kids in the region having some fun in the hills ,d01ezxk,harrypotter,entertainment,1455589193,meow_mayhem,2,0,6853,1547,0.0
holy hippogriffs  this is awesome  d  ,d02p1my,harrypotter,entertainment,1455674675,ramyam,1,0,10,11,0.0
what country and continent do you think it will be located  is there any information regarding ilvermony s location per jkr ,466bbj,harrypotter,entertainment,1455679969,Mrsphysics,1,0,1,170,0.0
footnotes  maybe interjected might get distracting  borderline fan fic lol,d010cta,harrypotter,entertainment,1455566767,Millerboycls09,8,0,5,78,0.0
it s a wozard pirate map to hidden treasure ,d02hc7k,harrypotter,entertainment,1455662818,cameronsivley,1,0,52,61,0.0
i m sure you ve all seen the posts on here or on tumblr about how sad it is that there will be more lupins and potters at hogwarts  but no more blacks well  according to  the black family tree   https  wwwhplexiconorgimagesblackfamilytreesofficialfinalversiongif  there are 3 different blacks that could theoretically have descendants at hogwarts sirius had an uncle that was disowned for giving him money when he ran away  a greatuncle who was a squib and a greatgreatuncle disowned for caring about muggle rights it is entirely possible and even likely that at least one of these gentleman have descendants who could attend hogwarts given that all of these gentleman were disowned it is even possible that they would be blacks more after sirius s heart than his mother s just something i thought people ought to know,45w7tg,harrypotter,entertainment,1455538699,Shandrith,52,0,2752,21181,0.0
it would be so perfect and so ironic that those who are disowned from the family would be the ones to carry on the family name the blacks tried so hard to be the pictureperfect wizarding family that they forced their family to become what embarrassed them the most ,d00mmst,harrypotter,entertainment,1455545100,ApricotPickles,32,0,457,19704,0.0
not to mention the weasleys  potters  and longbottoms listed in there they were women marrying men but one or more of their children could take  or be given  the family name black just to keep it going it s not totally improbable  edit  cleaned up a bit,d00lwws,harrypotter,entertainment,1455543299,AthosN8,11,0,4977,5879,0.0
ha  i never thought of that nice ,d018bmv,harrypotter,entertainment,1455578579,ramrod42,1,0,87,314,0.0
there are a number of pure blood lines that end in the book  crouch  dumbledore says in gof it was the end of that line  dumbledore crabbe  with vincent dying and his dad in azkaban  lestrange also a bunch of the death eaters do nt seem to have living relatives  avery  mulciber  macnair etc ,d01ppob,harrypotter,entertainment,1455611719,den789,1,0,1,319,0.0
the only thing wrong with that tree is that andromeda black married ted tonks who was muggle  born   not a muggle ,d0206sx,harrypotter,entertainment,1455639468,Feminist_Cat,1,0,383,3866,1.0
to me this isnt a big deal sirius was like the good apple in a tree of rotten ones being sad thats theres no more blacks is like being sad the hitler family ended when bill hitler was an animal rights activist dont get me wrong hitlers the hitlers are horrible but dont be sad that a racist family tree is ended be sad that good guy died,d00pkku,harrypotter,entertainment,1455550791,The_Gcm,-10,0,55,4887,0.0
i could be totally off base  but my first thought was the quibbler article luna was reading on the train when harry first meets her if you turn it upside down the runes become a spell that will turn your enemies ears into kumquats ,d02rq0f,harrypotter,entertainment,1455678884,abrial_alshar,1,0,1946,3103,0.0
in the book it s the password to get in as he s sleeping in the corridor when harry and the others go for the midnight duel ,d01dgj9,harrypotter,entertainment,1455586785,Jade3d,38,0,14,1181,0.0
map of the muggle underground   edit  spelling,d025cph,harrypotter,entertainment,1455646674,starflashfairy,5,0,576,7231,0.0
what  if any  new subjects do you think hogwarts would offer today ,461fyv,harrypotter,entertainment,1455608481,sophietheenglish,3,0,1,201,0.0
politics a look at the way the ministry of magic is run as well as various governments from around the world  both magical and muggle   considering the ministry is such a huge employer and that may students enter the ministry upon leaving hogwarts it seems prudent to give students a detailed understanding of how the government works this would be a newt level course  muggle studies not a new subject but a change in the way it would be taught from 12 year all students who grew up in a magical household  regardless of whether they are pureblood or muggleborn or whatever  would take this class it would teach them the very basics of muggle life how they live etc in third year  you can continue this subject and it would carry one much like it does in the books at newt level is get s much more theoretical and questions mugglemagical relations and things  magical studies the counterpart to muggle studies  this time for students who grew up in a muggle household  regardless of parentage   this would help students get a better understanding of the wizarding world  how laws are created  wizarding pastimes and things that most people who grew up in a magical household  would take for granted the course ends at the end of the second year however it s not very often  once a week or once every two weeks at max  literature taken at third year literature helps students get a very basic understanding of the written language both from a magical and a muggle perspective can be taken at newt level  introduction to healing basic healing subject taken at newt level does exactly what it say s on the tin  magical theory newt level in depth look at magical theory why spells do a certain thing  how language effects spells  how spells are created  aside from these i believe professor binns would have been sacked or at least  a history of magic professor hired to actually do a decent job and teach the students in an engaging way binns will teach to an empty classroom he wo nt mind or notice ,d01sgln,harrypotter,entertainment,1455622799,shaun056,8,0,5149,11702,0.0
maybe some language courses  like gobbledegook for example ,d01prze,harrypotter,entertainment,1455611953,MacabreGoblin,2,0,95,191,1.0
something related to magic items  how to identify it  create  improve its quality  etc early years it could be the basic stuff  like simply enchanting something  shield hats  glasses which enhance your vision  etc   and the advanced methods  would include the creation of magic effects that will last even after the creator dies  so its much more complicated in my opinion this would be very nice  the magic world would certainly advance  there would be faster brooms  floating shoes  clothes which can adapt to the owners size  hats that improve your concentration  etc  fred and george made a ton of money inventing stuff like this  so this is not very common and its probably not easy  they told harry that he would nt believe how many witches and wizards out there cant produce a proper shield charm  and they were mostly ministry workers  and its required top grades to work there ,d01ql5e,harrypotter,entertainment,1455615094,JuniorAL,2,0,1,101,0.0
basic healing,d01qv2q,harrypotter,entertainment,1455616217,alexi_lupin,2,0,2853,73988,1.0
english maths physical education  playing sports ,d01q5i6,harrypotter,entertainment,1455613384,ykickamoocow111,1,0,1,7556,0.0
really  really nice work ,d02lxh5,harrypotter,entertainment,1455669916,KimberlyInOhio,2,0,6529,30930,0.0
i think snape was jealous of james  but not really for the reasons that most people think especially lupin here snape does hate that james is popular   big quidditch hero   but also does nt value athleticism   i d rather be brainy than brawny    he s more madjealous that society values these things over things he values that james and sirius were handed everything in life looks  money  popularity  and his intelligence and hard work despite coming from poverty means nothing ,d014toe,harrypotter,entertainment,1455573228,spirklet,11,0,7466,19463,0.0
i think lupin s right to look for a reasoning beyond lily i thought snape and james had a problem with each other long before lily became an issue jameslily might have made it worse  but it was nt the source of their problem   plus  if lupin had any suspicions about snapelily  i doubt he d voice it in front of harry ,d013il1,harrypotter,entertainment,1455571315,muted90,14,0,1,288,0.0
i m going to make a lot of assumptions here so please bare with me  being in the order would bring about a lot of intimate information lupin was nt a person to blab what he knows and frankly who would he have talked to with sirius in prison  after lily s death snape would ve been inconsolable who knows how he reacted  probably withdrawing  and maybe even slipping up in front of members of the order because only they would be showing any emotion about the potters  remus is kind  compassionate  caring  and introspective perhaps these qualities couple with a few scraps of information from dumbledore or another member of the order and the out of character  overreaction  by snape  which by most people s standard would be controlled  but for a fellow introvert these signs could be a bit more obvious  of course if remus knows or caught wind that snape s patronus changed and bang  we get that odd sentence structure in the quote  retread it this time with the knowledge that remus is keeping the information guarded either for harry or even snap s sake it s an odd place to pause and he mentions  thinking  as in hypothesizing and using  anyway  as a throw away to move the subject along without dwelling i believe he s just giving a plausible story with partial truth but he knows the truth and is just being a good person and sparing two people a lot of pain and confusion ,d0189ed,harrypotter,entertainment,1455578479,AthosN8,2,0,4977,5879,0.0
looks like runes on the top and bottom of the page it could also be a ward  or a curse that has been revealed by some other sort of magic call up bill weasley he used to be a curse breaker ,d022gqa,harrypotter,entertainment,1455642716,Captain-_-Falcon,3,0,1286,260,0.0
hi  i got some questions i want to ask about the films i ve never read the books  but i plan to   and i guessed this would be the best place to ask them i m also on mobile so please tell me if the formatting is dodgy  first one is why was nt harry angry at dumbledore after harry died   he saw snape s memory of dumbledore manipulating harry into  raising him as pig to slaughter  yet when he saw him he did nt seem too bothered  in fact he looked like he still admired him  another question is what do you think harry thinks of his father after seeing snape s memory of him  cause to me it looked like he was a bully and stole lilly from him was there something that snape did that gave james the right to do that to him  or was it snape s hate for james that literally changed his memory  where did harry get the mirror shard and where did the mirror even come from  i ve looked through the films and there s no mention of it but then in the deathly hallows harry suddenly has it with no explanation  one more  what is the significance of snape s patronus  i know he loved lilly  but when dumbledore just randomly mentions lilly when he casts the doe  it s not really clear what he means  does he just ask if he loved her  would make sense after snape s  always   thanks guys i do love this subreddit  harry potter is pretty much my favourite film series as i grew up as the same age as harry and the lot  definitely an experience that i loved but did nt know was happening at the time ,45xmfq,harrypotter,entertainment,1455557881,Fuzzylemons,4,0,449,1024,0.0
this is the problem with watching the movies first     read the books asap the movies are fun entertainment but you wo nt get nearly as much out of them as you will out of the books i hope you get to soon and you re enjoying your hp journey  i can try to answer some of your questions  in the books harry goes through some more emotions about dumbledore having known he would need to die ultimately i think he comes out still admiring dumbledore because he knew how hard it was for him and that this was the only choice also  he was going through so many emotions about his own life that being mad at someone else was nt at the top of his mind  i think the jamessnape thing is very much up for debate i ve heard a lot of insightful things on this sub though  the mirror was from sirius he gave it to him as a gift there are two that are connected  the idea being sirius had one and harry had one and they would be able to talk through them   someone correct me if i m wrong but i think aberforth gets the other one after it was stolen from grimmauld place by mundungus  lily is represented by a doe this makes sense because she and james were together and his animagus  and probably patronus  was a stag the patronus is important because it is much stronger evidence that he still loves lily than just saying he does they talk about how only something really powerful emotionally can change a person s patronus  hope this helps other people help me out if i ve missed stuff i m sure i ve messed up a lot of spelling  sorry about that ,d00v17i,harrypotter,entertainment,1455559134,mjfc893,10,0,23,55,0.0
