text,id,subreddit,meta,time,author,ups,downs,authorlinkkarma,authorkarma,authorisgold
i m going to make a lot of assumptions here so please bare with me  being in the order would bring about a lot of intimate information lupin was nt a person to blab what he knows and frankly who would he have talked to with sirius in prison  after lily s death snape would ve been inconsolable who knows how he reacted  probably withdrawing  and maybe even slipping up in front of members of the order because only they would be showing any emotion about the potters  remus is kind  compassionate  caring  and introspective perhaps these qualities couple with a few scraps of information from dumbledore or another member of the order and the out of character  overreaction  by snape  which by most people s standard would be controlled  but for a fellow introvert these signs could be a bit more obvious  of course if remus knows or caught wind that snape s patronus changed and bang  we get that odd sentence structure in the quote  retread it this time with the knowledge that remus is keeping the information guarded either for harry or even snap s sake it s an odd place to pause and he mentions  thinking  as in hypothesizing and using  anyway  as a throw away to move the subject along without dwelling i believe he s just giving a plausible story with partial truth but he knows the truth and is just being a good person and sparing two people a lot of pain and confusion ,d0189ed,harrypotter,entertainment,1455578479,AthosN8,2,0,4977,5879,0.0
a divination chart  the sun in the middle makes me think it s astrology related ,d01xgct,harrypotter,entertainment,1455635127,ruelaurent,29,0,281,84,0.0
coloring it in correctly allows you to summon demons,d01z7ip,harrypotter,entertainment,1455637991,mattreyu,40,0,2686,222967,1.0
thats the bs3 chart  ,d022dfe,harrypotter,entertainment,1455642588,naeblis1911,3,0,1046,2554,1.0
it s clearly not page threehundred and fortynine ten points from gryffindor ,d0287jo,harrypotter,entertainment,1455650533,southernmost,-7,0,1,44037,0.0
thought i d share this with you guys i own one of several pairs of glasses made for the film  harry potter and the philosopher s stone  i was given these when i was 8 in 2002 by simon murray  the spectacle maker   here s a few photos   http  imgurcomazlkyh  cool huh ,464v3r,harrypotter,entertainment,1455660172,OriginalCrisis,33,0,3219,174,0.0
that is cool  thanks for sharing  ,d02hh9m,harrypotter,entertainment,1455663021,elbowsss,2,0,2212,8637,1.0
that s really cool  lucky you  ,d02igsy,harrypotter,entertainment,1455664494,GinervaMWeasley,1,0,1,23,0.0
maybe some language courses  like gobbledegook for example ,d01prze,harrypotter,entertainment,1455611953,MacabreGoblin,2,0,95,191,1.0
basic healing,d01qv2q,harrypotter,entertainment,1455616217,alexi_lupin,2,0,2853,73988,1.0
this is obviously written by someone who dislikes the franchise  and he did nt say it was evil he said it was a jerk  racism  his cause and effect is backwards slytherin is nt for purebloods  purebloods tend to prefer slytherin due to their arrogance  laziness  first off  some people are easier to read than others  but let s really look at the weasley example while a lot of people tend to forget this  the hat looks at values  not traits naturally  a family as tight and loving as the weasleys are going to have the same values taught to them by their parents again  i feel the writer is taking the quick sorting and the hat s quip and reversing which one effected the other also  harry was a great fit for both gryffindor and slytherin considering how much harry did nt want to be in slytherin  it had no reservations putting him into gryffindor on the other hand  it argued with neville for almost five minutes because he wanted to be a hufflepuff as we know  the hat was nt having it and put him where it thought he belonged  invasion of privacy  it s a psychic hat what are you going to do  also  the movie s exclamation about harry s feelings towards slytherin is inadmissible  seeing as the movies are terrible  closing  it was nt the hat s fault the school was segregated it was enchanted to sort things because four other wizards wanted it that way  tl  dr  sorting hat 4 lyf,d02jmt9,harrypotter,entertainment,1455666296,Crispy385,5,0,18,1925,1.0
that white line at the end must be the kings cross scene with dumbledore ,d02vpzs,harrypotter,entertainment,1455685950,Thatonepottergirl,1,0,783,149,0.0
this article is lazy and poorly informed which is unfortunate because there is a lot to criticize about the sorting  but this article takes the lazy approach of attacking the instrument rather than the institution ,d02jgo7,harrypotter,entertainment,1455666031,Booster6,3,0,1486,8967,0.0
does brewing a magical potion requires any magical skill  or it is enough to put right ingredences to cauldron in the right order and follow the recipe  would it be possible to mugglesquib to brew  for example  felix felicis or polyjuice potion ,465abe,harrypotter,entertainment,1455665544,Narsil098,4,0,1,38,0.0
found an answer straight from pottermore for you   gt  gt  it is often asked whether a muggle could create a magic potion  given a potions book and the right ingredients the answer  unfortunately  is no there is always some element of wandwork necessary to make a potion  merely adding dead flies and asphodel to a pot hanging over a fire will give you nothing but nastytasting  not to mention poisonous  soup  ,d02lc8c,harrypotter,entertainment,1455669038,managed_mischief_,4,0,1,1181,0.0
this is the most logical thing i ve seen from his tweets ,d02pt8t,harrypotter,entertainment,1455675860,mybossthinksimworkng,34,0,5,27366,0.0
this is the oc we deserve good work out there ,d02v831,harrypotter,entertainment,1455684986,teferi66,1,0,21,6635,0.0
i ve always wondered this critically  it did nt seem to be as well received as the other books and apart from a couple of the camping chapters  i m not really sure why could someone who did nt think the book was satisfactory elaborate as to why it disappointed ,466k16,harrypotter,entertainment,1455683451,cheeseygritz,0,0,9,831,0.0
it was disappointing to me for three reasons  1 most of my favorite characters died  2 an awful lot of the book felt disjointed and aimless to me  including the wandering around in the woods for weeks  3 this may be an unpopular opinion  but it s always bothered me that harry did nt actually die i felt like the whole whoops jk not dead  thing was a copout  and it cheapened the story for me i felt like that was the natural point to which the story was building ,d02utkq,harrypotter,entertainment,1455684231,MacabreGoblin,1,0,95,191,1.0
gt  credence  played by ezra miller  is apparently a character that becomes notable in the harry potter universe  we do nt know he s part of potter canon yet we only know that he will be in the end since he s from the us  we ve probably never heard of him again ,d02kch8,harrypotter,entertainment,1455667500,lupicorn,1,0,58,3719,0.0
my guess is he writes one of the textbooks he is nt personally significant in harry s story  but he becomes known throughout the wizarding world ,d02n2gz,harrypotter,entertainment,1455671693,KitMarlowe,1,0,92,264,0.0
we do nt know if hogwarts prey on creature fearswe only see hogwarts transform when there are humans the same rules might not apply ,d02s0fo,harrypotter,entertainment,1455679358,Mrsphysics,1,0,1,170,0.0
what country and continent do you think it will be located  is there any information regarding ilvermony s location per jkr ,466bbj,harrypotter,entertainment,1455679969,Mrsphysics,1,0,1,170,0.0
why does this sub in particular enjoy posting extra jpeged screenshots of tumblr reposts  if it s just text link to the actual post or copy and paste it if it s an image drag and drop it into imgur,d01fx99,harrypotter,entertainment,1455590652,GeneralRose,15,0,9664,39413,0.0
i have nt tried any yet  i ll probably get a sampler of each  ,d00bxkv,harrypotter,entertainment,1455511026,inked-bones,1,0,13,48,0.0
i would have loved this as a valentine s day gift  but there is always my birthday  or you know any other day is a great reason for a gift  ,d00cvs0,harrypotter,entertainment,1455513106,YoureSoVaneRomilda,1,0,1,43,0.0
oh my there are all sorts of fandom teas brb trying them all ,d00daaw,harrypotter,entertainment,1455514024,apprberriepie,1,0,784,5762,0.0
i am gon na order a sample box ,d00h85z,harrypotter,entertainment,1455525432,Censsara,1,0,752,770,0.0
i ordered harry potter themed teas through a seller here too  not this particular seller though  it was  this one   http  wwwadagiocomsignature_blendlisthtml  userid  327324ar   really fantastic customer service  and the teas all smelled amazing  they were a gift so i cant attest to tasteand im not much of a tea person as it is  p  ,d00ma11,harrypotter,entertainment,1455544240,coledarling,1,0,60,13004,0.0
 that s   https  wwwredditcomrharrypottercomments1zdjm4merlins_beard   so   https  wwwredditcomrharrypottercomments2905vomerlins_beard   cool   https  wwwredditcomrharrypottercomments44kko6merlins_beard ,d012z50,harrypotter,entertainment,1455570524,tsunami845,270,0,4535,61244,0.0
last october my girlfriend and i purchased tickets to see the cursed child in london on august 11 and 12 unfortunately  something recently came up with my girlfriend  s work and there  s no way we  ll be able to get to london at that time  i was wondering if there is any sort of ticket exchange or some other way we could possibly swap our tickets with someone who has tickets to a later showing any help would be greatly appreciated as we still really want to see the play in london thanks ,463k1r,harrypotter,entertainment,1455644166,smokie249,6,0,1,0,0.0
wizards returning as ghosts comprise several plot points in the septimus heap series  most notably  you can call on a meeting of all former wizard leaders to draw upon their collective ghostly advice of course  whether or not it is relevant or useful is up for debate ,d02ruen,harrypotter,entertainment,1455679080,UpgradeTech,1,0,12958,18341,0.0
needs more jpeg   s,d017ob4,harrypotter,entertainment,1455577556,rchard2scout,-3,0,243,2148,0.0
portus,d00utwz,harrypotter,entertainment,1455558841,lupicorn,2,0,58,3719,0.0
i dont follow haha,d011yex,harrypotter,entertainment,1455569070,FullAutoOctopus,22,0,2124,3823,0.0
1  iirc  jkr was a classics major she knows this  2  i think  given her extensive study of the classics   this   https  enwikipediaorgwikihermione_   mythology    is as likely a source  although less cool 3  to be completely fair  i think the original mythological figure in 2 was also likely named after hermes  in one aspect or another   so i still think this is pretty awesome,d01aqps,harrypotter,entertainment,1455582462,kdbvols,9,0,498,4015,0.0
i got the sense that it has to be an object  in the traditional sense the very nature of its purpose suggests that it should be able to be hidden it seems to need to be solid it definitely needs to be comprised of physical matter  otherwise how could you contain your soul within it  again  it needs to be a traditional object i have no idea about the moon  you d have to get there  as well as be able to perform the ritual to make it a horcrux  which might be difficult  but who knows  the ocean  almost certainly not liquids do nt seem like they could be made into horcruxes too much flux ,d02h38w,harrypotter,entertainment,1455662464,Fuck_Weyland-Yutani,3,0,8,452,0.0
me too ,d01078o,harrypotter,entertainment,1455566537,TheRedCormorant,5,0,51,3463,0.0
in the third book lupin describes the boggart and since it takes the form of whatever the person in front of it fears most no one knows what it looks like when it is alone then in the fifth book there is the boggart in the upstairs room of number 12 and molly asks moody to look at it since the boggart ca nt see moody it must have been in its regular form i wonder what it looks like ,464y68,harrypotter,entertainment,1455661192,curious_rampage,5,0,139,114,0.0
for some reason i always imagine them like  this   http  cdnbulbagardennetuploadthumb662093haunterpng250px093haunterpng  ,d02hetq,harrypotter,entertainment,1455662921,elbowsss,8,0,2212,8637,1.0
i have a theory  it is invisible in its neutral form kinda like a ghost as portrayed in modern times  where it s invisible but can move things and stuff like that if that s the case  then moody did nt even notice it ,d02ga5w,harrypotter,entertainment,1455661313,starazona,3,0,1,445,0.0
personally  i imagine it as a bluesilver sphere however  the reason that s the case is that i did nt realize what happened when it turned into a moon in front of lupin  and even though i now know that s wrong  it stuck ,d02hohn,harrypotter,entertainment,1455663312,Crispy385,1,0,18,1925,1.0
these are seriously adorable  you have a lot of talent ,d00btbt,harrypotter,entertainment,1455510775,so_last_summer,3,0,3429,3067,0.0
adorable can i ask for the recipe   i ve been wanting to try to make some of these for ages but have nt found a good one yet ,d00fkir,harrypotter,entertainment,1455519981,alruma,2,0,1,37,0.0
that s super cool  thanks for sharing ,d00c2hb,harrypotter,entertainment,1455511320,stamerius,1,0,1,63,0.0
the internet has won i need nothing else today ,d00msec,harrypotter,entertainment,1455545454,ApricotPickles,1,0,457,19704,0.0
since it sounds like they were stolen just in january  i suppose theres a chance they might be listed on craigslist or even ebay  i would take a look there  maybe you ll get lucky and can track them down  i ca nt imagine they would steal them simply for their own collection ,d01aa2q,harrypotter,entertainment,1455581716,takiniteasy88,3,0,2835,2873,1.0
english maths physical education  playing sports ,d01q5i6,harrypotter,entertainment,1455613384,ykickamoocow111,1,0,1,7556,0.0
i study ancient runes in my spare time most of the symbols in the border are runes ,d02956o,harrypotter,entertainment,1455651782,elle_the_indigo,2,0,2,991,0.0
the small symbols on the outside border are the symbols of planets  so that hints at astronomy ,d02hq46,harrypotter,entertainment,1455663377,jadeoracle,1,0,2254,12915,1.0
i ve been relistening to the harry potter series during delivery driving at work and i just finished  the order of the phoenix  again it must have been the most depressing feeling for harry  when he finally opened sirius  present at the end  realizing that he could have communicated with him so much easier and possibly prevented his death with it so sad and i had another reminder how snape could have prevented it all  by actually trying to teach harry occlumency and not giving up ,460oq8,harrypotter,entertainment,1455595500,ventz59,8,0,1,41,0.0
the part where he finds the mirror breaks my heart every time  if only he had opened the present when he d received it i really wish they had included that scene in the movie  especially since the mirror plays such a vital role in book 7   but it probably did nt seem too significant at the time  just a sad detail ,d02dib6,harrypotter,entertainment,1455657569,poufsouffle_pants,1,0,1,27,0.0
wow  that looks fantastic  those colors damn ,d01twu4,harrypotter,entertainment,1455627488,Platycakes,1,0,1,39,0.0
or summon the objects in the room after the fiendfyre  or summon the room with the fiendfyre gone  the nature of the fiendfyre is magic and presumably while it can destroy magical objects  i m under the impression that one could transfigure ashes of a former object back into itself so that leaves my question  is it possible for the room of requirement to restore all the objects in the room of hidden things  minus any enchantments cast upon the objects  which i presume is nullified after being burned   additional questions   does the room of requirement  being of its own magic  have its own protections which the fiendfyre would nt affect   does the room of requirement  being that it can be multiple rooms  still exist despite the fiendfyre in the version of the room of requirement that is the room of hidden things  also  if the room of requirement still exists  does that mean the room of hidden things just the only thing destroyed   is the nature of the room of requirement an everlasting spell  meaning that as a type of magic and not a object  the fiendfyre would nt be able to destroy it   does the room of requirement have its own magic   why did nt the fiendfyre escape the room of requirement ,45vzuy,harrypotter,entertainment,1455534433,AllyUnion,6,0,4,18,0.0
honestly i was always under the assumption that the ror itself was destroyed with the fiendfyre its really interesting to consider the alternative that  just  the room of hidden things was destroyed ,d00rgua,harrypotter,entertainment,1455553841,diegrauedame,6,0,1,46,0.0
my thoughts are  that magical destruction is final much like avada kedavera once it s goneit s gone  i m not sure what precedent is set for returning magical artifacts from ashes  other than obviously a phoenix  so it really boils down too is the ror more magical than magical destruction  i believe no  however the ror could conjure a fairly detailed replication of the original item if it was wellneeded the original however would be destroyed ,d00m62f,harrypotter,entertainment,1455543962,AthosN8,3,0,4977,5879,0.0
i assume no  because the items were destroyed by magic it was nt normal fire  it was magical fire kind of like how george s ear ca nt be healed because it was magically cursed off ,d00mnwx,harrypotter,entertainment,1455545173,ApricotPickles,3,0,457,19704,0.0
the room of requirement ca nt summon any objects from the room of hidden things because its purpose of keeping things hiddenwhen hermione tries to summon the diadem in deathly hallows it didnt work now you could say that maybe  as a headcanon  that voldemort put an enchantment on the tiara so it ca nt be summonedbut that ca nt be true because voldemort did nt think that anyone would know about the room so what was the point  i do nt know what happened to the room of requirement after the fiendfyre ate all the objectsnothing in the books says anything about it afterward also the transfiguration part would require you to know what the object was before it burned to ashes so i do nt think they can as for summoning the objects  requesting the ror  back from the asheswe really do nt know the limits of the room s magic also fiendfyre is very dark magic so i do nt think it s likely the room can bring it back ,d00wned,harrypotter,entertainment,1455561468,Mrsphysics,1,0,1,170,0.0
they both become the funniest jokes in the history of the universe  god damn  we need to try this ,d02h64l,harrypotter,entertainment,1455662578,c130,1,0,8062,20655,0.0
tea and butterbeer   my dear  you know it s either  champagne   http  41mediatumblrcom2ebc64ed51fc123548c2ce6f791563a9tumblr_o245t0ogjy1uj8acqo1_1280jpg  or nothing ,d00dxta,harrypotter,entertainment,1455515562,Lockhart_in_Lilac,3,0,2,16,0.0
https  pbstwimgcommediaczol6zywcaewpaijpg,d014gzo,harrypotter,entertainment,1455572718,katapotamus,11,0,1220,577,0.0
some variety of bowtruckle ,d0148hb,harrypotter,entertainment,1455572374,mattreyu,5,0,2686,222967,1.0
i found a front shot i ca nt seem to match up the pig like snout and teeth http  iimgurcomg7y7rrzjpg,d014j6j,harrypotter,entertainment,1455572806,theWWoHP,1,0,188,106,0.0
ot  but it reminds me of a mix of salacious crumb and a gamorrean,d01ljxm,harrypotter,entertainment,1455600324,Crispy385,1,0,18,1925,1.0
imperius the minister s secretary  tell himher to steal it,d01t9dh,harrypotter,entertainment,1455625562,malefiz123,1,0,1,14720,0.0
a real artificial eye you say  those are opposites  mind you  however  i love your tribute to my mentor  ,d000t8l,harrypotter,entertainment,1455490332,HonkMyTonks,6,0,1,15,0.0
i love that you may homage to the books and have the magical eye on the right  not the left like the movies changed it to  for some reason ,d006lcs,harrypotter,entertainment,1455500980,managed_mischief_,2,0,1,1181,0.0
hey madeye  i found  this   http  iimgurcomsvrwdxtpng  by the rose bushes  do you know what it is ,d008uar,harrypotter,entertainment,1455505019,SnogKingStebbins,2,0,163,20,0.0
you should be able to get it from gamestop  but   online     not  instore it will not be there if you try to get it in the store  and i do nt know if they can order it for you and have it shipped to you just running a quick search  it looks like it s going for  999 preowned with them  otherwise  on amazon it seems to be  2695 used right now on ebay  the cheapest i saw was a  099 bid  12 hrs left  with  400 shipping ,d01o7qz,harrypotter,entertainment,1455606833,StormTheParade,3,0,8669,13348,0.0
  rita skeeter    she reminded me of someone i know she was the cliche annoying reporter who put her own spin on everything the part that really sealed it was in interview about dumbledore and she said her and harry were in contact  drove me nuts    cho chang    i just found her horribly irritating ,d01komd,harrypotter,entertainment,1455598574,managed_mischief_,19,0,1,1181,0.0
justin finchfletchley i m still seething over the whole parseltonguewizard duel scene  malfoy  conjures a snake  it goes for j finch  then and  only then  does harry start speaking parseltongue  and the snake backs off really  he s smart enough to get into eton but he concludes from these events that harry sicced the snake on him  surely muggleborn justin finchfletchley should have no preexisting parselmouthbias i can only conclude that he s a colossal idiot  and that s before you consider his very punchable face in the movies ,d01z8bh,harrypotter,entertainment,1455638026,MacabreGoblin,8,0,95,191,1.0
villians  i really wanted to say  dolores umbridge   but she at least got jailed  while another disgusting person    rita skeeter   was never punished i guess that in britain s magical law there is no such thing as defamation in muggle world skeeter would ve drown in lawsuits   heroes     james potter    of course rich  spoiled brat  basically gryffindor s draco malfoy except everybody loves him because  yknow  rich and handsome ,d01w02k,harrypotter,entertainment,1455632405,Narsil098,3,0,1,38,0.0
zacharias smith probably he s not the worst person out there but even the bad guys have a bit of the  love to hate them  vibe going on  or they re interesting enough as characters to make me enjoy reading about them smith is just a jackass  honorable mentions to hagrid and dobby ,d01lhi2,harrypotter,entertainment,1455600183,alexi_lupin,2,0,2853,73988,1.0
i really hated pettigrew ,d01uttz,harrypotter,entertainment,1455629840,ThatGreekLady,2,0,1,895,0.0
obviously umbridge  but i ll be honest  harry himself is right up there snape constantly accuses him of every trait that drives me up the wall with him ,d01ll5t,harrypotter,entertainment,1455600393,Crispy385,1,0,18,1925,1.0
 amazon link to all current listings   http  wwwamazoncomgpofferlistingb0000bvuyhref  dp_olp_0  ie  utf8amp  condition  all ,d0252dc,harrypotter,entertainment,1455646285,LaughingIntoValhalla,1,0,73,1525,0.0
what a rotten thing for those people to do  i m so sorry  i think all of us here can relate to how important harry potter was when we were growing up books especially can take hold of our hearts and develop a rich tapestry of emotions that we associate with reading them ,d01b4a4,harrypotter,entertainment,1455583067,A_Flawed_System,2,0,1,46,0.0
that s real cruddy like damn ,d02fl0c,harrypotter,entertainment,1455660334,somethingwitty26,2,0,7,1136,0.0
i think this is being a bit to kind  but it may be half true  some things in it are quite nice  i think he disliked of muggle born and had more of a  those lower less real wizards  feeling a lot like we see in the real world in the ww2  just to name one example   this is mostly because people are often racist and classiest when there in such a passion also can you blame him  if he rely was this much of a  good person  i think the others would have known he would explain why he felt the way he felt  but i do like the idea of the chamber being a thing of defense ,d01rltl,harrypotter,entertainment,1455619333,elkor101,9,0,1,155,0.0
iveread about this before but it still does nt excuse the fact that he put a basilisk to kill innocent children ,d02hgwk,harrypotter,entertainment,1455663007,Mrsphysics,1,0,1,170,0.0
ginny she s about as deep as a small puddle ,d01m3dm,harrypotter,entertainment,1455601479,shaun056,15,0,5149,11702,0.0
  remus lupin   passiveaggressive  emotionallycowardly jerk he was the only good guy character that truly aggravated me  of the ones basically built for readers to hate    umbridge   was the worst i feel more comfortable when characters run into bellatrix lestrange umbridge is justdiabolical ,d01pyj8,harrypotter,entertainment,1455612646,muted90,2,0,1,288,0.0
umbridge reminds me of hillary,d01l8v9,harrypotter,entertainment,1455599694,torrunh,0,0,293,9233,0.0
i am sorry to hear about this  is it possible for you to hunt them down and make them pay or at least get your books back ,d01v0yx,harrypotter,entertainment,1455630310,DoctorTaeNy,2,0,1,3539,0.0
there are plenty of characters that i love to hate  looking at you umbridge   but i do nt know that there are any characters whose actual existence i hate  i was nt a big fan of cho chang post cedric diggory  but i guess if i had to choose my least favourite harry potter character is that nigel character from the movies why not just use a creevey brother for that role ,d01phee,harrypotter,entertainment,1455610885,Keica,6,0,125,8260,0.0
romilda vane is about the only character in the series whose presence i actively hate ,d01pbd7,harrypotter,entertainment,1455610312,AmEndevomTag,11,0,1,2156,0.0
