text,id,subreddit,meta,time,author,ups,downs,authorlinkkarma,authorkarma,authorisgold
that white line at the end must be the kings cross scene with dumbledore ,d02vpzs,harrypotter,entertainment,1455685950,Thatonepottergirl,1,0,783,149,0.0
i have regrettably not kept up with all of the information that has been added to the hp world since the books were finished  in the next few years i would love to reread the whole series  but it would be really fun to have all of the new information interjected throughout with asides  footnotes  etc  thoughts ,45xsew,harrypotter,entertainment,1455559806,colinstalter,35,0,9011,23328,0.0
yes  i saw a new version of the annotated alice in wonderland the other day  and it s amazing  it s like a huge illustrated version  similar in sizeshape to the illustrated harry potter and the sorcerer s stone   but the actual story is written on like 13 of each page  with extra information and paragraphs and illustrations in the empty parts designwise  it s beautiful  and it s such a cool way to read the book  but it would have to be very wellthought out as far as what information is revealed when  ,d014oda,harrypotter,entertainment,1455573013,whitbeyondmeasure,2,0,44,2320,1.0
it would break the flow of the story the only way to add it is by pulling a tolkien and putting all the pottermore stuff in a post dhending appendices they could also add some extensive family trees of the main characters ,d0135e3,harrypotter,entertainment,1455570780,zsmg,2,0,1,2470,0.0
this was my bulletin board for the month too  p http  iimgurcom7h3pfuyjpg,d02rem2,harrypotter,entertainment,1455678362,laneebird,1,0,43,8,0.0
you are the type of ra i hope i can be if i manage to get selected  my current ras are great guys  but they did a great gatsby theme instead of harry potter ,d02qfaf,harrypotter,entertainment,1455676813,DEP61,2,0,5581,13488,0.0
probably the best book to movie adaptation that s ever been released  at least imo ,d01rbqa,harrypotter,entertainment,1455618165,TheJohnny346,2,0,1578,7739,0.0
awesome drawing ,d02fjae,harrypotter,entertainment,1455660267,Poointhelou,4,0,1,338,0.0
wait til my father here s about this ,d02ixjn,harrypotter,entertainment,1455665216,VigilantePress,17,0,10,25,0.0
i feel there was nt enough in the movies actually it seems worse in the movies because all the pranks and fighting back against her  catharsis  fireworks  weasleys  is nt in the movie until just before they go to the ministry and the decrees were in higher number so i imagine in the film s universe it felt a lot worse whereas in the books it would ve been better ,d0249ec,harrypotter,entertainment,1455645189,Alagorn,1,0,21,6689,1.0
wow  that s so well done  i can draw a good outlet  ,d02h9a7,harrypotter,entertainment,1455662704,GoodniteMush,2,0,1,681,0.0
wow  did you do this yourself  ,d02hbro,harrypotter,entertainment,1455662801,elbowsss,3,0,2212,8637,1.0
its a mad house    a mad house    ,d02u4l7,harrypotter,entertainment,1455682971,jeezeitsjeff,1,0,3138,2824,0.0
i do nt know why it took me this long to notice this  but the name  hermione  is a derivative from hermes  but not necessarily from hermes the greek messenger god of trickery  trade  theft  heroes  and of course communication  hermes was merged with mercury by the romans   for the greeks had other gods named hermes  hermione s name fits all too well with the syncretic god hermes trismegastis  hermes trismegastis  famed deity for which the hermaneutic method is named  is thought by many scholars to be a syncretic divinity combining the greek god hermes with the egyptian god thoth the ancient greeks had noticed that both gods were gods of magic and scribes  and other forms of written communication   ie bookish they both were psychopomps  divine figures who escort others to the afterlife or the underworld hermes trismegastis combined within him hermes  godhood over communication and heroism and thoth s godhood over astrology  alchemy  and wisdom  it seems fitting that hermione could be named after the syncretic god of scribes  magic  heroism  and wisdom  on the other hand  although jk is known for her clever naming of characters in the harry potter stories  this could also be simply a pleasant convenience  i ve googled about this and found nothing to tell me one way or the other  does anyone know ,45znqo,harrypotter,entertainment,1455581228,magic_rhyme,6,0,123,4165,0.0
definitely  and then all of the things she happily does under voldemort s ministry regime later on she s a horrifying and disgusting person  and every bit as bad as the death eaters ,d01o916,harrypotter,entertainment,1455606935,Lord_Cronos,2,0,609,11561,0.0
can i have your talent please   this is amazing ,d02ue1v,harrypotter,entertainment,1455683440,Wolfy743,1,0,1,70,0.0
i ve heard there was a parseltongue in gryffindor once ,d029411,harrypotter,entertainment,1455651739,suugakusha,5,0,5538,95835,1.0
unless hogwarts employed professor wade wilson  probably not ,d01oikc,harrypotter,entertainment,1455607728,M_Night_Slamajam_,2,0,29,11435,0.0
in regard to your comment about being unable to learn parseltongue  i think it is possible to animal languages at least to be understood by those who are not natural speakers  dumbledore himself understands parseltongue   i d think owl language would be the most useful in the wizarding world it s so natural for owls to be seen about  so they d make the perfect observers and spies ,d01zvc7,harrypotter,entertainment,1455638996,poop_squirrel,4,0,107,8262,0.0
the top comment in this  thread   http  wwwredditcomrharrypottercomments440ppydid_dumbledore_speak_parseltongueczmh7bn  suggests that parseltongues could be magically attenuated to speaking to snakes  however elsewhere on this reddit and i believe jkr herself said it can not be learned we know genetics  of sorts  plays into it some  so are there natural felinetongues  aviriatoungues  rodentiatongues that we do nt know about out there  of course i m asking for wild speculation here as the canon does nt talk about it much and seems to keep parseltongues on par with voldy so no character wants to explore it in the books for fear of being named a deatheater or whatever irrational nonsense comes to mind ,462ivg,harrypotter,entertainment,1455630797,AthosN8,35,0,4977,5879,0.0
hitching on to this train of thought  would animagi be able to speak the tongue of the animal they can transform into  ie mcgonagall can talk to cats  sirius to dogs  etc  ,d024h10,harrypotter,entertainment,1455645475,Onate,5,0,77,3176,0.0
all of these questions are answered by the books  and some answered might be a little spoilery for some aspects that the movies never went into if you d rather not have any further spoilers  please stop reading here  a this is complicated and is actually a long overarcing thread in the last book through out the book  harry  at many points  feels very frustrated with dumbledore and the amount of secrets he kept from harry however he also comes to see that mostly when dumbledore was keeping secrets  it was as a benefit to harry it might not be something harry liked  but it was something he needed eventually  harry makes a decision to trust in dumbledore s judgement and sort of comes to accept that he can not always know everything and that sometimes he needs to not act  which is enormously hard for him   when he sees those memories  he does think about dumbledore s betrayal  but it feels to him as a minor thing against the knowledge that he has to die  gt  slowly  very slowly  he sat up  and as he did so he felt more alive and more aware of his own living body than ever before why had he never appreciated what a miracle he was  brain and nerve and bounding heart  it would all be gone    or at least  he would be gone from it his breath came slow and deep  and his mouth and throat were completely dry  but so were his eyes  gt  dumbledore  s betrayal was almost nothing of course there had been a bigger plan  harry had simply been too foolish to see it  he realized that now  the thing is that harry does see the sense of it he understands why dumbledore did what he did  and he understands why he is the one who has to die  and if it is him  then nobody else has to at this point  harry s emotions are a huge mess he is in a great state of shock and wanting to live but knowing he can not  so anger is not at the forefront of his brain eventually when he meets dumbledore  after being killed  by voldemort  the shock has worn off  but he is still mostly confused  which keeps him from feeling anger it also helps that pretty much one of the first things dumbledore tells him is that he is not exactly dead then dumbledore goes on to explain and apologises to harry  with tears in his eyes  which helps harry understand that everything dumbledore did  he did nt do for the funsies he made these decisions because they were the best ones  but they were nt easy or kind  not even on dumbledore himself  which is what helps harry come to peace with them  honestly  the books go way more in depth with harry s feelings re  dumbledore than anyone could ever do in a simple post  so i very much urge you to read them it will help clarify a lot  b when harry first finds out about the bully james was in the past  it actually bothers him a lot there is quite a chunk of the fifth book that deals with harry thinking about what he saw in the pensive and his father s behaviour he does quite a dangerous thing  using umbridge s fire to talk to sirius and lupin  just to get more information on his father s behaviour eventually he learns to give it a place he still loves his father  obviously  but he thinks of him with slightly less blind idealism still  from all accounts  it does seem like james  honestly  changed  and snape was nt exactly innocent in all of it either  james and snape pretty much continuously hexed each other  so it is not like james is an unrepenting douchebag either he s a person who made douchy choices as a teen  but also made a lot of good ones during that same time of his life  who eventually grew out of it  which is sort of how harry comes to remember him  c in the order of the phoenix  after christmas  sirius gives harry one of a pair of twoway mirrors but does nt explain them they are basically like mirror walkietalkies  that sirius and james used to use to talk to each other in detention harry  realising it is a way to contact sirius  fears that doing so will make sirius do something stupid and dangerous and puts them in the bottom of his trunk he forgets about them  even when he needs them most after sirius s death  harry remembers the mirror  however because sirius is dead  he can not use them anymore still  he does nt get rid of it it eventually shatters  but harry keeps the biggest piece the second mirror  the one that belonged to sirius is found by mundungus when he is looting sirius s house for stuff to sell he sells that mirror to aberforth  dumbledore s brother  who realises what is aberforth uses the mirror to keep an eye on harry  it is his blue eye harry sees  and eventually uses it to send dobby to them when they are in great danger  d snape loved lily snape has never loved anyone but lily lily cared great for him  as a friend  and potentially more according to jkr  but the path snape put himself on  the one with the dark arts  turned her away from him it all came to a head when snape called her a mudblood lily ended their friendship there  but snape did nt stop loving her because he loved her  he tried to ask voldemort to spare her  and through that  gave lily an out  which she refused to take but instead protected her son   knowing that snape loved lily so much  dumbledore used that love to get snape on their side when dumbledore asks if snape s feeling are still the same after all this time  snape casts that patronus  lily s patronus had been a doe as well  and tell him  yes  always he s still in this for lily ,d00vxp9,harrypotter,entertainment,1455560441,palcatraz,4,0,50,34365,0.0
 felinetongues  filch  ms figg   just kidding  althought it would be awesome ,d01wsiq,harrypotter,entertainment,1455633939,Narsil098,18,0,1,38,0.0
i think parseltongue can be a learned language ron used it to open up the chamber of secrets in the last book he may not have known what it meant and it took him a few times  but he did do it ,d021yzt,harrypotter,entertainment,1455642012,TimeladyofHufflepuff,13,0,34,5128,0.0
not to mention the weasleys  potters  and longbottoms listed in there they were women marrying men but one or more of their children could take  or be given  the family name black just to keep it going it s not totally improbable  edit  cleaned up a bit,d00lwws,harrypotter,entertainment,1455543299,AthosN8,11,0,4977,5879,0.0
the only thing wrong with that tree is that andromeda black married ted tonks who was muggle  born   not a muggle ,d0206sx,harrypotter,entertainment,1455639468,Feminist_Cat,1,0,383,3866,1.0
i think taking to cat is called redditortongues,d01xvte,harrypotter,entertainment,1455635870,Casitios,17,0,3404,10116,0.0
1  i totally forget how harry reacts after he sees the memories i think maybe he just sits down and cries for a bit  it was a lot to take in  2  snape kicks harry out of the dungeons after that lesson iirc  harry basically runs out of the dungeons and ends up on some stairs feeling nauseous about how he just saw his father behave  25  sirius and james had started to bully snape on the hogwarts express before they had even gotten sorted yet both james and sirius came from money and gave snape crap for wanting to be in slytherin house  like his mother eileen was   so  snape did not instigate the bullying by fifth year  snape was very much into the dark arts and was hanging around shady people and james was about to stop being such an arse all the time from snape s point of view  james stole her from lily s point of view  snape had become toxic and james was a changed man calling her a mudblood was the last straw and she cut snape out of her life and james and her clicked and they started dating  snape s memory did nt change what james didwas james grew up and matured  3  in order of the phoenix   at 12 grimmauld during the christmas holidays i think   sirius gives harry a package and tells him if he ever should need to be in contact  to use what s in the package harry has just seen a spat between snape and sirius and does not want to be the reason sirius ends up getting killed so  harry never opens the package  which contained the mirror shard he  does  open the package  after  sirius has died and feels like an idiot for not having opened it sooner mundungus feltcher ends up stealing stuff from grimmauld place after sirius dies he ends up selling the other half of the mirror to aberforth  dumbledore s brother who owns the hog s head tavern   so  when harry keeps seeing bright blue eyes in the mirror during deathly hallows  it s actually aberforth keeping a watchful eye on harry in case he needs help  4  dumbledore had just asked snape if he had grown to care about harry snape casts his patronus it s a doe just like lily s patronus was a doe dumbledore realizes that snape is still fighting for lily  lily after all this time   snape replies  always   in that snape had always loved lily in that he never stopped  or will stop  loving her ,d00vc6k,harrypotter,entertainment,1455559577,trekkie_becky,2,0,5956,33693,1.0
what a great question  imagine being able to talk to your dog or cat  jk needs to clear this up  ,d01wqc4,harrypotter,entertainment,1455633829,JoeysBluebirds,7,0,1,5142,1.0
you ve had too much dragon dust ,d01e0t1,harrypotter,entertainment,1455587669,frankenstien_farts,9,0,2744,9811,0.0
do you think that these characters knew the readers could  see  what they were doing and sometimes even read their thoughts  the very thought of this has blown my mind   ,45zzqh,harrypotter,entertainment,1455585713,ModernHomoSapiens,0,0,1,-76,0.0
but ca nt a patronus only be an animal  would a dementor be considered one ,d00w0us,harrypotter,entertainment,1455560570,Mrsphysics,5,0,1,170,0.0
this is the first time i ve seen it  and i got a medium to large giggle out of it  ,d02ailq,harrypotter,entertainment,1455653621,naeblis1911,2,0,1046,2554,1.0
to me this isnt a big deal sirius was like the good apple in a tree of rotten ones being sad thats theres no more blacks is like being sad the hitler family ended when bill hitler was an animal rights activist dont get me wrong hitlers the hitlers are horrible but dont be sad that a racist family tree is ended be sad that good guy died,d00pkku,harrypotter,entertainment,1455550791,The_Gcm,-10,0,55,4887,0.0
i swear  dolores umbridge s patronus should be a dementor instead of a cat _ ,d00zq1h,harrypotter,entertainment,1455565842,Annieorms,8,0,1,6,0.0
i have already read all of the potter books multiple times  but it s been a few years and i was looking to do so again as a frequent member of book clubs  i thought it could be enjoyable to find someone to read along with this seemed a good place to find someone for that   so if you like the idea and would nt mind taking the journey with a 37yearold fella  send me a message or write on kik to iamhereiguess,45y02s,harrypotter,entertainment,1455562321,iamhereiguess,4,0,1,8,0.0
ha  i never thought of that nice ,d018bmv,harrypotter,entertainment,1455578579,ramrod42,1,0,87,314,0.0
you could always join us over at rdueling for harry potter trivia ,d01nct4,harrypotter,entertainment,1455604472,k9centipede,1,0,9004,132629,1.0
my guess is dementors would stay the hell away from anyone who they made happy ,d00nrd4,harrypotter,entertainment,1455547489,-TracerBullet,10,0,910,14114,0.0
when i first read dh s king cross chapter i had a  ahha  moment to the triumph look    this was probably the most talked about moment during the long summer  period between gof and ootp   well second most talked about after shipping of course i think some fans even asked jkr about it during a qamp  a session but she could nt give an answer  the fact i still remember it while reading dh for the first time in 2007 shows you how big it was ,d01z5xu,harrypotter,entertainment,1455637925,zsmg,2,0,1,2470,0.0
yeah  that is an awesome moment i really love rereading  or listening to  the books and picking up on hints like that one that are woven throughout the series another great foreshadowing moment is the scene in order of the phoenix  after harry has the vision of mr weasley being attacked  and they re in dumbledore s office   dumbledore watched the smoke closely  his brow furrowed  and after a few seconds  the tiny puffs became a steady stream of smoke that thickened and coiled in the aira serpent s head grew out of the end of it  opening its mouth wide harry wondered whether the instrument was confirming his story  he looked eagerly at dumbledore for a sign that he was right  but dumbledore did not look up  naturally  naturally  murmured dumbledore apparently to himself  still observing the stream of smoke without the slightest sign of surprise but in essence divided   harry could make neither head nor tail of this question the smoke serpent  however  split itself instantly into two snakes  both coiling and undulating in the dark air with a look of grim satisfaction dumbledore gave the instrument another gentle tap with his wand  the clinking noise slowed and died  and the smoke serpents grew faint  became a formless haze  and vanished    ootp pg 470 in the american edition  this was most likely dumbledore working out his theory that a piece of voldemort s soul was living in harry i ve always wondered at what  exact  point in the series dumbledore realized and admitted to himself that harry had to die in order for voldemort to be defeated  and to see if his behavior towards harry changed at all as a result but i guess if he figured out in book four that voldemort s act of taking harry s blood might mean an ultimate triumph for him  it would nt have affected him as much so many questions   also  welcome to rharrypotter  i m incredibly new here as well and am so glad i finally found this place ,d00ruud,harrypotter,entertainment,1455554443,poufsouffle_pants,11,0,1,27,0.0
this is making me want to reread them all again i only finished them for the 6th time a few months ago lol also  i chuckled out loud at the  riddled  pun   well done  golf clap ,d00uknd,harrypotter,entertainment,1455558473,katapotamus,5,0,1220,577,0.0
it is also interesting to note how this passage foreshadows dumbledore s story line in future books up until this moment harry sees dumbledore as this infallible perfect god who always knows what to do and always has the right answer to all the issues as described in previous books and the beginning of fourth book this comes as a contrast to the fact that he is one of the people he thinks of after he has the dream at the beginning about voldemort killing frank bryce  he is the one he runs when he sees mad crouch and he is the one he wants to talk to after witnessing voldemort torturing wormtail  however the fact that he is tired and concerned shows us how human he actually is the glimpse of triumph of course indicates that he is as lucid and intelligent as always with very strong deductive skills but from now on he would proceed to make severe mistakes in book five  by choosing to keep harry and sirius out of the loop  he indirectly is responsible for sirius s death not to mention book six where we truly get to see a weakened dumbledore as he is dying from a curse which he accidentally put on himself it all culminates with book seven where we learn about his past  his involvement with grindelwald and his part in the death of his sister ,d011ure,harrypotter,entertainment,1455568927,mikkeldaman,8,0,4,20037,0.0
thought i d share this with you guys i own one of several pairs of glasses made for the film  harry potter and the philosopher s stone  i was given these when i was 8 in 2002 by simon murray  the spectacle maker   here s a few photos   http  imgurcomazlkyh  cool huh ,464v3r,harrypotter,entertainment,1455660172,OriginalCrisis,33,0,3219,174,0.0
that is cool  thanks for sharing  ,d02hh9m,harrypotter,entertainment,1455663021,elbowsss,2,0,2212,8637,1.0
 tattoos   do you have some hp ink you re dying to show off   have ideas for a tattoo but want to run it by some other wizards   post everything harry potter tattoo related below ,461i8p,harrypotter,entertainment,1455609826,AutoModerator,10,0,1476,278459,1.0
i got this about a year ago harry potter has always been my favorite so i knew i was going to love this ink forever  http  iimgurcomwuwuiz7jpg,d01z92w,harrypotter,entertainment,1455638059,laneebird,8,0,43,8,0.0
hahaha   yeah i bet that was awkward   of course  i would nt know   but i hope you enjoyed it  and i m sure you earned those points back by being really awesome since you are a hufflepuff  ,czzv8n9,harrypotter,entertainment,1455480715,TeddyBearLupin,0,0,1,4,0.0
hell  bro i would nt be mad fawcett s hot  ,d005equ,harrypotter,entertainment,1455498780,nitasu987,1,0,144,4085,0.0
 detention  as well  mr stebbins   https  imgpandawhalecom105895snapecaringgifshrugimgurl9rv7gif ,d006wpc,harrypotter,entertainment,1455501568,severusfuckingsnape,10,0,1,41,0.0
missing  apparel  couple of tshirts  a scarf  and a pair of shoes   the book jacket for sorcerer s stone  ruined in a move and need to find a new one   and deathly hallows pt 2 dvd because my boss borrowed it ,d01aq5m,harrypotter,entertainment,1455582437,katapotamus,2,0,1220,577,0.0
i think it would look good if you hade cuts in your hand in red ink that spell sectumsempra,d01s0dy,harrypotter,entertainment,1455621013,elkor101,1,0,1,155,0.0
got mine a while back but here s a  photo   http  iimgurcom1pejyesjpg  from when it was fresh  the death s head moth is a representation of life and death and how they are deeply entwined throughout the series ,d021ul3,harrypotter,entertainment,1455641839,diegrauedame,5,0,1,46,0.0
two friends and i got  these   http  imgurcomxxwk2uh  back in december this picture is right after we got them ,d022n4y,harrypotter,entertainment,1455642965,bioaberlecker,4,0,1,351,0.0
i got these two over the last four years      http  iimgurcom4jjafdxjpg http  iimgurcomntlxuyhjpg,d02oy0y,harrypotter,entertainment,1455674524,kelso7smith,4,0,919,58,0.0
i got this done last year as my  first tattoo   http  iimgurcomlzwjfnspng   please excuse the islander ladythigh and mosquito bites gt  _lt ,d02j52w,harrypotter,entertainment,1455665535,LeiLeiVB,3,0,7,10767,1.0
your movies are out of order  p,d01lkch,harrypotter,entertainment,1455600345,alexi_lupin,2,0,2853,73988,1.0
buzzfeed article  here   http  wwwbuzzfeedcomshayanroymadamhoochapproves  ci3obbgxol ,d01eodj,harrypotter,entertainment,1455588680,just-a-tv-nerd,2,0,46,2639,0.0
the photographer is a friend of mine and these pictures were shot at  kalap trust   http  wwwkalaptrustorg   india featuring kids in the region having some fun in the hills ,d01ezxk,harrypotter,entertainment,1455589193,meow_mayhem,2,0,6853,1547,0.0
anybody have a cool sirius black tattoo or idea for one that they want to share  i ve thought about getting his prison number for years  but alas  i am empty when it comes to ink thanks ,d02msf8,harrypotter,entertainment,1455671261,KeanuCheese,2,0,95,62,0.0
what s that framed print in the back  where can i buy it ,d01gfjd,harrypotter,entertainment,1455591454,starazona,1,0,1,445,0.0
