text,id,subreddit,meta,time,author,ups,downs,authorlinkkarma,authorkarma,authorisgold
1  i totally forget how harry reacts after he sees the memories i think maybe he just sits down and cries for a bit  it was a lot to take in  2  snape kicks harry out of the dungeons after that lesson iirc  harry basically runs out of the dungeons and ends up on some stairs feeling nauseous about how he just saw his father behave  25  sirius and james had started to bully snape on the hogwarts express before they had even gotten sorted yet both james and sirius came from money and gave snape crap for wanting to be in slytherin house  like his mother eileen was   so  snape did not instigate the bullying by fifth year  snape was very much into the dark arts and was hanging around shady people and james was about to stop being such an arse all the time from snape s point of view  james stole her from lily s point of view  snape had become toxic and james was a changed man calling her a mudblood was the last straw and she cut snape out of her life and james and her clicked and they started dating  snape s memory did nt change what james didwas james grew up and matured  3  in order of the phoenix   at 12 grimmauld during the christmas holidays i think   sirius gives harry a package and tells him if he ever should need to be in contact  to use what s in the package harry has just seen a spat between snape and sirius and does not want to be the reason sirius ends up getting killed so  harry never opens the package  which contained the mirror shard he  does  open the package  after  sirius has died and feels like an idiot for not having opened it sooner mundungus feltcher ends up stealing stuff from grimmauld place after sirius dies he ends up selling the other half of the mirror to aberforth  dumbledore s brother who owns the hog s head tavern   so  when harry keeps seeing bright blue eyes in the mirror during deathly hallows  it s actually aberforth keeping a watchful eye on harry in case he needs help  4  dumbledore had just asked snape if he had grown to care about harry snape casts his patronus it s a doe just like lily s patronus was a doe dumbledore realizes that snape is still fighting for lily  lily after all this time   snape replies  always   in that snape had always loved lily in that he never stopped  or will stop  loving her ,d00vc6k,harrypotter,entertainment,1455559577,trekkie_becky,2,0,5956,33693,1.0
one of my best friends is a giant harry potter fan and i always turned my nose to it  thinking it was childish and nerdy  on new year s day this year  i sat and wrote a list of all the movies i wanted to watch before the end of the year and i decided to put the hp series on the list  totally expecting to further justify my ill feelings for it  well  my wife  who always shared similar feelings on the topic  and i just finished deathly hallows pt 1 and we are hooked we ve watched all the films up until this point over the past couple of weeks and we re also reading the books we ve definitely found a new love ,45um5m,harrypotter,entertainment,1455507582,SwanRonson65,39,0,6,449,0.0
welcome  little lady  here s  something   http  iimgurcomzdhp8ryjpg  just for you  i hope you positively  love  it ,d00bl7q,harrypotter,entertainment,1455510298,Lockhart_in_Lilac,14,0,2,16,0.0
have you read the books  oh man  you guys should definitely read the books together  that would no doubt be a very wonderful experience ,d00bigb,harrypotter,entertainment,1455510134,Slam_Dunk_Kitten,9,0,1818,9526,0.0
read the books i am not even close to bullshitting you when i say they are so  so  so much better than the films there s a fuck ton of content that was left out of the movies for a lot of mundane filler  you ll be doing yourself a favour  ,d00eu7w,harrypotter,entertainment,1455517910,DefconDelta88,8,0,102,57771,0.0
welcome to the fandom ,d00awnz,harrypotter,entertainment,1455508939,heatm26,7,0,44,164,0.0
i m such a fan of harry also  swoon ,d00cwz3,harrypotter,entertainment,1455513184,YoureSoVaneRomilda,4,0,1,43,0.0
one of us  one of us  one of us  one of us ,d00kbjf,harrypotter,entertainment,1455538237,Mathy16,5,0,3067,13162,0.0
welcome to the culi mean  the club   d,d00ogct,harrypotter,entertainment,1455548828,Calingaladha,3,0,1993,8843,0.0
you should also listen to the audio tapes  c ,d00ed4x,harrypotter,entertainment,1455516622,MsSunshine87,2,0,151,1452,0.0
i hope this also prompts you to try not to judge things before you ve readseen them  you could be missing out on awesome stuff ,d00etod,harrypotter,entertainment,1455517870,alexi_lupin,1,0,2853,73988,1.0
i cant imagine anyone getting into hp from just watching the movies because they re a horrible misinterpretation of the books i suppose the millions of plot holes in them get people reading which is a good thing ,d00qeaq,harrypotter,entertainment,1455552149,rowle,1,0,1,540,0.0
a lot was changed for the movies  doing many of the characters a great disservice i strongly suggest you read the books  too ,d00wanh,harrypotter,entertainment,1455560963,raendrop,1,0,5280,30842,0.0
it s cultural ,d01965s,harrypotter,entertainment,1455579930,FieryFacias,1,0,1,8201,0.0
and you watched the movies  lame ,d00h4e1,harrypotter,entertainment,1455525028,zsmg,-7,0,1,2470,0.0
https  pbstwimgcommediaczol6zywcaewpaijpg,d014gzo,harrypotter,entertainment,1455572718,katapotamus,11,0,1220,577,0.0
some variety of bowtruckle ,d0148hb,harrypotter,entertainment,1455572374,mattreyu,5,0,2686,222967,1.0
fully grown madrakes would be my guess,d011js0,harrypotter,entertainment,1455568490,MissBubbly17,8,0,1,624,0.0
i found a front shot i ca nt seem to match up the pig like snout and teeth http  iimgurcomg7y7rrzjpg,d014j6j,harrypotter,entertainment,1455572806,theWWoHP,1,0,188,106,0.0
ot  but it reminds me of a mix of salacious crumb and a gamorrean,d01ljxm,harrypotter,entertainment,1455600324,Crispy385,1,0,18,1925,1.0
i got the exact same,d00lquv,harrypotter,entertainment,1455542853,AthosN8,3,0,4977,5879,0.0
i ve found quibblo to be quite unreliable,d00ttzl,harrypotter,entertainment,1455557403,starazona,1,0,1,445,0.0
welcome to our community ,d014tfh,harrypotter,entertainment,1455573218,jtgrenie,1,0,1,-25,0.0
this is the most  info   http  harrypotterwikiacomwikimerlin  i ve found on merlin via the hp wiki although i m unsure of where most of the details actually come from ,d01is8o,harrypotter,entertainment,1455595213,OnlyTryingToDrownHer,2,0,45,2697,0.0
ebony  phoenix feather  12 inches  supple,d00xusu,harrypotter,entertainment,1455563173,vitcavage,1,0,298,514,0.0
i remember reading the harry potter books with my girlfriend it was fun reading them together i m curious what you guys will think after seeing deathly hallows pt 2 ,d00hd13,harrypotter,entertainment,1455525948,ProfessorXavier111,1,0,1,4,0.0
if you already preordered  you get the lowest price it s listed for so all of us who preordered the  30  are now getting it for  18 ,d01bh0j,harrypotter,entertainment,1455583646,that_guy2010,7,0,1810,75737,1.0
excuse the missing word and typo ,d019zt3,harrypotter,entertainment,1455581251,LibraryDrone,1,0,48859,130569,0.0
you can get it for 1499 via digital download from barnes and noble ,d01qaxp,harrypotter,entertainment,1455613962,Jade3d,1,0,14,1181,0.0
pine  phoenix feather  10 34 inches  surprisingly swishy same as op ,d00rrun,harrypotter,entertainment,1455554316,SunSorched,2,0,8796,10031,0.0
since reparo fixes physical damage it will work on certain things you need to go deep into the device for example  if my phone was nt working  and the real problem would be component inside that is cracked  burned etc it will get fixed on the other hand  if  as mentioned here  it was like loose wire inside the device  it would nt get fixed because it s perfectly fine  just not connected to the circuit in order to work  if you re going to be a technician in real world  your magic skills will make your job a lot easier all you have to do is use reparo on it  and if it still wo nt work  you know that something is disconnected and not broken  3 also  the basic of not ruining the electronic while trying to repair it is to turn it off same as you would do to repair it with muggle technology ,d02chem,harrypotter,entertainment,1455656193,PiggiePutz,4,0,8,453,0.0
  dolores umbridge    she s absolutely despicable  i loathed her all the way through the ootp  and then when we saw her again in the dh  i could nt believe how nice she d found the new regime and how she fit in it  even though she was never a death eater ,d01lr97,harrypotter,entertainment,1455600751,Moonstone1966,25,0,170,3203,0.0
petunia when you re introduced to vernon and petunia  you get the feeling that vernon is the one who is out to get harry the most  what with the ridiculous antics in reality  petunia has a grudge about seven miles wide and is almost entirely aware of what harry potter represents to the wizarding world at large  and  keeps him in a cupboard under the stairs out of spite  ,d01y40b,harrypotter,entertainment,1455636243,Mintz_Meat,12,0,1,2345,0.0
romilda vane is about the only character in the series whose presence i actively hate ,d01pbd7,harrypotter,entertainment,1455610312,AmEndevomTag,11,0,1,2156,0.0
  rita skeeter    she reminded me of someone i know she was the cliche annoying reporter who put her own spin on everything the part that really sealed it was in interview about dumbledore and she said her and harry were in contact  drove me nuts    cho chang    i just found her horribly irritating ,d01komd,harrypotter,entertainment,1455598574,managed_mischief_,19,0,1,1181,0.0
justin finchfletchley i m still seething over the whole parseltonguewizard duel scene  malfoy  conjures a snake  it goes for j finch  then and  only then  does harry start speaking parseltongue  and the snake backs off really  he s smart enough to get into eton but he concludes from these events that harry sicced the snake on him  surely muggleborn justin finchfletchley should have no preexisting parselmouthbias i can only conclude that he s a colossal idiot  and that s before you consider his very punchable face in the movies ,d01z8bh,harrypotter,entertainment,1455638026,MacabreGoblin,8,0,95,191,1.0
there are plenty of characters that i love to hate  looking at you umbridge   but i do nt know that there are any characters whose actual existence i hate  i was nt a big fan of cho chang post cedric diggory  but i guess if i had to choose my least favourite harry potter character is that nigel character from the movies why not just use a creevey brother for that role ,d01phee,harrypotter,entertainment,1455610885,Keica,6,0,125,8260,0.0
pettigrew he s just a massive  slimy coward ,d020a8r,harrypotter,entertainment,1455639608,Draconiforscantis,5,0,16,720,0.0
i used to be ambivalent about him but  sirius black in the span of one night  harry goes from fear of being murdered by him  to being ready to follow him home like a puppy sirius being his dad s best friend notwithstanding  harry still does nt know the guy hell  harry does nt even know his dad i get that living with the dursleys sucked  but damn  and this is all before we knew what a jerkass he was in school he sent snape off to go see remus in his werewolf form when james found out  he was the one who saved snape from being attacked which means that sirius was nt going to do anything to stop it he was going to let one of his best friends eat the weird kid ,d01tkx1,harrypotter,entertainment,1455626540,ciocinanci,15,0,162,36640,0.0
ginny she s about as deep as a small puddle ,d01m3dm,harrypotter,entertainment,1455601479,shaun056,15,0,5149,11702,0.0
wormtail of course  because he is a coward and the kind of person that is mean to his friends because they threat you well  but they never say anything to somebody that will hurt them so its easy for him to betray his friends and leave his own mother to go and live as a rat  because he knew that the good people would nt kill him  but voldemort s supporters would ,d01pvf6,harrypotter,entertainment,1455612314,JuniorAL,4,0,1,101,0.0
villians  i really wanted to say  dolores umbridge   but she at least got jailed  while another disgusting person    rita skeeter   was never punished i guess that in britain s magical law there is no such thing as defamation in muggle world skeeter would ve drown in lawsuits   heroes     james potter    of course rich  spoiled brat  basically gryffindor s draco malfoy except everybody loves him because  yknow  rich and handsome ,d01w02k,harrypotter,entertainment,1455632405,Narsil098,3,0,1,38,0.0
zacharias smith probably he s not the worst person out there but even the bad guys have a bit of the  love to hate them  vibe going on  or they re interesting enough as characters to make me enjoy reading about them smith is just a jackass  honorable mentions to hagrid and dobby ,d01lhi2,harrypotter,entertainment,1455600183,alexi_lupin,2,0,2853,73988,1.0
i really hated pettigrew ,d01uttz,harrypotter,entertainment,1455629840,ThatGreekLady,2,0,1,895,0.0
  remus lupin   passiveaggressive  emotionallycowardly jerk he was the only good guy character that truly aggravated me  of the ones basically built for readers to hate    umbridge   was the worst i feel more comfortable when characters run into bellatrix lestrange umbridge is justdiabolical ,d01pyj8,harrypotter,entertainment,1455612646,muted90,2,0,1,288,0.0
cho chang partly because she was so pathetic and did nt know how good a thing she had with going out with harry  young me was in love   but as the series moved on and harry became older  i actually really started to dislike him  he was moody  ungrateful  whiney  selfpitying and over dramatic i felt like if i ever met a boy like him in real life i d have no problems telling him to suck it up and shut up there were times he made me want to skip his lines in the book  also  in terms of the movies  i hated all the girls simply on the principle that they were there on set and i was not  p,d02ien1,harrypotter,entertainment,1455664397,Snake-Lover9,1,0,1,34,0.0
obviously umbridge  but i ll be honest  harry himself is right up there snape constantly accuses him of every trait that drives me up the wall with him ,d01ll5t,harrypotter,entertainment,1455600393,Crispy385,1,0,18,1925,1.0
umbridge reminds me of hillary,d01l8v9,harrypotter,entertainment,1455599694,torrunh,0,0,293,9233,0.0
i want him to do it with me ,d02pxu1,harrypotter,entertainment,1455676061,ShesARealNowhereGirl,1,0,276,646,0.0
i remember reading that and wondering about it i was thinking  why did he have that look  what was he thinking   i am so happy you made this post o grade for you ,d00rxcs,harrypotter,entertainment,1455554553,elkor101,6,0,1,155,0.0
yep the first one i saw on my first run on the books is when trelawney has her real prediction in front of harry when harry reports it to dumbledore  he says something like   that s her second real prophecy  harry did not inquire what was the first one  which was revealed only on the 5th book ,d01bjxs,harrypotter,entertainment,1455583778,KitKal,3,0,3271,352,0.0
gt  yes it would have cost them their afterlives i think this is it accepting the afterlife is  within this world  the more brave and enlightened choice most people choose death it takes an extreme fear to choose to remain on the earth as a ghost  and i think it may be something ghosts regret  gt   wizards can leave an imprint of themselves upon the earth  to walk palely where their living selves once trod   said nick miserably  but very few wizards choose that path  gt   you  re dead  aren  t you   said harry exasperatedly  who can answer better than you   gt   i was afraid of death   said nick  i chose to remain behind i sometimes wonder whether i oughtn  t to have    well  that is neither here nor there    in fact  i am neither here nor there     he gave a small sad chuckle  i know nothing of the secrets of death  harry  for i chose my feeble imitation of life instead  which then leads us to ask why voldemort did not choose this option  perhaps because his soul was nt whole enough to make that choice  i think  in the end  voldemort s fate is far far worse than that even of a ghost  and though dumbledore says  do not pity the dead   i think he means those that chose a normal afterlife i think in this world  ghosts are to be pitied ,d02u8z5,harrypotter,entertainment,1455683187,bisonburgers,1,0,5,24815,0.0
lockhart i can barely get through cos because of his constant need for attention for things he did nt do   he takes credit for what others did for fame i loathe him ,d01y1va,harrypotter,entertainment,1455636145,nightgoddess8443,5,0,1176,3759,0.0
dumbledore  because he played too many games with people s lives it s like he thought everyone were pieces on a chess board he seems very calculated in the decisions he made though in real life personally  i d rather deal with voldemort  because at least you know what you re getting yourself into he s straight up with how he feels  and what he s going to do to you he plays no games ,d01t5zk,harrypotter,entertainment,1455625270,SCOREFirrree,2,0,1,75,0.0
oh my these are actually amazing i need to get these when i get paid ,d00j29k,harrypotter,entertainment,1455533047,jolli866,1,0,166,264,0.0
voldemort on the bad guys  side dumbledore on the good guys  side umbridge earns the special award,d01mjio,harrypotter,entertainment,1455602508,InquisitorCOC,2,0,1593,2966,0.0
very interesting look at the series i ve been very curious about what harry and co s state of mind will be like in the cursed child considering what they ve each seen ,d026995,harrypotter,entertainment,1455647899,HelloIAmHawt,3,0,6,3935,0.0
percy weasley he is the most dickish character in the series i mean yea i hate dolores but he was just mean to his parents and his whole family  the people who will unconditionally love him no matter what and that to me is unforgivable ,d01k7qx,harrypotter,entertainment,1455597677,maybeiamabanana,12,0,19,317,0.0
one of my best friends is a giant harry potter fan and i always turned my nose to it  thinking it was childish and nerdy  on new year s day this year  i sat and wrote a list of all the movies i wanted to watch before the end of the year and i decided to put the hp series on the list  totally expecting to further justify my ill feelings for it  well  my wife  who always shared similar feelings on the topic  and i just finished deathly hallows pt 1 and we are hooked we ve watched all the films up until this point over the past couple of weeks and we re also reading the books we ve definitely found a new love ,45um5m,harrypotter,entertainment,1455507582,SwanRonson65,39,0,6,449,0.0
i d be very concerned having people in court swear the unbreakable vow some people ca nt even handle getting legit information out of their head when they have to do tests in school because they re so freaking nervousanxious now think of some insecure earlyneville type of guy being questioned by someone like umbrigde witnesses would drop dead one by one simply for being nervous and confused,d02c0zx,harrypotter,entertainment,1455655584,12InchesOfSlave,3,0,1,2277,0.0
needs more jpeg   s,d017ob4,harrypotter,entertainment,1455577556,rchard2scout,-3,0,243,2148,0.0
those are amazing ,czzu25s,harrypotter,entertainment,1455478694,ShesARealNowhereGirl,3,0,276,646,0.0
classic dumbledore ,d02vvc1,harrypotter,entertainment,1455686245,Imterriblyvexed,1,0,1766,1551,0.0
and here i am i ca nt even color a coloring book ,d02n6ij,harrypotter,entertainment,1455671865,Eyevoree,2,0,18843,12680,0.0
omg  gurdyroot tea  i definitely got ta try the felix felicis eff it i m going for the sampler set lol thanks for sharing   d also related   wizarding world of harry potter beverages as tea    https  wwwadagiocomsearchindexhtml  query  wizardingworldofharrypotterbeverages ,d00gt4l,harrypotter,entertainment,1455523933,Platycakes,1,0,1,39,0.0
eres un mago  harry ,d02d99m,harrypotter,entertainment,1455657236,Stormmonger,3,0,103,2827,0.0
i remember reading the harry potter books with my girlfriend it was fun reading them together i m curious what you guys will think after seeing deathly hallows pt 2 ,d00hd13,harrypotter,entertainment,1455525948,ProfessorXavier111,1,0,1,4,0.0
why ,d02c74j,harrypotter,entertainment,1455655808,orthodexy,7,0,135,14718,0.0
i do nt think they are  but do  they   http  imgurcompfbezsa  come framed ,czztucr,harrypotter,entertainment,1455478326,Deluxx3,1,0,961,3834,0.0
welcome to our community ,d014tfh,harrypotter,entertainment,1455573218,jtgrenie,1,0,1,-25,0.0
i posted this one a few days ago  but here s a little filler i got to my hpthemed leg piece on saturday  http  iimgurcomsv5bvytjpg also  here s the rest of the piece  before i got the  all was well  filler   http  wwwimgurcomayneqt,d02pqal,harrypotter,entertainment,1455675730,mikeallnight,2,0,10901,1247,0.0
as dumbledore said  i think they sort too early,d029933,harrypotter,entertainment,1455651927,NikeReaper,2,0,1,192,0.0
i think percy would be very distraught at being in slytherin,d01iboz,harrypotter,entertainment,1455594460,Execute-Order-66,2,0,237,89,0.0
i imagine the sorting hat also considers the benefits of having a more or less equal number of students sorted into each house  or considers the houses  current capacity to accept new students in terms of dorms  teachertostudent ratios  etc ,d01lrb0,harrypotter,entertainment,1455600754,Rogue451,2,0,129,1203,0.0
mediamerlin s beard  awesome tag ,d01gob2,harrypotter,entertainment,1455591827,SuperSkeptik,1,0,260,28473,0.0
these are very cool  the fool is perfect now i m thinking of what might be on the other cards ,d01mvje,harrypotter,entertainment,1455603293,wmthebloody,1,0,1,160,0.0
beech wood  12 34 in  unicorn hair,d00oh7j,harrypotter,entertainment,1455548874,Take14theteam,4,0,1014,1317,0.0
a galleon for a crepe  better be one bangin  crepe ,d003xt4,harrypotter,entertainment,1455495993,shawnzy51889,2,0,175,3933,0.0
this is so cute  i wish my ta was into harry potter our theme was not nearly as cool you should add hermione s spew hats and socks for the unsuspecting elves to the gryffindor area  ,d02b8nj,harrypotter,entertainment,1455654571,eleven20,3,0,1,11,0.0
the weird sisters,d01ioub,harrypotter,entertainment,1455595055,hawksfan81,1,0,7611,92344,0.0
fabulous  where did you find this ,d00ti6i,harrypotter,entertainment,1455556920,PurpleCorgi,1,0,6,9053,0.0
shout out to boston redditors  will have to check this out ,d00ax5d,harrypotter,entertainment,1455508965,ThePossimpible_,1,0,36,403,0.0
international house of pancakes  seriously  though  it s kind of like asking which house of congress kanye west would be better suited for  at any rate  jk has already pointed out that while she briefly considered dudley ending up with a magical child  she ultimately decided that magical blood had no chance of overcoming dursley dna ,d01h55v,harrypotter,entertainment,1455592572,ciocinanci,5,0,162,36640,0.0
that is amazing  you are my hero of the day ,d001g1n,harrypotter,entertainment,1455491392,fuckinayyylmao,3,0,805,18074,0.0
holy fucking shit looking at these gave me goosebumps these are the greatest harry potter posters that have ever existed where do i send all my money to receive my own ,d007gql,harrypotter,entertainment,1455502604,vdubsonly17,4,0,79,1274,0.0
assuming this is current  i will make this happen for you ,d001s75,harrypotter,entertainment,1455491979,po976,2,0,1,12,0.0
to be fair  they all forgot their robes starting around movie  3 ,d0152sv,harrypotter,entertainment,1455573600,Falco98,793,0,4300,14196,0.0
i live less than a mile from there ,d006yid,harrypotter,entertainment,1455501665,12_Angry_Fremen,6,0,645,5408,0.0
i ca nt remember if there was ever explicit mention of a stained glass window in the books or not  but that could be it ,d02hhn0,harrypotter,entertainment,1455663036,ThatGuy994,1,0,132,555,0.0
probably arithmancy or ancient runes ,d01zeb4,harrypotter,entertainment,1455638281,RocketDancer,2,0,1,178,0.0
this is posted monthly,d01t1c3,harrypotter,entertainment,1455624849,molonlabe88,1,0,53285,44685,0.0
looks like runes on the top and bottom of the page it could also be a ward  or a curse that has been revealed by some other sort of magic call up bill weasley he used to be a curse breaker ,d022gqa,harrypotter,entertainment,1455642716,Captain-_-Falcon,3,0,1286,260,0.0
harrytine now there s a holiday i could get behind ,czzypsw,harrypotter,entertainment,1455486717,Keica,3,0,125,8260,0.0
i know exactly how you feel i lent my books to my grandmother since she wanted to read them my grandparents  house burned down in a wildfire a few months later  my grandparents were fine  they were in switzerland at the time ,d01klwn,harrypotter,entertainment,1455598424,kidgun,2,0,956,2930,0.0
10 sweet points for these sweets ,d004o92,harrypotter,entertainment,1455497394,RuffRuffHufflepuff,2,0,1,40,0.0
maybe something alchemy related  the philosophers stone is usually symbolized as a lion eating a sun  the sun looks just like that one idk just thinking out loud,d0273av,harrypotter,entertainment,1455649019,hitokiri-battousai,4,0,1158,4157,1.0
i had previously heard that this chapter would have been in the chamber of secrets  but i m still unsure as to how  what would they discuss ,d01zfdp,harrypotter,entertainment,1455638326,Chapea12,1,0,1,3067,0.0
integrating the  new  pottermore information would definitely change the style and flow of the story like in lemony snicket s tangents or romantic authors  florid pagelong descriptions  eragon and septimus heap had an appendix at the end to expand some of the lore and etymologies  otherwise  i can only think of those annotated shakespeare editions that put notes into the margins it preserves some of the formatting from overly long footnotes at the bottom of the page or those dreaded bracketed numbers where you have to constantly flip back and forth ,d0136uu,harrypotter,entertainment,1455570839,UpgradeTech,4,0,12958,18341,0.0
