text,id,subreddit,meta,time,author,ups,downs,authorlinkkarma,authorkarma,authorisgold
nice touch with the tomatopotato ,d01rqya,dota2,gaming,1455619931.0,TheOneTrueDoge,22.0,0.0,6,10940,0.0
its actually not that bad  she is at leas somewhat efficient if you do it right and against certain heroes lc is really good  storm  ember  slark  generally every very evasive hero   most of the time people just want something to blame thier loss on and jungle lc got such a circle jerk around her that its easy to just give her all the blame,d01s35c,dota2,gaming,1455621322.0,kettenschloss,1.0,0.0,1,756,0.0
it looks like the first episode of merlin  i love the look  keep it up ,d01yvi0,dota2,gaming,1455637480.0,Snoracks,4.0,0.0,1,1577,0.0
that s a piece of an art ,d020a7x,dota2,gaming,1455639607.0,VifonMaster,0.0,0.0,1,393,0.0
meanwhile ingame cm is almost as big as his entire body,d01xanm,dota2,gaming,1455634845.0,RoastyMeToasty,1.0,0.0,1,234,0.0
relevant  http  wallanonforgecomwpcontentuploadsgamedota2dlinajakirofireicedragondota2hdwallpaper1920x1080jpg,d01vdfo,dota2,gaming,1455631087.0,Ord0c,19.0,0.0,4,4960,0.0
reminds me of the people from legend of korra with the lionturtles looks dope,d01xtfq,dota2,gaming,1455635759.0,Slithzor,1.0,0.0,1,3,0.0
one s doodle is onee unachieveable masterwork ,d01x6wy,dota2,gaming,1455634662.0,sad555,1.0,0.0,7,1401,0.0
any chance to get this 1080p  this is really nice ,d0269ak,dota2,gaming,1455647901.0,SuchGaming,1.0,0.0,443,5,0.0
i thought it would be a drawing of jakiro when he was old ,d01vlg2,dota2,gaming,1455631565.0,poorgreazy,12.0,0.0,1,954,0.0
better model and textures than in game by far ever since winter wyvern was released poor jakiro has become aware of his malformed body and is terribly depressed please volvo  save this poor twin headed dragon before it is too late ,d01yzbd,dota2,gaming,1455637646.0,Reoisasa,4.0,0.0,3,52,0.0
vega are pretty much the alliance killer at this point,d02g7zu,dota2,gaming,1455661228.0,sjalfurstaralfur,3.0,0.0,4812,7714,0.0
anyone agree that loda played really bad both games ,d02dvm4,dota2,gaming,1455658062.0,Peakal,2.0,0.0,157,13612,0.0
why do they lose against a garbage tier team  will be a great one hour 3  0 tomorrow for eg,d02bjag,dota2,gaming,1455654945.0,Archyes,-12.0,0.0,3728,77540,0.0
alliance were beating themselves in their 4 games versus vega when i look at their drafts i see tons of utility and little to no damage vega could just go early deathball every game without anything punishing them credit to vega for seeing how alliance typically overdraft on utility heroes ,d02ecyo,dota2,gaming,1455658703.0,WithFullForce,10.0,0.0,706,21679,0.0
nice drafts ,d02bng6,dota2,gaming,1455655097.0,ashrashrashr,1.0,0.0,565,13677,0.0
why did nt i bet on the first series they played  it was 97  in favor of alliance lol,d02e3a3,dota2,gaming,1455658350.0,Bladejunkie,1.0,0.0,168,739,0.0
did nt navi just 20 vega  if alliance  back and vega gt  alliance and navi gt  vega then by extension we can conclude that navi is  in fact  back ,d02dc7i,dota2,gaming,1455657344.0,Charlie_Wax,-1.0,0.0,8508,36105,0.0
direct invite elegiggle,d02bix4,dota2,gaming,1455654932.0,showmeyourclam,-8.0,0.0,1,614,0.0
anyone knows why vega got first pick and dire in g1 and first pick in g2  seems like every team would prioritise dire over radiant and first pick over second pick ,d02bu7r,dota2,gaming,1455655340.0,_Herpaderp,2.0,0.0,1,66,0.0
it s not that vega played  incredibly well   but that alliance played suprisingly poorly they made so many misplays and questionable decisions that it was obvious they d be forced to gg ,d02fhgt,dota2,gaming,1455660197.0,AlexVSharp,-3.0,0.0,2,57,0.0
as much as i wanted alliance to win  vega played amazingly gl to them in the finals ,d02dyew,dota2,gaming,1455658165.0,LightLifter,15.0,0.0,3631,21883,0.0
ikea up in flames,d02bjqu,dota2,gaming,1455654961.0,BrooklynKurtz_,92.0,0.0,1,83,0.0
can i get a clue why seems like everybodys happy when a losing  why not just compliment vega cause they done well   and actually if we compliment the winner and cheer up the loser without hatingthat will be badass good community imo seemsgood,d02boro,dota2,gaming,1455655145.0,Silver_Lance,82.0,0.0,78,840,0.0
can we just refrain from the dumb    alliance are shit 4head    because they lost twice online  instead props to vega for their amazing early game dominance  alliance did not get a chance to establish their laning phase advantage as usual great rotations by vega supports and also  the draft was favorable both times for them ,d02bn84,dota2,gaming,1455655089.0,lethalitykd,18.0,0.0,17726,13424,0.0
she did the voice of luna  the sexiest voice of dota for me  so she have my respect,d014g33,dota2,gaming,1455572682.0,Chicauxerrus,40.0,0.0,3976,992,0.0
you had me going until you said replace the ut samples ,d01bov3,dota2,gaming,1455584003.0,Gearski,17.0,0.0,1,4886,0.0
rts voice lines  and they appear to be command amp  conquerinspired   not enough resources     insufficient funds    insufficient gold   not ready   upgrade complete   research complete     construction complete      reinforcements have arrived      building    paused     on hold      cancelled      mission accomplished      mission failed  ,d01i7du,dota2,gaming,1455594266.0,AronTimes,4.0,0.0,6,13244,0.0
i m still really sad that valve puts no effort in trying to get a complete set of responses for every hero  such as missing botmidtop that would be even more important to me than getting new announcements for the teams in the draft phase  also it would be cool to have responses to new items  especially aether lens      and     why     does     am     have     no     line     for     purchasing     battlefury     or     vlads ,d016n6n,dota2,gaming,1455575976.0,ExO_o,37.0,0.0,166,9717,0.0
 trw alliance wins   http  hydramediacursecdncomdota2gamepediacom99eann_custom_victory_22mp3 ,d016q21,dota2,gaming,1455576100.0,MechaKnightz,107.0,0.0,1571,12299,0.0
 she is a dog whisperer   https  wwwyoutubecomwatch  v  kmlxhy_9z3i ,d014dp2,dota2,gaming,1455572585.0,tiradium,128.0,0.0,45524,54087,0.0
ye good shit linda my grill keep it up yo,d01migz,dota2,gaming,1455602439.0,PUPPEYFANSHIT,-2.0,0.0,1,1062,0.0
yes  she is a top professional and did a lot of hard work but i do nt quite get the tone of this post which sounds like it s thanking her for doing some kind of charity  she was paid to do this as a professional and certainly she did a great job ,d018xdq,dota2,gaming,1455579539.0,DemonTree07,8.0,0.0,12,662,0.0
also huge credits should go to nolan north  he provided   brewmaster  earth spirit  gyrocopter  kotl  lone druid  lycan  meepo  ogre magi  shadow demon  troll bashlord even additional voices for other valve games  even voices for nonvalve games like oh man i just checked out his imdb page  http  wwwimdbcomnamenm0636046,d0170ix,dota2,gaming,1455576541.0,TehElusivePanda,23.0,0.0,300,1117,1.0
her work is amazing to add  i m continuously disappointed that valve keeps ruining a lot of the original default voices by making them  deeper  and  slower  in later patches  beastmaster  necrophos and recently zeus  along with the arcana  have fallen victim to this really terrible choice in altering their voices where the original character is taken out of the voiceacting and sound ,d01gska,dota2,gaming,1455592017.0,muhpreciousmmr,6.0,0.0,13,11458,1.0
 you must gather your party before venturing forth   http  hydramediacursecdncomdota2gamepediacomcc2ann_custom_adventure_alerts_15mp3 ,d01bnbn,dota2,gaming,1455583934.0,sleyn,15.0,0.0,1,462,0.0
gt  the old unreal tournament sound samples now feel tired and out of place  could not disagree more ,d019woc,dota2,gaming,1455581109.0,Tutush,28.0,0.0,821,27651,0.0
will try to always remember her name  linda k morris  salute ,d01sdht,dota2,gaming,1455622466.0,raylucker,2.0,0.0,1894,1613,0.0
more than half of the bug reports here  http  devdota2comforumdisplayphp  f  490  43 pages  are from him  all with detailed and precise explanations  he is is also extremely active on  the dota 2 wiki   http  dota2gamepediacomuser  bu3ny   shoutout to him for helping making dota a better game and community ,463o1n,dota2,gaming,1455645475.0,DatQuaser,3282.0,0.0,832,566,0.0
has anyone reported a bug that quickbuy does nt work if you die right after  like i spam my quick buy hotkey to buy my item before i die and somehow the game goes back and i lose my unreliable gold,d026axa,dota2,gaming,1455647962.0,envyWeLost,51.0,0.0,20,10347,0.0
yeah  i can safely say that ubu3nyy has the most knowledge when it comes to game mechanics in dota 2  even more than the devs themselves  he knows every single little interaction there is  he s very dedicated and consistent with his work  and singlehandedly keeping the gameplay bugs subforum alive there are many other people that also contributed so much  but bu3ny s the only one left that s still active  the only sad thing is that you re doing it for free  at least you got recognition from here ,d02hmp1,dota2,gaming,1455663240.0,Mu2e,2.0,0.0,175,342,0.0
and i thought i did my part when i reported like 3 bugs,d0278y9,dota2,gaming,1455649224.0,twiitar,37.0,0.0,621,8651,0.0
i rarely upvote this one seems mandatory ,d029ptb,dota2,gaming,1455652546.0,P3rCoNam,5.0,0.0,1,8,0.0
its time valve starts paying him ,d026f9f,dota2,gaming,1455648123.0,garvon_,35.0,0.0,108,5448,0.0
ubu3nyy is this him ,d026rnu,dota2,gaming,1455648587.0,0DST,25.0,0.0,2621,16855,0.0
you rock man i used the help a lot too back in 2011 when i got my key  for this i posted about od immortal and it got fixed  i still want auras ,d02p15q,dota2,gaming,1455674655.0,DarkSuo,2.0,0.0,1,673,0.0
shoutout to loda for finding more than 400 bugs on dota2 main client during official matches of his entire career ,d026e12,dota2,gaming,1455648078.0,umisodamnkawaii,95.0,0.0,113,1279,0.0
valve should make an item with his name  like guinsoo  eul ,d02i37u,dota2,gaming,1455663924.0,VitorVRS,1.0,0.0,7,146,0.0
time to hire this guy for a qa position,d025pl8,dota2,gaming,1455647161.0,BLUEPOWERVAN,124.0,0.0,38,3812,0.0
i think it would be a super cool idea  gt  after long thought  the goddess granted her daughter s request  allowing medusa to trade her legendary beauty for a face and form of terrifying strength never for a moment has medusa regretted her choice she understands that power is the only beauty worth possessingfor only power can change the world ,4664ne,dota2,gaming,1455677434.0,CheesewithWhine,17.0,0.0,26687,119849,1.0
its on thing to have cosmetics that dont follow color  its another to completely change them to another hero this would not be a good idea i rather have this for dota 3  where the same heroes have changed and evolved into something else ,d02tn5d,dota2,gaming,1455682120.0,MangoDevourer,1.0,0.0,2,914,0.0
mecutesa kawaii uguu   3,d02rwlv,dota2,gaming,1455679182.0,AuroraProxy,9.0,0.0,1797,9930,0.0
https  nicedotameme,d02tokp,dota2,gaming,1455682188.0,Kappanating322,0.0,0.0,1,195,0.0
honestly  this would be the best arcana idea for her hopefully we will get it within the next 10 or 15 years ,d02ru84,dota2,gaming,1455679072.0,thisrockismyboone,1.0,0.0,834,79291,0.0
it does nt seem like it makes sense a preugly medusa could nt fight  on account of lacking the strength she traded for her beauty she could nt ult either  on account of lacking the face that turns people to stone ,d02uht1,dota2,gaming,1455683625.0,Vancha,1.0,0.0,1548,25826,0.0
but then she d be a creep ,d02trdw,dota2,gaming,1455682323.0,_invoker,0.0,0.0,255,17466,0.0
god i hope od and spec get nerfed to the ground in 687,d02moye,dota2,gaming,1455671111.0,PaperyWhistle,-1.0,0.0,47,2939,0.0
same for vengeful spirit and her appearance  wings  flying ,d02spgx,dota2,gaming,1455680517.0,SirPeterKozlov,4.0,0.0,1,276,0.0
 leafeator has been tweeting about being blocked from viewing the account  along with the other rdota2 mods   https  twittercomleafeatorstatus699745538170707969  also it has become more apparent as of late of the ill intent of the twitter account with  tweets such as this   https  twittercomdota2redditstatus697899991646527488  lang  en  are there any other options for twitter accounts to follow that will provide rdota2 posts  i really do not want to continue supporting nassij ,465lb7,dota2,gaming,1455670005.0,Vloogue,27.0,0.0,1062,157,0.0
so who put the idiot in charge then,d02rqjz,dota2,gaming,1455678908.0,SolarClipz,3.0,0.0,889,73289,0.0
so me being me and liking green and watching vods and having a random train of thought  i was wondering why we did nt move up the damage bars a bit  condense them even  and then add  healing done  beneath it  this would subconsciously show people in vods  competitive games  while watching replays what supports do a lot more  even if it s not an accurate stat  this puts the support role in a positive spotlight and draws more attention to it  which might get more people to play it  i understand things like  what s included   needs to be figured out  but i figured what the heck  if people are willing to talk about i m sure we could figure it out  poor photoshop example  http  iimgurcomwy7olk8jpg,466cht,dota2,gaming,1455680409.0,BeardedZasso,5.0,0.0,1,301,0.0
i like how you drew a dick over invokers face to show the right amount of disgust towards the pick,d02ijji,dota2,gaming,1455664610.0,ExO_o,3.0,0.0,166,9717,0.0
 the little boy smile and it ll all be well ,d02j1lc,dota2,gaming,1455665389.0,generalecchi,-1.0,0.0,5374,6503,0.0
one thing to remember is the enemy is not a constant either if i get a jungle lc and compare it to my baseline enemy team  they re about to rip off our heads and shit down our necks  but every once in a while you get an enemy that is as much or more of a tool than jungle lc you re damn sure you delete that memory ,d01sehq,dota2,gaming,1455622575.0,D3Construct,9.0,0.0,779,43062,0.0
 fuck the system ,d028f3q,dota2,gaming,1455650816.0,generalecchi,2.0,0.0,5374,6503,0.0
things that got posted to d2g 3 years ago,d02tk7d,dota2,gaming,1455681974.0,PUPPEYFANSHIT,1.0,0.0,1,1062,0.0
let me guess  you only had invoker in there until he was picked   kappa,d02fxnn,dota2,gaming,1455660824.0,docxanderb,6.0,0.0,203,970,0.0
fuck diskover,d02ps6u,dota2,gaming,1455675812.0,Gh0stWalrus,1.0,0.0,259,13015,0.0
til ember can tp while in sof,d02bink,dota2,gaming,1455654922.0,dorjedor,44.0,0.0,632,2031,0.0
gt  i ca nt improve at all not sure what you mean here are you saying you know what to improve on but cant do it  or are you saying you do nt know where to improve on  if it is the former  then you just have to keep at it no one magically go from 50 cs in 20 min to 150 in 20 if it is the latter  you need to start criticizing your own games or get someone else to do so  playing with even higher mmr people wont really help you that much since you will be concentrating on primarily yourself and being rekt do nt teach you anything valuable,d02uw7a,dota2,gaming,1455684368.0,ssyl9,1.0,0.0,1,2200,0.0
does nt that sleight of fist feels slow ,d02ciug,dota2,gaming,1455656245.0,Chad_magician,1.0,0.0,1,2744,0.0
i hate you diskover kappa,d024dq1,dota2,gaming,1455645350.0,rinnagz,38.0,0.0,1,3691,0.0
saved this gif to my random dota crap folder 12222013 it s older than i thought ,d02l21q,dota2,gaming,1455668610.0,_GameSHARK,1.0,0.0,3,12801,0.0
 gt  continue to pelt classmates throughout the rest of the day  gt  4th period english teacher was nt having any of my shit  gt  bitch walks up to me and threatens to send me to the principal s office if i do nt stop  gt  take out a balloon hammer and just wail the shit out of her  gt   sanity  eclipsed   gt  students stare speechless  bitch s wig fell off  gt  spend the next hour in the office  gt  suspended for 2 weeks  gt  come back   affected by 40 stolen intelligence   gt  osfrog,d027mnq,dota2,gaming,1455649749.0,Ethernus,22.0,0.0,1,3795,0.0
quality shitpost detected,d0257ma,dota2,gaming,1455646483.0,ExO_o,4.0,0.0,166,9717,0.0
https  nicedotameme,d02to1l,dota2,gaming,1455682162.0,Kappanating322,1.0,0.0,1,195,0.0
this repost is so old thats like 2 maps ago ,d02pm95,dota2,gaming,1455675558.0,hanzellmo,1.0,0.0,1,819,0.0
i honestly think lee song is best champion in dota 3because of his ability to be blindso he cant see shitposts like this,d0231y3,dota2,gaming,1455643537.0,stefan321,192.0,0.0,4797,2131,0.0
quality content,d0222rv,dota2,gaming,1455642166.0,RampagingRagE,12.0,0.0,1,3790,0.0
hit 5 classmates rampage ,d024b20,dota2,gaming,1455645251.0,assman4000,0.0,0.0,25,913,0.0
not even od flair ,d0253bs,dota2,gaming,1455646321.0,Roegnvaldr,27.0,0.0,57,8039,0.0
thing is  people do nt play jungle legion when they re trying to win  unless they re lc mainers   they play it only because they did nt get a different core lane at best they just do nt care about the game  at worst they ll intentionally feed when afking in the jungle does nt cut it and their team is somehow winning ,d01sb0g,dota2,gaming,1455622197.0,kudah,2.0,0.0,44,2355,0.0
the compendium is good overall  but the fact that there s only one treasure reward between 2233 is pretty underwhelming ,d02nzuk,dota2,gaming,1455673088.0,Charlie_Wax,13.0,0.0,8508,36105,0.0
i agree surely they could at least put treasures alternating every 2 or 3 levels to keep things interesting the only thing that s more of a joke as a reward than the winter effects are the  upgraded  winter effects  also i m super tired of getting normal effigy blocks from the crimson parcels and the wheel i ve gotten only 1 actual item from the wheel  over like 4 or 5 spins  and that was an infuser  which i ll gladly take because it s useful at least  ,d02w1el,dota2,gaming,1455686584.0,disrupter,1.0,0.0,711,1494,0.0
hardest fucking 8k game in the history of 8k games in other news  sumail confirmed to be a temporary private contractor for bulba s mmr assassins ,d01p5ps,dota2,gaming,1455609787.0,Ethernus,136.0,0.0,1,3795,0.0
anele,d01p76r,dota2,gaming,1455609920.0,not_blathers_the_owl,4.0,0.0,692,1765,0.0
good guy sumail honestly would have commended,d01p5jm,dota2,gaming,1455609773.0,PUPPEYFANSHIT,-12.0,0.0,1,1062,0.0
https  wwwyoutubecomwatch  v  mt6sbiacaa,46593u,dota2,gaming,1455665093.0,dildowser,66.0,0.0,1,4,0.0
nyx s laugh is amazing  why did you have to ruin it with ld crappy sound ,d02ru3j,dota2,gaming,1455679067.0,tiradium,1.0,0.0,45524,54087,0.0
congrats universe   ,d01q26n,dota2,gaming,1455613034.0,Nineties,2.0,0.0,56,30695,0.0
why would anyone but this  honest question most of the effects go away within a couple months the sets you can buy for a couple of dollars on the market why would anyone think it s a good idea to spend  7   20 more on that ,d02sj2z,dota2,gaming,1455680215.0,Upintheair84,2.0,0.0,1,151,0.0
it is so that all the goodies are pushed into the pre lv30 stage  so you get to get the good goodies easier without gridning day and night ,d02t6uf,dota2,gaming,1455681323.0,HHhunter,1.0,0.0,4438,18061,0.0
ur right there should be a new treasure every level and a new immortal every other level fuck it there should be 5 immortals every time we level up and the compendium should only cost 3 dollars  what gives valve ,d02nu9g,dota2,gaming,1455672849.0,pepbe,-2.0,0.0,1,4071,0.0
sumail just wanted his boy universe to get 8k  team effort   keepo ,d01prv2,dota2,gaming,1455611940.0,pythonlol,12.0,0.0,55,920,0.0
dad  peetur why are you not here babyrage,d01rxu4,dota2,gaming,1455620726.0,serapheth,-13.0,0.0,1,7316,0.0
my god how come i never watched this channel,d02nxum,dota2,gaming,1455673001.0,itoshiki-sensei,0.0,0.0,1,138,0.0
reddit is so damn salty about invoker that it s kinda pathetic ,d02sxt9,dota2,gaming,1455680897.0,Dontdrop,-2.0,0.0,185,507,0.0
c a l c u l a t ed,d02izkh,dota2,gaming,1455665302.0,badboyzpwns,7.0,0.0,1,3220,0.0
nah man  pick od win game  ez mmr,d02mgd1,dota2,gaming,1455670729.0,ClassicJimmee,1.0,0.0,1,103,0.0
u_brendonsmall pls giff brutal,d02qmb7,dota2,gaming,1455677114.0,PaperyWhistle,2.0,0.0,47,2939,0.0
oh my god it s a black hooooooolllllllllleeeeeeeeeeee  well that was funny,d020oqw,dota2,gaming,1455640192.0,PrinceZero1994,5.0,0.0,2035,3743,0.0
that s a big fuck you from an artificial intelligent entity,d02j7sc,dota2,gaming,1455665653.0,generalecchi,14.0,0.0,5374,6503,0.0
you are not tidehunter  rylai  wake up girl ,d02ng0n,dota2,gaming,1455672258.0,raylucker,1.0,0.0,1894,1613,0.0
i ve totally never seen this image before ,d02uq46,dota2,gaming,1455684057.0,Fen_,1.0,0.0,464,19925,0.0
they have needed work for years ,d02kpsf,dota2,gaming,1455668081.0,TheRandomRGU,0.0,0.0,10180,35071,0.0
we all know how this goes jug starts with omnislash  which triggers abaddon s borrowed time and heals him to full jug pursues afterwards  slowing abaddon with greater maim from samp  y while abaddon runs  shieldless and mere hits away from death  away from the enemy jungle that he was farming solo eventually  abaddon s allied drow ranger shows up  on 20  health from farming big camps at melee range  and juggernaut charges at her  activating blade fury  dealing only a fraction of the damage that he could be dealing if he were rightclicking as juggernaut s health is quickly depleted  abaddon tries to secure the kill for himself  but blade fury has yet to end and accidentally uses mist coil on drow  denying himself before juggernaut can be defeated  drow then defeats juggernaut  thus finishing her vladimir s offering ,d02jq5f,dota2,gaming,1455666479.0,ReiceMcK,25.0,0.0,25,19957,0.0
guts vs skull knight,d026uw1,dota2,gaming,1455648707.0,umisodamnkawaii,-1.0,0.0,113,1279,0.0
https  nicedotameme,d0239kk,dota2,gaming,1455643828.0,Kappanating322,2.0,0.0,1,195,0.0
i m always surprised to see sniper as a popular pick  i hardly see him and when i do  he does nothing huh but his highest win rate is in the normal bracket so guess why he is mostly just there,d02gv9s,dota2,gaming,1455662139.0,Liddojunior,1.0,0.0,111,7293,0.0
687 patch notes gt  shallow grave now has a global range after sceptre due to popularity,d02tmfn,dota2,gaming,1455682083.0,ssyl9,2.0,0.0,1,2200,0.0
the yolo s that happen at the end of games are highlights of most pubs   ,d02awkp,dota2,gaming,1455654134.0,Flex-,1.0,0.0,6,1001,0.0
this happened to me and i procceeded the same way as you  making a reddit thread  hope you succeed friend  have my upboat ,d02mau8,dota2,gaming,1455670489.0,Kuro013,2.0,0.0,1262,15993,0.0
i m just waiting for professional teams to do this gon na be hilarious when they pause and say lag  ddos etc ,d01wd4i,dota2,gaming,1455633134.0,BlackChineseGuy,3.0,0.0,621,2551,0.0
holy shit  the skill is unreal  ps juggernaut op,d029bjb,dota2,gaming,1455652017.0,CrisM1,1.0,0.0,34,1481,0.0
suddenly reddit is in favor of puppy paws ,d02431n,dota2,gaming,1455644949.0,skinnyowner,2.0,0.0,139,5932,0.0
wow  o  so good  can we get a 1080p version from anywhere ,d0275ko,dota2,gaming,1455649100.0,nomeltian,29.0,0.0,1,38,0.0
any idea if pudge could ve blind hooked es and gotten free ,d02lb62,dota2,gaming,1455668993.0,_GameSHARK,5.0,0.0,3,12801,0.0
 source   https  youtube80vkqldre98 ,d02g0y3,dota2,gaming,1455660952.0,FusionX,8.0,0.0,8757,10140,0.0
was waiting for the rot deny,d02pb59,dota2,gaming,1455675082.0,ykcin978,1.0,0.0,754,532,0.0
gt  hexor no ,d02ivoj,dota2,gaming,1455665135.0,generalecchi,1.0,0.0,5374,6503,0.0
this is where i d put my aghs upgraded ulti if i skilled it,d02gy5n,dota2,gaming,1455662257.0,SManSte,49.0,0.0,1325,6538,0.0
spectre  zeus is a legit strategy for most mmr brackets  maybe not so good for 5k  i do nt know since i do nt play many games there ,d02mhp5,dota2,gaming,1455670789.0,amarin1492,1.0,0.0,1,2550,0.0
so did he live ,d020z6c,dota2,gaming,1455640609.0,Brettyoke49,1.0,0.0,256,2043,0.0
what is the euls combo  sunstrike  blast  meteor ,d02cja0,dota2,gaming,1455656261.0,apoptygma,1.0,0.0,490,2025,0.0
thanks for good collision volvo seemsgood,d02opm8,dota2,gaming,1455674166.0,randomkidlol,0.0,0.0,437,59590,0.0
 i know the feeling   https  wwwyoutubecomwatch  v  tu27tokptqamp  t  2961 ,d01w6f6,dota2,gaming,1455632770.0,Rvsz,6.0,0.0,3730,35872,0.0
how to do that without ordering es to attack ,d02sshc,dota2,gaming,1455680655.0,mgm007,1.0,0.0,6,20,0.0
okay  i ve seen a lot more gameplay post rather than shitposts getting to the front page this week what year is it now guys ,d02gqhc,dota2,gaming,1455661949.0,Ace37mike,4.0,0.0,4743,7522,0.0
arc is so annoying i think no one can deal with his spilit pushi think the best thing can do for   this shit   is disable his boots of travel nothing elsei am glad to see this in future ,466s4d,dota2,gaming,1455687053.0,canonn5,0.0,0.0,1,-1,0.0
door stuck    door stuck   ,d02m66b,dota2,gaming,1455670288.0,Antares5,24.0,0.0,1,280,0.0
so funny rofl,d023429,dota2,gaming,1455643618.0,ref_sm,-1.0,0.0,1,-4,0.0
you can also altmove and spin your hero and block all movement because pathing is still fucked you can also get stuck by yourself on random walls fuck valve,d02nt95,dota2,gaming,1455672806.0,ayylamoo911,-1.0,0.0,1,1431,0.0
credit to http  steamcommunitycomidbaldurstod for making this ,d02m7q0,dota2,gaming,1455670354.0,cSoze,8.0,0.0,41,55,0.0
is it better than the d2armory beta  cant check it out now  im on mobile phone  edit  the model doesnt come out  cant see anything i guess it takes a lot of data  which makes it is heavy to load i m stick with the d2armory until further improvement  great job anyway  ,d02uvo8,dota2,gaming,1455684341.0,raylucker,1.0,0.0,1894,1613,0.0
is that a taunt  the scientist in me interprets that as an invite ,d01siap,dota2,gaming,1455622974.0,WithFullForce,49.0,0.0,706,21679,0.0
 gifv link   https  iimgurcomfoezbvtgifv    faq   https  wwwredditcomrlivvenwikigifvbot ,d01rwyi,dota2,gaming,1455620627.0,gifv-bot,13.0,0.0,1,52737,1.0
wrong room dude should had posted this on rdota2smut,d01unro,dota2,gaming,1455629438.0,dorjedor,3.0,0.0,632,2031,0.0
question  how does our waifu control when to float and when to drop ,d02w3pk,dota2,gaming,1455686718.0,Mathieulombardi,1.0,0.0,1008,18035,0.0
