text,id,subreddit,meta,time,author,ups,downs,authorlinkkarma,authorkarma,authorisgold
this is really bad you d think that in general esports business is very shady and not many people can share information with the public so a team like secret would be able to show how it can be done  but apparently not  this is a major hit to the brand if you ask me having no strings attached to an org was a major point for people to root secret not only because of the players  but also because of the idea behind the team  this just seems like it s just safer to go with an org if you are a successful player rather than trying something in your own  edit  i also generally do nt like when stuff like this gets posted on social media money problems should be privat affairs  but god damn it has been over a year for them to pay people accordingly ,d02hzcw,dota2,gaming,1455663759.0,g0ggy,21.0,0.0,2293,6482,0.0
now i m glad s4 if out of secret  hope he got paid,d02iy2l,dota2,gaming,1455665238.0,matrix325,4.0,0.0,13517,9916,0.0
i guess it is safe to assume that s4 did nt recieve his money too,d02i9be,dota2,gaming,1455664178.0,Martblni,23.0,0.0,1763,24233,0.0
sucks that this has to happen to some real standup playerspeople fly and n0tail are the last 2 pros i d want this to happen to think of all the unneeded stress it caused year round for the players too even at last ti johan looked a little sadstressed at ti and i would nt doubt it s partly due to cyborgfatt ,d02p98y,dota2,gaming,1455675000.0,Kodakgee,4.0,0.0,53,890,0.0
gt  its a video game i wish all my teammates had that mentality ,d020c9o,dota2,gaming,1455639690.0,latticusnon,1.0,0.0,187,225000,0.0
i want a casual matchmaking option where this kind of thinking is mandatory and flaming people for their picksbuildswhatever is an immediate lifetime ban ,d01z592,dota2,gaming,1455637896.0,MikoSqz,14.0,0.0,231,69501,0.0
shady cyborgmatt next time only work with humans,d02h6mq,dota2,gaming,1455662597.0,ipiranga,31.0,0.0,2201,10647,1.0
where is that video games lawyer ,d02ja8s,dota2,gaming,1455665760.0,Atlanshadow,22.0,0.0,965,4201,0.0
proud of youand honestly thank you for leaving ,d01r0hy,dota2,gaming,1455616845.0,Geremin,5.0,0.0,1,4,0.0
even dagonchen works in 1k,d01nxro,dota2,gaming,1455606038.0,silveryrainz,3.0,0.0,1,41,0.0
oooooo i see upvote i drama ,d02mlem,dota2,gaming,1455670953.0,JothHago,2.0,0.0,2018,6310,1.0
i think this is cyborgmatt not doing his job  and the reasons are not justified no matter what  as it has been over a year  and you can fix all the payment problems and tax problems in a quarter of that time and even far less ,d02jhef,dota2,gaming,1455666062.0,W0rkSpace,6.0,0.0,153,356,0.0
there is so much shady stuff happening in this allegedly professional scene and if a well known team like secret has these fundamental problems  one can only imagine what players of smaller teams have to endure ,d02h53d,dota2,gaming,1455662537.0,oWn4g3,71.0,0.0,22,1774,0.0
cyborgfraud ,d02jsyb,dota2,gaming,1455666630.0,darktransition,6.0,0.0,1,430,0.0
i m gon na take the opportunity to talk about bonus gold  i am really on the fence as to whether it is a good thing or bad thing because i have reaped the benefits and downsides in both scenarios  there are games where we are crushing and an enemy ragequits  but then we are scrambling to end as their hard lategame carries are now getting bonus gold and we did nt even have the better lategame to begin with  then there are times where i have a teammate leave and i am a spectre and this bonus gold helps me get my radiance faster and i end up winning the game because my cm left  but there are also times where my teammates leave  i get bonus gold but still ca nt win the game and i end up salty that if there was more gold we could have won  or if my teammates did nt leave in the first place   i m not casting an opinion so what do you think  bonus gold yay or maybe needs a nerfbuff ,d01s49p,dota2,gaming,1455621443.0,The_Troll_Warlord,4.0,0.0,940,999,1.0
some next level patience from evany there ,d02ivhy,dota2,gaming,1455665128.0,nicholasg96,5.0,0.0,48,56,0.0
cyborgmatt   tobi is a shady behind the scenes and racist ,d02hsi3,dota2,gaming,1455663477.0,PeterStormare,129.0,0.0,6,4536,0.0
i guess now we know what sticky napalm is made of ,d019iij,dota2,gaming,1455580479.0,hibiki21,9.0,0.0,1,417,0.0
wow i would commend you for that shit  good job man  thats the real definition of taking one for the teamteamplay,d01xnfl,dota2,gaming,1455635470.0,fdfas9dfas9f,2.0,0.0,8,257,0.0
 ayy fuck yeah     https  smediacacheak0pinimgcom564xc1c6ebc1c6eb36b358864d60d95bfda39c593bjpg ,d02n3qg,dota2,gaming,1455671748.0,simo1548,2.0,0.0,655,1589,0.0
reminds me of battlenet dota 1 when players would pressure the noob on the team to abandon so they could get a gold boost ,d01mbqb,dota2,gaming,1455602005.0,EmbersDOTA,182.0,0.0,43,427,0.0
oh god his smile just makes it 17  worse,d012idu,dota2,gaming,1455569848.0,fwivo,18.0,0.0,1150,626,0.0
a selfless act ,d01pmls,dota2,gaming,1455611407.0,Esstand,2.0,0.0,1,12298,0.0
  buys taunt ,d01t1ti,dota2,gaming,1455624892.0,El_Pipone,6.0,0.0,1140,8932,1.0
float like a butterfly  fuck like a bat,d00zr2m,dota2,gaming,1455565883.0,schquid,144.0,0.0,1,211,0.0
let s save metalocalypse togheter  summon u_brendonsmall to suggest this idea  upvote it and share it,d02qj7s,dota2,gaming,1455676980.0,raidebaron,1.0,0.0,2,205,0.0
i want to point out that her taunt is still broken though  before reborn  her taunt would actually make a snow angel shape on the ground  this has nt been the case since the move to reborn ,d02iqjn,dota2,gaming,1455664914.0,ProjectileHerpes,2.0,0.0,727,74403,0.0
batty style ,d018slw,dota2,gaming,1455579331.0,FildoDildo,1.0,0.0,1,1270,0.0
to be serious its quite ez to avoid that combo bros as soon as euls ends walk sideways unless his deafening blast is on point u will be fine ,d02rva1,dota2,gaming,1455679121.0,lone_wanderer101,1.0,0.0,1445,1472,0.0
how to counter pudge  just dont get hit,d026c1l,dota2,gaming,1455648003.0,AustinTP,2.0,0.0,3358,1344,0.0
ty evany,d02l33t,dota2,gaming,1455668655.0,loveleeyh,11.0,0.0,3,1831,0.0
sorry i have to mention my special friend brunz who was the asshole invoker at the end  i forgot to put him in the credits and he was upset  he was also adamant that i post his mmr too  but he s just pushing his luck ,d00m8ip,dota2,gaming,1455544132.0,GottaGoFats,249.0,0.0,7528,6913,1.0
i m never going to dance again these guilty feet have got no rhythm though it s easy to pretend i know you re not a fool,d00nm4d,dota2,gaming,1455547200.0,EmirSc,8.0,0.0,21823,22861,0.0
you shouldve had a holy shit callout and involer ghost walking away,d00u599,dota2,gaming,1455557862.0,kyan-,3.0,0.0,1164,804,0.0
so in the end it s a public service announcement  686 invoker does nt just kill heroes  he kills dreams ,d0104ic,dota2,gaming,1455566427.0,xnxsvngl,3.0,0.0,6307,4427,0.0
you will never notice how awesome undying animations are until you watch this video  lol well done cap ,d00m1zv,dota2,gaming,1455543674.0,vitaminar,2.0,0.0,1,2313,0.0
invoker outta nowhere   ,d00nlhc,dota2,gaming,1455547165.0,Ace37mike,2.0,0.0,4743,7522,0.0
the dirge goes on baby  no invoker noob combo can stop the funkfor long at least,d00t8kp,dota2,gaming,1455556529.0,MrTheodore,1.0,0.0,174,93899,0.0
trigger warning please,d00nuwc,dota2,gaming,1455547683.0,Ssunnyday,0.0,0.0,1,6727,0.0
fucks given when your team blames you because of your jungle lc,d02lnrj,dota2,gaming,1455669510.0,bananamadafaka,1.0,0.0,1912,2207,0.0
it was possible to this with sentries awhile back you buy a bunch of sentries put it in the courier and ask someone who wants gold to buy a sentry in the courier it would stack with the rest of the sentries and the last person to buy sentries could sell it won a couple of games with that  fixed though    ,d025fak,dota2,gaming,1455646773.0,Khaleesiaffa,1.0,0.0,1,-2,0.0
i had a very similar top 8 prediction to nahaz yesterday somehow me and nahaz agree on a lot of stuff  like invites etc i always love watching these segments  ca nt get enough of them however  when talking about mvpp he says 4 players finished top 8  in fact it were only qo and febby from that roster kpii and nutz he seems to have forgotten about ,d02ic1j,dota2,gaming,1455664291.0,Teunski,1.0,0.0,470,29754,0.0
i played nyx against one last night  every tornadoeuls  spiked carapace ,d02k9w0,dota2,gaming,1455667390.0,Anuxinamoon,1.0,0.0,4002,11595,0.0
gt  edit  we lost it s okay it s the thought that counts ,d01ki81,dota2,gaming,1455598229.0,SirBelvedere,438.0,0.0,22317,101702,1.0
reminds me of pausing to get out of a grab in smash,d027gws,dota2,gaming,1455649529.0,StopLurker,1.0,0.0,1546,6956,0.0
i just want some other opinion on getting better at dota 2 i m 29k mmr and i feel really stagnated  i ca nt improve at all i have 2000 matches and i do nt get any better even if i watch videos  follow the competitive scene  etc  what i recently noticed is that i only play with people until 35k i have no friends above that i feel like i would maybe improve if i played with people above my level  but how can i do that  and what else do you suggest  the game is getting pretty dull for me because sometimes i win 10 in a row  sometimes i lose 10 in a row ,466kzl,dota2,gaming,1455683862.0,kenchikka,1.0,0.0,2,171,0.0
gt  i ca nt improve at all not sure what you mean here are you saying you know what to improve on but cant do it  or are you saying you do nt know where to improve on  if it is the former  then you just have to keep at it no one magically go from 50 cs in 20 min to 150 in 20 if it is the latter  you need to start criticizing your own games or get someone else to do so  playing with even higher mmr people wont really help you that much since you will be concentrating on primarily yourself and being rekt do nt teach you anything valuable,d02uw7a,dota2,gaming,1455684368.0,ssyl9,1.0,0.0,1,2200,0.0
russian speak english and play as support omg which parallel universe is it ,d01y0co,dota2,gaming,1455636078.0,Swiftly_Teemo,0.0,0.0,1,-12,0.0
ewww you bottle started ,d01mrfu,dota2,gaming,1455603020.0,Coral_Bones,1.0,0.0,107,1373,0.0
just as i expected  no one is practicing ,d024ypk,dota2,gaming,1455646148.0,JoyThief0007,131.0,0.0,1,808,0.0
ty evany,d02l33t,dota2,gaming,1455668655.0,loveleeyh,11.0,0.0,3,1831,0.0
6 seats  for a coach or is kamal just going to sit in the middle ,d0257y4,dota2,gaming,1455646496.0,Blargin,8.0,0.0,1,735,0.0
they better fucking use those ,d025g0v,dota2,gaming,1455646800.0,MightyOwl,1.0,0.0,467,118,0.0
i had completely forgotten about secret ,d0266m5,dota2,gaming,1455647799.0,Grizzlyboy,-7.0,0.0,4295,23400,0.0
why does a team with the 2 ugliest pro players have an instagram account ,d0226nl,dota2,gaming,1455642320.0,Rvsz,-45.0,0.0,3730,35872,0.0
til ember can tp while in sof,d02bink,dota2,gaming,1455654922.0,dorjedor,44.0,0.0,632,2031,0.0
you can do that ,d02aj6l,dota2,gaming,1455653643.0,sa6peto,2.0,0.0,27,1499,0.0
 fuck the system ,d028f3q,dota2,gaming,1455650816.0,generalecchi,2.0,0.0,5374,6503,0.0
saved this gif to my random dota crap folder 12222013 it s older than i thought ,d02l21q,dota2,gaming,1455668610.0,_GameSHARK,1.0,0.0,3,12801,0.0
this repost is so old thats like 2 maps ago ,d02pm95,dota2,gaming,1455675558.0,hanzellmo,1.0,0.0,1,819,0.0
very risky if sof doesnt end before tp channel is over you come back to finish the sof,d02tgha,dota2,gaming,1455681793.0,reapr56,1.0,0.0,505,3381,0.0
things that got posted to d2g 3 years ago,d02tk7d,dota2,gaming,1455681974.0,PUPPEYFANSHIT,1.0,0.0,1,1062,0.0
does nt that sleight of fist feels slow ,d02ciug,dota2,gaming,1455656245.0,Chad_magician,1.0,0.0,1,2744,0.0
can anyone tell me where i can buy those chairs  i fell in love,d02cfuj,dota2,gaming,1455656135.0,LegendaryPokemon,2.0,0.0,132,119,0.0
it was a tactical abandon for his team to get gold advantage  ,d02k18t,dota2,gaming,1455667013.0,lawlianne,1.0,0.0,130,4235,0.0
i m really hyped at the moment got the premium this year too  i hope home office will return my passport in time so i can come  o,d025vx1,dota2,gaming,1455647398.0,Tzeth,1.0,0.0,234,689,0.0
from https  wwwkhronosorgvulkan  as official as it gets  bring it lord gaben  we await o o,d02w477,dota2,gaming,1455686747.0,Socapex,1.0,0.0,708,16,0.0
first of all  vulkan not vulcan  and valve stance on vulkan is quite well known not really a secret they ve been working with khronos group since the start in adopting and promoting it they have made demos and tech work showing the promise of it already  dota 2 will have vulkan support  if that s your question that s for certain we are most likely to get it quite soon ,d02w9eg,dota2,gaming,1455687051.0,SirBelvedere,1.0,0.0,22317,101702,1.0
gt  thescore esports has not yet been able to independently verify these claims  i mean  what s the point them  like  seriously  if you go journalism school  first thing you ll learn is that you need to hear both sides a story second thing is that you need those juice pageviews boys xddd anyway  i m sure cyborgmatt would nt withhold money  that would be beyond retarded  right ,d02o0hl,dota2,gaming,1455673114.0,teerre,-4.0,0.0,42,71965,0.0
ir8 88,d011qid,dota2,gaming,1455568760.0,giantofbabil,3.0,0.0,245,4068,0.0
imagine how terrifying this would have been in real life you casually stand around by some stairs  and when you move away you just cant theres an invisible blob  the shape of a cow with a giant totem  in your way  blocking you just enough that your fat ass cant squeeze by ,d02i5pf,dota2,gaming,1455664027.0,Ssunnyday,87.0,0.0,1,6727,0.0
door stuck    door stuck   ,d02m66b,dota2,gaming,1455670288.0,Antares5,24.0,0.0,1,280,0.0
any idea if pudge could ve blind hooked es and gotten free ,d02lb62,dota2,gaming,1455668993.0,_GameSHARK,5.0,0.0,3,12801,0.0
 source   https  youtube80vkqldre98 ,d02g0y3,dota2,gaming,1455660952.0,FusionX,8.0,0.0,8757,10140,0.0
okay  i ve seen a lot more gameplay post rather than shitposts getting to the front page this week what year is it now guys ,d02gqhc,dota2,gaming,1455661949.0,Ace37mike,4.0,0.0,4743,7522,0.0
 mmm   https  githubcomrossengeorgievdota2_notebooksrawcbcdfaf3a7372357246ac3f9c0059a097b90bcc7resourcesemoticons102_984137cc_64gif ,d02gn1r,dota2,gaming,1455661814.0,What-A-Baller,2.0,0.0,3697,18566,0.0
 x      x ,d02iit6,dota2,gaming,1455664579.0,Epsi_,1.0,0.0,429,3004,0.0
was waiting for the rot deny,d02pb59,dota2,gaming,1455675082.0,ykcin978,1.0,0.0,754,532,0.0
was hoping that pudge denied himself feel dissapointed ,d02r1du,dota2,gaming,1455677771.0,rhaydo,1.0,0.0,1,393,0.0
how to do that without ordering es to attack ,d02sshc,dota2,gaming,1455680655.0,mgm007,1.0,0.0,6,20,0.0
gt  hexor no ,d02ivoj,dota2,gaming,1455665135.0,generalecchi,1.0,0.0,5374,6503,0.0
thanks for good collision volvo seemsgood,d02opm8,dota2,gaming,1455674166.0,randomkidlol,0.0,0.0,437,59590,0.0
you can also altmove and spin your hero and block all movement because pathing is still fucked you can also get stuck by yourself on random walls fuck valve,d02nt95,dota2,gaming,1455672806.0,ayylamoo911,-1.0,0.0,1,1431,0.0
end fast ggwp no def,d010vcu,dota2,gaming,1455567516.0,askjdhaslk,1.0,0.0,1,-60,0.0
awesome music,d00lzrb,dota2,gaming,1455543511.0,fubarex,4.0,0.0,1,15,0.0
fuck u don  t ruin invoker he is finally good again,d00w6ds,dota2,gaming,1455560790.0,shadowq8,-5.0,0.0,993,17065,0.0
lmao,d02nlle,dota2,gaming,1455672487.0,TheLastToa,1.0,0.0,30,183,0.0
more than half of the bug reports here  http  devdota2comforumdisplayphp  f  490  43 pages  are from him  all with detailed and precise explanations  he is is also extremely active on  the dota 2 wiki   http  dota2gamepediacomuser  bu3ny   shoutout to him for helping making dota a better game and community ,463o1n,dota2,gaming,1455645475.0,DatQuaser,3282.0,0.0,832,566,0.0
i do nt know what to say besides thanking you guys i have not expected something like this at all  and it s even top post of rdota2  feels really good to know that people appreciate what i do ,d02b56e,dota2,gaming,1455654447.0,Bu3nyy,2055.0,0.0,1456,15054,1.0
and i thought i did my part when i reported like 3 bugs,d0278y9,dota2,gaming,1455649224.0,twiitar,37.0,0.0,621,8651,0.0
time to hire this guy for a qa position,d025pl8,dota2,gaming,1455647161.0,BLUEPOWERVAN,124.0,0.0,38,3812,0.0
ubu3nyy is this him ,d026rnu,dota2,gaming,1455648587.0,0DST,25.0,0.0,2621,16855,0.0
has anyone reported a bug that quickbuy does nt work if you die right after  like i spam my quick buy hotkey to buy my item before i die and somehow the game goes back and i lose my unreliable gold,d026axa,dota2,gaming,1455647962.0,envyWeLost,51.0,0.0,20,10347,0.0
shoutout to loda for finding more than 400 bugs on dota2 main client during official matches of his entire career ,d026e12,dota2,gaming,1455648078.0,umisodamnkawaii,95.0,0.0,113,1279,0.0
its time valve starts paying him ,d026f9f,dota2,gaming,1455648123.0,garvon_,35.0,0.0,108,5448,0.0
i rarely upvote this one seems mandatory ,d029ptb,dota2,gaming,1455652546.0,P3rCoNam,5.0,0.0,1,8,0.0
aside from that  he is known to check bugs from known bugs list  a large thread on devdota which collects bug reports  after every update to see if they were quietly fixed ,d029yva,dota2,gaming,1455652877.0,Redthrist,4.0,0.0,160,9415,0.0
i wonder how much more time it would take to fix reset password on the forum,d026w30,dota2,gaming,1455648751.0,What-A-Baller,3.0,0.0,3697,18566,0.0
yeah  i can safely say that ubu3nyy has the most knowledge when it comes to game mechanics in dota 2  even more than the devs themselves  he knows every single little interaction there is  he s very dedicated and consistent with his work  and singlehandedly keeping the gameplay bugs subforum alive there are many other people that also contributed so much  but bu3ny s the only one left that s still active  the only sad thing is that you re doing it for free  at least you got recognition from here ,d02hmp1,dota2,gaming,1455663240.0,Mu2e,2.0,0.0,175,342,0.0
you rock man i used the help a lot too back in 2011 when i got my key  for this i posted about od immortal and it got fixed  i still want auras ,d02p15q,dota2,gaming,1455674655.0,DarkSuo,2.0,0.0,1,673,0.0
valve should make an item with his name  like guinsoo  eul ,d02i37u,dota2,gaming,1455663924.0,VitorVRS,1.0,0.0,7,146,0.0
i m a new fan to this guy  cheers mate ,d02ik9f,dota2,gaming,1455664641.0,oisanji,1.0,0.0,6939,1067,0.0
it s believable because he probably had no items too 4head,d01nhm3,dota2,gaming,1455604815.0,BerzerkMerc,8.0,0.0,1,627,0.0
because of this  i have now started to download dota2 finally going to give it a try,d00w7qo,dota2,gaming,1455560847.0,LessThan301,11.0,0.0,158,14341,0.0
i feel like misery is one of the weakest pro players out there but for whatever reason people do nt pay attention to all the bad shit he does feels like he could play dota for 100 years and still would nt reach bulldog s level ,d022tbl,dota2,gaming,1455643206.0,Jigglyesque,-3.0,0.0,1,315,0.0
have nt seen a sniper in months did nt know people still picked him ,d022sol,dota2,gaming,1455643181.0,SkeletronDOTA,7.0,0.0,46,10345,0.0
seems like it s not loading any mirror ,d0216x6,dota2,gaming,1455640914.0,t3hjs,2.0,0.0,706,52243,0.0
why he do dis ,461geo,dota2,gaming,1455608733.0,its_muri,350.0,0.0,2182,361,0.0
https  twittercomsumaaaailstatus699503742052204544,d01p5x7,dota2,gaming,1455609805.0,goody153,146.0,0.0,1,3770,0.0
lol american players feeding rtz mmr to beat badman,d01owel,dota2,gaming,1455608935.0,DurrrrDota,392.0,0.0,561,3446,0.0
 youtube link   https  wwwyoutubecomwatch  v  eowpduhxfxg  if anyone interested  he died 26 times that game ,d01rs3n,dota2,gaming,1455620064.0,SmokeITFunky,17.0,0.0,232,641,0.0
inb4 hes just a kid ,d01qrg5,dota2,gaming,1455615808.0,Que-Hegan,63.0,0.0,1,7964,0.0
not sure what happened but at the start of the stream rtz said sumail was broken then when the game began sumail  gyro  walked down mid first blood was drawn with him walking down mid t2,d01oygp,dota2,gaming,1455609121.0,its_muri,32.0,0.0,2182,361,0.0
instantly 5 lp games would do justice  reported or not,d01q4m3,dota2,gaming,1455613285.0,quanid,50.0,0.0,34,1049,0.0
this kid is a prick lmao hes got bad karma comin to him,d01z0sl,dota2,gaming,1455637710.0,completelyowned,6.0,0.0,5026,8683,0.0
i think universe will be embarrassed of getting his 8k this way ,d01u47t,dota2,gaming,1455628059.0,_mishka_,12.0,0.0,1960,570,0.0
so that s how people gain mmr in na,d01s7jx,dota2,gaming,1455621810.0,WithFullForce,10.0,0.0,706,21679,0.0
knockoff rtz confirmed  may aswell feed the big boy ,d01rnxg,dota2,gaming,1455619576.0,KillerOfAnime,3.0,0.0,19,146,0.0
because low prio dont punish hard enough  valve should have a system that detects when a player feed in the game and if he receive x reports he get 15 low prio games  win   the next time is 30 win games low prio  the next time 60 etc   i doubt any1 would do this kind of shit 4k the same with mute system  valve should make a system that detects chat activities and if some keywords are said too much in the game the player gets muted for a week  if he does that again muted for 1 month  dota would be the most serious game out there ,d020jwa,dota2,gaming,1455639999.0,paoxayla,3.0,0.0,51,303,0.0
does anybody know the reason  he just walks down mid minute 1,d01oyey,dota2,gaming,1455609117.0,shitinmyunderwear,6.0,0.0,2499,10758,0.0
yeah this is pretty scummy ,d01ptv1,dota2,gaming,1455612153.0,Flightlesstm,5.0,0.0,24,3135,0.0
daily reminder that all intentional feeders should be hung  drawn  and quartered and have their giblets hung on display at the pier as a warning to others,d01p420,dota2,gaming,1455609632.0,DOUBLEBOSSSPRINGSMAP,14.0,0.0,1569,6614,0.0
sumail currently making his way downtown feeding rtz and universe green eggs and ham wat do ,d01ufbf,dota2,gaming,1455628866.0,Rengas,2.0,0.0,73,2738,0.0
videos in this thread   watch playlist amp   9654    http  subtletvcom_r461geo  feature  playlist  video  comment     sumail intentional feeding 026   https  youtubecomwatch  v  eowpduhxfxg    1   https  redditcomrdota2comments461geo_d01rs3n  context  10  d01rs3n   youtube link if anyone interested he died 26 times that game   family guy  visiting ground zero   https  youtubecomwatch  v  lehbd3ghh4i    1   https  redditcomrdota2comments461geo_d01r2x8  context  10  d01r2x8   everyone knows government officials coulnamp   39  t possibly be wrong for reasons i dont want to go in on a dota sub this is a great video about the subject   tony hawk s pro rapper dan bull vs dave brown   https  youtubecomwatch  v  t_yihb9lyamp  t  23s    1   https  redditcomrdota2comments461geo_d01rc6i  context  10  d01rc6i   100  360  i didnamp   39  t realise just how well this line sums up dota until now  i m a bot working hard to help redditors find related videos to watch      info   https  npredditcomrsubtletvwikimentioned_videos    chrome extension   https  chromegooglecomwebstoredetailmentionedvideosforreddfiimkmdalmgffhibfdjnhljpnigcmohf ,d01rsa0,dota2,gaming,1455620083.0,Mentioned_Videos,3.0,0.0,1,45401,0.0
i feel like valve needs to put in place some sort of conduct policy or something in place for this kind of shit this literally ruined the game for 4 other people  wasting their time and losing mmr it just makes the professional scene look bad to let people do this so blatantly and not get punished ,d01swrm,dota2,gaming,1455624419.0,KaoticSkunk,2.0,0.0,58,441,0.0
the kid is a massive shit stain stop using the age excuse as well  i know so many teenagers who are nt shit stains ,d01sz8a,dota2,gaming,1455624651.0,_mishka_,7.0,0.0,1960,570,0.0
w h o c a r e s h o c a r e s,d01wcwh,dota2,gaming,1455633121.0,PolarBURIED,4.0,0.0,16,3884,0.0
suma1l is broken,d01owwl,dota2,gaming,1455608978.0,lethalitykd,2.0,0.0,17726,13424,0.0
i am pretty sure if you linked a random dotabuff account who was doing the same thing as sumail  everyone would condemn it  but since it s sumail it s alright  he is just a 17 year old with the emotional maturity of one  so you ca nt blame him  but hey we can blame all the other 17 year olds who do the same things in their pubs  those guys are grade a douchebags  not  sumail  though,d01rpkp,dota2,gaming,1455619766.0,themightyseer,3.0,0.0,1,553,0.0
match id please,d01saj7,dota2,gaming,1455622144.0,sagarkpeace,1.0,0.0,132,96,0.0
911 was nt just a side job,d01v1wi,dota2,gaming,1455630370.0,HeavenlyGifted,1.0,0.0,14,199,0.0
we can talk here all we want  but i just wish valve gave a shit about things like these ,d020223,dota2,gaming,1455639270.0,VuckFalve,1.0,0.0,1,620,0.0
because he s a child,d02n8oy,dota2,gaming,1455671954.0,konrrr,1.0,0.0,433,506,0.0
after his first death he says  vann scofield rodeo and a few others have broken me  in all chat  vann is sa player  scofield is some pro dunno who rodeo ,d02o9c1,dota2,gaming,1455673480.0,vyampols,1.0,0.0,12,201,0.0
le reddit brokeback brokeback,d02ra7c,dota2,gaming,1455678165.0,Rkmkn,1.0,0.0,1,2741,0.0
ha  this reminds me of the scene in edge of tomorrow tom cruise is injured  and what sherface is coming over to shoot him so the day can start over again  and he s pleading  no no  i m okay  i m fine  best clip i could find https  wwwyoutubecomwatch  v  yd4exe1apfa  t  6m20s,d029uhf,dota2,gaming,1455652717.0,fdsdfg,36.0,0.0,96,74858,0.0
commended,d024zo4,dota2,gaming,1455646187.0,JoyThief0007,79.0,0.0,1,808,0.0
pudge is a hero that  when you first played the game you hated him so much  but as the time goes he became the most unique hero and so fun to watch,d025ssw,dota2,gaming,1455647280.0,newlifewating,54.0,0.0,11,78,0.0
seriously fuck those who run straight to fountain with dot  when is clear you will die either way let someone deny ,d0256vw,dota2,gaming,1455646455.0,TinyMVP,36.0,0.0,170,2471,0.0
i think of it more like pudge screaming into the mic  come back here you retard you will die let me deny you  ,d02fudk,dota2,gaming,1455660699.0,_GameSHARK,3.0,0.0,3,12801,0.0
