text,id,subreddit,meta,time,author,ups,downs,authorlinkkarma,authorkarma,authorisgold
thank you for this amazing post  what would i do if i did nt hear about something that happens every day thousands of times  but it happened to pro player so now it is on the front page ,d02v2gj,dota2,gaming,1455684691.0,Caderrific,1.0,0.0,1,316,0.0
probably got 5v1 d because  lol camp the pro so he wont win the game  if i didnt sometimes play with friends  i d abandon all day and only play lowpriority i ve had 100x more fun games with fun teammates who speak english in lowpriority than i ve ever had in ranked  because on euwest all nonrussian players are reported every game ,d025yuy,dota2,gaming,1455647506.0,ayylamoo911,0.0,0.0,1,1431,0.0
there must be a reason why misery never achieved anything despite playing since day 1 until he became the weakest link on secret ,d02dh1t,dota2,gaming,1455657526.0,Rvsz,0.0,0.0,3730,35872,0.0
this is nt ranked ,d02ns7u,dota2,gaming,1455672761.0,layzworm,0.0,0.0,3819,2499,0.0
if you can play on us east servers and you want to play then feel free to pm me  we can be garbage at this game together ,d02tcg0,dota2,gaming,1455681594.0,KEDAAAH,1.0,0.0,78,2481,0.0
since their creation in 2014  team secret has been a team brand name associated with being a home for superteams comprised of allstar players of the time now in the third major incarnation  this attribution still rings true their lineup remains unchanged since the frankfurt major all of the players in the current roster are in the top echelon of players in their respective role  they were once considered the best team in the world but after the frankfurt major  team secret have looked vulnerable can they overcome recent disappointments and return to full strength for the shanghai major   here you can read more about secret  s drafting pattern in the 686 patch and about their individuals   http  wwwgosugamersnetdota2features4722shanghaimajorpreviewteamsecret ,4622rr,dota2,gaming,1455622502.0,Divushka,30.0,0.0,335,0,0.0
w33 beelieevee,d020zsf,dota2,gaming,1455640634.0,PrinceZero1994,3.0,0.0,2035,3743,0.0
overrated players make up an overrated team ,d01sju4,dota2,gaming,1455623132.0,Rvsz,-17.0,0.0,3730,35872,0.0
ppl should do that more often  i dont know how the game played out  but based on pure net worth  id say that enigma did pretty well compared to the rest of the monkeys he was playing with  and that would make me not flip a table after the game for sure   id commend those ppl  d,d02ai6t,dota2,gaming,1455653604.0,sa6peto,1.0,0.0,27,1499,0.0
that s rubick s custom animation for casting repel  for those wondering ,d02lax0,dota2,gaming,1455668983.0,Bu3nyy,16.0,0.0,1456,15054,1.0
 drop the beat in the hood ,d02jab8,dota2,gaming,1455665762.0,generalecchi,1.0,0.0,5374,6503,0.0
game now offiacially playable,d023jpo,dota2,gaming,1455644209.0,bubadoto,1.0,0.0,150,64,0.0
yea my queue times are way too long  need more players at this level ,d01vddg,dota2,gaming,1455631083.0,Rvsz,15.0,0.0,3730,35872,0.0
i stopped caring once it just became a number ,d01vkwj,dota2,gaming,1455631534.0,poorgreazy,1.0,0.0,1,954,0.0
i mean  9kna is like 6k eu so   mr babyrage gets fed by teammates gt  lt ,d02aoli,dota2,gaming,1455653842.0,sa6peto,-3.0,0.0,27,1499,0.0
dat uspkirt and legs kreygasm,d01ump6,dota2,gaming,1455629366.0,Save_Pandam0n1um,2.0,0.0,124,6237,0.0
like one treasure or something every 10 level ,464709,dota2,gaming,1455651852.0,Lecia_Dota,11.0,0.0,1930,2676,0.0
it still does nt show the snow angel properly,d01zz71,dota2,gaming,1455639154.0,Stanel3ss,1.0,0.0,1,6398,0.0
did you pause while in the air  or time it for when you were coming down  assume in the air  which means he messed up sun strike  400 damage  and maybe didnt blast correctly at the ultimate time which meant you had less meteor ticks  plz respond,d02lzdm,dota2,gaming,1455669995.0,mavis3055,1.0,0.0,1,345,0.0
lone druid s fucking bear items lol god damn how many years has it been already ,d02kftn,dota2,gaming,1455667648.0,lawlianne,3.0,0.0,130,4235,0.0
6 seats  for a coach or is kamal just going to sit in the middle ,d0257y4,dota2,gaming,1455646496.0,Blargin,8.0,0.0,1,735,0.0
they better fucking use those ,d025g0v,dota2,gaming,1455646800.0,MightyOwl,1.0,0.0,467,118,0.0
i would have commended the good man then and there ,d01w1ix,dota2,gaming,1455632486.0,xnxsvngl,1.0,0.0,6307,4427,0.0
 runes,d02kebg,dota2,gaming,1455667580.0,AnotherDragon,1.0,0.0,95,143,0.0
i had completely forgotten about secret ,d0266m5,dota2,gaming,1455647799.0,Grizzlyboy,-7.0,0.0,4295,23400,0.0
bone7 should come in that is the c9 dream ,d022hum,dota2,gaming,1455642761.0,dunndone,7.0,0.0,139,4987,0.0
12k mind games,d01ws53,dota2,gaming,1455633920.0,Kojyneox,1.0,0.0,223,370,0.0
what s your mmr just curious,d02jieq,dota2,gaming,1455666107.0,XxEpicTacosxX,1.0,0.0,489,14936,1.0
its kinda weird that w33 invoker is a bit shaky even though he keep spamming him in pub and i do expect to see speetre and morpleeng instead of ember and gyro at sh major,d01tkyw,dota2,gaming,1455626545.0,quanid,5.0,0.0,34,1049,0.0
when your sand king bot has 4 wards in 3 slots  brown boots  two gg branches and is stuck in the trees south of the dire safelane t1,d02q8q2,dota2,gaming,1455676527.0,SoupKitchenHero,5.0,0.0,1,8026,0.0
the one who gets matched against sumail ,d01v5uf,dota2,gaming,1455630620.0,D0to0,98.0,0.0,1,1129,0.0
that fucking ursa got human eyes man,d01vvvk,dota2,gaming,1455632168.0,BeyondCake,1.0,0.0,1024,1763,0.0
reddit awaits,d01vbd0,dota2,gaming,1455630956.0,DaftGank,5.0,0.0,1,2146,0.0
misery is super bad  not even a surprise ,d026whw,dota2,gaming,1455648767.0,Rmd456,0.0,0.0,430,461,0.0
do nt know what to expect from this team,d021iga,dota2,gaming,1455641365.0,felslima,2.0,0.0,1,4,0.0
this is bug or what  this should be fixed asap ,d02n1z1,dota2,gaming,1455671672.0,carebear3132,1.0,0.0,1,0,0.0
damn good ,d02do94,dota2,gaming,1455657787.0,metapod42,1.0,0.0,1,80,0.0
basically having control be the unified attack order and the modifier in which to create control groups sucks i m looking to change it  but ca nt figure out how any help would be appreciated ,466e59,dota2,gaming,1455681039.0,afraidtoleavemystoop,2.0,0.0,3,690,0.0
can someone explain to me how this might make invoker  miss  his combo ,d0231ec,dota2,gaming,1455643516.0,dkaarvand,1.0,0.0,31,3337,0.0
or just stick with ur team and avoid being ganked for a good 6 minutes till that voker realizes he wasted 2k  gold,d02rql8,dota2,gaming,1455678909.0,Rkmkn,1.0,0.0,1,2741,0.0
whoever plays more ,d01vhh1,dota2,gaming,1455631327.0,Nerovinsar,1.0,0.0,1395,18299,0.0
that midnight pulse dmg seemed underwhelming  did he not have it maxed out 32 mins in ,d02bzdg,dota2,gaming,1455655525.0,weepiestchimp,1.0,0.0,1,50,0.0
crystal maiden  has a taunt of spreading legs,d01u84r,dota2,gaming,1455628355.0,tomato-dragon,2.0,0.0,463,976,0.0
instantly 5 lp games would do justice  reported or not,d01q4m3,dota2,gaming,1455613285.0,quanid,50.0,0.0,34,1049,0.0
this kid is a prick lmao hes got bad karma comin to him,d01z0sl,dota2,gaming,1455637710.0,completelyowned,6.0,0.0,5026,8683,0.0
so that s how people gain mmr in na,d01s7jx,dota2,gaming,1455621810.0,WithFullForce,10.0,0.0,706,21679,0.0
videos in this thread   watch playlist amp   9654    http  subtletvcom_r461geo  feature  playlist  video  comment     sumail intentional feeding 026   https  youtubecomwatch  v  eowpduhxfxg    1   https  redditcomrdota2comments461geo_d01rs3n  context  10  d01rs3n   youtube link if anyone interested he died 26 times that game   family guy  visiting ground zero   https  youtubecomwatch  v  lehbd3ghh4i    1   https  redditcomrdota2comments461geo_d01r2x8  context  10  d01r2x8   everyone knows government officials coulnamp   39  t possibly be wrong for reasons i dont want to go in on a dota sub this is a great video about the subject   tony hawk s pro rapper dan bull vs dave brown   https  youtubecomwatch  v  t_yihb9lyamp  t  23s    1   https  redditcomrdota2comments461geo_d01rc6i  context  10  d01rc6i   100  360  i didnamp   39  t realise just how well this line sums up dota until now  i m a bot working hard to help redditors find related videos to watch      info   https  npredditcomrsubtletvwikimentioned_videos    chrome extension   https  chromegooglecomwebstoredetailmentionedvideosforreddfiimkmdalmgffhibfdjnhljpnigcmohf ,d01rsa0,dota2,gaming,1455620083.0,Mentioned_Videos,3.0,0.0,1,45401,0.0
suma1l is broken,d01owwl,dota2,gaming,1455608978.0,lethalitykd,2.0,0.0,17726,13424,0.0
le reddit brokeback brokeback,d02ra7c,dota2,gaming,1455678165.0,Rkmkn,1.0,0.0,1,2741,0.0
what is roshpit champions and why should i play it ,d02o6f3,dota2,gaming,1455673359.0,SilentShadows,1.0,0.0,1,535,0.0
the first time i watched it  i was like  why they are not defending the base lol,d027xru,dota2,gaming,1455650166.0,n3cooling,1.0,0.0,532,350,0.0
pretty sure i ve been using it for ages ,d01uexe,dota2,gaming,1455628840.0,MooningCat,1.0,0.0,1760,4075,0.0
if you have virdus claw  primal form of the tentacular timelord  and jewel of aeons all equiped  he will begin switching between three poses  and even ingame it s really annoying and distracting ,464n69,dota2,gaming,1455657404.0,MidSolo,26.0,0.0,6093,39286,0.0
it s almost like they re one of the best teams in america or something ,d01oe7g,dota2,gaming,1455607365.0,Charlie_Wax,45.0,0.0,8508,36105,0.0
fucking lanaro ,d01ra2i,dota2,gaming,1455617970.0,Mathieulombardi,6.0,0.0,1008,18035,0.0
really good artbut who the fuck wants to watch jugg fight abba,d02eors,dota2,gaming,1455659132.0,Invoke_ezmode,3.0,0.0,1,-3,0.0
really nice,d026yg1,dota2,gaming,1455648840.0,Dante93,1.0,0.0,2,839,0.0
i queued for a pub game yesterday planning to play a casual game of dota one of the players asked at the draft if we could try for the 35 minute win challenge i figure  screw it  why not  our team of 5 completely random people turned into the deathball push from hell  lycan  nature s prophet  death prophet  pugna  and shadow shaman we won in 19 minutes we friended each other and did it two more times afterwards i got the quest and won a bzz pugna set from my parcel ,d00z30l,dota2,gaming,1455564922.0,Dyne4R,189.0,0.0,173,3197,0.0
that rng on right click damage,d00yyyx,dota2,gaming,1455564760.0,quanid,4.0,0.0,34,1049,0.0
the unforgiven,d00xdb7,dota2,gaming,1455562486.0,generalecchi,2.0,0.0,5374,6503,0.0
too bad ca nt get battle pass in africa   ,d00ybis,dota2,gaming,1455563830.0,icecoldmind,0.0,0.0,6,158,0.0
anyone know where i can watch a timelapse of someone creating something like this ,d02d7ze,dota2,gaming,1455657186.0,le_f,1.0,0.0,1,7597,0.0
abaddon wins easily jugg is pretty weak in the very late game ,d02o4u3,dota2,gaming,1455673293.0,ahmeddota99,1.0,0.0,1,223,0.0
when rtz abandons a ranked game nobody cares  when misery abandons a ranked game everyone loses their minds ,d027fdl,dota2,gaming,1455649470.0,Ynnad00,0.0,0.0,50,7775,0.0
i can watch the stream so the game has started but i ca nt find the game in dota i paid for this shit ,4642ot,dota2,gaming,1455650428.0,ABigBadBear,13.0,0.0,447,421,0.0
udanielj_valve fix pls,d028rt6,dota2,gaming,1455651286.0,jstq,0.0,0.0,291,1329,0.0
was that phoenix babushka  ,d02aajm,dota2,gaming,1455653315.0,sa6peto,1.0,0.0,27,1499,0.0
brb deleting dota2,d01sehs,dota2,gaming,1455622575.0,raylucker,1.0,0.0,1894,1613,0.0
t r i g g e r e d,d01ul9z,dota2,gaming,1455629272.0,Save_Pandam0n1um,1.0,0.0,124,6237,0.0
im never playing sven again after this,d01xbjc,dota2,gaming,1455634889.0,RoastyMeToasty,1.0,0.0,1,234,0.0
i do nt see it,d0235cl,dota2,gaming,1455643666.0,dkaarvand,1.0,0.0,31,3337,0.0
i was studying the image and wondering what the stupid question was for so long  god damn it when i finally found op s question in the comments  yupp  guess it was answered already  aegis consumed time and rosh respawn time range ,d02u5n2,dota2,gaming,1455683022.0,lawlianne,2.0,0.0,130,4235,0.0
can anyone tell me what those numbers represent ,d02py97,dota2,gaming,1455676080.0,Homogenous,1.0,0.0,37,13,0.0
thats one on best artworks ever posted here ,d0272ug,dota2,gaming,1455649002.0,filiard,3.0,0.0,558,4875,0.0
i would love for a way to see if you have already watched a game or not a little tick box  different colour to the  watch  button or even change it to saying  watched  i m going through the tourny and watching the games in order but i lose where i am upto and what i have already seen  should nt be too hard to implement ,465vs2,dota2,gaming,1455674107.0,SilentShadows,2.0,0.0,1,535,0.0
holy shit this is so high quality material,d02p99m,dota2,gaming,1455675001.0,uberxD,1.0,0.0,1036,3357,0.0
i remember in the original dota 2 client that you were allowed to create teams and fight others in matchmaking now  do nt misconstrue me by all means  i do nt mean to state anything about the pro scene etc  but that i enjoyed being able to make goofy teams with friends as well as people i met in various games and subsequently play with them every so often in a more organized fashion  i m currently a 43k player who usual solo ques  but would enjoy being able to more often play in an organized setting   so really  my question revolves around whether or not this will be added again or at the very minimal a similar replacement to it whether within the dota client or not ,466gcr,dota2,gaming,1455681920.0,Happymealify,2.0,0.0,1,-29,0.0
the kid is a massive shit stain stop using the age excuse as well  i know so many teenagers who are nt shit stains ,d01sz8a,dota2,gaming,1455624651.0,_mishka_,7.0,0.0,1960,570,0.0
info and signups   https  wwwfacebookcomevents103202123399784   https  wwwfacebookcomevents103202123399784 ,466rw7,dota2,gaming,1455686942.0,ladybugman,1.0,0.0,1,1,0.0
all about the stats bruh,d02vgm2,dota2,gaming,1455685436.0,Awesometof93,1.0,0.0,32,25,0.0
i think universe will be embarrassed of getting his 8k this way ,d01u47t,dota2,gaming,1455628059.0,_mishka_,12.0,0.0,1960,570,0.0
we can talk here all we want  but i just wish valve gave a shit about things like these ,d020223,dota2,gaming,1455639270.0,VuckFalve,1.0,0.0,1,620,0.0
does anybody know the reason  he just walks down mid minute 1,d01oyey,dota2,gaming,1455609117.0,shitinmyunderwear,6.0,0.0,2499,10758,0.0
yeah this is pretty scummy ,d01ptv1,dota2,gaming,1455612153.0,Flightlesstm,5.0,0.0,24,3135,0.0
inb4 hes just a kid ,d01qrg5,dota2,gaming,1455615808.0,Que-Hegan,63.0,0.0,1,7964,0.0
why does jugg get a cool set and not abaddon demonic vessel lives matter too ,d02gis4,dota2,gaming,1455661648.0,Tarrannosaurus,5.0,0.0,1,6403,0.0
that s a good spot,d0213v4,dota2,gaming,1455640793.0,ykcin978,46.0,0.0,754,532,0.0
love it  my fav hero and most played   what mmr is this  if you care to share     do you find the new veil stronger on him early  mid game now  ,d02dlaw,dota2,gaming,1455657679.0,metapod42,1.0,0.0,1,80,0.0
but where was rampage ,d02k58i,dota2,gaming,1455667189.0,lawlianne,1.0,0.0,130,4235,0.0
veil of discord good item ,d02vbzd,dota2,gaming,1455685189.0,Caderrific,1.0,0.0,1,316,0.0
w h o c a r e s h o c a r e s,d01wcwh,dota2,gaming,1455633121.0,PolarBURIED,4.0,0.0,16,3884,0.0
mmm  looking good ,d02cqva,dota2,gaming,1455656547.0,Nin10dude64,4.0,0.0,1,2869,0.0
because he s a child,d02n8oy,dota2,gaming,1455671954.0,konrrr,1.0,0.0,433,506,0.0
try to get it as a loading screen in the game ,d027kxq,dota2,gaming,1455649684.0,thrillhouse3671,8.0,0.0,10730,80649,0.0
knockoff rtz confirmed  may aswell feed the big boy ,d01rnxg,dota2,gaming,1455619576.0,KillerOfAnime,3.0,0.0,19,146,0.0
because low prio dont punish hard enough  valve should have a system that detects when a player feed in the game and if he receive x reports he get 15 low prio games  win   the next time is 30 win games low prio  the next time 60 etc   i doubt any1 would do this kind of shit 4k the same with mute system  valve should make a system that detects chat activities and if some keywords are said too much in the game the player gets muted for a week  if he does that again muted for 1 month  dota would be the most serious game out there ,d020jwa,dota2,gaming,1455639999.0,paoxayla,3.0,0.0,51,303,0.0
lol american players feeding rtz mmr to beat badman,d01owel,dota2,gaming,1455608935.0,DurrrrDota,392.0,0.0,561,3446,0.0
daily reminder that all intentional feeders should be hung  drawn  and quartered and have their giblets hung on display at the pier as a warning to others,d01p420,dota2,gaming,1455609632.0,DOUBLEBOSSSPRINGSMAP,14.0,0.0,1569,6614,0.0
lc has a daedelus  refresher  treads  blink  and blademail at 29 minutes ,d02ccpv,dota2,gaming,1455656017.0,NotADemon_AMA,10.0,0.0,2902,13917,1.0
after his first death he says  vann scofield rodeo and a few others have broken me  in all chat  vann is sa player  scofield is some pro dunno who rodeo ,d02o9c1,dota2,gaming,1455673480.0,vyampols,1.0,0.0,12,201,0.0
wow  how does it feel to be a god  you re like i do nt know  top 10 world  i mean  wow,d02lx9b,dota2,gaming,1455669906.0,teerre,1.0,0.0,42,71965,0.0
if they all reach 8k that s a 40k mmr team but it s also important to consider that 7k mmr na is 5k mmr eu,d01ruzg,dota2,gaming,1455620397.0,medwannabe,-13.0,0.0,1,1460,0.0
butterfly coupled with blademail were game losing  if you had manta  something else you most likely would have won you also needed to be careful with break from tas se,d02psch,dota2,gaming,1455675818.0,Zyndikill115,1.0,0.0,1,463,0.0
also  shallow grave only last 5 seconds  for one target allied unit and there is a cooldown ,d02ukae,dota2,gaming,1455683749.0,gundambeginner,1.0,0.0,357,210,0.0
damn looks badass ,d02p1kq,dota2,gaming,1455674673.0,egyptionsr2buff,3.0,0.0,35,198,0.0
https  wwwdotabuffcommatches2157045016 ember on my team pauses as we load in saying he has a nose bleed enemy team unpauses two or three times  so the ember decided to feed himself and couriers down mid  all the while flaming and harassing is there nothing but reporting that can be done for people that cancerous ,464exy,dota2,gaming,1455654572.0,RequiemFear,6.0,0.0,3,1297,0.0
unless valve employ tonnes of online police  it will always be automated nothing can be done ,d02nqad,dota2,gaming,1455672682.0,gundambeginner,1.0,0.0,357,210,0.0
god damnit  this is unseeable ,d01krwh,dota2,gaming,1455598754.0,HypnoToad112,27.0,0.0,1,238,0.0
they will release an arcana only for someone popular to sell a lot and medusa sure as hell isnt popular,d02vqk3,dota2,gaming,1455685981.0,godfrey1,1.0,0.0,72,20295,0.0
this challenge is easy  pick jakiro offlane he pushes towers very quickly and in offlane he puts a lot of pressure on the safelane carry it also helps if you tell your team you are going for 35mins so someone else might pick something suitable  it took me like 5 games to get this ,d00z61u,dota2,gaming,1455565045.0,waoh,4.0,0.0,131,1962,0.0
i just gave up on that challenge ,d00ycvl,dota2,gaming,1455563884.0,Theology1,1.0,0.0,260,339,0.0
good stuff ,d024aug,dota2,gaming,1455645243.0,cd3-,5.0,0.0,5,433,0.0
cause they are a secuence i do nt know really he just adds 300 to each number,d02q4yh,dota2,gaming,1455676365.0,yupster466,-1.0,0.0,1,208,0.0
and this is an example to why people in reddit are the worst  rip unnecessary nerfs on heroes ,d01vb3u,dota2,gaming,1455630939.0,HeavenlyGifted,1.0,0.0,14,199,0.0
can not be unseen wutface,d01ifes,dota2,gaming,1455594624.0,DaTrace,3.0,0.0,1,648,0.0
op  spend more time concentrating on game and less time worrying about something so small that no one cares kthanxbaai,d01kbqg,dota2,gaming,1455597888.0,CunningStunt1,0.0,0.0,368,304,0.0
if you look closely none is aligned it s just more visible with 3 bars than 4 ,d01m87j,dota2,gaming,1455601781.0,eri_bloo,6.0,0.0,203,215,0.0
i skipped work today just to watch this alliance game and guess how mad it makes me when i realize  i am not going to get paid today and also not going to be able to see the game i am on limited data wireless connection  so cant use twitch on twitch moonducktv says  we cant do shit  if you want refund ask from valve  i did not expect this type of reply from such fun amp  awesome people even a reply saying  we are looking into it but its out of our control  please understand  would calm down anyone it just made me more mad now m sitting here helpless writing this post  because guess what  nobody can do anything  gg ,d029cqw,dota2,gaming,1455652061.0,Arjs,-1.0,0.0,1,12,0.0
seems like a classic case of  destroy enemy heroes and continue to farm when you should ve been pushing,d026vur,dota2,gaming,1455648743.0,danicolorado10,3.0,0.0,1,1456,0.0
haha,d00x9w5,dota2,gaming,1455562348.0,oisanji,0.0,0.0,6939,1067,0.0
nice,d024hrd,dota2,gaming,1455645502.0,lqdsnk,1.0,0.0,1,64,0.0
yeah but path of the blossom says it s only for the high ground siege to complete ,d019cqf,dota2,gaming,1455580220.0,super_pack1,1.0,0.0,1,9,0.0
it s john cena  when did valve added that hero  ,d02j3yp,dota2,gaming,1455665488.0,generalecchi,-2.0,0.0,5374,6503,0.0
i feel like valve needs to put in place some sort of conduct policy or something in place for this kind of shit this literally ruined the game for 4 other people  wasting their time and losing mmr it just makes the professional scene look bad to let people do this so blatantly and not get punished ,d01swrm,dota2,gaming,1455624419.0,KaoticSkunk,2.0,0.0,58,441,0.0
great last three minutes though 4head,d02fpnn,dota2,gaming,1455660516.0,hobo__spider,1.0,0.0,3379,6526,0.0
kanye,d0153ow,dota2,gaming,1455573637.0,aaddeerraall,9.0,0.0,128,3103,0.0
lobby games,d02tjnp,dota2,gaming,1455681947.0,ez-R-ez-Gaem,1.0,0.0,1,9552,0.0
 youtube link   https  wwwyoutubecomwatch  v  eowpduhxfxg  if anyone interested  he died 26 times that game ,d01rs3n,dota2,gaming,1455620064.0,SmokeITFunky,17.0,0.0,232,641,0.0
i clicked on this without looking closely  expected a gfycat link or somethng did not expect this sweet image ,d02v5js,dota2,gaming,1455684853.0,MrRKipling,1.0,0.0,12,286,0.0
need more art like this  damn ,d026w7r,dota2,gaming,1455648755.0,emailboxu,2.0,0.0,368,36646,0.0
this is awesome dude  should be a loading screen for sure,d029tko,dota2,gaming,1455652684.0,nocopzone,1.0,0.0,1,359,0.0
this was an excellent play as a pudge pick  this made me chuckle at the necro nice job ,d00wq2h,dota2,gaming,1455561573.0,Torashu,6.0,0.0,735,2648,0.0
shouldnt his aura be showing ,d00yxt8,dota2,gaming,1455564716.0,Marsinator,3.0,0.0,483,1027,0.0
damn son  calm the fuck down it s just a game  you fucking gave that necrophos player extreme depression and erektile dysfunction  i only hype this play because i m shit at pudge and every other hero _ ,d01l6mb,dota2,gaming,1455599567.0,Yaliw,1.0,0.0,1,2150,1.0
inb4 necro goes to devdota and complains about pudge using maphack ,d01ms5t,dota2,gaming,1455603069.0,Redthrist,1.0,0.0,160,9415,0.0
blind hook best hook,d01s4gb,dota2,gaming,1455621463.0,raylucker,1.0,0.0,1894,1613,0.0
the likedislike button is going nuts ,d020q82,dota2,gaming,1455640252.0,cd3-,1.0,0.0,5,433,0.0
i am pretty sure if you linked a random dotabuff account who was doing the same thing as sumail  everyone would condemn it  but since it s sumail it s alright  he is just a 17 year old with the emotional maturity of one  so you ca nt blame him  but hey we can blame all the other 17 year olds who do the same things in their pubs  those guys are grade a douchebags  not  sumail  though,d01rpkp,dota2,gaming,1455619766.0,themightyseer,3.0,0.0,1,553,0.0
some things never change ,d02olvl,dota2,gaming,1455674011.0,amonaroll,1.0,0.0,1,2299,0.0
i assume op is the artist if that so  could we have more ,d028sti,dota2,gaming,1455651323.0,gt2slurp,1.0,0.0,2,249,0.0
911 was nt just a side job,d01v1wi,dota2,gaming,1455630370.0,HeavenlyGifted,1.0,0.0,14,199,0.0
oh baby a triple ,d02ujwd,dota2,gaming,1455683729.0,Chickenation,1.0,0.0,1,460,0.0
now i would pay for a retina version,d02ivyd,dota2,gaming,1455665148.0,mmm0nky,1.0,0.0,1,32,0.0
i m thinking about an epic rap battle of dota 2 hope sb will work on it ,d02r7ke,dota2,gaming,1455678049.0,nghiahust,1.0,0.0,3,1170,0.0
you did nt mean boobs by assets  m8 i m truly disappointed,d01r12y,dota2,gaming,1455616912.0,Brunoob,5.0,0.0,4037,7730,0.0
hi there  reddit  we are academic researchers from finland our current project aims to map out the training methods of pro esport players assuming that some of those players are here  we invite everyone who  competes  or  seriously works to compete  on a professional level  ie on a level that provides considerable financial compensation  to participate the study  to consider yourself as part of our target group  you should estimate your mmr around the top 5   to participate  simply answer the questions behind this link  http  kyselytlimequerycomindexphp428968langen the survey takes about 5 minutes  some questions are optional answering is totally anonymous  and the results will be handled according to academic ethical principles you participation will contribute to the advancements of esports cultures  and when the research is finished you will be able to utilise the results in your training the survey is open until february 29  2016  a warm thank you in advance  note  this is a reposting of a call that we did last week  it did nt reach any players   if you think this is inappropriate  let us know we will not repost after today ,464xtm,dota2,gaming,1455661070.0,EsportResearch,4.0,0.0,1,4,0.0
like anyone can fight with that kinda hat the jugg had on any movement will block his vision entirely,d02mtoy,dota2,gaming,1455671317.0,raizen0106,1.0,0.0,9,1337,0.0
i like how wr most likely though she outplayed you ,d02i01o,dota2,gaming,1455663789.0,Konras,3.0,0.0,257,1881,0.0
her boobs have 3 times the pixels her shield has ha  who would have thought ,d024u58,dota2,gaming,1455645972.0,See4urSelf,3.0,0.0,522,484,0.0
