text,id,subreddit,meta,time,author,ups,downs,authorlinkkarma,authorkarma,authorisgold
got ta have that fresh meat,d02n0uu,dota2,gaming,1455671624.0,ClassicJimmee,1.0,0.0,1,103,0.0
i think he mightve survived that on the last tick of gale not getting the kill,d02sibl,dota2,gaming,1455680180.0,Ynnad00,1.0,0.0,50,7775,0.0
pudge was like  goddamn it  you are not gon na die one more time you stupid fuck ,d026bfp,dota2,gaming,1455647981.0,garvon_,1.0,0.0,108,5448,0.0
better love story than me and the girl i like biblethump,d02gurs,dota2,gaming,1455662119.0,SManSte,1.0,0.0,1325,6538,0.0
skill level  demigod,d029e58,dota2,gaming,1455652114.0,CrisM1,-1.0,0.0,34,1481,0.0
1010,d026fm4,dota2,gaming,1455648137.0,warden5738256,0.0,0.0,55,1681,0.0
i paused the game and he fucked up ,462e8o,dota2,gaming,1455628777.0,buflo,1209.0,0.0,62,140,0.0
 wizards hate him  ,d01ut72,dota2,gaming,1455629801.0,El_Pipone,530.0,0.0,1140,8932,1.0
686e  pauses are disabled when invoker is about to eul a target,d01y0uw,dota2,gaming,1455636100.0,kyan-,141.0,0.0,1164,804,0.0
i bet it messed up the timing on his script kappa,d01viof,dota2,gaming,1455631402.0,vipirius,299.0,0.0,524,7161,0.0
http  hydramediacursecdncomdota2gamepediacom881invo_rare_05mp3,d01uxqz,dota2,gaming,1455630099.0,corinarh,99.0,0.0,135,3403,0.0
lol just di out of it,d01x6fn,dota2,gaming,1455634637.0,Atrioventricular,130.0,0.0,6577,29974,0.0
who dares threaten my concentration ,d01xw63,dota2,gaming,1455635888.0,LordoftheHill,20.0,0.0,2,3613,0.0
but you can only pause once every 300 sec iirc  ,d01vh6p,dota2,gaming,1455631309.0,kissmyasthma123,14.0,0.0,69,221,0.0
 did i use euls two seconds ago or just one   well to tell you the truth in all this excitement i kinda lost track myself but being this is an invoked sunstrike  the most powerful pure damage nuke in the world and would blow your head clean off  you ve got ta ask yourself one question   do i feel lucky   well  do ya  punk ,d021qml,dota2,gaming,1455641686.0,Beastius,39.0,0.0,1,2949,0.0
 try this simple trick that will win you many games  gone wrongsexualwildjust a prank  ,d0222xu,dota2,gaming,1455642173.0,TheRealFakeDendi,4.0,0.0,1310,22563,0.0
   witnessed   ,d01wc78,dota2,gaming,1455633081.0,ActualDemon,3.0,0.0,60,2510,0.0
what i do  get blademail as soon as possible see him burn ,d01whky,dota2,gaming,1455633371.0,Vine8zman,6.0,0.0,1,1139,0.0
invokers hate him  what a weird old trick ,d021pyx,dota2,gaming,1455641660.0,dog_obgyn,2.0,0.0,242,650,0.0
https  nicedotameme,d0239kk,dota2,gaming,1455643828.0,Kappanating322,2.0,0.0,1,195,0.0
suddenly reddit is in favor of puppy paws ,d02431n,dota2,gaming,1455644949.0,skinnyowner,2.0,0.0,139,5932,0.0
how to counter pudge  just dont get hit,d026c1l,dota2,gaming,1455648003.0,AustinTP,2.0,0.0,3358,1344,0.0
you monster,d02i2ua,dota2,gaming,1455663909.0,kaitoshion07,2.0,0.0,1,1,0.0
i m just waiting for professional teams to do this gon na be hilarious when they pause and say lag  ddos etc ,d01wd4i,dota2,gaming,1455633134.0,BlackChineseGuy,3.0,0.0,621,2551,0.0
mom get the camera,d0263d1,dota2,gaming,1455647674.0,Brim_Dunkleton,1.0,0.0,1,1350,0.0
reminds me of pausing to get out of a grab in smash,d027gws,dota2,gaming,1455649529.0,StopLurker,1.0,0.0,1546,6956,0.0
it doesnt pause needs 3 sec and ur dead in 25,d02bz0h,dota2,gaming,1455655513.0,taeyeon_sg,1.0,0.0,5,192,0.0
what is the euls combo  sunstrike  blast  meteor ,d02cja0,dota2,gaming,1455656261.0,apoptygma,1.0,0.0,490,2025,0.0
i can see how it can interrupt all those macrovokers ,d02dvu1,dota2,gaming,1455658070.0,Konras,1.0,0.0,257,1881,0.0
hahahahahahhahahahahah,d02gonf,dota2,gaming,1455661877.0,SManSte,1.0,0.0,1325,6538,0.0
i played nyx against one last night  every tornadoeuls  spiked carapace ,d02k9w0,dota2,gaming,1455667390.0,Anuxinamoon,1.0,0.0,4002,11595,0.0
did you pause while in the air  or time it for when you were coming down  assume in the air  which means he messed up sun strike  400 damage  and maybe didnt blast correctly at the ultimate time which meant you had less meteor ticks  plz respond,d02lzdm,dota2,gaming,1455669995.0,mavis3055,1.0,0.0,1,345,0.0
this is bug or what  this should be fixed asap ,d02n1z1,dota2,gaming,1455671672.0,carebear3132,1.0,0.0,1,0,0.0
lmao,d02nlle,dota2,gaming,1455672487.0,TheLastToa,1.0,0.0,30,183,0.0
doesnt matter most of these shittard invoker spammers are using macros  scripts anyway,d02ra15,dota2,gaming,1455678157.0,-kami-,1.0,0.0,20,325,0.0
or just stick with ur team and avoid being ganked for a good 6 minutes till that voker realizes he wasted 2k  gold,d02rql8,dota2,gaming,1455678909.0,Rkmkn,1.0,0.0,1,2741,0.0
to be serious its quite ez to avoid that combo bros as soon as euls ends walk sideways unless his deafening blast is on point u will be fine ,d02rva1,dota2,gaming,1455679121.0,lone_wanderer101,1.0,0.0,1445,1472,0.0
i actually laughed out loud because it can work  d will try ty dude,d02256k,dota2,gaming,1455642261.0,ullu13,1.0,0.0,1,1350,0.0
can someone explain to me how this might make invoker  miss  his combo ,d0231ec,dota2,gaming,1455643516.0,dkaarvand,1.0,0.0,31,3337,0.0
who ,d0229ms,dota2,gaming,1455642437.0,Aufbaf,-9.0,0.0,523,2538,0.0
sometimes i wonder if pudge s player model is intentionally far bigger than it actually appears to be  this might prove my theory   no it wo nt   ,d02g25q,dota2,gaming,1455661001.0,Blackajack20,10.0,0.0,161,304,0.0
boobs,d027p8f,dota2,gaming,1455649848.0,PurpleWarSnail,1.0,0.0,1,9,0.0
watch him whip  whip watch him nae nae,d00zint,dota2,gaming,1455565547.0,Fizzdar,3.0,0.0,1981,4284,0.0
overused anus,d02nuit,dota2,gaming,1455672861.0,hadezb,2.0,0.0,1,-4,0.0
i did nt know observer wards can block woah,d02ry8l,dota2,gaming,1455679256.0,sasawedx,1.0,0.0,1,-7,0.0
bu3ny is a golden god his work on the wiki is so comprehensive it scares me aside from all the testing he does to clarify the notes  on the side of each spell on the wiki  he s very thorough in general  my favorite edit i caught that was made by him was for 685b s change for agh doom the official changelog just said    scepter doom no longer increases damage   http  storesteampoweredcomnews19087   which means absolutely nothing to me the wiki goes ahead to clarify   aghanim s scepter no longer increases doom damage from 203550 to 406080   http  dota2gamepediacomdoom  balance_changelog   it s a small detail  but dota is just a bunch of stupid small details  so it s a relief that we have an encyclopedic source like the wiki  lt  3 bu3ny  and all the wiki contributors ,d0272sh,dota2,gaming,1455649000.0,tsunami643,303.0,0.0,11891,23938,0.0
best clinkz ever ,d02ev6m,dota2,gaming,1455659363.0,pizzademons,0.0,0.0,395,17276,0.0
 my man    https  wwwyoutubecomwatch  v  kpcmfjfn8oi ,d029v1u,dota2,gaming,1455652737.0,Licheus,1.0,0.0,426,1209,0.0
overused anus,d02tu66,dota2,gaming,1455682460.0,EqualWin,3.0,0.0,5,10263,0.0
commended ,d02hvq8,dota2,gaming,1455663610.0,Avishai2112,1.0,0.0,3,34,0.0
magic sucks,d01zahw,dota2,gaming,1455638121.0,Magina90,18.0,0.0,1,1824,0.0
more drama boys popcorns out  unzip pants oh yeah reddit drama rdrama,d02qtc7,dota2,gaming,1455677411.0,deliaren,0.0,0.0,27,4162,0.0
he just put the team out of misery ,d02hc5g,dota2,gaming,1455662816.0,ToraToraToraToraTora,1.0,0.0,1038,38,0.0
somebody hire this guy ,d02kapv,dota2,gaming,1455667426.0,LegendofOld,1.0,0.0,152,176,0.0
valve should do something about these pro players  ruining the communityregion they are in it gives bad impression to legit players who are actually trying i feel bad for the players who are caught in these disgusting acts ,d025f93,dota2,gaming,1455646771.0,ThesisEmpty,1.0,0.0,1,16,0.0
he hit 8k few days ago and he is prob now   75k   77k or something like that  he is sooooo tilted ,d01ovy8,dota2,gaming,1455608892.0,rejectx,52.0,0.0,399,28601,0.0
when you try to move forward but hit a wall of air ,d02hjvs,dota2,gaming,1455663127.0,InfiniteSquirrels,0.0,0.0,1,887,0.0
teamwork my friend ,d02bmhr,dota2,gaming,1455655063.0,GrDenny,1.0,0.0,1,2277,0.0
https  twittercomclementinatorstatus635811100890693632,d01tf5t,dota2,gaming,1455626060.0,woopadisco,142.0,0.0,1,389,0.0
artour the boy,d01ygfh,dota2,gaming,1455636803.0,14MySterY-,1.0,0.0,5886,25886,0.0
damn that ending though i came here expecting some moves  not some feels ,d00lj9m,dota2,gaming,1455542269.0,KohakuKen,310.0,0.0,677,22131,0.0
this bullshit is exactly what ruins tons of games and is what valve needs to clamp down on yet there will still be people defending this ,d01oxo7,dota2,gaming,1455609048.0,SHAQ_FU_KAZAAM,222.0,0.0,115,13584,0.0
i think an announcer pack would work better than music pack personally while it s very different than anything dethklok  which would really just be the talented brenden small   there is a metal music pack already out i think it s called the dire shred pack  i bought it  it s awesome   an announcer pack would be a lot more fun to have  in my opinion ,d02vdca,dota2,gaming,1455685259.0,totalysharky,1.0,0.0,3,2327,0.0
honestly  sumail is a disgrace to the dota 2 professional stage ,d01p7r2,dota2,gaming,1455609974.0,cutt88,119.0,0.0,2194,3959,0.0
i can see how it can interrupt all those macrovokers ,d02dvu1,dota2,gaming,1455658070.0,Konras,1.0,0.0,257,1881,0.0
i did nt think veno s ult could kill you ,d02um5a,dota2,gaming,1455683845.0,nowherechild,1.0,0.0,1,38,0.0
couldve lived wouldnt have denied and flamed her instead for tread switching too late and misstiming bottle usage,d02fp3s,dota2,gaming,1455660493.0,Sc2DiaBoLuS,1.0,0.0,659,2378,0.0
well he is either tilted or boosting universes und arteezys mmr  which had in the past lead to bans from the leaderboard if i remember it correctly,d01owfc,dota2,gaming,1455608937.0,Stasimir,31.0,0.0,2,492,0.0
i ve done this at least 3 times  do i get a frontpage post ,d02f5nx,dota2,gaming,1455659745.0,Autism_Spirit,-2.0,0.0,2,3745,0.0
i play around  4k  i think this is the bracket where people are good enough to take over games like in 2k or something ,d028vcv,dota2,gaming,1455651420.0,vissermans1,-6.0,0.0,1,-7,0.0
i did nt know observer wards can block woah,d02ry8l,dota2,gaming,1455679256.0,sasawedx,1.0,0.0,1,-7,0.0
invoker pickers hate him,d02m8b8,dota2,gaming,1455670379.0,opinion2stronk,2.0,0.0,1,3155,0.0
miracle,d01wpgh,dota2,gaming,1455633785.0,Profileee,4.0,0.0,1,2069,0.0
it s really annoying to try to gank as necro and similar since everyone can pretty much instantly notice that they re starting to lose health and the spell just tells you necro is near you anyway if wk can toggle his aura  i think it should be made that necro can toggle it too since it would really help out with those earlymid game ganks ,46289h,dota2,gaming,1455625853.0,TheDrunkDemo,318.0,0.0,481,323,0.0
you must be the guy get hooked by pudge yesterday,d01upue,dota2,gaming,1455629575.0,generalecchi,786.0,0.0,5374,6503,0.0
if people notice the aura they should be in deep shit by then anyway you re not going to do any initiating on your own as a necro  are you  if you are you ll want a blink  i dont think this is a critical enough thing to warrant a change in something that gives the hero his flair ,d01txfy,dota2,gaming,1455627535.0,D3Construct,6.0,0.0,779,43062,0.0
 we jojo now   https  youtubeib0exaejwms  t  15  also  nope and it would be cool if people stop suggesting to make all passives toggleable ,d01zh8g,dota2,gaming,1455638401.0,Epsi_,2.0,0.0,429,3004,0.0
   lore,d01xxqs,dota2,gaming,1455635960.0,brianbezn,1.0,0.0,1,4753,0.0
i want sven cleave toggle as well  wk gets it,d022dh7,dota2,gaming,1455642590.0,ullu13,1.0,0.0,1,1350,0.0
wk toggles only between hero and creeps it s a buff to lane sustain on the hero itself  it was meant to be sustain for him and team  necro having his debuff toggle between onoff or hero only is dumb  since it s purely a buff to controlling lane and harass  if you do nt want it in lane or in general  do nt level it first it s basically removing a passive on your hero  wk still receives the benefits of his passive,d02fglw,dota2,gaming,1455660164.0,Liddojunior,1.0,0.0,111,7293,0.0
heartstopper aura is like a big radar for the enemy team can see the nexro approach from faar away ,d02slhi,dota2,gaming,1455680330.0,lone_wanderer101,1.0,0.0,1445,1472,0.0
isnt there a ticking down ,d01ujht,dota2,gaming,1455629151.0,mervynngwaihong,77.0,0.0,1,1862,0.0
shallow grave is not a fucking global spell  stop diving for gabe sake  sincerely  your slave dazzle ,466bd4,dota2,gaming,1455679983.0,buffbear13,4.0,0.0,7,245,0.0
now we know what happened to the magnus in that clip from yesterday ,d02q45v,dota2,gaming,1455676333.0,Meedled,1.0,0.0,188,390,0.0
how does this seem good  when it s wrong to feed  how is it fair to other players   where is the justice in that ,d01pckt,dota2,gaming,1455610427.0,NADotaSucks,-10.0,0.0,1,-52,0.0
thats why you leave your fucking orbs organized in the next spell  so you can simply invoke it and its done  plus it saves you time on invoke cooldown,d01y6zl,dota2,gaming,1455636378.0,rangerbr,1.0,0.0,1,504,0.0
thanks to this i have seen that the aas on my team are always terrible  but they re mediocre on the enemy team ,d026h5f,dota2,gaming,1455648194.0,NevilleNeville,1.0,0.0,1,3193,0.0
universe is by far my favorite pro player does he ever stream ,d02sdj8,dota2,gaming,1455679953.0,Frigid319,1.0,0.0,17,723,0.0
and the chinese are still playing cdec,d02ta9o,dota2,gaming,1455681490.0,HHhunter,23.0,0.0,4438,18061,0.0
notice that rtz is left,d02u9th,dota2,gaming,1455683228.0,GatherLemon,6.0,0.0,181,7178,0.0
someone please photoshop spectre s head onto sputnik i will pay you with one pogchamp,d02vrfi,dota2,gaming,1455686030.0,Turbo2x,1.0,0.0,4746,57253,0.0
arteezy said that hes given up on 9k though because its boring and hes just been randoming now,d02w82d,dota2,gaming,1455686975.0,Gh0stWalrus,1.0,0.0,259,13015,0.0
it s a hobby for me i enjoy the difficulty of the game and the fact that it s rewarding when you re successful  i do need to start looking for other things to do though,d01uw6a,dota2,gaming,1455629996.0,TONKAHANAH,1.0,0.0,1,9202,0.0
right in the feels dont go back to it it was a stepping stone for you so never look back  press on bud  ,d01y5nv,dota2,gaming,1455636317.0,Limzos,2.0,0.0,27,28,0.0
damn dude you sounded just like what i am today yeah high mmr gives me satisfaction and it s like giving me a title that i m good at something the thing is there really are other people that would still be asshole even if you will cheer them up yeah sometimes when i get depressed i play the game but ending up throwing or losing and yeah i felt sorry for my teammates for that one i ve also flamed a player that is having his worst day and end up feeling sorry for him because he started responding to me after i gave my most asshole trashtalk  and yeah i feel like he s about to burst his feelings   but now i do everything to not hurt the feelings of other people because i do nt know what they ve been through  i really think that video games  specially multiplayers  are the last resort of other people to temporary relieve there depression and have fun with others  remember dendi    so being a asshole flamer would really ruin someone s day  thanks to this op i m enlightened,d01urnw,dota2,gaming,1455629698.0,wasloyalty,1.0,0.0,1,54,0.0
pressing tab alternates to the next chat channel its kind of a pain to keep clicking on each tab ,465vic,dota2,gaming,1455674001.0,strumpetz,3.0,0.0,83,5734,0.0
so i really enjoyed the threads where people commented on each other s dotabuff profiles but have nt seen one in forever post your dotabuff account and respond to others with an insult and a compliment  or two insults if they ve been spamming invoker lately ,46387i,dota2,gaming,1455640400.0,kingmelkor,59.0,0.0,1,1053,0.0
chat moving so fast  nobody will see this post http  wwwdotabuffcomplayers79209837,d027i0d,dota2,gaming,1455649569.0,MrTheodore,3.0,0.0,174,93899,0.0
here s mine to start  http  wwwdotabuffcomplayers77165961,d020u7k,dota2,gaming,1455640412.0,kingmelkor,2.0,0.0,1,1053,0.0
i ve been working on getting better in the offlane and as a hard 5 support    it has nt been working  http  wwwdotabuffcomplayers60246118,d025lnm,dota2,gaming,1455647013.0,MightyOwl,2.0,0.0,467,118,0.0
http  wwwdotabuffcomplayers151029412,d026daj,dota2,gaming,1455648051.0,byoza,2.0,0.0,239,2245,0.0
teache me sensei  http  wwwdotabuffcomplayers107588934   http  wwwdotabuffcomplayers107588934 ,d027imi,dota2,gaming,1455649594.0,newlifewating,2.0,0.0,11,78,0.0
why not http  wwwdotabuffcomplayers65028745,d028p0y,dota2,gaming,1455651185.0,Lordof9Bears,2.0,0.0,96,1216,0.0
http  wwwdotabuffcomplayers173833721,d029j2a,dota2,gaming,1455652295.0,Break_the_Sky,2.0,0.0,935,417,0.0
http  wwwdotabuffcomplayers151506356 hi ,d029wcv,dota2,gaming,1455652785.0,nlnj_a,2.0,0.0,1671,1021,0.0
http  wwwdotabuffcomplayers23193840,d02cirk,dota2,gaming,1455656242.0,NotADemon_AMA,2.0,0.0,2902,13917,1.0
overused anus,d02nuit,dota2,gaming,1455672861.0,hadezb,2.0,0.0,1,-4,0.0
thats what you get for trying to ks,d02cqzi,dota2,gaming,1455656552.0,slasherswayonlyway,-1.0,0.0,42,626,0.0
then rubick could steal it and it would make it really hard to get his ult ,d02fhoy,dota2,gaming,1455660207.0,bioz1,1.0,0.0,1,88,0.0
do you have difficulties playing your hero and want valve to make the game easier for you ,d01tfxc,dota2,gaming,1455626122.0,tomatozmbie,121.0,0.0,452,4891,0.0
i see spectre and invoker in all my games god forbid spectre has a zeus on his team  that s nearly an instant win due to the amazing synergy  i loathe spectre with all my heart fuck that ridiculous hero ,d02hpoe,dota2,gaming,1455663359.0,Toroto90,1.0,0.0,218,1367,0.0
i think this would buff necro a little bit  the hero is already a good hero with a high winrate  and this would make him a little too versatile maybe not that it would make him a ganking powerhouse  but that his job is to be hard to fight into and good for grouping up with  not to be super versatile and be able to gank as well just my two cents ,d02osze,dota2,gaming,1455674314.0,ohGrizzly,0.0,0.0,2,594,0.0
make sadist toggleable too because sometimes i m feeling merciful,d01undx,dota2,gaming,1455629412.0,SenatorBanana,118.0,0.0,5294,34747,0.0
no there has to be some downside to uncounterable lane harass from 1200 range because muh trench balance ,d02clnm,dota2,gaming,1455656349.0,Declination,3.0,0.0,1,375,0.0
source  artist s name pls  i need to know who the awesome artist is pls ,d02b4kw,dota2,gaming,1455654425.0,Xionarc,2.0,0.0,1,15,0.0
i actually feel like this might be a needlessly large buff if you could use hs to harass and not push during the laning phasethat would be insanely strong  the real tradeoff at the moment is that your lane is pushed up 247,d022xxw,dota2,gaming,1455643384.0,TiePoh,1.0,0.0,1,777,1.0
when the name of clinkz pops up on the screen ,d02nucj,dota2,gaming,1455672854.0,meeposki,1.0,0.0,278,1221,0.0
 do nt  buff  necro,d02b3hs,dota2,gaming,1455654384.0,A-M-A-T-E-R-A-S-U,4.0,0.0,8827,12244,1.0
fyi necro can gank aura is nt visible on heros until they have vision on necro confirmed in the comments on https  wwwredditcomrdota2comments45xnseas_a_level_15_player_this_is_my_greatest_play_ever,d01yjws,dota2,gaming,1455636961.0,Meflakcannon,1.0,0.0,515,5827,0.0
i could ve sworn that if you overkilled someone who had blademail on it would only do their remaining hp in damage to you guess i was wrong ,d02q9ee,dota2,gaming,1455676559.0,srcrackbaby,1.0,0.0,1,9745,0.0
sometimes i wonder if pudge s player model is intentionally far bigger than it actually appears to be  this might prove my theory   no it wo nt   ,d02g25q,dota2,gaming,1455661001.0,Blackajack20,10.0,0.0,161,304,0.0
please no  necrophos does not need another buff,d01tiua,dota2,gaming,1455626367.0,ilovezam,17.0,0.0,1535,11800,0.0
meanwhile china doesnt have any 8k s,d0224d2,dota2,gaming,1455642229.0,paoxayla,1.0,0.0,51,303,0.0
make the aura global  make it affect allies too problems solved ,d02tt73,dota2,gaming,1455682411.0,cavalone,1.0,0.0,1,-1,0.0
slightly related but i wish we could toggle luna s glaives as well as heartstopper aura,d021pz6,dota2,gaming,1455641660.0,errormacro_,1.0,0.0,211,2133,0.0
dont u want alt clicking something ,d02h3hw,dota2,gaming,1455662474.0,Goodjokemate,1.0,0.0,1,142,0.0
inb4 rubick steals heartstopper aura,d01xgn1,dota2,gaming,1455635140.0,Jolteneo,33.0,0.0,1,31,0.0
buy a blink  approach from unconventional directions  in short  git gud,d02dedx,dota2,gaming,1455657428.0,trutheality,1.0,0.0,1,5762,0.0
so now  do we have to expect a great delay responses from matt prior this drama too ,d02pyfd,dota2,gaming,1455676087.0,raidenfi,3.0,0.0,1,92,0.0
i m starting to play dota with the knowledge that i m bad i play it because i like to cool character design i m having fun  but i feel sorry that some people fall into pits of despair because of how competitive they are ,d01uol8,dota2,gaming,1455629493.0,LessThan301,2.0,0.0,158,14341,0.0
 some geography help   https  myrantsandramblesfileswordpresscom200806canada2jpg ,d02vjwb,dota2,gaming,1455685612.0,casonthemason,1.0,0.0,968,39064,0.0
rtz is canadian 4head,d02tuki,dota2,gaming,1455682479.0,cchafner,17.0,0.0,1,16,0.0
http  wwwdotabuffcomplayers89008119,d027kvv,dota2,gaming,1455649682.0,calebfaice,2.0,0.0,1,1081,0.0
i m actually curious as to what i ve been playing mostly recently  i know i ve been having a bit of a bad month  http  wwwdotabuffcomplayers104014026,d029kps,dota2,gaming,1455652356.0,-BrokeN-,2.0,0.0,28,2258,0.0
even though invoker just one shots me every game and just boils my blood  it s nice to see him in high skill games and the competitive scene  it s a fun hero to watch ,d023f5i,dota2,gaming,1455644037.0,Aishan,7.0,0.0,3027,2045,0.0
http  wwwdotabuffcomplayers91629128,d028lz5,dota2,gaming,1455651072.0,mrbossmayne,2.0,0.0,1,-1,0.0
i represent all the awful players out there  http  wwwdotabuffcomplayers179044172,d0261mm,dota2,gaming,1455647610.0,dotadotcom,2.0,0.0,1,0,0.0
lovely colors,d02lgks,dota2,gaming,1455669218.0,Slocknog,1.0,0.0,3301,37169,0.0
holy shit at least try to hook the clinkz,d02jh33,dota2,gaming,1455666048.0,GorgontheWonderCow,7.0,0.0,1426,3286,0.0
support life http  wwwdotabuffcomplayers69004381,d029jtd,dota2,gaming,1455652322.0,Yargadactyl,2.0,0.0,1,774,0.0
i am zombie apocalypse  http  wwwdotabuffcomplayers107041350,d027u0p,dota2,gaming,1455650025.0,klondikethedestroyer,2.0,0.0,1630,2774,0.0
http  wwwdotabuffcomplayers72833166 lets try this,d028dka,dota2,gaming,1455650759.0,Thepotatofiend,2.0,0.0,25,9,0.0
is that lina  so jakiro is lina s dragon slave ,d027cvj,dota2,gaming,1455649374.0,MaDNiaC,1.0,0.0,20,40198,0.0
here we go http  wwwdotabuffcomplayers130488491,d029bos,dota2,gaming,1455652023.0,mdmanow,2.0,0.0,1,489,0.0
why does the invis hero always reveal themselves  so much funnier when they stay invis forcing them to check replay  i love getting the invis rune with dark seer casually standing next to jungle heroes it s great ,d02q0pv,dota2,gaming,1455676183.0,Scenick,1.0,0.0,3383,3259,0.0
http  wwwdotabuffcomplayers133519250,d022kcs,dota2,gaming,1455642857.0,Sleonidas,2.0,0.0,54,1617,0.0
4,d02rorr,dota2,gaming,1455678826.0,Reszs,1.0,0.0,95,17,0.0
please giff jakiro set if we could do it to hide slardar s ugly model  we could rectify the same injustice done to our beloved twoheaded dragon ,d024bvs,dota2,gaming,1455645281.0,direwulfesbane,3.0,0.0,7,1033,0.0
it s quite messy due to the constant changing between unranked and ranked and the people i play withskill levels but here you go if someone wants to give some advice  http  wwwdotabuffcomplayers91485906,d0286f8,dota2,gaming,1455650492.0,Callu23,2.0,0.0,1,215,0.0
i want to see pudge pov  would nt that be a bug if pudge can not move but he clicks on the river and not on the radiant mid ,d02ojra,dota2,gaming,1455673920.0,jermteam,-1.0,0.0,21,197,0.0
you now me on effigy nice ,d01sxip,dota2,gaming,1455624491.0,LeRohameaux,-2.0,0.0,11810,11116,1.0
im guessing sea server ,d01qogb,dota2,gaming,1455615470.0,neo_nash,5.0,0.0,4931,1946,0.0
classic reddit with hate postsand you all wonder why pro players dislike reddit,d028e1u,dota2,gaming,1455650778.0,pacinci,2.0,0.0,1,635,0.0
when you re best is nt good enough,d02unfw,dota2,gaming,1455683915.0,Adesorvari,1.0,0.0,11,-1,0.0
misery  pro 4head,d021htn,dota2,gaming,1455641342.0,pgrujoski,-5.0,0.0,29,70,0.0
or you could mute dota in the soundmanager  you helpless fool,d02muz3,dota2,gaming,1455671372.0,Titsandassandclass,0.0,0.0,1,218,0.0
 aghanims scepter upgrade  lightning grapple  storm spirit channels for 1s  then travels up to 7008751050 distance to the target point all units within 200 radius of storm spirit at any point  are dragged to the target location all enemy units take 250 damage on arrival units are dragged at a speed of 1000  and are disabled  100 mana  35s cd  just a strange idea i had  it felt like a skill like this is something storm would have ,d02nbw3,dota2,gaming,1455672088.0,TheCruncher,1.0,0.0,409,5177,0.0
since the creation of the rick amp  morty announcer and the partnership between valve amp  adult swim  i always though it would be a great thing if we had a metalocalypsedethklok music pack in dota 2  because metalocalypse is one of the most popular animated series of adult swim  dethklok have recorded 3 albums and they even did a tour if it s eventually in the making and sold in the dota 2 store  we can buy it and show our support for a final season of metalocalypse and push adult swim amp  hubu to produce it  i call upon u_brendonsmall to suggest this idea and to show our support for the fifth and final season of metalocalypse tl  dr  add a metalocalypsedethklok music pack  summon u_brendonsmall to suggest this idea,4660oi,dota2,gaming,1455675946.0,raidebaron,5.0,0.0,2,205,0.0
the dirge goes on and on and on and onnn  strangers  waiting all along the boulevard their shadows searching in the niiiiight,d00wp3h,dota2,gaming,1455561535.0,sylfire,4.0,0.0,456,4192,0.0
