text,id,subreddit,meta,time,author,ups,downs,authorlinkkarma,authorkarma,authorisgold
in an effort to make it easier for the til community to verify submissions  we re kindly asking that contributors make a top level comment after submitting a til   quoting the relevant text from their source    which should be concisely paraphrased in the submission title   this is not currently a requirement  but we d appreciate it if everyone would try their best to do it if the til you are posting is linking to a wikipedia page  please directly link to the section of the wikipedia page that is relevant to your til submission  in most cases this will be 2  3 sentences  but up to 4  5 should be fine if more context is required if it s not possible to copypaste the text  then a screenshot of the relevant part  preferably highlighted  or indicating where in the link provided is the relevant piece of information located is also acceptable if the source includes audio or video  then please link to the pertinent time stamp and transcribe it  note that if a source is  just  a table  graph or other raw datastatistics then you wo nt be able to quote it  by design   find another source  and see below for an explanation    we d also like to clarify our first rule about submissions needing to be verifiable with a reliable source that   completely   supports the claims in the post title this means that you   can not interpret data and draw your own conclusions    everything must be clearly and  explicitly  stated in your source  in words  we encounter a lot of issues when people try to submit technical papers  statistical data or other studies that  may  support a claim  but one that the authors do nt explicitly make  and hence subject to extra scrutiny   you have to make it clear when a source just provides evidence supportingrefuting a hypothesis  but does nt go as far as explicitly stating it as an accepted fact  this means that   merely quoting statistics and implicitly generalizing the results of a study is often not acceptable    you also need to be diligent about not misleading people with overly simplified  outdated or refuted claims   as an example  you may come across a paper describing a study where coffee consumption was found to be associated with reduced incidents of cancer a misleading and unacceptable conclusion would be  1  gt  til coffee can cure 58  of cancer patients on the other hand  this would possibly be acceptable as the details make it clear that the result is not definitive  gt  til a 2004 study found that coffee consumption was negatively correlated with incidents of bowel cancer in senior citizens you still have to do your research  because if this was later disproven or brought into question then it may subsequently removed as misleading by omission a variation that may better address this is  gt  til a 2004 study found that coffee consumption was negatively correlated with incidents of bowel cancer in senior citizens   however subsequent research was unable to replicate the results  of course at this point your til is less of an attention grabber and not particularly noteworthy  but hopefully this highlights some of the issues we face with verifying sensational claims   1 unless the authors made the same unconditional claim  which is highly unlikely    while we do our best to verify submissions and remain objective  please note that   extraordinary or controversial claims will likely be subject to more scrutiny   and it is up to contributors to make them as airtight as possible  and us to be pedantic     tl  dr    be extremely careful with primary sources  and do nt interpret datastatistics yourself  find a   reliable   source that does that for you and paraphrase   as always  we encourage everyone to report rule violations and send us a message about inaccurate tils if you feel something was unfairly removed then please first check the comments and then feel free to ask us  we try our best to tag all removals  but this system is somewhat limited  ,2kx75y,todayilearned,learning,1414789182.0,TILMods,2109.0,0.0,1,0,0.0
this thread has been linked to from another place on reddit    rundelete    meta  rtodayilearned makes effort to be more transparent and consistent   http  npredditcomrundeletecomments31487wmeta_rtodayilearned_makes_effort_to_be_more      footer    if  you  follow  any  of  the  above  links   respect  the  rules  of  reddit  and  do nt  vote     info   rtotesmessengerwiki      contact   messagecompose  to   r  totesmessenger        bot ,cpy9g47,todayilearned,learning,1427925692.0,TotesMessenger,1.0,0.0,1,301427,0.0
sorry i m new but  do the posts get moderated before posting  if so  how would i make a  top level comment  if i ca nt even see the post yet ,cmeu969,todayilearned,learning,1417130410.0,sleepyface37,1.0,0.0,940,8504,0.0
 a wet person does not fear the rain  makes sense in fact  it reminds me of a story from the hagakure  gt  there is something to be learned from a rainstorm when meeting with a sudden shower  you try not to get wet and run quickly along the road but doing such things as passing under the eaves of houses  you still get wet when you are resolved from the beginning  you will not be perplexed  though you still get the same soaking this understanding extends to everything ,d02p5hf,todayilearned,learning,1455674836.0,slowmoon,5.0,0.0,1567,34269,1.0
but he won our hearts  which is more than can be said about most artists  except for his nazi phase   ,d02qoft,todayilearned,learning,1455677205.0,CrapfestLicker,2.0,0.0,820,48068,1.0
a dry person does not fear the sand ,d02poi2,todayilearned,learning,1455675654.0,LuckyLuke364,1.0,0.0,111,370,1.0
i like finding knowledge and meaning in things little to no meaning,d02sy8q,todayilearned,learning,1455680917.0,Icyrhodes,1.0,0.0,1,7,0.0
til is basically becoming a summary of the front page of rall ,d02obg0,todayilearned,learning,1455673569.0,Atlanticall,1.0,0.0,1,36897,1.0
never be human trials in what countries  looks like a new medical tourism opportunity ,d02spg9,todayilearned,learning,1455680516.0,ENG-eins,3.0,0.0,5303,2398,0.0
i just find it amazing that our tribal instincts are so strong that people are actually picking sides in a dispute between two mountains  i m just as bad  if they put the world buckaroo championships on tv i d have a favourite player within 10 minutes of watching and an inexplicable contempt for his opponents ,d0184ah,todayilearned,learning,1455578252.0,Easytype,96.0,0.0,3132,70166,1.0
piling rocks on top of hills has happened before   the englishman who went up a hill but came down a mountain   http  wwwimdbcomtitlett0112966 ,d01awdt,todayilearned,learning,1455582718.0,A40,26.0,0.0,39,402927,1.0
same is true of mt princeton  14204 ft  and adjacent mt yale  14200 ft   alumni groups of each university have been known to tote extra rocks up to the summits of their namesake peaks to sustainreverse the current rankings ,d01g02n,todayilearned,learning,1455590774.0,TalkingButthole,22.0,0.0,1,855,0.0
til supporting mountains is a thing ,d01j7hh,todayilearned,learning,1455595917.0,not_the1,21.0,0.0,1,589,0.0
got lost with my former boss on mount massive one time following cairns in the rock field ended up in a place where it was either turn back or go up the steep scree wall went up the scree then continued up to the summit screw mt massive  elbertsnotsobad,d01lrpi,todayilearned,learning,1455600778.0,RawPacket,10.0,0.0,203,3751,1.0
this was following the great depression  no one cares now  gt  a matter of some contention after the great depression arose over the heights of massive and its neighbor  mount elbert  which have a height difference of only 12 feet  37 m   this led to an ongoing dispute which came to a head with the mount massive supporters taking it upon themselves to build large piles of stones on the summit to boost its height  only to have the mount elbert proponents demolish them ,d018sz0,todayilearned,learning,1455579346.0,Jux_,38.0,0.0,225124,1453754,1.0
feel bad for elbert it comes in second in the lower 48 at 14433 feet to whitney which is 14494 ,d01apee,todayilearned,learning,1455582405.0,mrshatnertoyou,7.0,0.0,1483,364375,1.0
mt elbert also has a really lovely bamp  b and cabin place at the bottom of the independance pass it s a really nice place for a summer mountain trip ,d019f6s,todayilearned,learning,1455580328.0,_tx,8.0,0.0,4909,171793,1.0
cue the benny hill music ,d01aavn,todayilearned,learning,1455581751.0,SmugSceptic,2.0,0.0,20091,42937,1.0
certainly no dumber than supporting a sports team ,d01ksng,todayilearned,learning,1455598795.0,TheCreatorLovesYou,3.0,0.0,171073,10795,1.0
massive is a more impressive looking mountain  it has 4 summits above 14000   and looms over the town of leadville elbert is the next major peak to the south of it but does nt look all that special from its most accessible east side the competition was probably driven by a desire for the state s highest point to fit a preconceived notion of a high mountain ,d01nufy,todayilearned,learning,1455605783.0,benderson,2.0,0.0,163,3012,0.0
what  they ca nt even make their own pile  that s like the kids coming after school to smash your snow fort ,d024ja6,todayilearned,learning,1455645559.0,ShouldBe_Working,1.0,0.0,503,33356,0.0
massive lt  elbert,d01dmtr,todayilearned,learning,1455587059.0,ImperialRedditer,1.0,0.0,23,2892,0.0
 firstworldproblems  thestruggleisreal,d01ojsi,todayilearned,learning,1455607831.0,PM_ME_ONE_BTC,0.0,0.0,1,6373,0.0
mountain supporters  people with sane minds are seriously competing which mountain is better ,d01wrbt,todayilearned,learning,1455633877.0,beveik,0.0,0.0,1,326,0.0
jesus christ humans are just full of enmity ,d017sag,todayilearned,learning,1455577726.0,ZapPowerz,-15.0,0.0,24937,134465,0.0
that s because those ceremonies are shit shows also  ucablebent1988 i did nt just jump on the bandwagon i ve been listening to david bowie my whole life and yes he is one of my favorite musicians out there  born 1973 ,d02etxe,todayilearned,learning,1455659318.0,thinksalot,2.0,0.0,375,4864,0.0
nan madol gets far too little attention ,d02qhkk,todayilearned,learning,1455676910.0,spammeaccount,4.0,0.0,2982,55286,0.0
reminds me a little of the old daedric ruins in morrowind ,d02r8vg,todayilearned,learning,1455678104.0,2pete,2.0,0.0,3337,41464,1.0
 nan madol   http  nanmadolcom  is one of the ancient sites that should be well known worldwide  i had the chance of visiting it and it is on par with more well known sites across the globe  its remoteness might be the reason it gets so little appreciation ,d02s68f,todayilearned,learning,1455679620.0,donna_darko,2.0,0.0,2171,2166,0.0
jeopardy  http  wwwdailymotioncomvideoxl30xt_jeopardyapril11997christianloripaul_shortfilms,d02lks6,todayilearned,learning,1455669389.0,pebrain21,2.0,0.0,922,2124,0.0
and can be used as an adhesive along with mutfruit and tatos ,d02rujg,todayilearned,learning,1455679086.0,slyfoxninja,1.0,0.0,346,12521,0.0
does nt mean he was nt a really good artist ,d02gary,todayilearned,learning,1455661338.0,apbadogs,3.0,0.0,280,74569,1.0
females also get  morning wood  with the clitoris during rem  though i m not sure how much it would help with bladder control  https  enwikipediaorgwikinocturnal_clitoral_tumescence,d02tqhf,todayilearned,learning,1455682279.0,am_medstudent,1.0,0.0,1,78,0.0
yesssss canada is now cultural ,d02lzyz,todayilearned,learning,1455670021.0,ncc84,1.0,0.0,1,41,0.0
what impresses me about lady gaga is her deft ability to craft songs that are immediately forgettable now  that takes some kind of talent ,d02gnb8,todayilearned,learning,1455661825.0,LadyCaCaWhore,1.0,0.0,1,-12,0.0
i totally believe this,d02o5bv,todayilearned,learning,1455673315.0,zippythechimp88,1.0,0.0,9,253,0.0
https  youtube1j0xdgisug,d02ogj3,todayilearned,learning,1455673785.0,toan55,1.0,0.0,47,42910,1.0
my grandma worked for ge in the late 30 s and told me once they made a light bulb that would never burn out  but they shelved it because their sales would plummet,d02q26n,todayilearned,learning,1455676248.0,mattreyu,1.0,0.0,2686,222967,1.0
what s stopping a different set of manufactures from producing these lights  and selling them here  even if they too do nt wish to sell a foreverbulb  they could make one double the osram  phillips  ge one  and sweep the market  there s definitely a market for it ,d02qzeu,todayilearned,learning,1455677684.0,CurrisCore,1.0,0.0,1,1580,0.0
useful for anyone new  hi  world   thanks  ,cqe3az2,todayilearned,learning,1429165236.0,itsshweta,-4.0,0.0,1,4,0.0
i am glad to see something like this this is one of the few larger subs that actively try to keep their posts on topic and of a higher quality it also encourages users to take part in the process of cleaning it up if more of the larger subs did this  i would nt have to sift through crap posts that made the top because they are getting emotion based upvotes ,clt4ipv,todayilearned,learning,1415143182.0,scott60561,1.0,0.0,12659,139730,0.0
til corn needs to get it s shit together ,d028e0b,todayilearned,learning,1455650776.0,DerekSavoc,10.0,0.0,172,31816,0.0
overachiever ,d02awqn,todayilearned,learning,1455654141.0,ekidwell,3.0,0.0,38834,27227,0.0
the perfect that comes out of your body looking exactly like it went in ,d0278id,todayilearned,learning,1455649208.0,diegojones4,2.0,0.0,1575,913000,1.0
it is also a rock band  d,d02bvln,todayilearned,learning,1455655390.0,RockeSolid,2.0,0.0,13438,2400,1.0
hah  beat that tomatoes  d,d02ln1w,todayilearned,learning,1455669482.0,bexhemmingson,2.0,0.0,1,6,0.0
and can be used as an adhesive along with mutfruit and tatos ,d02rujg,todayilearned,learning,1455679086.0,slyfoxninja,1.0,0.0,346,12521,0.0
it s literally a gigantic grass,d02va0c,todayilearned,learning,1455685086.0,zehydra,1.0,0.0,1,8561,0.0
i ve always said that  fruit  is a botanical term and  vegetable  is a culinary one  calling corn a  grain  is disingenuous just because its kernels can be called  grains  does not make it part of the  wheat family   edit  okay i m okay with the  corn is grain  thing i still think it s a case of  technical correctness  like calling cucumbers fruits ,d026pwr,todayilearned,learning,1455648522.0,ness839,1.0,0.0,1331,46844,0.0
corn is poison and soy sugar wheat all poison ,d028yl1,todayilearned,learning,1455651537.0,sojourntheanomoly,-1.0,0.0,14,3533,0.0
and a type of joke ,d027pg2,todayilearned,learning,1455649855.0,binger5,0.0,0.0,1,70409,0.0
til my mom loves a fictional dildo ,d023cys,todayilearned,learning,1455643956.0,Momadance1,5.0,0.0,3,475,0.0
steely dan s and blue movies what a great night,d025aj5,todayilearned,learning,1455646591.0,bolanrox,1.0,0.0,26003,64743,0.0
now put one on dan rather,d02nh0d,todayilearned,learning,1455672299.0,Steely_Dan_Rather,1.0,0.0,169,4767,0.0
apparently when you grew up you did nt have the rock and roll book of lists in your bathroom ,d02qek5,todayilearned,learning,1455676782.0,kmcg103,1.0,0.0,161,28817,0.0
just another reason to love steely dan ,d02ulu5,todayilearned,learning,1455683829.0,ScrotalFrostbite,1.0,0.0,1,141,0.0
this is the conventional theory but is not entirely true jupiter is still believed to be a protector in terms of long period  comets   but not asteroids in general the idea in your title largely stems from theorizations and computer simulations done in 1994 and earlier it was a ground breaking study but was done on inferior computing power with large approximations  for near orbit asteroids such as ones in the asteroid belt  more recent studies show that jupiter s gravity causes asteroid collisions  disrupting their orbit and sending more asteroids insystem towards earth  so  while it probably was helpful after the heavy bombardment period and the formation of our planet  the gas giants are believed to have caused the late heavy bombardment   and helps stave off longperiod comets  it is fond of throwing bits from the asteroid belt at us  wikipedia does nt even give a citation for the last part of the title   here is a source   http  wwwspacecom14919jupitercometimpactsearthhtml ,d02njpk,todayilearned,learning,1455672411.0,Donald_Keyman,134.0,0.0,292180,1800966,1.0
i take back everything bad i ever said about jupiter ,d02ft6e,todayilearned,learning,1455660654.0,proper1420,28.0,0.0,3,42485,0.0
jupiter da real mvp,d02gkqp,todayilearned,learning,1455661724.0,persistent_derp,14.0,0.0,5257,9516,0.0
good guy jupiter meme please  mahman  ,d02f14w,todayilearned,learning,1455659576.0,IllBrujo,9.0,0.0,1,2916,0.0
that s true to an extent  but jupiter has been known throw rocks our way and some have hit us as well ,d02rht7,todayilearned,learning,1455678507.0,slyfoxninja,2.0,0.0,346,12521,0.0
good guy jupiter,d02tn8a,todayilearned,learning,1455682123.0,jdmflcl,1.0,0.0,118,1182,0.0
i ve heard it destablizises orbits of objects and makes us more susceptible to a strike ,d02hi80,todayilearned,learning,1455663059.0,sheepsleepdeep,3.0,0.0,116829,96135,1.0
i was smoking some fine herbs with my friend at a view point and told him about how jupiter kind of protects earth we were walking back on a narrow path  i was leading  and then a fly flew right into my eye he says  thanks jupe  ,d02snvr,todayilearned,learning,1455680442.0,Ho_Phat,1.0,0.0,320,1034,0.0
i was just reading an article by an astronomer about this very same thing yesterday  http  wwwslatecomblogsbad_astronomy20160215jupiter_may_be_responsible_for_life_on_earthhtml it both helps and hurts  but it could also be responsible for the conditions that allowed for life to develop on earth ,d02ss97,todayilearned,learning,1455680645.0,VonKrieger,1.0,0.0,7,6542,1.0
thank you jupiter ,d02swm3,todayilearned,learning,1455680843.0,EasyLightfoot,1.0,0.0,2,636,0.0
is this attributable to jupiter s extensive stormcloud cover ,d02tbz1,todayilearned,learning,1455681570.0,Empyrealist,1.0,0.0,13473,36529,0.0
how can asteroids impact  gas giants  is the gravity within strong enough to keep them ,d02u374,todayilearned,learning,1455682902.0,UseUrMind,1.0,0.0,917,341,0.0
does jupiters mass get bigger causing more collisions ,d02uf6p,todayilearned,learning,1455683495.0,TheHighJedi,1.0,0.0,8,978,0.0
shitty science question but would nt this mean that jupiter grows by 20008000 times quicker from it absorbing the mass and increasing gravity from these rogue space stones ,d02ujb6,todayilearned,learning,1455683700.0,dgd765,1.0,0.0,598,15637,0.0
jupiter is my homeboy,d02ul76,todayilearned,learning,1455683795.0,senormessieur,1.0,0.0,2593,5774,0.0
it would be interesting to wake up in the middle of the night and go outside  and find jupiter is filling the whole sky the cosmic vacuum cleaner has come for us  i wonder what it would be like at that point to ride it into the gas giant  rwritingprompts  you want to do this one  and you know that when people wake up and see what s going on  they re still going to raid the stores for milk and bread ,d02v17f,todayilearned,learning,1455684626.0,hodyoaten,1.0,0.0,14679,188973,1.0
checkmate  atheists,d02vbxg,todayilearned,learning,1455685187.0,golgonooza,1.0,0.0,15,523,0.0
that is interesting and a huge relief to know do you have an address i can mail a thank you card to jupiter for protecting us inner planets ,d02vcyn,todayilearned,learning,1455685241.0,Vilirus,1.0,0.0,1,952,0.0
does that mean the grs is the power indicator ,d02i1fw,todayilearned,learning,1455663849.0,OutcastSTYLE,1.0,0.0,1,1897,0.0
dinosaur  uh  you missed one ,d02r2qk,todayilearned,learning,1455677831.0,Bon_Qui_Qui,1.0,0.0,1,201,0.0
 stop hitting yourselfstop hitting yourself ,d02olvw,todayilearned,learning,1455674012.0,Owlingday,1.0,0.0,1618,1124,0.0
i saw a special once that said jupiter was just a bit too small to become a star if its absorbing all this mass  could its gravity increase to the point it ignites and becomes a star ,d02rqkg,todayilearned,learning,1455678908.0,crystalblue99,1.0,0.0,236,5883,0.0
our solar system s condom   wherein cometsasteroids are sperm and earth is an ovum  ,d02irmc,todayilearned,learning,1455664960.0,dsimpson1975,0.0,0.0,1520,351,0.0
thanks  jupiter ,d02p6yn,todayilearned,learning,1455674898.0,CauseISaidSoThatsWhy,0.0,0.0,1,2717,0.0
classic jupes ,d02qm6b,todayilearned,learning,1455677108.0,Fragmaster,0.0,0.0,532,9024,0.0
so when you call it a vacuum cleaner  do you mean it vacuums up material  in the vacuum  vacuumcaption ,d02iuo1,todayilearned,learning,1455665091.0,Toshiro46,-2.0,0.0,5,5774,1.0
but jupiter is made of gas comets will just go right through it,d02s17u,todayilearned,learning,1455679391.0,ArcusImpetus,-2.0,0.0,1,6070,0.0
thank you jocelyne bloch  i have multiple sclerosis  ms  with 913 lesions  i  m extremely happy to about this for the first time  i think that count will go down  with  ms  there has been great advancement in slowing new lesions growth  but this is the first time i heard of work being done in repairing lesions  p s a great aspect is that they can inject into an area with lesions  and the cells will only grow where there is a lesion and fade away where there is no lesion you could not design a better system ,d02tdoc,todayilearned,learning,1455681656.0,Amit514,2.0,0.0,1,7,0.0
yeah russians be tough as fuck,d027ag4,todayilearned,learning,1455649282.0,shaqup,2.0,0.0,3055,1185,0.0
mount everest rules ,d01hpj8,todayilearned,learning,1455593473.0,himalayan19,2.0,0.0,1,153,0.0
i guess i ca nt blame him for swearing when he fell out of a canoe i hate seeing young men dropping fbombs in front of little old ladies in the grocery store for no reason ,d02m19e,todayilearned,learning,1455670075.0,ewgoforth,13.0,0.0,1,864,0.0
i assume that the court case was full of profantity as a show of defiance ,d02mkuf,todayilearned,learning,1455670930.0,pm_me_your_sundress,3.0,0.0,20,12622,0.0
i remember the  cussing canoeist  from my childhood  but they must have covered his first conviction much more heavily here in michigan than they did his winning appeal so i ve been extra fucking careful around kids all these shitty years for no goddamn fucking reason ,d02re40,todayilearned,learning,1455678340.0,cute_things_are_cute,3.0,0.0,1,28,0.0
the prosecutor  richard vollbach  is now arenac county probate  81st district court judge  presiding family court judge and chief judge pro tempore ,d02st5y,todayilearned,learning,1455680687.0,sadpanda34,2.0,0.0,3,1897,0.0
you like that you fucking retard ,d02prn3,todayilearned,learning,1455675789.0,Hairy_Cheeks,2.0,0.0,477,25168,0.0
the look on the officers face when some overprotective mom says   i d like to press charges ,d02tc3y,todayilearned,learning,1455681577.0,kobekramer1,1.0,0.0,304,4587,0.0
tim boomer i met him in chicago on a work assignment good guy  his desk area was plastered with articles about the incident ,d02upjb,todayilearned,learning,1455684029.0,Pindogger,1.0,0.0,8,1078,0.0
sad reality of this is that even though this got overturned  it probably cost the guy a shitload of money  this is nt the only dumb law on michigan books just recently there was a sodomy  law upheld which effectively makes oral and anal sex punishable by up to 15 years in prison life in prison for repeat offenders  source  http  wwwlegislaturemigov  s  0ons5cex3yiq5e1ewrxrxwxp   milegaspx  page  getobjectamp  objectname  mcl750158,d02uzye,todayilearned,learning,1455684562.0,Caleo,1.0,0.0,1447,34239,0.0
but still  you should nt swear around children and some women  your grandmother for instance ,d02lhk3,todayilearned,learning,1455669257.0,unmodster,1.0,0.0,684,20735,0.0
go mountains ,d01sj20,todayilearned,learning,1455623052.0,NoPlayTime,1.0,0.0,2404,13936,0.0
i hope this cuts down on bs neoconservative think tank links that clearly have an agenda and misuse data to mislead readers ,cmpwaqt,todayilearned,learning,1418147418.0,yetiman223,-6.0,0.0,4221,43168,0.0
awesome  man  i really have to pee    brain    hey  how bout i make your dick stand straight up  ,d01kl3x,todayilearned,learning,1455598381.0,Archchancellor,35.0,0.0,20445,89025,0.0
morning wood is actually a kind of exercise  all men without physiological erectile dysfunction experience it   https  enwikipediaorgwikinocturnal_penile_tumescence   it s healthy for your penis lack of sleep can lead to ed ,d01jrpe,todayilearned,learning,1455596877.0,Donald_Keyman,46.0,0.0,292180,1800966,1.0
http  iimgurcomueyeyktjpg,d01jugo,todayilearned,learning,1455597011.0,Donald_Keyman,42.0,0.0,292180,1800966,1.0
i just have to chime in on how awesome that thumbnail is great picture choice in the article science does have humour ,d01sv3b,todayilearned,learning,1455624253.0,fraxinuscavum,12.0,0.0,127,1655,0.0
but it still wo nt explain why i feel a massive need to masturbatehump stuff in the morning ,d01mygh,todayilearned,learning,1455603487.0,zahrul3,12.0,0.0,235044,126795,0.0
http  achewoodcomindexphp  date  08012008,d01uqfx,todayilearned,learning,1455629614.0,THE_SEX_YELLER,6.0,0.0,3366,3133,0.0
science  can we get on the random boners without any stimulation now  those are the true penile menace ,d01krdp,todayilearned,learning,1455598724.0,Ask_me_about_WoTMUD,4.0,0.0,1,938,0.0
is this the same reason why extreme sleep deprivation will do the same thing to you ,d01l1rl,todayilearned,learning,1455599298.0,rydan,3.0,0.0,6344,112592,1.0
i m in my 60 s i wish i could still get the morning wood ,d02e8ho,todayilearned,learning,1455658543.0,gaseouspartdeux,3.0,0.0,3150,22264,0.0
cmonnn you mean to tell me you never realized that a pisswood existed ,d01zzm3,todayilearned,learning,1455639171.0,TheyCallMeNameless,2.0,0.0,1,-1,0.0
pahaha that thumbnail is perfect,d022wo4,todayilearned,learning,1455643335.0,Dynoglory,2.0,0.0,386,4315,0.0
that is actually nice to know,d02fqtq,todayilearned,learning,1455660563.0,AuroraNight88,2.0,0.0,1,12,0.0
i call mine a  piss stiffy ,d01qvdx,todayilearned,learning,1455616253.0,GasolineKisses,1.0,0.0,1696,495,0.0
