text,id,subreddit,meta,time,author,ups,downs,authorlinkkarma,authorkarma,authorisgold
the prosecutor  richard vollbach  is now arenac county probate  81st district court judge  presiding family court judge and chief judge pro tempore ,d02st5y,todayilearned,learning,1455680687.0,sadpanda34,2.0,0.0,3,1897,0.0
but still  you should nt swear around children and some women  your grandmother for instance ,d02lhk3,todayilearned,learning,1455669257.0,unmodster,1.0,0.0,684,20735,0.0
i guess i ca nt blame him for swearing when he fell out of a canoe i hate seeing young men dropping fbombs in front of little old ladies in the grocery store for no reason ,d02m19e,todayilearned,learning,1455670075.0,ewgoforth,13.0,0.0,1,864,0.0
i assume that the court case was full of profantity as a show of defiance ,d02mkuf,todayilearned,learning,1455670930.0,pm_me_your_sundress,3.0,0.0,20,12622,0.0
sad reality of this is that even though this got overturned  it probably cost the guy a shitload of money  this is nt the only dumb law on michigan books just recently there was a sodomy  law upheld which effectively makes oral and anal sex punishable by up to 15 years in prison life in prison for repeat offenders  source  http  wwwlegislaturemigov  s  0ons5cex3yiq5e1ewrxrxwxp   milegaspx  page  getobjectamp  objectname  mcl750158,d02uzye,todayilearned,learning,1455684562.0,Caleo,1.0,0.0,1447,34239,0.0
 all of the modification work is performed at the maintenance depot at hill afb near ogden  utah other than those modifications  the aircraft are taken from the standard usaf inventory as production fighters  and can be returned to an operational squadron in short order without any major modification ,d02rdq4,todayilearned,learning,1455678322.0,blakelewis07,1.0,0.0,25492,5450,0.0
itt  people who completely missed the subplot of billy ray s young looking pedophile buddy infiltrating middleschool to start a child pornography ring sorry  spoilers if you have nt watched all of the last season ,d02ov1u,todayilearned,learning,1455674399.0,Alpha-Pig,-2.0,0.0,2039,20399,0.0
those mother fuckers were hard interestingly  the only democracy to fight on the axis side  simply because the russians forced them to defend themselves ,d025zul,todayilearned,learning,1455647543.0,the_logic_engine,103.0,0.0,566,10017,0.0
ufifth_down  you may also be interested in reading about  simo h  yh    https  enwikipediaorgwikisimo_h  c3  a4yh  c3  a4   a finnish sniper during the winter war with the highest ever recorded sniper kill count  505  figure chris kyle had  160   the soviets nicknamed him  white death  due to his lethality and conducted operations for the sole purpose of eliminating him despite being shot in the face  he lived to a ripe old age of 96 ,d024t13,todayilearned,learning,1455645929.0,curzyk,35.0,0.0,1,5944,0.0
i find it pleasantly coincidental that finns and hungarians share a common language groupand a natural inclination to oppose the russians ,d02pdj8,todayilearned,learning,1455675182.0,Infinitopolis,1.0,0.0,15,35010,0.0
overachiever ,d02awqn,todayilearned,learning,1455654141.0,ekidwell,3.0,0.0,38834,27227,0.0
i ve always said that  fruit  is a botanical term and  vegetable  is a culinary one  calling corn a  grain  is disingenuous just because its kernels can be called  grains  does not make it part of the  wheat family   edit  okay i m okay with the  corn is grain  thing i still think it s a case of  technical correctness  like calling cucumbers fruits ,d026pwr,todayilearned,learning,1455648522.0,ness839,1.0,0.0,1331,46844,0.0
corn is poison and soy sugar wheat all poison ,d028yl1,todayilearned,learning,1455651537.0,sojourntheanomoly,-1.0,0.0,14,3533,0.0
duh ,d02eb7g,todayilearned,learning,1455658641.0,beebleeble,1.0,0.0,1,73,0.0
maybe that s why the cold war ended ,d0174y4,todayilearned,learning,1455576728.0,black_flag_4ever,516.0,0.0,151066,479508,1.0
insert  independence day  quote here ,d018icq,todayilearned,learning,1455578876.0,dont_know_what_i_am,13.0,0.0,57,2520,0.0
in truth  this was a device he used to find some kind of common ground between the two countries he was nt seriously considering an alien invasion he and gorbachev could nt agree on any scenario in which the us and ussr would change the adversarial nature of their relationship  so he came up with a scenario as a means of getting both men to think differently ,d01pw2y,todayilearned,learning,1455612381.0,ynotzo1dberg,8.0,0.0,18,663,0.0
one of the first things clinton done when he became president was to check and see if aliens were real and covered up he obviously did nt find anything but there is even some stuff the president ca nt get access to because he does nt know where to look or the records have not been  updated  yet private contractors sometimes known more than potus do know this  if you have the technology to travel across the universe in a timely manner  than you have more than enough technology to cloak us from you you sugar water loven advanced hairless apes remember we are among you always ,d01a6jr,todayilearned,learning,1455581558.0,SmugSceptic,10.0,0.0,20091,42937,1.0
that was awfully nice of them pausing their threats to blow up the world when aliens are coming to enslave us all ,d02dxvz,todayilearned,learning,1455658146.0,jaxative,2.0,0.0,1,17015,0.0
it s just the galactic pizza delivery alien ,d01rpml,todayilearned,learning,1455619773.0,7LeagueBoots,1.0,0.0,463,24898,0.0
i m a bot   bleep    bloop   someone has linked to this thread from another place on reddit    rknowyourshit   til that reagan and gorbachev agreed to pause the cold war in case of an alien invasion  todayilearned   https  npredditcomrknowyourshitcomments46269ztil_that_reagan_and_gorbachev_agreed_to_pause_the      footer     if you follow any of the above links  please respect the rules of reddit and do nt vote in the other threads      info   rtotesmessenger      contact   messagecompose  to  rtotesmessenger        bot ,d01t1fx,todayilearned,learning,1455624860.0,TotesMessenger,1.0,0.0,1,301427,0.0
the look on the officers face when some overprotective mom says   i d like to press charges ,d02tc3y,todayilearned,learning,1455681577.0,kobekramer1,1.0,0.0,304,4587,0.0
yeah  tons of people in this state that are outside of the larger cities get very backwards in their voting alabama has some fun stuff going on with our politics one thing that is fun is that we operate under the home rule doctrine  which means anything that a county wants to do is required to go on a state wide ballot mobile wants to add some tax having to do with hurricane disaster stuff  everyone in the state votes on this  from mobile all the way up to birmingham also we do nt rewrite anything if i recall correctly we have the largestlongest state constitution in the country alabama  rather than removing anything basically keeps all of our laws as a running total and in the bottom of every bill or amendment that passes is  anything that previously conflicts with this is now considered repealed and invalid   so we just keep tacking stuff on the end and never really remove anything at all  so we still have a lot of fun stuff on the books from years back ,d01rksf,todayilearned,learning,1455619217.0,kingfisher6,2.0,0.0,95,5988,0.0
the fact that the state waited til then does nt really matter as the federal gov ruled that type of discrimination illegal with loving v va in the late 60s ,d01rjrj,todayilearned,learning,1455619101.0,Alldaylikemoneymay,1.0,0.0,1,523,0.0
i wonder how common it is to repealoverturn laws that the supreme court has already declared unconstitutional  as the interracial marriage ban was 3 decades before this law was overturned in alabama   i understand the symbolic value of repealing such a law  and the troublesome matter that 40  voted against it   but in for all practical purposes  the law being on the books has no tangible impact ,d027uqf,todayilearned,learning,1455650052.0,Nerdn1,1.0,0.0,77,27534,0.0
i never knew those guys were racists  never really liked their music anyway ,d01pa4u,todayilearned,learning,1455610198.0,bobboboran,1.0,0.0,1,2353,0.0
this should nt be surprising  seriously the  my bfgffeonsee s parents do nt approve of me because of my ethnicity  trope is a thing for a reason bigotry does nt have to be a blatent and obvious as the klan ,d01rkgr,todayilearned,learning,1455619181.0,Toddsci,1.0,0.0,1,11700,0.0
 officially but ebony has been mixing with ivory in alabama for decades someone probably just happened to notice that the law had never been officially rescinded and then did so publicly for pc brownie points because everyone knows the only way to teach society to forget about race and move forward is to constantly call attention to it in a public manner every chance you get s,d01x9l1,todayilearned,learning,1455634792.0,TruckNutz69,1.0,0.0,17,7310,0.0
eli5  i always hear on reddit about the gloriousness of the tough finns  but my wikipedia perusings indicate that they lost the winter war and were forced to give up a small amount of valuable land worth 13 of their economy what am i missing ,d0279cj,todayilearned,learning,1455649239.0,AnthonyGonzalez27780,31.0,0.0,348,15696,0.0
this type of improvised incendiary weapon was such an important tool for the finnish resistance that they actually mass produced them in a factory  after impacting and igniting a tank  the oil used in production of the tank to protect it from rust would ignite also  turning the tank into a dutch oven  and often causing it to explode quite an effective weapon against an imposing enemy  if you can get close enough  gt  against attacking soviet tanks  the finns were using incendiary devices consisting of bottles of ethanol  tar  and gasoline with a simple burning rag for a fuse these were improved by using longburning storm matches attached to the bottle s side  gt   these molotov cocktails   http  culinarylorewdfilescomlocalfilesfoodhistory  3ahowdidthemolotovcocktailgetitsnamefinnishmolotovcocktailjpg  were actually massproduced by the finnish alcohol monopoly alko  gt  the finns  of course  did not invent the idea of device  they only gave it a name that has stuck to this day such devices had been used many other times throughout history  and the chinese had employed molotov cocktails against japanese tanks in 1937   culinary lore   http  wwwculinarylorecomfoodhistory  howdidthemolotovcocktailgetitsname   a nontraditional source for the history of weapons but a good source all the same,d028a1z,todayilearned,learning,1455650628.0,awkwardtheturtle,23.0,0.0,1335,145436,1.0
i ve looked at some of the theories  and the conspiracies  and i think oj did nt actually kill nicole or goldman i agree with the idea that his son did it  and oj went over there to help cover it up   here s   http  wwwbusinessinsidercomojsimpsonmurdersandjasonsimpson20146  some background on the notion ,d02v6pe,todayilearned,learning,1455684913.0,jayman419,1.0,0.0,708,88824,1.0
dude that s a cool story ,d02r7ju,todayilearned,learning,1455678049.0,CatfishKing21,1.0,0.0,1,1443,0.0
gt  the name  molotov cocktail  was coined by the finns during the winter war  1  the name is an insulting reference to soviet foreign minister vyacheslav molotov  who was responsible for the setting of  spheres of interest  in eastern europe under the molotov  ribbentrop pact in august 1939 the pact with the nazis bearing molotov s name was widely mocked by the finns  as was much of the propaganda molotov produced to accompany the pact  including his declaration on soviet state radio that bombing missions over finland were actually airborne humanitarian food deliveries for their starving neighbours the finns sarcastically dubbed the soviet cluster bombs  molotov bread baskets  in reference to molotov s propaganda broadcasts  2  when the handheld bottle firebomb was developed to attack soviet tanks  the finns called it the  molotov cocktail   as  a drink to go with the food    3  molotov himself despised the name  particularly as the term became ubiquitous  4 ,d024irh,todayilearned,learning,1455645540.0,Fifth_Down,200.0,0.0,8481,21322,1.0
let us return the favour comrade,d02p3o0,todayilearned,learning,1455674761.0,SteroidSandwich,1.0,0.0,12900,145231,0.0
so putin has historical precedent with russia s wink wink foreign policy a la his  our troops are simply vacationing in ukraine  claim ,d02usx5,todayilearned,learning,1455684197.0,BreezyMcWeasel,1.0,0.0,3,1423,0.0
the perfect that comes out of your body looking exactly like it went in ,d0278id,todayilearned,learning,1455649208.0,diegojones4,2.0,0.0,1575,913000,1.0
apart from scifi movies  is nt it obvious that invading aliens would have technology so far in advance of ours that resistance really would be futile we have nt had manned visits to another planet  no space habitats  lunar coloniesinvading aliens have the ability attack across interstellar space  holy space opera bat creature ,d01ghoz,todayilearned,learning,1455591546.0,farticustheelder,12.0,0.0,1,4791,0.0
so ozymandias was right ,d01ktdz,todayilearned,learning,1455598834.0,Dorsinator5000,5.0,0.0,590,105,0.0
ozymandius had to rethink a few things ,d01uma0,todayilearned,learning,1455629338.0,anonnonaano,2.0,0.0,1,295,0.0
great piece of historical info  thanks ,d02v8af,todayilearned,learning,1455684996.0,adave4allreasons,1.0,0.0,151,686,0.0
this  to me  proves that nothing happened at area 51 ,d01mvfe,todayilearned,learning,1455603285.0,pisses_on_kittens3,1.0,0.0,1,369,0.0
aliens are serious business ,d01jg55,todayilearned,learning,1455596334.0,Gorbachof,1.0,0.0,7,549,0.0
gt   from the fireside house  president reagan suddenly said to me  what would you do if the united states were suddenly attacked by someone from outer space  would you help us   gt   i said  no doubt about it   gt   he said  we too   gt   so that s interesting   gorbachev said to much laughter ,d017fif,todayilearned,learning,1455577180.0,LaTalpa123,366.0,0.0,31923,28569,1.0
i consider myself a purist regarding butter tarts and my filling of choice is red currents  made thus  properly  they are my kryptonite ,d02lebj,todayilearned,learning,1455669124.0,Waldo_Pepper62,1.0,0.0,149,158,0.0
pretty much how i play madden ,d02jhzl,todayilearned,learning,1455666088.0,logicalphallus-ey,1.0,0.0,3,1372,0.0
same with the highschool coaches hall of famer william maradei we recovered one of those kicks during the state championship  which we ended up winning ,d02rung,todayilearned,learning,1455679091.0,Graceful_Ballsack,1.0,0.0,547,6859,0.0
i upvoted this even though i know jackshit about american football  sounded like a big feat ,d02ld6i,todayilearned,learning,1455669076.0,ChaIroOtoko,1.0,0.0,652,12345,0.0
it is also a rock band  d,d02bvln,todayilearned,learning,1455655390.0,RockeSolid,2.0,0.0,13438,2400,1.0
til what a butter tart is ,d02cehh,todayilearned,learning,1455656083.0,demonspawn79,3.0,0.0,1374,26219,0.0
i have a feeling i know exactly when and where you learned this fact ,d01c8lw,todayilearned,learning,1455584885.0,Just1morefix,252.0,0.0,1,282320,1.0
oh god fuck,d01jwna,todayilearned,learning,1455597119.0,pusangani,0.0,0.0,179,17729,0.0
you may find  this   http  wwwcbsnewscomnewsafter148yearsmississippifinallyratifies13thamendmentwhichbannedslavery  interesting,d01eov2,todayilearned,learning,1455588701.0,RuleOfGondorIsMine,4.0,0.0,1,3156,0.0
huh before 2000 you ca nt interracially marry and have a hot plate in your office ,d01cmb7,todayilearned,learning,1455585469.0,EZ_does_it,3.0,0.0,120072,176134,1.0
https  myoutubecomwatch  v  kmzpdd4pwvm,d01lvh9,todayilearned,learning,1455600995.0,doublethegin,1.0,0.0,42,4129,0.0
that is why the ending to the watchmen comic is much less stupid than most people tend to think a little history goes a long way to appreciating a wellresearched story ,d01jo9j,todayilearned,learning,1455596710.0,royalstaircase,8.0,0.0,17553,20327,0.0
you mean they had these laws on the books even though they were not being enforced  this happens all the time there s a list of them somewhere but a few i remember are allowed to kill mormons under the extermination order until the 90 s no bouncing balls on sunday  some are really crazy like no chewing gum while crossing the street  basically these laws are just never repealed inspite of being illegal ,d01cakp,todayilearned,learning,1455584968.0,Loquicious,65.0,0.0,1,3464,0.0
and texas penal code 2106 still outlaws homosexual conduct  more than a decade after lawrence v texas held that unconstitutional  http  wwwstatuteslegisstatetxusdocspehtmpe21htm,d01cs63,todayilearned,learning,1455585724.0,tarponfishing,55.0,0.0,1,5642,1.0
a lot of people  like my mother  wish this law was still around and enforced ,d01vwr1,todayilearned,learning,1455632217.0,IThoughtYoudBeBigger,2.0,0.0,15,5162,0.0
til my mom loves a fictional dildo ,d023cys,todayilearned,learning,1455643956.0,Momadance1,5.0,0.0,3,475,0.0
barry scheck strumpet street walker tramp ,d02us3c,todayilearned,learning,1455684155.0,keelaritannaford,1.0,0.0,114,16,0.0
 just in case you came here for the song   https  wwwyoutubecomwatch  v  jwkmhclkvog ,d024ztp,todayilearned,learning,1455646193.0,SsurebreC,2.0,0.0,2774,54820,0.0
happened in the us too  https  enwikipediaorgwikiantiunion_violence the ludlow massacre for instance  the more you know ,d01w4h0,todayilearned,learning,1455632663.0,cp5184,5.0,0.0,999,69136,0.0
nooooooooo  my fellow bananas  killed in their prime ,d01u4a9,todayilearned,learning,1455628064.0,Bananaboatsunshine,-5.0,0.0,3926,64948,0.0
again  in high school extra points is not that unusual  but the numbers are in your coach s favor ,d02utpv,todayilearned,learning,1455684238.0,ut94,1.0,0.0,1,1,0.0
i graduated from pa and can provide some insight into coach kelly s strategy he never kicks field goals  always goes for 2 his thinking is most defenses do nt practice blocking against a team that goes for 2 every time also  he does nt want to put all his trust into one player  kicker  for that one extra point when he can put the ball in the qbs hands and have multiple options for 2 points  qb sneak  running back  wrs  etc  he also onside kicks every time  again because most teams do nt practice recovering onside kicks and his teams practices like crazy lastly  he does not field punts he lets them kick it as deep as they want and he just takes the ball from wherever they down it his thinking there is that a lot can go wrong when fielding a punt and give the other team the chance to recover a dropped ball or something similar he s has gotten a ton of grief here in the state for his antics  but it has paid off and he is highly regarded by pa students and alumni just thought i d throw out some info  edit  i meant punt  not kickoff calm yourselves ,d02aibu,todayilearned,learning,1455653609.0,SwapperJacks,88.0,0.0,8,435,0.0
yeah  coached my kid s youth football team for years we always did this lots of upside  very little downside  with little guys  it s hard to cover a proper kickoff well if your kicker is any good but they ll go get an onside kick like nobody s business ,d02p3p6,todayilearned,learning,1455674762.0,lythander,1.0,0.0,4534,5330,0.0
well i can tell ya if you are at your own 20 yard line you might want to consider punting ,d02bqj0,todayilearned,learning,1455655209.0,Drum_Stick_Ninja,-3.0,0.0,2125,7970,0.0
i do nt think this strategy would work past the hs level,d02orfu,todayilearned,learning,1455674245.0,lilaidan,0.0,0.0,11,23,0.0
he must have some very talented players ,d02qaz7,todayilearned,learning,1455676628.0,i_am_clit_commander,1.0,0.0,1,30,0.0
just another reason to love steely dan ,d02ulu5,todayilearned,learning,1455683829.0,ScrotalFrostbite,1.0,0.0,1,141,0.0
apparently when you grew up you did nt have the rock and roll book of lists in your bathroom ,d02qek5,todayilearned,learning,1455676782.0,kmcg103,1.0,0.0,161,28817,0.0
i ve heard it destablizises orbits of objects and makes us more susceptible to a strike ,d02hi80,todayilearned,learning,1455663059.0,sheepsleepdeep,3.0,0.0,116829,96135,1.0
it would be interesting to wake up in the middle of the night and go outside  and find jupiter is filling the whole sky the cosmic vacuum cleaner has come for us  i wonder what it would be like at that point to ride it into the gas giant  rwritingprompts  you want to do this one  and you know that when people wake up and see what s going on  they re still going to raid the stores for milk and bread ,d02v17f,todayilearned,learning,1455684626.0,hodyoaten,1.0,0.0,14679,188973,1.0
does that mean the grs is the power indicator ,d02i1fw,todayilearned,learning,1455663849.0,OutcastSTYLE,1.0,0.0,1,1897,0.0
dinosaur  uh  you missed one ,d02r2qk,todayilearned,learning,1455677831.0,Bon_Qui_Qui,1.0,0.0,1,201,0.0
thanks  jupiter ,d02p6yn,todayilearned,learning,1455674898.0,CauseISaidSoThatsWhy,0.0,0.0,1,2717,0.0
so when you call it a vacuum cleaner  do you mean it vacuums up material  in the vacuum  vacuumcaption ,d02iuo1,todayilearned,learning,1455665091.0,Toshiro46,-2.0,0.0,5,5774,1.0
but jupiter is made of gas comets will just go right through it,d02s17u,todayilearned,learning,1455679391.0,ArcusImpetus,-2.0,0.0,1,6070,0.0
that s fantastic  but what the hell was then done with the kids  i feel like someone would notice 3000 babies bouncing around ,d01j3q0,todayilearned,learning,1455595745.0,Starsy,97.0,0.0,181667,229739,1.0
til people were still gettin  it on despite being in a death camp never has there been a more powerful testament to the enduring power of the human spirit ,d01icni,todayilearned,learning,1455594501.0,sexyjohnjohnson,11.0,0.0,1376,27444,0.0
and then they all died,d01isf1,todayilearned,learning,1455595221.0,Plugawy_Nedznik,6.0,0.0,1,92649,1.0
 euthanize   i think you mean  kill  ,d01m061,todayilearned,learning,1455601279.0,refugefirstmate,-10.0,0.0,6,42439,1.0
it s a choice not a child ,d01r2ri,todayilearned,learning,1455617113.0,malvoliosf,-9.0,0.0,24740,110141,0.0
worth noting  she died in 1907  long before stalin s rise to power and subsequent crimes against humanity  also worth noting  he married again 12 years later  to nadezhda alliluyeva  who was rumored to be bipolar and killed herself in 1932 ,d01imtq,todayilearned,learning,1455594963.0,Starsy,536.0,0.0,181667,229739,1.0
well  i m sure that hitler cared for eva braun too  but the world would have been a lot better if both of the two had been shot dead a long time earlier ,d01vdn6,todayilearned,learning,1455631100.0,RoboNinjaPirate,4.0,0.0,6375,223653,1.0
wow  i did nt see that commie ,d01i8in,todayilearned,learning,1455594319.0,EZ_does_it,4.0,0.0,120072,176134,1.0
gt   this creature softened my heart of stone she died and with her died my last warm feelings for humanity  well that seems nice gt  he became so distraught during her burial that he threw himself into her open grave and had to be dragged out  duuude what the fuck ,d01iyp9,todayilearned,learning,1455595514.0,evilcounsel,2.0,0.0,2271,13292,0.0
the story is eerily simmilar to the story of ivan the terrible  who became murderous lunatic after the death of his wife ,d029ucb,todayilearned,learning,1455652712.0,mishach,1.0,0.0,10,7650,0.0
this story is vicious propaganda spread by american politicians who are trying to make russia look bad  russia is beautiful country of freedom and democracy where drinking fountains overflow with vodka all day and the people dance in the streets with joy ,d02gtqv,todayilearned,learning,1455662079.0,Spdrjay,9.0,0.0,1,110555,0.0
well misinformation and propaganda have always been part of the repertoire of all regimes in history ,d02a62r,todayilearned,learning,1455653147.0,RockeSolid,4.0,0.0,13438,2400,1.0
i ve seen some not that sophisticated pro russian gibberish on rconspiracy once you see it ,d02caex,todayilearned,learning,1455655931.0,black_flag_4ever,3.0,0.0,151066,479508,1.0
have you ever had a look at the national endowment for democracy  ned   http  wwwnedorgabouthistory they were the ones behind the viral video  i am a ukrainian  that played a role in building western support for the ukrainian uprising the director of the video has openly talked about doing a prepvisit for the video ca a year before the conflict in ukraine started  the video was also pushed by voice of america  another interesting outfit to look up and it is no longer a state secret that the cia were the editors and managers of voe  i think it s super we start to focus on propaganda  especially on te internet we would however be naive in thinking it is all  them  and never  us  ,d02ekgk,todayilearned,learning,1455658975.0,TotallyKnackered,2.0,0.0,16,26403,1.0
gt   russia  s information war might be thought of as the biggest trolling operation in history  and its target is nothing less than the utility of the internet as a democratic space in the midst of such a war  the runet  as the russian internet is often called  can be an unpleasant place for anyone caught in the crossfire soon after i met leonid volkov  he wrote a post on his facebook wall about our interview  saying that he had spoken with someone from the new york times a former prokremlin blogger later warned me about this kremlin allies  he explained  monitored volkov  s page  and now they would be on guard  that was not smart   he said ,d029wd8,todayilearned,learning,1455652785.0,Salojin,1.0,0.0,167,6448,0.0
a truly sad day in history ,d01vxtj,todayilearned,learning,1455632277.0,havebananas,1.0,0.0,152,154393,0.0
pretty sure this is in the novel  one hundred years of solitude ,d019ua6,todayilearned,learning,1455581000.0,Pishwi,25.0,0.0,1,40952,0.0
