text,id,subreddit,meta,time,author,ups,downs,authorlinkkarma,authorkarma,authorisgold
just so you know when the ground crew pulls up to the flight line in 4 minivans  they drive and park those minivans like nothing i have ever seen  it is fucking amazing  you have to watch for it because there is other stuff going on  but watch those me minivans as they pull in  everyone involved is squared away ,d02oe1q,todayilearned,learning,1455673680.0,Anon_Subber,3.0,0.0,14,66,0.0
so  largest by square footage  weight or volume  because that quaken aspen is suppose to cover 106 acres  so less square footage  but weights 6000 tonnes each trunk can be up too 100ft tall someone would have to do the math  i do nt know how thick the fungus is  but is seems the tree stand wins in weight and maybe total volume ,d01qj0r,todayilearned,learning,1455614852.0,TheScamr,7.0,0.0,36,259536,1.0
i think we just found the source of donald trump s hair ,d01qw90,todayilearned,learning,1455616353.0,SmugSceptic,7.0,0.0,20091,42937,1.0
is nt resistance about the cold war never ending and aliens invading ,d01nttz,todayilearned,learning,1455605736.0,Yinonormal,1.0,0.0,651,4623,0.0
one went down several years ago roughly 40 miles east of my town it was the day before an air show at moody afb in valdosta  ga the odd thing was  is that it was in straight and level flight  not performing stunts ,d02b5ew,todayilearned,learning,1455654456.0,squabs217,10.0,0.0,1,1566,0.0
the precision being displayed in the estimated date is impressive ,d020c4z,todayilearned,learning,1455639685.0,A_Major_Dude,2.0,0.0,1,124,0.0
til corn needs to get it s shit together ,d028e0b,todayilearned,learning,1455650776.0,DerekSavoc,10.0,0.0,172,31816,0.0
science  can we get on the random boners without any stimulation now  those are the true penile menace ,d01krdp,todayilearned,learning,1455598724.0,Ask_me_about_WoTMUD,4.0,0.0,1,938,0.0
same thing happened on the  columbia   https  enwikipediaorgwikispace_shuttle_columbia_disaster   it just did nt work out so well ,d02hsre,todayilearned,learning,1455663489.0,malvoliosf,3.0,0.0,24740,110141,0.0
it s a great movie fun from start to finish ,d02q6jy,todayilearned,learning,1455676435.0,ZenTechnician,5.0,0.0,1,10223,0.0
that was my madden 95 strategy ,d01y7d0,todayilearned,learning,1455636396.0,Amida0616,123.0,0.0,289,19753,0.0
honestly  i do nt know if this violates any rulesbut i had no idea these actors starred in a movie together  let alone with this plot also  i learned who julie brown is  born in 1989  give me a break ,d02pjrz,todayilearned,learning,1455675450.0,artful_dodger,1.0,0.0,2431,2340,0.0
gt  farm owners and residents who live on the property told a dallasft worth nbc station that the real reason for the law enforcement exercise appears to have been code enforcement  gt  local authorities had cited the garden of eden in recent weeks for code violations  including  grass that was too tall  bushes growing too close to the street  a couch and piano in the yard  chopped wood that was not properly stacked  a piece of siding that was missing from the side of the house  and generally unclean premises   smith s statement said she said the police did nt produce a warrant until two hours after the raid began  and officers shielded their name tags so they could nt be identified  that s fucked ,d011u0x,todayilearned,learning,1455568899.0,Donald_Keyman,485.0,0.0,292180,1800966,1.0
the problem is generally called  overcriminalization  whereby police are using incredible amounts of resources and force on extremely marginal violations of the law  policy organizations from all over the political spectrum have written to condemn overcriminalization  http  wwwheritageorgissueslegalovercriminalization http  wwwbrookingsedublogsfixgovposts20151222mensreareformvillasenor https  wwwacluorgblogspeakeasycriminalcodesgonewild,d010ia9,todayilearned,learning,1455566988.0,cashcow1,992.0,0.0,13,216544,1.0
gt   grass that was too tall  bushes growing too close to the street  a couch and piano in the yard  chopped wood that was not properly stacked  a piece of siding that was missing from the side of the house  and generally unclean premises   in other words  the city is trying to make up excuses for using a swat team that fucked up and did nt find any drugs ,d018tet,todayilearned,learning,1455579366.0,nurb101,34.0,0.0,1278,78825,0.0
noknock raids are scary as hell as a prospect ,d010mct,todayilearned,learning,1455567152.0,Honk_If_Top_Comment,131.0,0.0,7,244717,1.0
murican police state at its finest ,d013dys,todayilearned,learning,1455571125.0,TodayThink,73.0,0.0,40,2757,0.0
i live up the street from where this happened it actually happened just outside of arlington  but in a small enough township that they contract with the city for police services  hence arlington pd action  the issue was nt weed the issue was that they were violating city ordinance by keeping old junk on the property and growing food without farming licenses several adjacent property owners had complained that it devalued their property  that the junk  which they recycled into useful things in the spirit of self sustainability  were harboring pests like rats and mosquito s  which im sure it was  the city had been sending notices and fining the property owners of the organic commune for quite some time for violations  but they really were looking for an angle to shut the whole thing down so  someone  reported a grow op there  believable if you know anyone that lived there  which i do  and a judge issued a raid warrant for it  of course  a warrant for weed does nt give them the right to use okra and tomatoes as evidence in a case  but it does give them the right to seize anything in the process of a search it was extremely dirty and not handled correctly by the city and arlington pd they lost a lot of support by the people around here because of it  i personally understand the gripes of the adjacent property owners  and i do nt think the owners of the commune property were very considerate of their neighbors  essentially ignoring them with  its my land  freedom  evil corporations lobby to make it illegal for me to grow my own food  and all of that  when it was nt about anything like that but the way the city handled things had a lot to be desired to say the very least ,d01c2oy,todayilearned,learning,1455584627.0,monzzter221,13.0,0.0,39,19378,0.0
when you are looking to start your own property and do things your own way  you have to appreciate the invasive nature of law enforcement and the stretching idea of plain view it s why so many property owners essentially build moats around their properties where they dig down about four or five feet and make it about six feet wide and will sometimes add a fence to the outside of it if your neighbors who have a house a quarter of a mile from your property line can see onto your property and find the state you keep it in distasteful  they can get code enforcement involved if they are annoying enough  if they ca nt see your property  the rare neighbor will trespass and then cry to the cops when your dogs chase them off or they cut themselves on the barbed wire you have on the top of the fence  when i went in on a property as part of a trust the first thing we made sure of  was that there were no neighbors it wo nt stop the cops from executing a warrant  but it makes it far harder to get a warrant and just because you are nt breaking the law does nt mean cops wo nt bust in and look for things to arrest you for or that there is no chance they wo nt plant drugs  government really does nt like people deviating from the accepted norm of being plebes ,d01bqkn,todayilearned,learning,1455584082.0,Davidkpa,7.0,0.0,1,11647,0.0
i love how all high school football content just uses that explosions in the sky  style music now ,d02l7rb,todayilearned,learning,1455668853.0,HomEntertAnment,1.0,0.0,510,6311,0.0
me when i play madden,d02a728,todayilearned,learning,1455653186.0,fistedsister89,3.0,0.0,2026,2826,0.0
how on earth did they seize blackberry bushes without dying  we ca nt even trim the demonbushes of death in our yard without massive injury ,d014np8,todayilearned,learning,1455572986.0,lousymom,414.0,0.0,4861,16161,0.0
as a kid i always thought it was wordplay about his grungy tavern ie  moe s is slack ,d02ki8a,todayilearned,learning,1455667757.0,jack_herring,-2.0,0.0,42,68,0.0
i ca nt find the video but there was a community that met up privately to get raw cow milk and they were swatted and held at gun point and told to pour all the milk out ,d013p6s,todayilearned,learning,1455571584.0,malicesin,56.0,0.0,878,3193,0.0
i get that they were looking for marijuana  but when they found none why did they seize all the other plants  could they not identify marijuana plants   take anything green  the boys at the lab will sort it later  ,d01175f,todayilearned,learning,1455567992.0,petdragon42,4252.0,0.0,20,4742,0.0
so we are calling swat to tell people to cut their grass and clean up their property  this country continues to amaze me ,d010q5w,todayilearned,learning,1455567308.0,Asi9_42ne,370.0,0.0,157,78149,0.0
is this state sponsored terrorism ,d012p1q,todayilearned,learning,1455570113.0,pby1000,43.0,0.0,31,4007,1.0
the finnish side of my family lived in suomussalmi and my grandfather was one of those crazy bastards that burned down his home just to mess with the russians during the initial attack he later built it all up again  just to loose the barn and most of the animals in a fire a couple years later  and once again built it up the finns were poor bastards back then  and they fought for what little they had he died in the early 60 s when my dad was just a kid so i never got to meet him i have one of his medals from the war  and whenever i feel that life is unfair  i think about what they went through he rebuilt his home 2 times in 10 years  and raised 8 kids with barely any money hard motherfuckers  finns back then ,d02k41a,todayilearned,learning,1455667139.0,Vikingoverlord,8.0,0.0,5219,7545,1.0
i am ok with this i would hope that all of our genetic heritage would come together to fight an existential threat,d0293zu,todayilearned,learning,1455651738.0,S-uperstitions,1.0,0.0,508,8126,0.0
hats down to the finns for coining this name personally  i find  molotov   much more interesting to say than  incendiary     justcsgothings,d02shme,todayilearned,learning,1455680147.0,gunavata,1.0,0.0,1,1,0.0
i feel like this is describing your average madden player ,d02auwp,todayilearned,learning,1455654075.0,nadawg,6.0,0.0,10,1587,0.0
and we all have adrian veidt to thank for that ,d017vyd,todayilearned,learning,1455577887.0,SaintVanilla,91.0,0.0,1,659291,1.0
you ve got to love how protective sky is of little earth ,d01o1ci,todayilearned,learning,1455606323.0,hangm4n,2.0,0.0,7788,22950,0.0
i doubt when reagan said it he was serious he has a good sense of humor and loved to joke plus  he was very good friends with gorbachev,d021uk8,todayilearned,learning,1455641838.0,Rutawitz,2.0,0.0,446,40781,1.0
tim boomer i met him in chicago on a work assignment good guy  his desk area was plastered with articles about the incident ,d02upjb,todayilearned,learning,1455684029.0,Pindogger,1.0,0.0,8,1078,0.0
 and recently  anatoly zak reports for popular mechanics  the russian government revealed that in the 1970s  the soviet almaz space station was not only armed with a topsecret space cannon  but it was also testfired  they had a space cannon and even fired it  that itself is quite amazing i wonder what they test fired at ,d027w44,todayilearned,learning,1455650106.0,A-TeamTown,2.0,0.0,1,904,0.0
this is the same reason that apple is so successful,d024y3r,todayilearned,learning,1455646125.0,sinkingstepz,7.0,0.0,11,1160,0.0
i remember that playboy issue ,d02vfns,todayilearned,learning,1455685384.0,Maximum_Overdrive,1.0,0.0,377,6194,0.0
all i can say is dahhhhhhhhhm ,d02snlt,todayilearned,learning,1455680428.0,RarewareUsedToBeGood,1.0,0.0,3594,17472,0.0
who the fuck tattoos a baby what an asshole,d02lipj,todayilearned,learning,1455669302.0,misdirected_asshole,15.0,0.0,26,8949,0.0
misread the title as saying  bollocks   looked at picture  was extremely confused ,d02mmo8,todayilearned,learning,1455671010.0,talkingtomiranda,2.0,0.0,1,35,0.0
pretty sure it s illegal to tattoo a baby  wtf and why tattoo all 3  ca nt you just leave 1 out and logically tell them apart because she s the only one without a tattoo ,d02vfi0,todayilearned,learning,1455685374.0,minerlj,1.0,0.0,6245,25646,0.0
so back in the day i worked at the university of minnesota hospital two of these girls  nicole and erica i think  were nursing assistants there at the time they were without a doubt the hottest girls there and that is saying something about a hospital full of college age workers  one day a buddy of mine tells me there are three of them he saw them eating in the cafeteria i called total bullshit on him and then magically a few months later all three were in playboy  so  you know  he was right  this story had no point but there it is ,d02tc9w,todayilearned,learning,1455681586.0,oldmanpaco,24.0,0.0,1,449,0.0
man i already know the pick up line i would use to great success   aye girl  are you a triplet  because dddaaaaahhhhmmmmmmm ,d02o221,todayilearned,learning,1455673180.0,Ericbishi,1.0,0.0,335,6923,0.0
triplets basil ,d02v7ux,todayilearned,learning,1455684974.0,adviceKiwi,1.0,0.0,2194,9787,0.0
just doing research  and learned that these triplets were all pregnant at the same time and had ultrasounds on tv  https  wwwyoutubecomwatch  v  slbethbfrrc,d02qnz9,todayilearned,learning,1455677185.0,d_rickards,1.0,0.0,1,1019,0.0
i just find it odd that each of them had a daughter then a son like what are the chances that their first born are all the same gender ,d02txn0,todayilearned,learning,1455682630.0,Maverick524,1.0,0.0,190,253,0.0
southern states are indeed strange   alabama did nt ratify amendment giving women right to vote until 1953   mississippi finally ratified the 13th amendment  banning slavery  in 2013 ,d01m324,todayilearned,learning,1455601460.0,AfricazMost,27.0,0.0,5913,30676,0.0
i am half polish  mom s side  and catholic people like her not only make me proud of my heritage and faith  but give me resolve to be a better person i can complain that it s too cold  or that i hate preparing my taxes  or whatever  and then remember people have it worse and ask what i can do  since even in the middle of a concentration camp  this woman managed to make a difference  especially for the children who survived ,d01tcqi,todayilearned,learning,1455625852.0,saricher,20.0,0.0,12244,5141,0.0
pahaha that thumbnail is perfect,d022wo4,todayilearned,learning,1455643335.0,Dynoglory,2.0,0.0,386,4315,0.0
til mcdonald s was a subsidiary of wolfram amp  hart ,d02ccoz,todayilearned,learning,1455656016.0,Plainchant,12.0,0.0,148193,36132,0.0
i was reading the history of syphylis and read that initially the condom was used as a barrier against stds only  it said that the first recorded instance of using it to prevent pregnancy was in the journals of the infamous casanova ,d01g8gu,todayilearned,learning,1455591135.0,TotallyKnackered,119.0,0.0,16,26403,1.0
before anyone else comments  yes the correct spelling is  flouted,d01gp0k,todayilearned,learning,1455591859.0,HeyItsNickCA,310.0,0.0,68673,16167,0.0
i would love to be in the conversation for rationalizing the increase in teen pregnancies in the towns that banned birth control ,d01ks0e,todayilearned,learning,1455598759.0,Big_Test_Icicle,148.0,0.0,34779,43181,0.0
comstock should have no authority outside of the floating skycity of columbia ,d01pi85,todayilearned,learning,1455610968.0,karmatiger,7.0,0.0,7358,6134,0.0
always wear a jimmy hat ,d01en1c,todayilearned,learning,1455588623.0,Brodusgus,12.0,0.0,3156,20686,0.0
lucky bastard ,d01uq7n,todayilearned,learning,1455629600.0,Malinois,3.0,0.0,1,2792,0.0
adorable  wow  she s been working a long time ,d02c5qx,todayilearned,learning,1455655757.0,EllieWest,5.0,0.0,1,153,0.0
see people this is why they the 2nd amendment is crucial people with power are psycho losers ,d0230or,todayilearned,learning,1455643489.0,corneliusharvardus,1.0,0.0,869,446,0.0
some states have banned sex toys instead  shops sell  novelty cake toppers  or something similar the thing is  it still may be shaped like a cock  but since they re selling it as a novelty it gets around both any law banning dildos as well as any regulation against unsafe sex toys ,d01lkqz,todayilearned,learning,1455600369.0,Roebuck527,1407.0,0.0,1,5850,0.0
bioshock infinite reference is here,d01n3tx,todayilearned,learning,1455603845.0,lindseyotts,22.0,0.0,44,249,0.0
and so mass murdering asshole joseph stalin was born ,d01lq85,todayilearned,learning,1455600692.0,NineteenEighty9,-1.0,0.0,60331,76601,0.0
kind of reminds me how in texas the sellers of sex shops must ask if you re buying the toys for educational purposes no more than 3 sex toys are allowed in a residential home  and sodomy is still illegal are these laws still enforced ,d01mlml,todayilearned,learning,1455602644.0,princessluna3000,13.0,0.0,218,1930,0.0
good guy jupiter,d02tn8a,todayilearned,learning,1455682123.0,jdmflcl,1.0,0.0,118,1182,0.0
i worked on this study as part of the egs team the subtext here is that most of that energy would be incredibly expensive to produce  many times the current cost of energy   while geothermal energy technically exists everywhere in massive quantities  the costbenefit analysis  which is another big part of this study  suggests that the technology to make tapping this energy feasible is about 50 years out ,d020830,todayilearned,learning,1455639519.0,UnfortunatelyBob,3.0,0.0,42,967,0.0
that s how they power all their synths,d01d6o0,todayilearned,learning,1455586358.0,wolf120,16.0,0.0,59787,11923,1.0
float  flout  doubt trout ,d01mlny,todayilearned,learning,1455602646.0,fundudeonacracker,7.0,0.0,1,2779,0.0
fuck lets do this i live in arkansas and we feel earthquakes from all the damn fracking in oklahoma rather feel earthquakes for something good then something worse ,d0201c3,todayilearned,learning,1455639241.0,imadyke,1.0,0.0,366,3451,0.0
shitty science question but would nt this mean that jupiter grows by 20008000 times quicker from it absorbing the mass and increasing gravity from these rogue space stones ,d02ujb6,todayilearned,learning,1455683700.0,dgd765,1.0,0.0,598,15637,0.0
still would rather use mirrors to heat up salt how fucking simple can it get mirrors and molten salt mirrors and molten salt guys  thats all you need to make an awesome energy source ,d01lteb,todayilearned,learning,1455600876.0,BicycleOfLife,38.0,0.0,3229,16754,0.0
never be human trials in what countries  looks like a new medical tourism opportunity ,d02spg9,todayilearned,learning,1455680516.0,ENG-eins,3.0,0.0,5303,2398,0.0
this is horrifying i wish serial or making a murderer would focus on clearly innocent cases like this  although some of the appeal of those was the ambiguity  but this is terrible ,d02e1vy,todayilearned,learning,1455658298.0,keeblercobbler,1.0,0.0,198,4411,1.0
i understand confidentiality  but in a case like this  doing the right thing should be more important than getting that paycheck ,d02tgpe,todayilearned,learning,1455681803.0,Iucidnightmares,1.0,0.0,1,27,0.0
it s a pretty daunting example of how bad things can get without proper resource management there are several major rivers in the world that rarely even reach the ocean  the yellow river and the colorado river being notable examples the southern portion of the aral sea is all but doomed  its fate sealed by the damming of its northern portion  which  if there is a silver lining  is recovering  and its fish population returning the salinity in what is left of the southern portion makes it inhospitable for the species that once thrived there ,d02v6wp,todayilearned,learning,1455684923.0,quiteintriguing,1.0,0.0,2405,123630,0.0
https  youtube1j0xdgisug,d02ogj3,todayilearned,learning,1455673785.0,toan55,1.0,0.0,47,42910,1.0
various types of pizza had existed in the us for 50 years or so before these troops returned home with an appetite for tomato pie few people ate it other than italian immigrants and their families the troops who had stayed in italy  though  had eaten as much of it as they could get while they were there  and came home looking for more  americans put quite a spin on the traditional idea of a pizza new styles like chicago deep dish grew rapidly in popularity  popularized as an italian dish eventually  these new pies made their way back to italy  where it was adopted as a native  dish  this archetype of the transference of ideas like food staples is an important concept in social studies and anthropology  where it s appropriately known as   the pizza effect   https  enwikipediaorgwikipizza_effect   it is used to help track and understand the flow of information and ideas across cultures in addition  it is not a onetimeonly deal  the effect is a cycle  gt  stephen jenkins noted that the feedback phenomenon could continue  in the case of pizza  he wrote that the return of pizza to italy again influenced american cuisine  gt   pizzaloving american tourists  going to italy in the millions  sought out authentic italian pizza italians  responding to this demand  developed pizzerias to meet american expectations delighted with their discovery of  authentic  italian pizza  americans subsequently developed chains of  authentic  italian brickoven pizzerias  gt   hence  americans met their own reflection in the other and were delighted ,d02e2pz,todayilearned,learning,1455658328.0,awkwardtheturtle,333.0,0.0,1335,145436,1.0
my dad  born in 1943  grew up on a very rural farm  no running water like you do he only ever ate at home  home cooked food they grew or hunted  his dad had pizza once and hated it  never tried it again my dad wanted to see what the hype was all about  the first time he had pizza he was  14 and spent a good chunk his savings which was a lot of money for his family and went into town bought an entire pizza he ate the entire thing and 30 mins later he was sick as all get out and ended up throwing it all up  he went back to the pizza shop and ordered another  kept that one down and loved pizza ever since  my love for pizza is much less story worthy  tmnt all the way ,d02oz1y,todayilearned,learning,1455674566.0,kroon,17.0,0.0,8677,55197,0.0
and pizza came to new york before going  back  across the atlantic to rome ,d02bqgk,todayilearned,learning,1455655207.0,2baldguys,7.0,0.0,1614,11578,0.0
yay for war giving us the greatest vegetable ever,d02pkks,todayilearned,learning,1455675485.0,SteroidSandwich,2.0,0.0,12900,145231,0.0
the italians won against the filthy americans with their delicious  and poisonous  pizza  they re waiting for us to drop ded ,d02fzk4,todayilearned,learning,1455660899.0,ImperialRedditer,4.0,0.0,23,2892,0.0
just another reason they were the greatest generation ,d02b6wf,todayilearned,learning,1455654508.0,squabs217,2.0,0.0,1,1566,0.0
i m a bot   bleep    bloop   someone has linked to this thread from another place on reddit    rknowyourshit   til that pizza was nt popular in the us until after wwii  when us troops  including dwight eisenhower  returned home from occupied italy with an appreciation for italian pizza  todayilearned   https  npredditcomrknowyourshitcomments46693ktil_that_pizza_wasnt_popular_in_the_us_until      footer     if you follow any of the above links  please respect the rules of reddit and do nt vote in the other threads      info   rtotesmessenger      contact   messagecompose  to  rtotesmessenger        bot ,d02ryzx,todayilearned,learning,1455679291.0,TotesMessenger,0.0,0.0,1,301427,0.0
now if only they had brought italian women back too le sigh,d02r302,todayilearned,learning,1455677842.0,MathematicalMystic,-5.0,0.0,1,61,0.0
hmm  could pizza be responsible for our ever more fascist country ,d02ns9a,todayilearned,learning,1455672764.0,ImThat-OtherGuy,-6.0,0.0,1,408,0.0
i wonder why he would expect anyone to listen   why yes  of course we are sending humanitarian aid to a nation even though we re basically starving people in our nation totally not a lie to get the finns killed ,d02jpvq,todayilearned,learning,1455666464.0,Imperium_Dragon,7.0,0.0,123,108611,0.0
later  many people regarded that as a poor decision ,d023c63,todayilearned,learning,1455643927.0,iamtheowlman,1.0,0.0,400,135152,0.0
legal or not  anyone that can let a man get convicted of murder while knowing his innocence is a piece of shit ,d02cp9p,todayilearned,learning,1455656485.0,cheapL3Y,10.0,0.0,47,4893,1.0
i can only imagine his feelings i live in abject terror of losing my wife ,d02au1m,todayilearned,learning,1455654042.0,TheRarebitFiend,2.0,0.0,1,5805,0.0
a very interesting dilemma i find it unfortunate that many people reading this story jump to the conclusion that lawyerconfidentiality is something to be feared in our society i would be much more fearful of a world where in my most dire of situations  i would not be able to trust my own lawyers to only have my best interests in mind ,d02k6r0,todayilearned,learning,1455667253.0,Zhaff_Pedley,1.0,0.0,543,924,0.0
the finns  super nice  fascinating culture  beautiful language  and  harder than a coffin nail ,d025niu,todayilearned,learning,1455647084.0,hobnobbinbobthegob,370.0,0.0,1767,568492,1.0
all of rage  just  automatically  ,d02q32z,todayilearned,learning,1455676286.0,CreeksideStrays,11.0,0.0,241,11935,0.0
on a similar note  american soldiers stationed in italy needed coffee  but most could nt stand the taste of espresso  which is how nearly all coffee in italy is served   in an attempt to create something more similar to the dripstyle brew they were accustomed to  they started diluting the espresso with hot water  thus  the americano was born ,d02r15z,todayilearned,learning,1455677761.0,feedmesweat,7.0,0.0,17,4736,0.0
