text,id,subreddit,meta,time,author,ups,downs,authorlinkkarma,authorkarma,authorisgold
bailly was a total badass he s also the guy in the center of  this famous picture by jacques louis david   https  uploadwikimediaorgwikipediacommons66dle_serment_du_jeu_de_paumejpg  with his right hand raised ,d02fw5h,todayilearned,learning,1455660767.0,pulpfiction5eva,1.0,0.0,765,2339,0.0
  in the hood summer time is the killing season     it s hot out this bitch that s a good enough reason  ,d02t5ui,todayilearned,learning,1455681275.0,Tainted_Bruh,1.0,0.0,330,18345,0.0
my favorite last words before execution are from  madame roland   https  enwikipediaorgwikimadame_roland  imprisonment_and_death   who when seeing a statue of liberty nearby said   oh liberty  what crimes are committed in thy name  ,d01qp7f,todayilearned,learning,1455615556.0,Aqquila89,5.0,0.0,246518,193701,1.0
jesus christ  i just want you to know that this til prompted me to start a 3 hour  wikiroll  where i jumped from all the corresponding events of the french revolution and ended with the formation of the ussr in 1922 thank you for indirectly providing me with some knowledge bro,d01ou7d,todayilearned,learning,1455608737.0,CARNIesada6,22.0,0.0,1,1330,0.0
they had to use the guillotine it would have been difficult finding a rope that would hold the weight of the balls on that guy ,d01goes,todayilearned,learning,1455591831.0,jubbergun,1.0,0.0,2428,64686,0.0
but the us really stands for freedom and democracy on the world stage  there is no alternative to supporting the  free world  under the banner of the us  one of the worst things about the us is that it is so fucking good at propaganda ,d01t0l4,todayilearned,learning,1455624778.0,silverstrikerstar,7.0,0.0,5969,59314,0.0
in that case i should have been dead 20 years ago ,d02r8br,todayilearned,learning,1455678081.0,username_004,3.0,0.0,3,21767,1.0
 new orleans is sinking  by the tragically hip was banned by some stations after hurricane katrina ,d02si1h,todayilearned,learning,1455680167.0,bob_marley98,1.0,0.0,254,14416,0.0
and war pigs ,d02uz1n,todayilearned,learning,1455684517.0,adamtheimpaler,1.0,0.0,1298,2576,0.0
these missions were so secrete that many of the crew members on the submarines did not know what their mission was ,d02radu,todayilearned,learning,1455678173.0,spacepaulZ,2.0,0.0,5587,175,0.0
man  this is probably one of the worst written wikipedia articles i ve read reads like a middle school report,d02t7fa,todayilearned,learning,1455681351.0,tentacleseverywhere,1.0,0.0,577,2999,0.0
larry is a genius ,d02jvbo,todayilearned,learning,1455666752.0,slashing164,4.0,0.0,4844,14475,0.0
ivy bells,d02rgd6,todayilearned,learning,1455678442.0,Terpin50,1.0,0.0,1,49,0.0
i remember the  cussing canoeist  from my childhood  but they must have covered his first conviction much more heavily here in michigan than they did his winning appeal so i ve been extra fucking careful around kids all these shitty years for no goddamn fucking reason ,d02re40,todayilearned,learning,1455678340.0,cute_things_are_cute,3.0,0.0,1,28,0.0
when i was young and taking guitar lessons i brought in a few rage songs to learn  i just remember my teacher letting out a huge sigh and saying do these guys ever stop whining about stuff  ,d02t0zi,todayilearned,learning,1455681044.0,CeeArthur,2.0,0.0,63,6794,0.0
i think they might have missed an obvious one in  juicy  by the notorious big gt  now i m in the limelight cause i rhyme tight  time to get paid  blow up like the world trade,d02smxw,todayilearned,learning,1455680396.0,blobbydigital,1.0,0.0,3669,37700,0.0
i thought layne staley wrote  rooster  in sort of a commemoration of his grandfather  who was a marine  definitely a patriotic song but it still has an undertone of antiwar themes  whatever ,d02rtia,todayilearned,learning,1455679040.0,zacht180,2.0,0.0,1714,30765,0.0
what if i just want a mic check  hah  hoo hah  but seriously  frank sinatra  what the hell ,d02qyfa,todayilearned,learning,1455677638.0,aznednacni,4.0,0.0,6938,20814,0.0
yes  the country went a bit insane after 911 unfortunately  a lot of people stayed there ,d02sp89,todayilearned,learning,1455680505.0,DevonLovelock,3.0,0.0,1,1478,1.0
bleed americanjimmy eat world ,d02vd1k,todayilearned,learning,1455685244.0,finishedlurking,1.0,0.0,1,4681,0.0
scientology killed this boy we need to outlaw this evil corporation,d01u47w,todayilearned,learning,1455628059.0,Ginkgopsida,167.0,0.0,12471,69652,1.0
that sounds like a miscavige of justice to me ,d01vmdx,todayilearned,learning,1455631621.0,Catostomidae,235.0,0.0,171,40141,0.0
it is amazing how many times it the painting has been damaged andor fucked  i wonder how different it looks now compared to its original state ,d02ta6a,todayilearned,learning,1455681485.0,lobster198,1.0,0.0,1,967,0.0
yeah the guy who found it  got it from his dad  posted it on here in the last year ,d02kp6h,todayilearned,learning,1455668055.0,Naphtalian,3.0,0.0,1,4221,0.0
and being an unofficial scientologist,d02rxj7,todayilearned,learning,1455679225.0,slyfoxninja,1.0,0.0,346,12521,0.0
so they ve been decimated    ,d02n7e8,todayilearned,learning,1455671901.0,DeathBaron,34.0,0.0,5,3631,0.0
 canada s snowbirds have a similar record it seems   https  enwikipediaorgwikisnowbirds  accidents ,d02lf1x,todayilearned,learning,1455669155.0,JHDarkLeg,4.0,0.0,757,34178,0.0
my family is related to her husband  and thus her kids if anyone has any links or stories about any of them let me know  thank you for sharing op ,d02cir2,todayilearned,learning,1455656241.0,SrgntRichtofen,1.0,0.0,65,715,0.0
not to be morbid but this  was  the nazis  why did nt they just kill her and find another midwife who would do this  i have to believe there was a plural number of midwives being imprisoned  and that some of them were either less ethical or less strong in their convictions  note  it s of course amazing that she was able to perform this work and save many lives  but there s a piece of the puzzle missing here that s all i m saying  edit  oh the nazis did nt realize what was going on  because a large majority of the newborns were being killed by others anyway that is depressing  but answers the question  ,d01otie,todayilearned,learning,1455608675.0,cat-n-jazz,-1.0,0.0,511,10764,0.0
also happens when i wake up and think about debating hilary in the general election,d01k5ui,todayilearned,learning,1455597578.0,TRUMP_SIMULATOR,-4.0,0.0,1,171,0.0
it definitely would have changed   the exterminator  episode   https  enmwikipediaorgwikithe_diplomat  27s_club   gt   meanwhile  george is so desperate to find an africanamerican to pose as his friend  that he asks the africanamerican man whose house he invaded in  the couch   when he refuses  george tries to befriend karl  the exterminator who fumigated jerry s apartment for fleas in  the doodle   ,d02sk97,todayilearned,learning,1455680271.0,bootscallahan,1.0,0.0,2354,12823,1.0
but it still wo nt explain why i feel a massive need to masturbatehump stuff in the morning ,d01mygh,todayilearned,learning,1455603487.0,zahrul3,12.0,0.0,235044,126795,0.0
image is the  grandfather rock on samui island in thailand   http  wwwkosamuicomlamaibeachhintahinyaihtm  promo ,d023rhh,todayilearned,learning,1455644511.0,holysocks,1.0,0.0,26579,112930,0.0
i call mine a  piss stiffy ,d01qvdx,todayilearned,learning,1455616253.0,GasolineKisses,1.0,0.0,1696,495,0.0
ive always been curious do females experience morning twig ,d01u2hy,todayilearned,learning,1455627927.0,Piemasterjelly,1.0,0.0,68,31674,0.0
cmonnn you mean to tell me you never realized that a pisswood existed ,d01zzm3,todayilearned,learning,1455639171.0,TheyCallMeNameless,2.0,0.0,1,-1,0.0
awesome  man  i really have to pee    brain    hey  how bout i make your dick stand straight up  ,d01kl3x,todayilearned,learning,1455598381.0,Archchancellor,35.0,0.0,20445,89025,0.0
 morning wood also helps with bladder control at night  yeah  but how much   to the nth degree  https  myoutubecomwatch  v  torhkxaxma,d02hz1q,todayilearned,learning,1455663746.0,MoneyTreeFiddy,1.0,0.0,246,36632,0.0
http  achewoodcomindexphp  date  08012008,d01uqfx,todayilearned,learning,1455629614.0,THE_SEX_YELLER,6.0,0.0,3366,3133,0.0
at first glance  i thought the picture was of a husky with its mouth open ,d02sb1m,todayilearned,learning,1455679839.0,rathemighty,1.0,0.0,2360,6041,0.0
that is some g shit something leonidas would say ,d02qc9v,todayilearned,learning,1455676685.0,joewaffle1,2.0,0.0,5184,87291,0.0
and convincing your wife to give you morning headsex because she believes she makes you really horny ,d01osyy,todayilearned,learning,1455608626.0,PM_ME_ONE_BTC,1.0,0.0,1,6373,0.0
indeed  i still miss her ,d01xg75,todayilearned,learning,1455635119.0,StalinsFist,2.0,0.0,1,471,0.0
i swear to god  he looks like a penis   http  vignette1wikianocookienetdisneyimagesdd4jacksonsjpgrevisionlatest  cb  20100406200230amp  pathprefix  es ,d02hqtp,todayilearned,learning,1455663406.0,FookYu315,11.0,0.0,104,25686,0.0
lmao that picture ,d02jcoe,todayilearned,learning,1455665864.0,McSpicy,1.0,0.0,1,3,0.0
also sounds good for getting older kids to eat their dinner without fear of missing anything on telly i imagine ,d02ekh2,todayilearned,learning,1455658975.0,Bepha,6.0,0.0,3371,12411,0.0
is this as wellknown a band as wikipedia suggests  never heard of them before right now ,d02qr8u,todayilearned,learning,1455677321.0,h3lme7,-1.0,0.0,1199,87785,0.0
pussy whipped,d023b80,todayilearned,learning,1455643892.0,Hubbarti,1.0,0.0,1,142,0.0
and it wore spandex and a cape ,d02ifs6,todayilearned,learning,1455664450.0,Spdrjay,2.0,0.0,1,110555,0.0
would have gone great in some gumbo ,d02rzgr,todayilearned,learning,1455679313.0,slyfoxninja,1.0,0.0,346,12521,0.0
well  at least he was true to his word is he known to you by his humanitarian efforts  i think not though  he helped hitler kill himself  so he got that one going for him ,d01zd1l,todayilearned,learning,1455638227.0,carpetjuice,1.0,0.0,1,235,0.0
holy shit  racists in the early 60s   who would ve thought,d02s82x,todayilearned,learning,1455679705.0,hussain300,1.0,0.0,65,4514,0.0
also  gt  high temperatures have a significant effect on income a study of counties in the united states found that economic productivity of individual days declines by about 17  for each degree celsius above 15  c  59  f  ,d029rqb,todayilearned,learning,1455652616.0,farouqyoshi,1.0,0.0,28401,145,0.0
man  that explains so much every time i d go to moe s  i would get a halfvanilla coke  halforange coke for a orange creamsicle coke after about six months of that  vanilla orange appeared like cherry vanilla as a possible flavor  so  if you ve seen orange vanilla  you re welcome ,d027cm7,todayilearned,learning,1455649364.0,Starsy,1265.0,0.0,181667,229739,1.0
all about that peach sprite man,d02a8zr,todayilearned,learning,1455653261.0,alexcustom6877,165.0,0.0,60,1497,0.0
i want to get one of these machine and fill it with liquors  then program it with recipes  martinis at the push of a button ,d029ale,todayilearned,learning,1455651982.0,TheThirdStrike,81.0,0.0,530,43046,0.0
where the rum button at ,d027qmj,todayilearned,learning,1455649899.0,binger5,84.0,0.0,1,70409,0.0
ugh  those machines  the  classic  coke ends up tasting like a diet cherry  vanilla  lime  orange backwash slushy ,d029824,todayilearned,learning,1455651890.0,transfire,219.0,0.0,139,4501,0.0
i made cherry gingerale the other day  it was terrible  you re welcome ,d02dfpm,todayilearned,learning,1455657476.0,yellow_yellow,23.0,0.0,2075,2057,0.0
i ve been telling them  add vanilla to everything ,d02pvbs,todayilearned,learning,1455675950.0,Indigoh,4.0,0.0,6253,64880,0.0
is that why our parents used to call them nigger toes ,d02ra9o,todayilearned,learning,1455678167.0,ConfirmationBias_,5.0,0.0,177,5414,0.0
i totally believe this,d02o5bv,todayilearned,learning,1455673315.0,zippythechimp88,1.0,0.0,9,253,0.0
my grandma worked for ge in the late 30 s and told me once they made a light bulb that would never burn out  but they shelved it because their sales would plummet,d02q26n,todayilearned,learning,1455676248.0,mattreyu,1.0,0.0,2686,222967,1.0
mayor eastwood was great for carmel ,d027ll6,todayilearned,learning,1455649708.0,networklackey,3.0,0.0,16,97454,0.0
fucking strawberry sprite  man all day erry day ,d02h0k3,todayilearned,learning,1455662353.0,Daft_Punk91,5.0,0.0,83,3514,0.0
i hate those fucking machines regular coke  sprite  etc all taste like they have been mixed with cleaning supplies or dirty sponges i have to add shitty flavors to mask the terrible flavor of those wretched machines it has got so bad that i wont go to some stores because i know they have those machines,d02ij1s,todayilearned,learning,1455664589.0,dillywin,11.0,0.0,12,15342,0.0
jeez even vending machines data mine us,d02lsmo,todayilearned,learning,1455669710.0,see_phu,17.0,0.0,80,982,0.0
does the feedback tell them that the vanilla in these machines tastes like medicine  and nothing like normal vanilla coke ,d02gb32,todayilearned,learning,1455661347.0,IMAROBOTLOL,5.0,0.0,38407,120931,1.0
from what i ve read  george s entire character is pretty much entirely based off of larry david ,d02amex,todayilearned,learning,1455653763.0,XYZ-Wing,6.0,0.0,1,4387,0.0
if that were true we would have been drinking suicide in the bottle a decade ago ,d02gnu9,todayilearned,learning,1455661846.0,GMG10101985,16.0,0.0,18,93,0.0
if we ve learned one think about newer tech it s that _everything_ tracks you and is market research  no matter what it is they ll find a way to leverage it to try and get more money ,d02mc7p,todayilearned,learning,1455670548.0,losian,3.0,0.0,349,87109,1.0
 here are some other freestyle favorites   https  youtubeshfcoppjztm ,d02nmdq,todayilearned,learning,1455672521.0,StolenOle,3.0,0.0,33,186,0.0
i just want goddamn cherry coke   tm and i mean actual cherry coke  not just coke with cherry syrup mixed in at the fountain ,d02r669,todayilearned,learning,1455677987.0,fizzlefist,3.0,0.0,9552,216459,1.0
all while thousands of muslims in new jersey cheered,d02rcam,todayilearned,learning,1455678259.0,TRUMP_SIMULATOR,4.0,0.0,1,171,0.0
sprite  hic fruit punch call it  sprunch ,d02ooey,todayilearned,learning,1455674116.0,mkilp001,3.0,0.0,53,298,0.0
ugh i hate when this comes up it was a suggestion  not an edict it was a list of songs deemed to be  disturbing  or  offensive   not a demand to remove those songs ,d02t0m1,todayilearned,learning,1455681027.0,bittersister,7.0,0.0,214,3660,0.0
good guy jupiter meme please  mahman  ,d02f14w,todayilearned,learning,1455659576.0,IllBrujo,9.0,0.0,1,2916,0.0
someone should have just said  fuck you  i wo nt do what you tell me ,d02r3hq,todayilearned,learning,1455677864.0,TheLeopardColony,11.0,0.0,1,96818,0.0
probably a decent idea,d02v05m,todayilearned,learning,1455684573.0,Connors116,1.0,0.0,441,1699,0.0
theodore roosevelt s four sons all served in both world wars  except for quentin  the youngest who was killed in action in the first ,d02cr8x,todayilearned,learning,1455656563.0,Aqquila89,2.0,0.0,246518,193701,1.0
with boston being taken  washington knew that new york would be the next harbor they try to land in the british landed in late august    and took the city  boroughs in less than a day  holding it through the entire war ,d027iie,todayilearned,learning,1455649590.0,bolanrox,3.0,0.0,26003,64743,0.0
rinterestingasfuck wow ,d01sqyz,todayilearned,learning,1455623837.0,furrythrowawayaccoun,1.0,0.0,3964,7393,0.0
kinda curious as to what the israeli f15s shot down ,d02cmb0,todayilearned,learning,1455656374.0,demonspawn79,2.0,0.0,1374,26219,0.0
i do nt know how anyone decides  maybe i ll sing in falsetto from now on  and thinks it s a good idea but he pulls it off for emma is a great album ,d02avq7,todayilearned,learning,1455654105.0,8Draw,4.0,0.0,18389,9654,0.0
it pays to be a manlet ,d02g0o4,todayilearned,learning,1455660941.0,Brodusgus,3.0,0.0,3156,20686,0.0
put me to sleep could nt even finish the song ,d024kn7,todayilearned,learning,1455645612.0,simphead,0.0,0.0,1,0,0.0
doubt he said this to be honest  seeing as he was french probably some shit lime  je suis une from age   jesus christ you lads can be dense sometimes  kind regards  rhysarsehole,d016k0z,todayilearned,learning,1455575839.0,Rhysarsehole,-32.0,0.0,1,-23,0.0
this is the reason why charles i  executed 30 january 1649  wore two shirts to the block  gt   the season is so sharp as probably may make me shake  which some observers may imagine proceeds from fear i would have no such imputation ,d018zzd,todayilearned,learning,1455579651.0,SirGuyGrand,77.0,0.0,17086,36421,0.0
gt  all six of the show s stars were asking for  1050000 per episode each  we thought  700000 was an appropriate increase   ancier said  gt  but  their response to  700000 per episode  ancier said  was  we d like  1050000  gt  ancier said he needed a way to prove to the cast that nbc was serious about walking away from the biggest hit on its primetime schedule  so i asked the promotion department to cut promos saying you ve loved them for seven years  see how it all ends with the series finale of friends this thursday  gt  the threat worked  the friends came back to the negotiating table two years later  they got their  1 millionanepisode deal  does nt sound like it worked that well sounds like they got more than was offered  then their demands were met almost in full a couple years later ,d00tekt,todayilearned,learning,1455556775.0,Donald_Keyman,942.0,0.0,292180,1800966,1.0
is it safe ,d02f679,todayilearned,learning,1455659766.0,Hackrid,2.0,0.0,1,22538,0.0
that was one of his miracles  only dude with a j name ,d01vgpi,todayilearned,learning,1455631282.0,black_flag_4ever,113.0,0.0,151066,479508,1.0
you never wondered what inre stood for  iesus nazarenus rex iudaeorum  jesus of nazareth king of the jews  also  latin did nt have a w  so veni vidi vici is pronounced with w sounds in place of v sounds ,d02mlk6,todayilearned,learning,1455670960.0,blackgreygreen,6.0,0.0,319,36547,0.0
take that jesuits ,d01w4ft,todayilearned,learning,1455632661.0,havebananas,4.0,0.0,152,154393,0.0
in the latin alphabet  jehova begins with an i ,d02354e,todayilearned,learning,1455643657.0,ghaelon,4.0,0.0,1,5441,0.0
yohoshua or some variant of joshua  a common jewish name ,d024yij,todayilearned,learning,1455646141.0,zstandig,2.0,0.0,1,10715,0.0
 a wet person does not fear the rain  makes perfect sense though  it s saying someone who is in a condition can not be threatened with the thing that causes that condition ,d01tt1z,todayilearned,learning,1455627191.0,linearcolumb,251.0,0.0,1,1028,0.0
you have been banned from rgetmotivated,d01u03n,todayilearned,learning,1455627741.0,JimBroke,41.0,0.0,1333,18341,0.0
in space  no one can hear you scream ,d01uk7b,todayilearned,learning,1455629201.0,Spdrjay,4.0,0.0,1,110555,0.0
a gullible person does not fear bullshit ,d01vjl6,todayilearned,learning,1455631456.0,black_flag_4ever,1.0,0.0,151066,479508,1.0
http  wwwwisdomofchopracom this cracks me up ,d02ac1o,todayilearned,learning,1455653371.0,mishach,1.0,0.0,10,7650,0.0
unequivocally rejecting quotes  alternative medicines  and conspiracy theories makes you as smart as someone who completely embraces and believes those things intelligence is being able to read  understand  and recognize what is true  you can quote me on that ,d0251rp,todayilearned,learning,1455646264.0,gerbil_111,-1.0,0.0,1,4202,0.0
thats ted danson money ,d011ulj,todayilearned,learning,1455568921.0,yayalorde,4.0,0.0,2082,2701,0.0
should have just gone got on them and killed a couple of them off,d011dfo,todayilearned,learning,1455568238.0,dogmeattaste,70.0,0.0,1,208,0.0
with a million an episode  maybe they can actually afford those fancy apartments they have on the show,d013sdn,todayilearned,learning,1455571715.0,Kitakitakita,90.0,0.0,2,845,0.0
brad garrett thought he could get ray money  that s the biggest joke of them all,d00tr27,todayilearned,learning,1455557282.0,cisxuzuul,101.0,0.0,1,16699,0.0
was he iewish ,d02llal,todayilearned,learning,1455669410.0,_mindpalace_,3.0,0.0,696,9509,0.0
but his middle initial is still h right ,d025zrd,todayilearned,learning,1455647540.0,AdmAkbar_2016,3.0,0.0,1,3551,0.0
not to mention that it was most likely in aramaic  which does nt even have roman letters,d01uut1,todayilearned,learning,1455629904.0,deus_lemmus,72.0,0.0,547,6902,0.0
this is why on a crucifix says inri the initials for jesus of nazareth king of the jews  iesus nazarenus rex iudaeorum source  took latin at a catholic school,d023byg,todayilearned,learning,1455643920.0,samuraipenguin99,31.0,0.0,41,74,0.0
the letter u did nt exist yet either julius  for instance  was spelled ivlivs bibles would only spell jesus iesus if they were printedcopied before j was accepted into the alphabet  but after u was ,d023mnk,todayilearned,learning,1455644323.0,malektewaus,2.0,0.0,1026,24650,0.0
in arabic  he is called  issa  ,d02avay,todayilearned,learning,1455654090.0,nolander_78,5.0,0.0,147,5108,0.0
this will come in extremely handy when overcoming the gaintlet of booby traps and puzzles put in place to protect the holy grail ,d01yo4f,todayilearned,learning,1455637150.0,Nate16,437.0,0.0,1,6040,0.0
all the friends stuck together  as usual  they made a pact in the beginning to always negotiate as a group and never as individuals  they were all paid the same from beginning to end got ta respect that ,d00pkvo,todayilearned,learning,1455550805.0,SaintVanilla,4659.0,0.0,1,659291,1.0
 guys  they re picking up another season of the show    that s the best  and most awkward news i ve gotten all day  ,d011kqa,todayilearned,learning,1455568527.0,cashcow1,1323.0,0.0,13,216544,1.0
i loved that show it was so ridiculous and hilarious ,d0186ns,todayilearned,learning,1455578355.0,RoboNinjaPirate,77.0,0.0,6375,223653,1.0
 such a good show   https  wwwyoutubecomwatch  v  nvehftjp3ja ,d015dhn,todayilearned,learning,1455574050.0,flyingfences,42.0,0.0,2426,23395,1.0
netflix should buy the rights to this show and resurrect it ,d01f2es,todayilearned,learning,1455589297.0,jubbergun,25.0,0.0,2428,64686,0.0
 is that a silencer    no  it s my own invention i call it a loudener  57,d01mdak,todayilearned,learning,1455602107.0,Shirt_and_Stacks,7.0,0.0,1125,21100,1.0
videos in this thread   watch playlist amp   9654    http  subtletvcom_r45yapm  feature  playlistamp  nline  1  video  comment     sledgehammer s01 e03  witless    https  youtubecomwatch  v  zcessva3wgkamp  t  1238s    30   https  redditcomrtodayilearnedcomments45yapm_d014unx  context  10  d014unx   hammer is rescued by an amish man and his daughter   sledge hammer s01e22 the spa who loved me   https  youtubecomwatch  v  3gkdcb3jcsamp  t  1354s    23   https  redditcomrtodayilearnedcomments45yapm_d017icy  context  10  d017icy   hereamp   39  s the infamous scene   sledge hammer    under the gun   pilot episode    https  youtubecomwatch  v  nvehftjp3ja    15   https  redditcomrtodayilearnedcomments45yapm_d015dhn  context  10  d015dhn   such a good show   sledge hammer  indoor shooting range   https  youtubecomwatch  v  onql_yktm    14   https  redditcomrtodayilearnedcomments45yapm_d016g9k  context  10  d016g9k   i came here to post this   i remember this show  but this is the only scene i can specifically recall the tape just kept saying amp  quot  shoot me  shoot me  amp  quot  edit  found the clip   sledge hammer s01e22 the spa who loved me  full   no canned laughter    https  youtubecomwatch  v  s6plrbmuusw    11   https  redditcomrtodayilearnedcomments45yapm_d01fjnf  context  10  d01fjnf   for anyone who would like to watch for yourself best last words before failing to disarm a nuke  amp  quot  i know what iamp   39  m doingamp  quot   captain hammer  long    https  youtubecomwatch  v  julyxwzih8    5   https  redditcomrtodayilearnedcomments45yapm_d017ffd  context  10  d017ffd   amp  quot  the hammer is my penisamp  quot   sledge hammer s invention  a loudener   https  youtubecomwatch  v  wkm9gdux0y    1   https  redditcomrtodayilearnedcomments45yapm_d01hulj  context  10  d01hulj   amp  quot  no itamp   39  s not a silencer i call it a loudeneramp  quot  i m a bot working hard to help redditors find related videos to watch      play all   http  subtletvcom_r45yapm  feature  playlistamp  ftrlnk  1    info   https  npredditcomrsubtletvwikimentioned_videos    chrome extension   https  chromegooglecomwebstoredetailmentionedvideosforreddfiimkmdalmgffhibfdjnhljpnigcmohf ,d01hxpu,todayilearned,learning,1455593845.0,Mentioned_Videos,5.0,0.0,1,45401,0.0
wow  never even heard of this show reminds me a lot of garth marenghi s dark place  which i suppose is a spiritual successor ,d01fzq8,todayilearned,learning,1455590760.0,imthemostmodest,3.0,0.0,98,23830,0.0
just watched an episode  under the gun   it was damned funny ,d01k5of,todayilearned,learning,1455597571.0,_The_Yattering_,3.0,0.0,70,4818,0.0
https  wwwyoutubecomwatch  v  xgou7urntbi if no one linked it yet ,d01ju5c,todayilearned,learning,1455596995.0,Johnnyfiftyfive,2.0,0.0,15,19247,0.0
fuck  looks like i m adding another show to my watch list it s almost like someone made naked gun a show ,d01sqha,todayilearned,learning,1455623789.0,DudeImMacGyver,2.0,0.0,2996,22332,0.0
next  i bet you re going to tell me there was nt a bunch of dudes named mark  matt and john running around the middle east 2000 years ago ,d022thf,todayilearned,learning,1455643212.0,Graybealz,22.0,0.0,34,3081,0.0
the only person i ve met in real life that posts pseudoinspirational quotes on social media legitimately told me that the show johnny bravo predicted the 911 attacks sooooooooo  the study makes sense to me ,d02dzng,todayilearned,learning,1455658213.0,-snowflakemango-,1.0,0.0,17,2054,0.0
 salt of the internet   http  iimgurcommrmiykfjpg ,d02t0f4,todayilearned,learning,1455681017.0,sam2wi,1.0,0.0,319,7485,0.0
it also was nt written in english  til,d02108f,todayilearned,learning,1455640651.0,hoo_dawgy,5.0,0.0,1010,9617,0.0
